7,2039,2697,AiLibrary,C++ Library from Ailurus Studio,https://starobinskii.github.io/AiLibrary,https://github.com/starobinskii/AiLibrary,BSD-3-Clause,?,,Met,Given only https: URLs.,Met,,Met,,Met,"Projects on GitHub by default use issues and pull requests, as encouraged by documentation such as <https://guides.github.com/activities/contributing-to-open-source/>.",Met,https://raw.githubusercontent.com/starobinskii/AiLibrary/master/CODE_OF_CONDUCT.md,Met,Non-trivial license location file in repository: <https://github.com/starobinskii/AiLibrary/blob/master/LICENSE.md>.,Met,The BSD-3-Clause license is approved by the Open Source Initiative (OSI).,Met,The BSD-3-Clause license is approved by the Open Source Initiative (OSI).,Met,,Met,,Met,"Repository on GitHub, which provides public git repositories with URLs.",Met,"Repository on GitHub, which uses git. git can track the changes, who made them, and when they were made.",Met,,Met,"Repository on GitHub, which uses git. git is distributed.",Met,,Met,,Met,,Met,https://github.com/starobinskii/AiLibrary/blob/master/CHANGELOG.md,,"Software is typically distributed using package managers (homebrew, snapcraft, ...)",?,,Met,,Met,https://github.com/starobinskii/AiLibrary/issues/new/choose,Met,,Met,,Met,https://github.com/starobinskii/AiLibrary/issues,Met,https://github.com/starobinskii/AiLibrary/issues,,,Met,,Met,Non-trivial build file in repository: <https://github.com/starobinskii/AiLibrary/blob/master/Makefile>.,Met,Non-trivial build file in repository: <https://github.com/starobinskii/AiLibrary/blob/master/Makefile>.,Met,,Met,,Met,,?,,?,,?,,?,,Met,,Met,,Met,,Met,,Met,,,,,,,,,,,,,,,,,,Met,,Met,,Met,,Met,,Met,"lgtm
https://lgtm.com/projects/g/starobinskii/AiLibrary/",Met,,Met,,Met,,?,Using Catch2,?,,?,,?,,,2018-07-30 22:08:30 UTC,2019-02-10 13:13:10 UTC,,,?,,,Met,GitHub supports discussions on issues and pull requests.,Met,,Met,,?,,?,,?,,?,,?,,Unmet,"Found all required security hardening headers. // X-Content-Type-Options was not set to ""nosniff"".",?,,?,,87,,,2022-05-13 23:00:16 UTC,False,"C++, YAML, Bash",30,4,?,,?,,?,,?,,?,,?,,?,,?,,?,,?,,?,,?,,?,,?,,?,,?,,?,,?,,?,,?,,?,,?,,?,,?,,?,,?,,?,,?,,?,,?,,?,,?,,?,,?,,?,,?,,?,,?,,?,,?,,4,?,,?,,?,,?,,?,,?,,?,,?,,?,,?,,?,,?,,Unmet,,Unmet,,87,,,,,,,,,Met,
8,2040,2698,circumplex,R Package for the Analysis and Visualization of Circumplex Data,https://circumplex.jmgirard.com,https://github.com/jmgirard/circumplex,GPL-3.0,?,,Met,Given only https: URLs.,Met,,Met,,Met,"Projects on GitHub by default use issues and pull requests, as encouraged by documentation such as <https://guides.github.com/activities/contributing-to-open-source/>.",?,,Met,Non-trivial license location file in repository: <https://github.com/jmgirard/circumplex/blob/master/LICENSE.md>.,Met,The GPL-3.0 license is approved by the Open Source Initiative (OSI).,Met,// Did not find license in the OSI list. The GPL-3.0 license is approved by the Open Source Initiative (OSI).,Met,Some documentation basics file contents found.,?,,Met,"Repository on GitHub, which provides public git repositories with URLs.",Met,"Repository on GitHub, which uses git. git can track the changes, who made them, and when they were made.",?,,Met,"Repository on GitHub, which uses git. git is distributed.",Met,,Met,,Met,,Met,Non-trivial release notes file in repository: <https://github.com/jmgirard/circumplex/blob/master/NEWS.md>.,?,,?,,Met,,Met,https://github.com/jmgirard/circumplex/issues,Met,,Met,,Met,https://github.com/jmgirard/circumplex/issues,Met,https://github.com/jmgirard/circumplex/issues,?,,Met,,Met,,Met,devtools,Met,devtools,Met,testthat,Met,,Met,,Met,,Met,,?,,?,,?,,?,,Unmet,,Unmet,,?,,?,,?,,?,,?,,?,,?,,?,,?,,?,,?,,?,,?,,?,,?,,?,,?,,?,,?,,?,,,2018-07-31 00:40:39 UTC,2018-11-03 01:17:22 UTC,?,,Met,Travis CI,,Met,GitHub supports discussions on issues and pull requests.,?,,Met,,?,,?,,?,,?,,?,,Unmet,"// X-Content-Type-Options was not set to ""nosniff"".",?,,?,,51,,,2022-04-17 23:00:32 UTC,False,"R, C++",24,0,?,,?,,?,,?,,?,,?,,?,,?,,?,,?,,?,,?,,?,,?,,?,,?,,?,,?,,?,,?,,?,,?,,?,,?,,?,,?,,?,,?,,?,,?,,?,,?,,?,,?,,?,,?,,?,,?,,?,,?,,4,?,,?,,?,,?,,?,,?,,?,,?,,?,,?,,?,,?,,Unmet,,Unmet,,51,,,,,,,,,Met,
9,2041,2699,fixedWidth,R Package for saving fixed width files,https://github.com/JestonBlu/fixedWidth,https://github.com/JestonBlu/fixedWidth,LGPL-3.0,?,,Met,Given only https: URLs.,Met,,Met,,Met,"Projects on GitHub by default use issues and pull requests, as encouraged by documentation such as <https://guides.github.com/activities/contributing-to-open-source/>.",Met,https://github.com/JestonBlu/fixedWidth,Met,https://github.com/JestonBlu/fixedWidth/blob/master/LICENSE,Met,The LGPL-3.0 license is approved by the Open Source Initiative (OSI).,Met,The LGPL-3.0 license is approved by the Open Source Initiative (OSI).,Met,// No appropriate folder found for documentation basics.,Met,,Met,"Repository on GitHub, which provides public git repositories with URLs.",Met,"Repository on GitHub, which uses git. git can track the changes, who made them, and when they were made.",Met,,Met,"Repository on GitHub, which uses git. git is distributed.",Met,,Met,,Met,,Met,https://github.com/JestonBlu/fixedWidth/releases,Met,https://github.com/JestonBlu/fixedWidth/releases,?,,Met,,Met,Github issue feature: https://github.com/JestonBlu/fixedWidth/issues,Met,,Met,,Met,Github issue log: https://github.com/JestonBlu/fixedWidth/issues,Met,https://github.com/JestonBlu/fixedWidth/issues,Met,https://github.com/JestonBlu/fixedWidth/issues,Met,,Met,,Met,,Met,,Met,,Met,,Met,,Met,,Met,,Met,,,,,,,,Met,,Met,,,,,,,,,,,,,,,,,,Met,,Met,,Met,,Met,,,Travis CI,,,,,,,Met,,,,Met,,,,,2018-07-31 03:52:42 UTC,2018-08-10 12:45:47 UTC,,,Met,,,Met,GitHub supports discussions on issues and pull requests.,Met,,Met,,?,,?,,?,,?,,?,,Met,Found all required security hardening headers.,?,,?,,100,2018-08-10 12:45:47 UTC,,,False,R,12,5,?,,?,,?,,?,,?,,?,,?,,?,,?,,?,,?,,?,,?,,?,,?,,?,,?,,?,,?,,?,,?,,?,,?,,?,,?,,?,,?,,?,,?,,?,,?,,?,,?,,?,,?,,?,,?,,?,,?,,?,,4,?,,?,,?,,?,,?,,?,,?,,?,,?,,?,,?,,?,,Met,,Unmet,,105,,,,,,2018-08-10 12:45:47 UTC,,,Met,
10,2042,2701,rise,RISE Analysis in R,https://github.com/lumenlearning/rise,https://github.com/lumenlearning/rise,OTHER,?,,Met,Given only https: URLs.,?,,?,,Met,"Projects on GitHub by default use issues and pull requests, as encouraged by documentation such as <https://guides.github.com/activities/contributing-to-open-source/>.",?,,Met,Non-trivial license location file in repository: <https://github.com/lumenlearning/rise/blob/master/LICENSE>.,?,,Unmet,// Did not find license in the OSI list.,Unmet,// No appropriate folder found for documentation basics.,?,,Met,"Repository on GitHub, which provides public git repositories with URLs.",Met,"Repository on GitHub, which uses git. git can track the changes, who made them, and when they were made.",?,,Met,"Repository on GitHub, which uses git. git is distributed.",?,,?,,?,,Unmet,// No release notes file found.,?,,?,,?,,?,,?,,?,,?,,?,,?,,?,,?,,?,,?,,?,,?,,?,,?,,?,,?,,?,,?,,?,,?,,?,,?,,?,,?,,?,,?,,?,,?,,?,,?,,?,,?,,?,,?,,?,,?,,?,,?,,?,,?,,?,,,2018-07-31 06:41:34 UTC,2018-07-31 06:41:34 UTC,?,,?,,,Met,GitHub supports discussions on issues and pull requests.,?,,?,,?,,?,,?,,?,,?,,Met,Found all required security hardening headers.,?,,?,,13,,,2022-04-17 23:00:32 UTC,False,"R, TeX (CII estimate)",19,0,?,,?,,?,,?,,?,,?,,?,,?,,?,,?,,?,,?,,?,,?,,?,,?,,?,,?,,?,,?,,?,,?,,?,,?,,?,,?,,?,,?,,?,,?,,?,,?,,?,,?,,?,,?,,?,,?,,?,,?,,4,?,,?,,?,,?,,?,,?,,?,,?,,?,,?,,?,,?,,Unmet,,Unmet,,13,,,,,,,,,Met,
11,2043,2685,GLPI,"GLPI is a Free Asset and IT Management Software package,ITIL Service Desk, licenses tracking and software auditing.",https://glpi-project.org,https://github.com/glpi-project/glpi,GPL-2.0,?,,Met,Given only https: URLs.,Met,https://github.com/glpi-project/glpi/blob/master/README.md,Met,https://github.com/glpi-project/glpi/blob/master/README.md,Met,http://glpi-developer-documentation.readthedocs.io/en/master/sourcecode.html#workflow,Met,http://glpi-developer-documentation.readthedocs.io/en/master/sourcecode.html,Met,Non-trivial license location file in repository: <https://github.com/glpi-project/glpi/blob/master/COPYING.txt>.,Met,The GPL-2.0 license is approved by the Open Source Initiative (OSI).,Met,The GPL-2.0 license is approved by the Open Source Initiative (OSI).,Met,https://github.com/glpi-project/glpi/blob/master/README.md#documentation,,"GLPI is only used from its WEB interface, there is no CLI interface (unless we can consider its REST API as an interface usable in CLI).",Met,"Repository on GitHub, which provides public git repositories with URLs.",Met,"Repository on GitHub, which uses git. git can track the changes, who made them, and when they were made.",Met,"The main repository contains all versions of GLPI, whether in BETA, RELEASE-CANDIDATE, STABLE, we manage this in branches ""BUGFIXES"" (current STABLE version) and ""MASTER"" (future MAJOR version) : http://glpi-developer-documentation.readthedocs.io/en/master/sourcecode.html#branches",Met,"Repository on GitHub, which uses git. git is distributed.",Met,"GLPI follows a semantic versioning scheme, on 3 digits. The first one is the major release, the second the minor and the third the fix release.

Major releases may come with important incompatibilities as well as new features; minor versions may bring new features as well, but stay perfectly compatible inside a major version.

Fixes releases will only fix reported issues without adding anything new.",Met,,Met,All releases are tagged : https://github.com/glpi-project/glpi/tags,Met,Non-trivial release notes file in repository: <https://github.com/glpi-project/glpi/blob/master/CHANGELOG.md>.,Met,"GLPI Release notes is carried out according to Keep a Changelog project: <https://keepachangelog.com/en/1.0.0/> which identified ""Security"" changes.",?,,Met,https://github.com/glpi-project/glpi/issues,Met,https://github.com/glpi-project/glpi/blob/master/.github/ISSUE_TEMPLATE/bug_report.md,Met,,Met,,Met,"All archive are available on the GitHub project page. Also, GLPI have a forum for old discussions : https://forum.glpi-project.org",Unmet,"GLPI doesn't have a page yet that describes the vulnerability reporting process, but have a private mailing-list dedicated for those discussions: : glpi-security@ow2.org",Unmet,"GLPI doesn't have a page yet that describes the vulnerability reporting process, but have a private mailing-list dedicated for those discussions: : glpi-security@ow2.org",Met,,,"GLPI is developed in PHP, the source code doesn't need to be built.",,"GLPI is developed in PHP, the source code doesn't need to be built.",,"GLPI is developed in PHP, the source code doesn't need to be built.",Met,"The GLPI test suite is described on this page : https://github.com/glpi-project/glpi/blob/master/tests/README.md
They are mandatory for each contribution, and maintained by core-developers.",Met,,Met,,Met,"Here is the procedure for new Features contribution : https://glpi-developer-documentation.readthedocs.io/en/master/sourcecode.html#features
Every proposal must contains unit tests; for new features as well as bugfixes. For the bugfixes; this is not a strict requirement if this is part of code that is not tested at all yet. See the unit testing section at the bottom of the page.",Met,,Met,,Met,GLPI CI process runs Coding Standard tests: <https://github.com/glpi-project/glpi/blob/master/.circleci/config.yml#L63>,Met,,Met,,Met,,Met,,Met,GLPI relies on publicly published libraries such as PHP password_hash for users' passwords encryption.,Met,,Met,,Met,,Met,,,No key agreement protocols are implemented by GLPI itself. It relies on HTTPS for some exchanges.,Met,,Met,,Met,Downloads are delivered using HTTPS from the official GLPI GitHub platform.,Met,,Met,,Met,,?,,?,,?,,?,,?,,?,,?,,?,,"GLPI stands for **Gestionnaire Libre de Parc Informatique** is a Free Asset and IT Management Software package, that provides ITIL Service Desk features, licenses tracking and software auditing.

GLPI features:
* Inventory of computers, peripherals, network printers and any associated components through an interface, with inventory tools such as: [FusionInventory](http://fusioninventory.org/) or [OCS Inventory](https://www.ocsinventory-ng.org/fr/)
* Data Center Infrastructure Management (DCIM)
* Item lifecycle management
* Licenses management (ITIL compliant)
* Management of warranty and financial information (purchase order, warranty and extension, damping)
* Management of contracts, contacts, documents related to inventory items
* Incidents, requests, problems and changes management
* Knowledge base and Frequently-Asked Questions (FAQ)
* Asset reservation

Moreover, GLPI supports many [plugins](http://plugins.glpi-project.org) that provide additional features.",2018-07-31 06:48:51 UTC,2019-01-04 09:01:51 UTC,Met,,Met,"ATM, GLPI uses CircleCI <https://github.com/glpi-project/glpi/blob/master/.circleci/config.yml> and TravisCI <https://github.com/glpi-project/glpi/blob/master/.travis.yml> for each commit (on pull-request or not).",cpe:2.3:a:glpi-project:glpi,Met,GitHub supports discussions on issues and pull requests.,Met,,Met,https://github.com/glpi-project/glpi/blob/master/README.md#documentation,?,,?,,?,,?,,?,,Unmet,// One or more of the required security hardening headers is missing.,?,,?,,85,,,2022-04-18 23:00:11 UTC,False,"PHP, JavaScript, CSS",32,4,?,,?,,?,,?,,?,,?,,?,,?,,?,,?,,?,,?,,?,,?,,?,,?,,?,,?,,?,,?,,?,,?,,?,,?,,?,,?,,?,,?,,?,,?,,?,,?,,?,,?,,?,,?,,?,,?,,?,,?,,9,?,,?,,?,,?,,?,,?,,?,,?,,?,,?,,?,,?,,Unmet,,Unmet,,85,,,,,,,,,Met,
12,2044,2702,dupRadar,Duplication rate quality control for RNA-Seq datasets.,http://bioconductor.org/packages/dupRadar,https://git.bioconductor.org/packages/dupRadar,GPL-3.0-or-later,?,,Unmet,// Given an http: URL.,Met,,Met,,Met,http://bioconductor.org/packages/release/bioc/html/dupRadar.html,?,,?,,Met,The GPL-3.0-or-later license is approved by the Open Source Initiative (OSI).,Met,The GPL-3.0-or-later license is approved by the Open Source Initiative (OSI).,Met,"http://bioconductor.org/packages/release/bioc/html/dupRadar.html
http://bioconductor.org/packages/release/bioc/vignettes/dupRadar/inst/doc/dupRadar.html
http://bioconductor.org/packages/release/bioc/manuals/dupRadar/man/dupRadar.pdf
http://bioconductor.org/packages/release/bioc/news/dupRadar/NEWS",Met,,Met,https://github.com/ssayols/dupRadar,Met,,Met,,Met,,Met,,Unmet,Following Bioconductor's versioning rules: https://bioconductor.org/developers/how-to/version-numbering/,Met,,Met,Following Bioconductor's versioning rules: https://bioconductor.org/developers/how-to/version-numbering/,Unmet,,?,,Met,https://github.com/ssayols/dupRadar,Met,"https://support.bioconductor.org/
https://github.com/ssayols/dupRadar",Met,,Met,,Met,"https://github.com/ssayols/dupRadar
http://bioconductor.org/packages/release/bioc/html/dupRadar.html",?,,?,,?,,?,,?,,?,,?,,?,,?,,?,,?,,?,,?,,?,,?,,?,,?,,?,,?,,?,,?,,?,,?,,?,,?,,?,,?,,?,,?,,?,,?,,?,,?,,?,,?,,?,,?,,,2018-07-31 07:00:16 UTC,2019-12-02 09:12:12 UTC,?,,?,,,Met,https://support.bioconductor.org/,?,,Met,,?,,?,,?,,?,,?,,Unmet,"// X-Content-Type-Options was not set to ""nosniff"".",?,,?,,34,,,2019-11-29 23:01:20 UTC,True,R,13,2,?,,?,,?,,?,,?,,?,,?,,?,,?,,?,,?,,?,,?,,?,,?,,?,,?,,?,,?,,?,,?,,?,,?,,?,,?,,?,,?,,?,,?,,?,,?,,?,,?,,?,,?,,?,,?,,?,,?,,?,,0,?,,?,,?,,?,,?,,?,,?,,?,,?,,?,,?,,?,,Unmet,,Unmet,,34,,,,,,,,,Met,
13,2045,2703,issues,,,https://github.com/MomX/Momocs/issues,,?,,Met,Given only https: URLs.,?,,?,,Unmet,// No contribution file found.,?,,Unmet,// No license location file found.,?,,?,,Met,Some documentation basics file contents found.,?,,?,,?,,?,,?,,?,,?,,?,,Met,Non-trivial release notes file in repository: <https://github.com/MomX/Momocs/blob/master/NEWS.md>.,?,,?,,?,,?,,?,,?,,?,,?,,?,,?,,?,,?,,?,,?,,?,,?,,?,,?,,?,,?,,?,,?,,?,,?,,?,,?,,?,,?,,?,,?,,?,,?,,?,,?,,?,,?,,?,,?,,?,,?,,?,,?,,?,,?,,,2018-07-31 07:06:06 UTC,2018-07-31 07:06:06 UTC,?,,?,,,?,,?,,?,,?,,?,,?,,?,,?,,?,,?,,?,,6,,,,False,"R, PLSQL (CII estimate)",1,0,?,,?,,?,,?,,?,,?,,?,,?,,?,,?,,?,,?,,?,,?,,?,,?,,?,,?,,?,,?,,?,,?,,?,,?,,?,,?,,?,,?,,?,,?,,?,,?,,?,,?,,?,,?,,?,,?,,?,,?,,0,?,,?,,?,,?,,?,,?,,?,,?,,?,,?,,?,,?,,Unmet,,Unmet,,6,,,,,,,,,Met,
14,2046,2704,nomacs,"nomacs is a free image viewer for windows, linux, and mac systems.",https://nomacs.org,https://github.com/nomacs/nomacs,GPL-3.0-or-later,?,,Met,Given only https: URLs.,Met,https://nomacs.org/,Met,https://github.com/nomacs/nomacs/issues/,Met,"Projects on GitHub by default use issues and pull requests, as encouraged by documentation such as <https://guides.github.com/activities/contributing-to-open-source/>.",?,,Met,https://github.com/nomacs/nomacs/blob/master/LICENSE,Met,http://www.gnu.org/licenses/gpl.txt The GPL-3.0-or-later license is approved by the Open Source Initiative (OSI).,Met,The GPL-3.0-or-later license is approved by the Open Source Initiative (OSI).,Unmet,// No appropriate folder found for documentation basics.,?,,Met,"Repository on GitHub, which provides public git repositories with URLs.",Met,"Repository on GitHub, which uses git. git can track the changes, who made them, and when they were made.",Unmet,,Met,"Repository on GitHub, which uses git. git is distributed.",Met,nomacs uses semantic versioning (see https://github.com/nomacs/nomacs/releases),Met,,Met,https://github.com/nomacs/nomacs/tags,Met,https://github.com/nomacs/nomacs/blob/master/ImageLounge/src/changelog.txt,,there have been no publicly known vulnerabilities,?,,Met,https://github.com/nomacs/nomacs/issues,Met,https://github.com/nomacs/nomacs/issues,Met,https://github.com/nomacs/nomacs/issues,Met,https://github.com/nomacs/nomacs/issues,Met,https://github.com/nomacs/nomacs/issues,?,,?,,?,,Met,https://travis-ci.org/nomacs/nomacs,Met,we use cmake,Met,https://travis-ci.org/nomacs/nomacs,Unmet,,?,,?,,?,,?,,?,,Met,we use /W4 (in VS) see: https://github.com/nomacs/nomacs/blob/master/ImageLounge/cmake/WinBuildTarget.cmake,Met,,Met,/W4 which is the second highest warning level in VS,?,,?,,?,,?,,?,,?,,?,,?,,?,,?,,?,,?,,?,,?,,?,,?,,?,,?,,?,,?,,?,,?,,,2018-07-31 07:08:09 UTC,2018-07-31 07:39:51 UTC,?,,?,,,Met,GitHub supports discussions on issues and pull requests.,?,,Met,https://github.com/nomacs/nomacs/issues,?,,?,,?,,?,,?,,Unmet,"// X-Content-Type-Options was not set to ""nosniff"".",?,,?,,43,,,2022-04-18 23:00:11 UTC,False,C++,23,4,?,,?,,?,,?,,?,,?,,?,,?,,?,,?,,?,,?,,?,,?,,?,,?,,?,,?,,?,,?,,?,,?,,?,,?,,?,,?,,?,,?,,?,,?,,?,,?,,?,,?,,?,,?,,?,,?,,?,,?,,4,?,,?,,?,,?,,?,,?,,?,,?,,?,,?,,?,,?,,Unmet,,Unmet,,43,,,,,,,,,Met,
15,2047,2705,plantecophys,Analysing and Modelling Leaf Gas Exchange Data in R,http://remkoduursma.github.io/plantecophys,https://github.com/RemkoDuursma/plantecophys,,?,,Unmet,// Given an http: URL.,?,,?,,Met,"Projects on GitHub by default use issues and pull requests, as encouraged by documentation such as <https://guides.github.com/activities/contributing-to-open-source/>.",?,,Unmet,// No license location file found.,?,,?,,Met,Some documentation basics file contents found.,?,,Met,"Repository on GitHub, which provides public git repositories with URLs.",Met,"Repository on GitHub, which uses git. git can track the changes, who made them, and when they were made.",?,,Met,"Repository on GitHub, which uses git. git is distributed.",?,,?,,?,,Unmet,// No release notes file found.,?,,?,,?,,?,,?,,?,,?,,?,,?,,?,,?,,?,,?,,?,,?,,?,,?,,?,,?,,?,,?,,?,,?,,?,,?,,?,,?,,?,,?,,?,,?,,?,,?,,?,,?,,?,,?,,?,,?,,?,,?,,?,,?,,?,,,2018-07-31 07:18:33 UTC,2018-07-31 07:18:33 UTC,?,,?,,,Met,GitHub supports discussions on issues and pull requests.,?,,?,,?,,?,,?,,?,,?,,Unmet,"// X-Content-Type-Options was not set to ""nosniff"".",?,,?,,10,,,2022-04-17 23:00:32 UTC,False,R (CII estimate),19,0,?,,?,,?,,?,,?,,?,,?,,?,,?,,?,,?,,?,,?,,?,,?,,?,,?,,?,,?,,?,,?,,?,,?,,?,,?,,?,,?,,?,,?,,?,,?,,?,,?,,?,,?,,?,,?,,?,,?,,?,,4,?,,?,,?,,?,,?,,?,,?,,?,,?,,?,,?,,?,,Unmet,,Unmet,,10,,,,,,,,,Met,
16,2048,2708,lifecontingencies,Financial and Actuarial Mathematics for Life Contingencies,https://github.com/spedygiorgio/lifecontingencies,https://github.com/spedygiorgio/lifecontingencies,,?,,Met,Given only https: URLs.,Met,,Met,,Met,"Projects on GitHub by default use issues and pull requests, as encouraged by documentation such as <https://guides.github.com/activities/contributing-to-open-source/>.",Unmet,,Unmet,// No license location file found.,?,,?,,Unmet,// No appropriate folder found for documentation basics.,?,,Met,"Repository on GitHub, which provides public git repositories with URLs.",Met,"Repository on GitHub, which uses git. git can track the changes, who made them, and when they were made.",?,,Met,"Repository on GitHub, which uses git. git is distributed.",?,,?,,?,,Met,Non-trivial release notes file in repository: <https://github.com/spedygiorgio/lifecontingencies/blob/master/ChangeLog>.,?,,?,,?,,?,,?,,?,,?,,?,,?,,?,,?,,?,,?,,?,,?,,?,,?,,?,,?,,?,,?,,?,,?,,?,,?,,?,,?,,?,,?,,?,,?,,?,,?,,?,,?,,?,,?,,?,,?,,?,,?,,?,,?,,?,,,2018-07-31 09:02:07 UTC,2018-07-31 09:03:06 UTC,?,,?,,,Met,GitHub supports discussions on issues and pull requests.,?,,?,,?,,?,,?,,?,,?,,Met,Found all required security hardening headers.,?,,?,,15,,,2022-04-18 23:00:11 UTC,False,R,20,0,?,,?,,?,,?,,?,,?,,?,,?,,?,,?,,?,,?,,?,,?,,?,,?,,?,,?,,?,,?,,?,,?,,?,,?,,?,,?,,?,,?,,?,,?,,?,,?,,?,,?,,?,,?,,?,,?,,?,,?,,4,?,,?,,?,,?,,?,,?,,?,,?,,?,,?,,?,,?,,Unmet,,Unmet,,15,,,,,,,,,Met,
17,2049,2709,labelVector,Label Attributes for Atomic Vectors,https://github.com/nutterb/labelVector,https://github.com/nutterb/labelVector,OTHER,?,,Met,Given only https: URLs.,Met,The repository's README (https://github.com/nutterb/labelVector/blob/master/README.md) provides a description of the purpose and use of the R package.,?,,Met,"Projects on GitHub by default use issues and pull requests, as encouraged by documentation such as <https://guides.github.com/activities/contributing-to-open-source/>.",?,,Met,Non-trivial license location file in repository: <https://github.com/nutterb/labelVector/blob/master/LICENSE>.,Met,"The license for the R package is the MIT license, as declared in the DESCRIPTION file. https://github.com/nutterb/labelVector/blob/master/DESCRIPTION",Met,The MIT license is included in the OSI list.,Met,The project README (https://github.com/nutterb/labelVector/blob/master/README.md) gives instructions for installation.  The `/man` directory gives function level documentation.  The package vignette (https://github.com/nutterb/labelVector/blob/master/vignettes/labelVector.Rmd) provides background on motivation and use of the package.,Met,The project README (https://github.com/nutterb/labelVector/blob/master/README.md) gives instructions for installation.  The `/man` directory gives function level documentation.  The package vignette (https://github.com/nutterb/labelVector/blob/master/vignettes/labelVector.Rmd) provides background on motivation and use of the package.,Met,"Repository on GitHub, which provides public git repositories with URLs.",Met,"Repository on GitHub, which uses git. git can track the changes, who made them, and when they were made.",Met,Repository has a `devel` branch to isolate development from working code.  It also maintains releases for code bases released to CRAN.,Met,"Repository on GitHub, which uses git. git is distributed.",Met,,Met,,Met,,Met,Non-trivial release notes file in repository: <https://github.com/nutterb/labelVector/blob/master/NEWS>.,Met,,?,,Met,,Met,https://github.com/nutterb/labelVector/issues,Met,No issues reported to date.,Met,No issues reported to date,Met,https://github.com/nutterb/labelVector/issues,Met,https://github.com/nutterb/labelVector/issues,,Project does not support private vulnerability reports.,,"No reports submitted, to date.",Met,,Met,,Met,,Met,,Met,,Met,,?,,?,,?,,?,,Met,,Met,,?,,?,,,,,,,,,,,,,,,,,,Met,,?,,Met,,Met,,Met,Uses R CMD check,Met,,Met,,Met,Code analysis is run with Travis CI on each commit. ,Met,,,,Met,,Met,,,2018-07-31 10:58:55 UTC,2018-07-31 11:25:35 UTC,,,Met,,,Met,GitHub supports discussions on issues and pull requests.,Met,,Met,The GitHub repository uses issue tracking.,?,,?,,?,,?,,?,,Met,Found all required security hardening headers.,?,,?,,87,,,2022-04-18 23:00:12 UTC,False,R,25,2,?,,?,,?,,?,,?,,?,,?,,?,,?,,?,,?,,?,,?,,?,,?,,?,,?,,?,,?,,?,,?,,?,,?,,?,,?,,?,,?,,?,,?,,?,,?,,?,,?,,?,,?,,?,,?,,?,,?,,?,,4,?,,?,,?,,?,,?,,?,,?,,?,,?,,?,,?,,?,,Unmet,,Unmet,,87,,,,,,,,,Met,
