13,543,771,jabref,Graphical Java application for managing BibTeX and BibLaTeX (.bib) databases,https://www.jabref.org,https://github.com/JabRef/jabref,MIT,?,,Met,Given only https: URLs.,?,,?,,Met,Non-trivial contribution file in repository: <https://github.com/JabRef/jabref/blob/master/CONTRIBUTING.md>.,?,,Met,Non-trivial license location file in repository: <https://github.com/JabRef/jabref/blob/master/LICENSE.md>.,Met,The MIT license is approved by the Open Source Initiative (OSI).,Met,The MIT license is approved by the Open Source Initiative (OSI).,?,,?,,Met,"Repository on GitHub, which provides public git repositories with URLs.",Met,"Repository on GitHub, which uses git. git can track the changes, who made them, and when they were made.",?,,Met,"Repository on GitHub, which uses git. git is distributed.",?,,?,,?,,Met,Non-trivial release notes file in repository: <https://github.com/JabRef/jabref/blob/master/CHANGELOG.md>.,?,,?,,?,,?,,?,,?,,?,,?,,?,,?,,?,,?,,?,,?,,?,,?,,?,,?,,?,,?,,?,,?,,?,,?,,?,,?,,?,,?,,?,,?,,?,,?,,?,,?,,?,,?,,?,,?,,?,,?,,?,,?,,?,,?,,,2016-12-07 10:59:50 UTC,2016-12-07 10:59:50 UTC,?,,?,,,Met,GitHub supports discussions on issues and pull requests.,?,,?,,?,,?,,?,,?,,?,,Unmet,"X-Content-Type-Options was not set to ""nosniff"".",?,,?,,16,,,2022-04-09 23:00:20 UTC,False,"Java, TeX, Python (CII estimate)",29,0,?,,?,,?,,?,,?,,?,,?,,?,,?,,?,,?,,?,,?,,?,,?,,?,,?,,?,,?,,?,,?,,?,,?,,?,,?,,?,,?,,?,,?,,?,,?,,?,,?,,?,,?,,?,,?,,?,,?,,?,,4,?,,?,,?,,?,,?,,?,,?,,?,,?,,?,,?,,?,,Unmet,,Unmet,,16,,,,,,,,,Met,
14,544,772,Python bindings to the Compact Language Detector,,https://github.com/GregBowyer/cld2-cffi,https://github.com/GregBowyer/cld2-cffi,Apache-2.0,?,,Met,Given only https: URLs.,?,,?,,Met,"Projects on GitHub by default use issues and pull requests, as encouraged by documentation such as <https://guides.github.com/activities/contributing-to-open-source/>.",?,,Met,Non-trivial license location file in repository: <https://github.com/GregBowyer/cld2-cffi/blob/master/LICENSE>.,Met,The Apache-2.0 license is approved by the Open Source Initiative (OSI).,Met,The Apache-2.0 license is approved by the Open Source Initiative (OSI).,?,,?,,Met,"Repository on GitHub, which provides public git repositories with URLs.",Met,"Repository on GitHub, which uses git. git can track the changes, who made them, and when they were made.",?,,Met,"Repository on GitHub, which uses git. git is distributed.",?,,?,,?,,Unmet,No release notes file found.,?,,?,,?,,?,,?,,?,,?,,?,,?,,?,,?,,?,,?,,?,,?,,?,,?,,?,,?,,?,,?,,?,,?,,?,,?,,?,,?,,?,,?,,?,,?,,?,,?,,?,,?,,?,,?,,?,,?,,?,,?,,?,,?,,?,,,2016-12-07 19:45:23 UTC,2016-12-07 19:45:23 UTC,?,,?,,,Met,GitHub supports discussions on issues and pull requests.,?,,?,,?,,?,,?,,?,,?,,Met,Found all required security hardening headers.,?,,?,,15,,,2022-04-09 23:00:21 UTC,False,"C++, C, Python (CII estimate)",29,0,?,,?,,?,,?,,?,,?,,?,,?,,?,,?,,?,,?,,?,,?,,?,,?,,?,,?,,?,,?,,?,,?,,?,,?,,?,,?,,?,,?,,?,,?,,?,,?,,?,,?,,?,,?,,?,,?,,?,,?,,4,?,,?,,?,,?,,?,,?,,?,,?,,?,,?,,?,,?,,Unmet,,Unmet,,15,,,,,,,,,Met,
15,545,775,Amity Room Allocation System,This is a room allocation system for one of Andelas facilities called Amity.,https://github.com/andela-akhenda/cp1a,https://github.com/andela-akhenda/cp1a,MIT,?,,Met,Given only https: URLs.,?,,?,,Met,"Projects on GitHub by default use issues and pull requests, as encouraged by documentation such as <https://guides.github.com/activities/contributing-to-open-source/>.",?,,Met,Non-trivial license location file in repository: <https://github.com/andela-akhenda/cp1a/blob/master/LICENSE>.,Met,The MIT license is approved by the Open Source Initiative (OSI).,Met,The MIT license is approved by the Open Source Initiative (OSI).,?,,?,,Met,"Repository on GitHub, which provides public git repositories with URLs.",Met,"Repository on GitHub, which uses git. git can track the changes, who made them, and when they were made.",?,,Met,"Repository on GitHub, which uses git. git is distributed.",?,,?,,?,,Unmet,No release notes file found.,?,,?,,?,,?,,?,,?,,?,,?,,?,,?,,Met,Non-trivial build file in repository: <https://github.com/andela-akhenda/cp1a/blob/master/Makefile>.,Met,Non-trivial build file in repository: <https://github.com/andela-akhenda/cp1a/blob/master/Makefile>.,?,,?,,?,,?,,?,,?,,?,,?,,?,,?,,?,,?,,?,,?,,?,,?,,?,,?,,?,,?,,?,,?,,?,,?,,?,,?,,?,,?,,?,,?,,?,,?,,,2016-12-08 20:22:34 UTC,2016-12-08 20:24:04 UTC,?,,?,,,Met,GitHub supports discussions on issues and pull requests.,?,,Met,,?,,?,,?,,?,,?,,Met,Found all required security hardening headers.,?,,?,,19,,,2022-04-09 23:00:21 UTC,False,"Python, Makefile (CII estimate)",29,0,?,,?,,?,,?,,?,,?,,?,,?,,?,,?,,?,,?,,?,,?,,?,,?,,?,,?,,?,,?,,?,,?,,?,,?,,?,,?,,?,,?,,?,,?,,?,,?,,?,,?,,?,,?,,?,,?,,?,,?,,4,?,,?,,?,,?,,?,,?,,?,,?,,?,,?,,?,,?,,Unmet,,Unmet,,19,,,,,,,,,Met,
16,546,777,laravel-google-custom-search-engine,Laravel package to get Google Custom Search results from Google Custom Search Engine API for both free and paid versions.,https://github.com/jdrda/laravel-google-custom-search-engine,https://github.com/jdrda/laravel-google-custom-search-engine,MIT,?,,Met,Given only https: URLs.,?,,?,,Met,"Projects on GitHub by default use issues and pull requests, as encouraged by documentation such as <https://guides.github.com/activities/contributing-to-open-source/>.",?,,Met,Non-trivial license location file in repository: <https://github.com/jdrda/laravel-google-custom-search-engine/blob/master/license.md>.,Met,The MIT license is approved by the Open Source Initiative (OSI).,Met,The MIT license is approved by the Open Source Initiative (OSI).,?,,?,,Met,"Repository on GitHub, which provides public git repositories with URLs.",Met,"Repository on GitHub, which uses git. git can track the changes, who made them, and when they were made.",?,,Met,"Repository on GitHub, which uses git. git is distributed.",?,,?,,?,,Unmet,No release notes file found.,?,,?,,?,,?,,?,,?,,?,,?,,?,,?,,?,,?,,?,,?,,?,,?,,?,,?,,?,,?,,?,,?,,?,,?,,?,,?,,?,,?,,?,,?,,?,,?,,?,,?,,?,,?,,?,,?,,?,,?,,?,,?,,?,,?,,,2016-12-09 08:40:07 UTC,2016-12-09 08:40:54 UTC,?,,?,,,Met,GitHub supports discussions on issues and pull requests.,?,,?,,?,,?,,?,,?,,?,,Met,Found all required security hardening headers.,?,,?,,15,,,2022-04-09 23:00:22 UTC,False,PHP (CII estimate),29,0,?,,?,,?,,?,,?,,?,,?,,?,,?,,?,,?,,?,,?,,?,,?,,?,,?,,?,,?,,?,,?,,?,,?,,?,,?,,?,,?,,?,,?,,?,,?,,?,,?,,?,,?,,?,,?,,?,,?,,?,,4,?,,?,,?,,?,,?,,?,,?,,?,,?,,?,,?,,?,,Unmet,,Unmet,,15,,,,,,,,,Met,
17,549,784,httpie,"Modern command line HTTP client  user-friendly curl alternative with intuitive UI, JSON support, syntax highlighting, wget-like downloads, extensions, etc. Follow https://twitter.com/CLIHTTP for tips and updates.",https://httpie.org,https://github.com/jkbrzt/httpie,BSD-3-Clause,?,,Met,Given only https: URLs.,Met,,Met,,Met,"Projects on GitHub by default use issues and pull requests, as encouraged by documentation such as <https://guides.github.com/activities/contributing-to-open-source/>.",Met,https://github.com/jkbrzt/httpie/blob/master/CONTRIBUTING.rst,Met,Non-trivial license location file in repository: <https://github.com/jkbrzt/httpie/blob/master/LICENSE>.,Met,The BSD-3-Clause license is approved by the Open Source Initiative (OSI).,Met,The BSD-3-Clause license is approved by the Open Source Initiative (OSI).,Met,https://httpie.org/doc,Met,,Met,"Repository on GitHub, which provides public git repositories with URLs.",Met,"Repository on GitHub, which uses git. git can track the changes, who made them, and when they were made.",?,,Met,"Repository on GitHub, which uses git. git is distributed.",?,,?,,?,,Unmet,No release notes file found.,?,,?,,?,,?,,?,,?,,?,,?,,?,,?,,Met,Non-trivial build file in repository: <https://github.com/jkbrzt/httpie/blob/master/Makefile>.,Met,Non-trivial build file in repository: <https://github.com/jkbrzt/httpie/blob/master/Makefile>.,?,,?,,?,,?,,?,,?,,?,,?,,?,,?,,?,,?,,?,,?,,?,,?,,?,,?,,?,,?,,?,,?,,?,,?,,?,,?,,?,,?,,?,,?,,?,,?,,,2016-12-12 03:18:53 UTC,2016-12-12 03:21:34 UTC,?,,?,,,Met,GitHub supports discussions on issues and pull requests.,?,,Met,,?,,?,,?,,?,,?,,Unmet,"X-Content-Type-Options was not set to ""nosniff"".",?,,?,,27,,,2022-03-08 23:00:22 UTC,False,"Python, Shell, Makefile (CII estimate)",28,2,?,,?,,?,,?,,?,,?,,?,,?,,?,,?,,?,,?,,?,,?,,?,,?,,?,,?,,?,,?,,?,,?,,?,,?,,?,,?,,?,,?,,?,,?,,?,,?,,?,,?,,?,,?,,?,,?,,?,,?,,4,?,,?,,?,,?,,?,,?,,?,,?,,?,,?,,?,,?,,Unmet,,Unmet,,27,,,,,,,,,Met,
18,551,786,The EBA bug finder,"EBA is a static bug finder for C that specializes in finding violations of control-dominated API rules (aka ""resource manipulation bugs""). EBA is lightweight and fast, and yet it is able to find deep cross-function bugs.",https://github.com/IagoAbal/eba,https://github.com/IagoAbal/eba,BSD-3-Clause,?,,Met,"The project is hosted on GitHub so this condition is met.

For the project website I use a custom domain, for which I still have to setup HTTPS.",Met,Cf. http://www.iagoabal.eu/eba/,Met,"EBA is hosted on GitHub so it's very simple to obtain, provide feedback, and contribute to it.",Met,"Projects on GitHub by default use issues and pull requests, as encouraged by documentation such as <https://guides.github.com/activities/contributing-to-open-source/>.",Unmet,,Met,Cf. https://github.com/IagoAbal/eba/blob/master/LICENSE,Met,Cf. https://github.com/IagoAbal/eba/,Met,,Met,This is briefly explained in the README file: https://github.com/IagoAbal/eba/blob/master/README.md,Unmet,,Met,"Repository on GitHub, which provides public git repositories with URLs.",Met,"Repository on GitHub, which uses git. git can track the changes, who made them, and when they were made.",Met,,Met,"Repository on GitHub, which uses git. git is distributed.",Met,Even though the project has no releases so far... I will do follow semantic versioning.,Met,,Met,,Met,Cf. https://github.com/IagoAbal/eba/blob/master/CHANGES.md,Met,,?,,Met,,Met,Cf. https://github.com/IagoAbal/eba/issues,Met,,Met,,Met,Cf. https://github.com/IagoAbal/eba/issues,Met,Cf. https://github.com/IagoAbal/eba/issues,,"EBA is ""just"" a static bug finder.",Met,,Met,"EBA uses OMake, cf. https://github.com/IagoAbal/eba/blob/master/OMakefile",Met,"OMake may not be the most common, but it is well known within the OCaml community. I am considering switching to Oasis in the short term.",Met,,Met,EBA uses CRAM: https://github.com/brodie/cram,Met,omake test,Unmet,,Unmet,,Unmet,,Unmet,,Met,"EBA is written in OCaml, which is a considerably safe language. Plus, the OCaml compiler makes many warnings ""fatal"" by default, e.g. unused definition.",Met,,Unmet,,Met,,Met,,,,,,,,,,,,,,,,,,Met,No possible MITM attacks.,Met,,Met,,Met,,Unmet,,Unmet,,,,,,Unmet,Runtime assertion checks.,,,Met,,Met,,,2016-12-12 09:55:08 UTC,2016-12-21 10:32:53 UTC,,,Unmet,,,Met,GitHub supports discussions on issues and pull requests.,Met,No credentials needed.,Met,,?,,,,,,,,,,Met,Found all required security hardening headers.,?,,?,,93,,,2022-03-22 23:00:27 UTC,False,"OCaml, C, Shell (CII estimate)",29,9,?,,?,,?,,?,,?,,?,,?,,?,,?,,?,,?,,?,,?,,?,,?,,?,,?,,?,,?,,?,,?,,?,,?,,?,,?,,?,,?,,?,,?,,?,,?,,?,,?,,?,,?,,?,,?,,?,,?,,?,,13,?,,?,,?,,?,,?,,?,,?,,?,,?,,?,,?,,?,,Unmet,,Unmet,,93,,,,,,,,,Met,
19,552,263,Weblate,Web based lozalization tool with tight version control integration.,https://weblate.org,https://github.com/WeblateOrg/weblate,GPL-3.0,?,,Met,Given only https: URLs.,Met,,Met,https://weblate.org/support/,Met,Non-trivial contribution file in repository: <https://github.com/WeblateOrg/weblate/blob/master/CONTRIBUTING.md>.,Met,https://docs.weblate.org/en/latest/contributing.html,Met,Non-trivial license location file in repository: <https://github.com/WeblateOrg/weblate/blob/master/COPYING>.,Met,The GPL-3.0 license is approved by the Open Source Initiative (OSI).,Met,The GPL-3.0 license is approved by the Open Source Initiative (OSI).,Met,https://docs.weblate.org/,Met,https://docs.weblate.org/en/latest/user/index.html,Met,"Repository on GitHub, which provides public git repositories with URLs.",Met,"Repository on GitHub, which uses git. git can track the changes, who made them, and when they were made.",Met,,Met,"Repository on GitHub, which uses git. git is distributed.",Met,https://github.com/WeblateOrg/weblate/releases,Met,,Met,https://github.com/WeblateOrg/weblate/releases,Met,https://docs.weblate.org/en/latest/changes.html,Met,https://docs.weblate.org/en/latest/changes.html (though there was none yet),?,,Met,https://github.com/WeblateOrg/weblate/issues,Met,Described on our website: https://weblate.org/support/,Met,All issues are tagged and verified within few weeks: https://github.com/WeblateOrg/weblate/issues,Met,,Met,https://github.com/WeblateOrg/weblate/issues,Met,https://weblate.org/support/,Met,Reported using email and optionally PGP encrypted: https://weblate.org/support/,Met,,,We do not compile code.,,,,,Met,There is built in testsuite.,Met,"Testuite uses standard Django framework, see https://docs.weblate.org/en/latest/contributing.html#testsuite",Met,Our code coverage is above 90%: https://codecov.io/github/WeblateOrg/weblate,Met,https://docs.weblate.org/en/latest/contributing.html,Met,Our code base grows and our test coverage stays about same.,Met,https://docs.weblate.org/en/latest/contributing.html,Met,"We use pylint, pep8 and other linters: https://landscape.io/github/WeblateOrg/weblate",Met,There are almost no errors reported: https://landscape.io/github/WeblateOrg/weblate,Met,"We do use various python linting tools, tests are run with python warnings enabled.",Met,,Met,,,,,,,,,,,,,,,,,,Met,https is used,Met,,Met,,Met,,Met,"We use several services for that: https://landscape.io/github/WeblateOrg/weblate, https://scrutinizer-ci.com/g/WeblateOrg/weblate and https://www.codacy.com/app/nijel/weblate",Met,https://www.codacy.com/app/Weblate/weblate/dashboard,Met,,Met,Run on every commit,Met,"We use several third party services for that:

* https://www.codacy.com/app/Weblate/weblate/dashboard
* https://landscape.io/github/WeblateOrg/weblate/",Met,https://www.codacy.com/app/Weblate/weblate/dashboard,Met,Assertions are not really practical in Python besides being used in tests,Met,,,2016-12-12 11:06:46 UTC,2019-08-21 20:36:03 UTC,,,Met,https://travis-ci.org/WeblateOrg/weblate,cpe:/a:weblate:weblate,Met,GitHub supports discussions on issues and pull requests.,Met,,Met,,Met,"We do use Django's hardening features where available and secure setup is actively enforced, see https://docs.weblate.org/en/latest/admin/install.html#production-setup",,,,,,,,,Met,"Both our website and GitHub are configured this way:

https://www.ssllabs.com/ssltest/analyze.html?d=github.com
https://www.ssllabs.com/ssltest/analyze.html?d=weblate.org",Met,Installable using pip,,Implented to a degree supported by distutils.,100,2016-12-12 11:30:50 UTC,,,False,"Python, Javascript, HTML",24,93,Met,https://docs.weblate.org/en/latest/contributing.html#dco,Met,https://docs.weblate.org/en/latest/about.html#leadership,Met,https://github.com/WeblateOrg/weblate/blob/master/CODE_OF_CONDUCT.md,?,,?,,?,,Met,https://github.com/weblateorg/weblate/milestones,Met,https://docs.weblate.org/en/latest/internals.html,Met,https://docs.weblate.org/en/latest/contributing.html#security,Met,https://docs.weblate.org/en/latest/admin/quick.html,Met,https://docs.weblate.org/en/latest/,Met,https://github.com/WeblateOrg/weblate,Met,We do follow Bootstrap accessibility guidelines,Met,https://docs.weblate.org/en/latest/contributing.html#translating,Met,We're using PBKDF2 (as implemented in Django) to store passwords.,Met,https://docs.weblate.org/en/latest/admin/upgrade.html,Met,https://hackerone.com/weblate/thanks,Met,https://docs.weblate.org/en/latest/contributing.html#security,Met,https://docs.weblate.org/en/latest/contributing.html#coding-standard,Met,We have code style checks enabled on pull requests.,,We do not produce binaries,,There is no build system,,There is no build system,,There is no build system,Met,We use standard tools (pip or setuptools),Met,Using both Git clone or pip will work,Met,https://github.com/WeblateOrg/weblate/blob/master/requirements.txt,Met,https://requires.io/github/WeblateOrg/weblate/requirements/?branch=master,Met,All dependencies are installed as python packages,Met,We remove usage of deprecated APIs as soon as it is technically possible,Met,https://travis-ci.org/WeblateOrg/weblate,Met,Pretty much every functionality bug is added to tests,Met,https://codecov.io/github/WeblateOrg/weblate/,Met,https://docs.weblate.org/en/latest/contributing.html#testsuite,Met,https://docs.weblate.org/en/latest/contributing.html#owasp,Met,All forms use Django validation,Met,"The only related code is password hashing and that is fully configurable, see https://docs.djangoproject.com/en/1.11/topics/auth/passwords/",Met,Credentials are stored in a database,Met,https://docs.weblate.org/en/latest/admin/quick.html#verify,Met,"All release tags are signed, see https://github.com/WeblateOrg/weblate/releases",74,?,,Met,All our files have copyright and license header,Met,All our files have copyright and license header,Met,We have newbie label for that: https://github.com/WeblateOrg/weblate/labels/good%20first%20issue,Met,We do require 2FA on GitHub,Met,We're using GitHub,?,,?,,Met,https://codecov.io/github/WeblateOrg/weblate/,Met,https://codecov.io/github/WeblateOrg/weblate/,?,,?,,Met,,Unmet,,193,,,,,,2016-12-12 11:30:50 UTC,,,Met,
20,553,787,mutator,"A C code mutator,Misra-C checker and when possible, a Misra-C implementer using the Clang frontend written mostly in C++ and some bash.",https://github.com/bloodstalker/mutator,https://github.com/bloodstalker/mutator,LGPL-3.0,?,,Met,Given only https: URLs.,Met,the repo README is supposed to do just that. the language is in english.,Met,the github issue system can be used or they can just contact me(both are said in the README),Met,"Projects on GitHub by default use issues and pull requests, as encouraged by documentation such as <https://guides.github.com/activities/contributing-to-open-source/>.",Met,"https://github.com/bloodstalker/mutator
currently the only kindof required contributations is testers and code reveiwers which is explained int he README.md in the project root.",Met,Non-trivial license location file in repository: <https://github.com/bloodstalker/mutator/blob/master/LICENSE.txt>.,Met,The LGPL-3.0 license is approved by the Open Source Initiative (OSI).,Met,The LGPL-3.0 license is approved by the Open Source Initiative (OSI).,Met,the documentation is available inside README.md,Met,the documentation is available inside README.md,Met,"Repository on GitHub, which provides public git repositories with URLs.",Met,"Repository on GitHub, which uses git. git can track the changes, who made them, and when they were made.",Met,"the project has not reached a candidate release version yet, but release candidates will b branched from the master.",Met,"Repository on GitHub, which uses git. git is distributed.",Met,"https://github.com/bloodstalker/mutator
currently all releases are dev releases.",Met,,Met,,Met,"https://github.com/bloodstalker/mutator/changelog
as there are no public releases, it is empty.
the changes made to each file are only reflected in the commit comments.
the changes will be documented once we reach a first release for any of the executables.",Met,there are currently no releases for the project,?,,Met,github issue tracker?,Met,https://github.com/bloodstalker/mutator/issues,Met,,Met,there are currently no requests,Met,https://github.com/bloodstalker/mutator/issues github's issue trackre,Met,"https://github.com/bloodstalker/mutator
doesnt really apply to a code-mutation, static analysis tool.",,does not apply to the project,Met,"none so far, so its not exactly a yes or no.",Met,Non-trivial build file in repository: <https://github.com/bloodstalker/mutator/blob/master/makefile>.,Met,Non-trivial build file in repository: <https://github.com/bloodstalker/mutator/blob/master/makefile>.,Met,https://travis-ci.org/bloodstalker/mutator,Met,"the default target to run for the executables is the tests. the project can also be built and run for code coverage, both with gcov and profdata support.",Met,,Met,the results can be viewwed using llvm-cov and building the executables in coverage mode and then running them with default options.,Met,the test folder contains all the tests for any newly added feature.,Met,the tests source files could be viewed for added tests per new lines of code.,Met,"https://github.com/bloodstalker/mutator
the test plan can be found in the README.md in the project root",Met,all compiler flags are enabled.,Met,"all warnings are adressed. currently the project has not yet reached a release version so the only warnings are for unused but defined objects. the rest of the warnings, have all been dealt with.",Met,"all warnings are adressed. currently the project has not yet reached a release version so the only warnings are for unused but defined objects. the rest of the warnings, have all been dealt with.",Met,"it just doesnt not apply, ",Met,"it just doesnt not apply, ",,does not apply,,the libraries used so far by the project are the clang and llvm libraries and tinyxml2.,,no such functionality exists for the project.,,does not apply,,does not apply,,does not apply,,does not apply,,,Met,uses https,Met,uses https,Met,currently there are no such vulnerabilities ,Met,"currently there are no such vulnerabilities. though we could argue that broken Travi builds could be interpreted as that for the project. if s, they are treated as highly critical and fixed immediately.",Met,https://scan.coverity.com/projects/bloodstalker-mutator,Met,the project is using Coverity,Met,currently the only defects matching the description given by this clause belong to the third-party libraries used by the project and not to the project itself.,Met,Coverity and CI Travis integration.,Met,the project uses valgrind.,Met,valgrind,Met,asserts are being used.,,does not apply,,2016-12-12 23:20:40 UTC,2017-01-15 14:47:57 UTC,,does not apply,Met,https://travis-ci.org/bloodstalker/mutator,,Met,GitHub supports discussions on issues and pull requests.,Met,has never happened,Met,provided in the repository README.md,?,,,doesnt apply,,doesnt apply,,doesnt apply,,doesnt apply,Met,Found all required security hardening headers.,Met,GNU make,Met,,100,2017-01-15 14:47:57 UTC,,,False,"C++, C, Python (CII estimate)",3,24,?,,?,,?,,?,,?,,?,,?,,?,,?,,?,,?,,?,,?,,?,,?,,?,,?,,?,,?,,?,,?,,?,,?,,?,,?,,?,,?,,?,,?,,?,,?,,?,,?,,?,,?,,?,,?,,?,,?,,?,,26,?,,?,,?,,?,,?,,?,,?,,?,,?,,?,,?,,?,,Met,,Unmet,,124,,,,,,2017-01-15 14:47:57 UTC,,,Met,
21,556,791,Omegle-Client,,https://gitlab.com/tfSheol/Omegle-Client,https://gitlab.com/tfSheol/Omegle-Client.git,,?,,Met,Given only https: URLs.,Met,,Met,,Met,,Met,,Met,,Met,,Met,,Met,,Met,,?,,?,,?,,?,,?,,?,,?,,?,,?,,?,,?,,?,,?,,?,,?,,?,,?,,?,,?,,?,,?,,?,,?,,?,,?,,?,,?,,?,,?,,?,,?,,?,,?,,?,,?,,?,,?,,?,,?,,?,,?,,?,,?,,?,,?,,?,,?,,?,,?,,?,,?,,?,,,2016-12-13 22:54:22 UTC,2016-12-13 22:55:31 UTC,?,,?,,,Met,,?,,Met,,?,,?,,?,,?,,?,,Unmet,One or more of the required security hardening headers is missing.,?,,?,,15,,,2022-03-11 23:00:36 UTC,False,,27,0,?,,?,,?,,?,,?,,?,,?,,?,,?,,?,,?,,?,,?,,?,,?,,?,,?,,?,,?,,?,,?,,?,,?,,?,,?,,?,,?,,?,,?,,?,,?,,?,,?,,?,,?,,?,,?,,?,,?,,?,,0,?,,?,,?,,?,,?,,?,,?,,?,,?,,?,,?,,?,,Unmet,,Unmet,,15,,,,,,,,,Met,
22,557,793,willgo,,,https://gitlab.com/Willgo/willgo,,?,,Met,Given only https: URLs.,?,,?,,?,,?,,?,,?,,?,,?,,?,,?,,?,,?,,?,,?,,?,,?,,?,,?,,?,,?,,?,,?,,?,,?,,?,,?,,?,,?,,?,,?,,?,,?,,?,,?,,?,,?,,?,,?,,?,,?,,?,,?,,?,,?,,?,,?,,?,,?,,?,,?,,?,,?,,?,,?,,?,,?,,?,,?,,?,,?,,?,,,2016-12-14 12:13:15 UTC,2016-12-14 12:13:15 UTC,?,,?,,,?,,?,,?,,?,,?,,?,,?,,?,,?,,?,,?,,3,,,2022-03-12 23:00:28 UTC,False,,27,0,?,,?,,?,,?,,?,,?,,?,,?,,?,,?,,?,,?,,?,,?,,?,,?,,?,,?,,?,,?,,?,,?,,?,,?,,?,,?,,?,,?,,?,,?,,?,,?,,?,,?,,?,,?,,?,,?,,?,,?,,0,?,,?,,?,,?,,?,,?,,?,,?,,?,,?,,?,,?,,Unmet,,Unmet,,3,,,,,,,,,Met,
23,558,794,l3.io,,https://github.com/laithshadeed/l3.io,https://github.com/laithshadeed/l3.io,MIT,?,,Met,Given only https: URLs.,?,,?,,Met,"Projects on GitHub by default use issues and pull requests, as encouraged by documentation such as <https://guides.github.com/activities/contributing-to-open-source/>.",?,,Met,Non-trivial license location file in repository: <https://github.com/laithshadeed/l3.io/blob/master/LICENSE.md>.,Met,The MIT license is approved by the Open Source Initiative (OSI).,Met,The MIT license is approved by the Open Source Initiative (OSI).,?,,?,,Met,"Repository on GitHub, which provides public git repositories with URLs.",Met,"Repository on GitHub, which uses git. git can track the changes, who made them, and when they were made.",?,,Met,"Repository on GitHub, which uses git. git is distributed.",?,,?,,?,,Unmet,No release notes file found.,?,,?,,?,,?,,?,,?,,?,,?,,?,,?,,?,,?,,?,,?,,?,,?,,?,,?,,?,,?,,?,,?,,?,,?,,?,,?,,?,,?,,?,,?,,?,,?,,?,,?,,?,,?,,?,,?,,?,,?,,?,,?,,?,,?,,,2016-12-14 18:42:43 UTC,2016-12-14 18:42:59 UTC,?,,?,,,Met,GitHub supports discussions on issues and pull requests.,?,,?,,?,,?,,?,,?,,?,,Met,Found all required security hardening headers.,?,,?,,15,,,2022-03-12 23:00:28 UTC,False,JavaScript (CII estimate),28,0,?,,?,,?,,?,,?,,?,,?,,?,,?,,?,,?,,?,,?,,?,,?,,?,,?,,?,,?,,?,,?,,?,,?,,?,,?,,?,,?,,?,,?,,?,,?,,?,,?,,?,,?,,?,,?,,?,,?,,?,,4,?,,?,,?,,?,,?,,?,,?,,?,,?,,?,,?,,?,,Unmet,,Unmet,,15,,,,,,,,,Met,
