,id,user_id,name,description,homepage_url,repo_url,license,homepage_url_status,homepage_url_justification,sites_https_status,sites_https_justification,description_good_status,description_good_justification,interact_status,interact_justification,contribution_status,contribution_justification,contribution_requirements_status,contribution_requirements_justification,license_location_status,license_location_justification,floss_license_status,floss_license_justification,floss_license_osi_status,floss_license_osi_justification,documentation_basics_status,documentation_basics_justification,documentation_interface_status,documentation_interface_justification,repo_public_status,repo_public_justification,repo_track_status,repo_track_justification,repo_interim_status,repo_interim_justification,repo_distributed_status,repo_distributed_justification,version_unique_status,version_unique_justification,version_semver_status,version_semver_justification,version_tags_status,version_tags_justification,release_notes_status,release_notes_justification,release_notes_vulns_status,release_notes_vulns_justification,report_url_status,report_url_justification,report_tracker_status,report_tracker_justification,report_process_status,report_process_justification,report_responses_status,report_responses_justification,enhancement_responses_status,enhancement_responses_justification,report_archive_status,report_archive_justification,vulnerability_report_process_status,vulnerability_report_process_justification,vulnerability_report_private_status,vulnerability_report_private_justification,vulnerability_report_response_status,vulnerability_report_response_justification,build_status,build_justification,build_common_tools_status,build_common_tools_justification,build_floss_tools_status,build_floss_tools_justification,test_status,test_justification,test_invocation_status,test_invocation_justification,test_most_status,test_most_justification,test_policy_status,test_policy_justification,tests_are_added_status,tests_are_added_justification,tests_documented_added_status,tests_documented_added_justification,warnings_status,warnings_justification,warnings_fixed_status,warnings_fixed_justification,warnings_strict_status,warnings_strict_justification,know_secure_design_status,know_secure_design_justification,know_common_errors_status,know_common_errors_justification,crypto_published_status,crypto_published_justification,crypto_call_status,crypto_call_justification,crypto_floss_status,crypto_floss_justification,crypto_keylength_status,crypto_keylength_justification,crypto_working_status,crypto_working_justification,crypto_pfs_status,crypto_pfs_justification,crypto_password_storage_status,crypto_password_storage_justification,crypto_random_status,crypto_random_justification,delivery_mitm_status,delivery_mitm_justification,delivery_unsigned_status,delivery_unsigned_justification,vulnerabilities_fixed_60_days_status,vulnerabilities_fixed_60_days_justification,vulnerabilities_critical_fixed_status,vulnerabilities_critical_fixed_justification,static_analysis_status,static_analysis_justification,static_analysis_common_vulnerabilities_status,static_analysis_common_vulnerabilities_justification,static_analysis_fixed_status,static_analysis_fixed_justification,static_analysis_often_status,static_analysis_often_justification,dynamic_analysis_status,dynamic_analysis_justification,dynamic_analysis_unsafe_status,dynamic_analysis_unsafe_justification,dynamic_analysis_enable_assertions_status,dynamic_analysis_enable_assertions_justification,dynamic_analysis_fixed_status,dynamic_analysis_fixed_justification,general_comments,created_at,updated_at,crypto_weaknesses_status,crypto_weaknesses_justification,test_continuous_integration_status,test_continuous_integration_justification,cpe,discussion_status,discussion_justification,no_leaked_credentials_status,no_leaked_credentials_justification,english_status,english_justification,hardening_status,hardening_justification,crypto_used_network_status,crypto_used_network_justification,crypto_tls12_status,crypto_tls12_justification,crypto_certificate_verification_status,crypto_certificate_verification_justification,crypto_verification_private_status,crypto_verification_private_justification,hardened_site_status,hardened_site_justification,installation_common_status,installation_common_justification,build_reproducible_status,build_reproducible_justification,badge_percentage_0,achieved_passing_at,lost_passing_at,last_reminder_at,disabled_reminders,implementation_languages,lock_version,badge_percentage_1,dco_status,dco_justification,governance_status,governance_justification,code_of_conduct_status,code_of_conduct_justification,roles_responsibilities_status,roles_responsibilities_justification,access_continuity_status,access_continuity_justification,bus_factor_status,bus_factor_justification,documentation_roadmap_status,documentation_roadmap_justification,documentation_architecture_status,documentation_architecture_justification,documentation_security_status,documentation_security_justification,documentation_quick_start_status,documentation_quick_start_justification,documentation_current_status,documentation_current_justification,documentation_achievements_status,documentation_achievements_justification,accessibility_best_practices_status,accessibility_best_practices_justification,internationalization_status,internationalization_justification,sites_password_security_status,sites_password_security_justification,maintenance_or_update_status,maintenance_or_update_justification,vulnerability_report_credit_status,vulnerability_report_credit_justification,vulnerability_response_process_status,vulnerability_response_process_justification,coding_standards_status,coding_standards_justification,coding_standards_enforced_status,coding_standards_enforced_justification,build_standard_variables_status,build_standard_variables_justification,build_preserve_debug_status,build_preserve_debug_justification,build_non_recursive_status,build_non_recursive_justification,build_repeatable_status,build_repeatable_justification,installation_standard_variables_status,installation_standard_variables_justification,installation_development_quick_status,installation_development_quick_justification,external_dependencies_status,external_dependencies_justification,dependency_monitoring_status,dependency_monitoring_justification,updateable_reused_components_status,updateable_reused_components_justification,interfaces_current_status,interfaces_current_justification,automated_integration_testing_status,automated_integration_testing_justification,regression_tests_added50_status,regression_tests_added50_justification,test_statement_coverage80_status,test_statement_coverage80_justification,test_policy_mandated_status,test_policy_mandated_justification,implement_secure_design_status,implement_secure_design_justification,input_validation_status,input_validation_justification,crypto_algorithm_agility_status,crypto_algorithm_agility_justification,crypto_credential_agility_status,crypto_credential_agility_justification,signed_releases_status,signed_releases_justification,version_tags_signed_status,version_tags_signed_justification,badge_percentage_2,contributors_unassociated_status,contributors_unassociated_justification,copyright_per_file_status,copyright_per_file_justification,license_per_file_status,license_per_file_justification,small_tasks_status,small_tasks_justification,require_2FA_status,require_2FA_justification,secure_2FA_status,secure_2FA_justification,code_review_standards_status,code_review_standards_justification,two_person_review_status,two_person_review_justification,test_statement_coverage90_status,test_statement_coverage90_justification,test_branch_coverage80_status,test_branch_coverage80_justification,security_review_status,security_review_justification,assurance_case_status,assurance_case_justification,achieve_passing_status,achieve_passing_justification,achieve_silver_status,achieve_silver_justification,tiered_percentage,repo_url_updated_at,achieved_silver_at,lost_silver_at,achieved_gold_at,lost_gold_at,first_achieved_passing_at,first_achieved_silver_at,first_achieved_gold_at,maintained_status,maintained_justification
0,3154,4240,appsec_spell_checker,CS-GY9163: Application Security Fall 2019 Unit Assignment 1,https://github.com/shrowner/appsec_spell_checker,https://github.com/shrowner/appsec_spell_checker,,?,,Met,Given only https: URLs.,?,,?,,Met,"Projects on GitHub by default use issues and pull requests, as encouraged by documentation such as <https://guides.github.com/activities/contributing-to-open-source/>.",?,,Unmet,// No license location file found.,?,,?,,Unmet,// No appropriate folder found for documentation basics.,?,,Met,"Repository on GitHub, which provides public git repositories with URLs.",Met,"Repository on GitHub, which uses git. git can track the changes, who made them, and when they were made.",?,,Met,"Repository on GitHub, which uses git. git is distributed.",?,,?,,?,,Unmet,// No release notes file found.,?,,?,,?,,?,,?,,?,,?,,?,,?,,?,,?,,?,,?,,?,,?,,?,,?,,?,,?,,?,,?,,?,,?,,?,,?,,?,,?,,?,,?,,?,,?,,?,,?,,?,,?,,?,,?,,?,,?,,?,,?,,?,,?,,?,,,2019-09-04 17:37:31 UTC,2019-09-04 17:37:31 UTC,?,,?,,,Met,GitHub supports discussions on issues and pull requests.,?,,?,,?,,?,,?,,?,,?,,Met,Found all required security hardening headers.,?,,?,,10,,,2022-04-02 23:00:22 UTC,False,C,12,0,?,,?,,?,,?,,?,,?,,?,,?,,?,,?,,?,,?,,?,,?,,?,,?,,?,,?,,?,,?,,?,,?,,?,,?,,?,,?,,?,,?,,?,,?,,?,,?,,?,,?,,?,,?,,?,,?,,?,,?,,4,?,,?,,?,,?,,?,,?,,?,,?,,?,,?,,?,,?,,Unmet,,Unmet,,10,,,,,,,,,Met,
1,3155,4245,Lely core libraries,"The Lely core libraries are a collection of libraries designed to support the implementation robot control applications, on Linux, Windows or bare metal platforms. The primary components are an event loop/task scheduling mechanism, an I/O abstraction layer, and an extensive implementation of the CANopen protocol. The libraries have no external dependencies (apart from optional BlueZ headers on Linux).

The libraries are used to control sensors and actuators in all the recent robots made by Lely.",https://opensource.lely.com/canopen,https://gitlab.com/lely_industries/lely-core,Apache-2.0,?,,Met,Given only https: URLs.,Met,,Met,,Unmet,"The project uses the GitLab issue board and merge requests, but this is not directly mentioned in the documentation.",Unmet,T.B.D.,Met,https://gitlab.com/lely_industries/lely-core/blob/master/LICENSE,Met,The Apache-2.0 license is approved by the Open Source Initiative (OSI).,Met,The Apache-2.0 license is approved by the Open Source Initiative (OSI).,Met,http://lely_industries.gitlab.io/lely-core/doxygen/,Met,,Met,,Met,,Met,,Met,,Met,,Met,,Met,,Met,https://gitlab.com/lely_industries/lely-core/-/releases,Met,,?,,Met,,Met,https://gitlab.com/lely_industries/lely-core/issues,Met,,Met,,Met,https://gitlab.com/lely_industries/lely-core/issues,Unmet,"The project uses the GitLab issue board, but this has not yet been explicitly documented.",,,,,Met,,Met,autotools,Met,,Met,,Met,make check,Unmet,Coverage is currently ~50%.,Met,,Met,,Unmet,,Met,,Met,All warnings are treated as errors.,Met,"Compiler flags include ""-Wall -Wextra -pedantic -Werror"".",Met,,Met,,,,,,,,,,,,,,,,,,Met,Both GitLab (for source code) and Launchpad (for Ubuntu packages) use https.,Met,,Met,"Coverity Scan has recently enabled for this project, and the reported vulnerabilities (mostly false positives) are in the process of being fixed.",Met,,Met,"cppcheck, cpplint, clang static analyzer, Coverity Scan",Met,,Met,,Met,"All static analysis tools are run on every commit, with the exception of Coverity Scan, since it is limited to three scans per day.",Unmet,The test suite currently has ~50% code coverage. Efforts are underway to increase the coverage.,Met,The entire test suite is run under valgrind.,Met,,Met,,,2019-09-05 15:09:36 UTC,2020-01-21 08:55:40 UTC,,,Met,The project uses the GitLab CI/CD pipelines.,,Met,https://gitlab.com/lely_industries/lely-core/issues,Met,,Met,,?,,?,,?,,?,,?,,Unmet,"Found all required security hardening headers. // X-Content-Type-Options was not set to ""nosniff"".",?,,?,,97,,,2022-04-24 23:00:24 UTC,False,"C, C++",23,5,?,,?,,?,,?,,?,,?,,?,,?,,?,,?,,?,,?,,?,,?,,?,,?,,?,,?,,?,,?,,?,,?,,?,,?,,?,,?,,?,,?,,?,,?,,?,,?,,?,,?,,?,,?,,?,,?,,?,,?,,0,?,,?,,?,,?,,?,,?,,?,,?,,?,,?,,?,,?,,Unmet,,Unmet,,97,,,,,,,,,Met,
2,3156,4246,Hyperactive,A hyperparameter optimization and meta-learning toolbox for convenient and fast prototyping of machine-/deep-learning models.,https://github.com/SimonBlanke/Hyperactive,https://github.com/SimonBlanke/Hyperactive,MIT,?,,Met,Given only https: URLs.,?,,?,,Met,"Projects on GitHub by default use issues and pull requests, as encouraged by documentation such as <https://guides.github.com/activities/contributing-to-open-source/>.",?,,Met,Non-trivial license location file in repository: <https://github.com/SimonBlanke/Hyperactive/blob/master/LICENSE>.,Met,The MIT license is approved by the Open Source Initiative (OSI).,Met,The MIT license is approved by the Open Source Initiative (OSI).,Unmet,// No appropriate folder found for documentation basics.,?,,Met,"Repository on GitHub, which provides public git repositories with URLs.",Met,"Repository on GitHub, which uses git. git can track the changes, who made them, and when they were made.",?,,Met,"Repository on GitHub, which uses git. git is distributed.",?,,?,,?,,Unmet,// No release notes file found.,?,,?,,?,,?,,?,,?,,?,,?,,?,,?,,?,,?,,?,,?,,?,,?,,?,,?,,?,,?,,?,,?,,?,,?,,?,,?,,?,,?,,?,,?,,?,,?,,?,,?,,?,,?,,?,,?,,?,,?,,?,,?,,?,,?,,,2019-09-05 16:58:49 UTC,2019-09-05 17:00:28 UTC,?,,?,,,Met,GitHub supports discussions on issues and pull requests.,?,,?,,?,,?,,?,,?,,?,,Met,Found all required security hardening headers.,?,,?,,15,,,2022-04-03 23:00:32 UTC,False,"Python, Jupyter Notebook, Shell",13,0,?,,?,,?,,?,,?,,?,,?,,?,,?,,?,,?,,?,,?,,?,,?,,?,,?,,?,,?,,?,,?,,?,,?,,?,,?,,?,,?,,?,,?,,?,,?,,?,,?,,?,,?,,?,,?,,?,,?,,?,,4,?,,?,,?,,?,,?,,?,,?,,?,,?,,?,,?,,?,,Unmet,,Unmet,,15,,,,,,,,,Met,
3,3157,4248,ghdl,"Open-source analyzer, compiler and simulator for VHDL 2008/93/87",https://github.com/ghdl/ghdl,https://github.com/ghdl/ghdl,GPL-2.0-or-later CC-BY-SA-4.0,?,,Met,github.,Met,https://github.com/ghdl/ghdl/blob/master/README.md,Met,"https://github.com/ghdl/ghdl/issues/new/choose
https://github.com/ghdl/ghdl/blob/master/.github/CONTRIBUTING.md
https://ghdl.readthedocs.io/en/latest/contribute.html
",Met,"Projects on GitHub by default use issues and pull requests, as encouraged by documentation such as <https://guides.github.com/activities/contributing-to-open-source/>.

https://ghdl.readthedocs.io/en/latest/contribute.html",Met,"https://github.com/ghdl/ghdl/blob/master/.github/PULL_REQUEST_TEMPLATE.md
https://ghdl.readthedocs.io/en/latest/references/CodingStyle.html",Met,Non-trivial license location file in repository: <https://github.com/ghdl/ghdl/blob/master/COPYING.md>.,Met,The GPL-2.0-or-later license is approved by the Open Source Initiative (OSI).,Met,The GPL-2.0-or-later license is approved by the Open Source Initiative (OSI).,Met,"https://github.com/ghdl/ghdl/tree/master/doc
https://ghdl.readthedocs.io",Met,https://ghdl.readthedocs.io/en/latest/using/InvokingGHDL.html,Met,"Repository on GitHub, which provides public git repositories with URLs.",Met,"Repository on GitHub, which uses git. git can track the changes, who made them, and when they were made.",Met,The full history is available in the git repo.,Met,"Repository on GitHub, which uses git. git is distributed.",Met,"https://github.com/ghdl/ghdl/releases
https://github.com/ghdl/ghdl/blob/master/configure#L26",Unmet,"v1 has not been released yet and patch releases are not published. As a result, all the releases are kind-of MINOR releases where features are added and backwards compatibility is preserved if possible. However, some complementary tools/libraries depend on internal data structures that change frequently. Until these data structures are stabilized, it is not possible to adopt a proper SemVer format.",Met,Each version is tagged and a branch exists for each version.,Met,Non-trivial release notes file in repository: <https://github.com/ghdl/ghdl/blob/master/NEWS.md>.,,There have been no publicly known vulnerabilities,?,,Met,https://github.com/ghdl/ghdl/issues,Met,https://github.com/ghdl/ghdl/issues/new/choose,Met,"All of the bugs are acknowledged as fast as possible, and information about the expected priority and/or ETA is provided.",Met,Almost all issues are attended in less than 24h.,Met,https://github.com/ghdl/ghdl/issues,Met,The process is the same as for any other bug: https://github.com/ghdl/ghdl/issues/new/choose,Met,"Private chats and the email address of the author are available.
https://gitter.im/tgingold",,,Met,,Met,,Met,,Met,,Met,"Bash scripts are provided, which allow to run one or multiple test suites: https://github.com/ghdl/ghdl/blob/master/testsuite/testsuite.sh",Met,,Met,,Met,,Met,https://github.com/ghdl/ghdl/blob/master/.github/PULL_REQUEST_TEMPLATE.md,Met,,Met,,Met,-gnatwa is used.,Met,,Met,Use of Ada greatly reduce the number of vulnerabilities.,,,,,,,,,,,,,,,,,Met,,Met,No use of HTTP.,Met,No vulnerabilities reported.,Met,No vulnerabilities reported.,,No FLOSS tools exist that implement this criterion in the target languages.,,There is no FLOSS tool that can implement this criterion in Ada and/or VHDL.,,,,,Unmet,,Unmet,,Met,Assertions and checks are enabled,Met,Assertion error results in a stop.,,2019-09-06 00:38:38 UTC,2019-09-14 00:36:49 UTC,,,Met,https://github.com/ghdl/ghdl/actions,,Met,"GitHub supports discussions on issues and pull requests.
There is also a chat room: https://gitter.im/ghdl1/Lobby",Met,Only tokens for CI are used.,Met,"English is the main language everywhere (comments in source code, documentation, issues, chat, etc.)",?,,,,,,?,,?,,Unmet,"// X-Content-Type-Options was not set to ""nosniff"".",Met,A makefile is provided and packages for major distributions are available.,Met,All the build procedure is executed on publicly available systems and with sources available in the main repo: https://github.com/ghdl/ghdl/tree/master/dist,100,2019-09-14 00:05:04 UTC,2019-09-13 23:57:21 UTC,,False,"VHDL, Ada, C, Python, Shell, Makefile, GDB",26,49,?,,?,,Met,https://github.com/ghdl/ghdl/blob/master/.github/CODE_OF_CONDUCT.md,?,,?,,?,,?,,?,,?,,Met,https://ghdl.readthedocs.io/en/latest/using/QuickStartGuide.html,Met,"Different versions of the docs are available, so each user can read the one corresponding to the installed release.",Met,https://github.com/ghdl/ghdl/pull/923,?,,?,,Met,Github meets this criterion.,,v1 has not been release yet. All existing releases are development/experimental versions.,,No vulnerabilities resolved in the last 12 months.,?,,Met,https://ghdl.readthedocs.io/en/latest/references/CodingStyle.html,,There is no FLOSS tool that can do so in Ada and VHDL.,?,,Met,The project can be built with or without debugging information.,?,,?,,Met,Standard makefile conventions are honored.,Met,"Apart from git and make, separate docker images with build and run/test dependencies are available.",Met,"This is defined in dockerfiles, but also in package management system sources (PKGBUILD, deb, rpm, etc.)

https://github.com/ghdl/ghdl/issues/901",?,,Met,Externally-maintainer dependencies are explicitly defined and standard components provided by the system or programming language are used.,Met,No deprecated or obsolete functions or APIs are used.,Met,"https://github.com/ghdl/ghdl/tree/master/testsuite

https://github.com/ghdl/ghdl/actions/",Met,Each reproducible issue/bug is added to the set of regression tests.,?,,?,,?,,?,,?,,?,,?,,?,,39,Met,https://github.com/ghdl/ghdl/graphs/contributors,Met,"Copyright statements are manually added to each source file.

https://github.com/ghdl/ghdl/issues/843",?,,?,,?,,?,,?,,?,,?,,?,,?,,?,,Met,,Unmet,,149,,,,,,2019-09-14 00:05:04 UTC,,,Met,
4,3159,4247,appsecurity9163,Learn Secure coding and application development techniques,https://github.com/zacisgr8/appsecurity9163,https://github.com/zacisgr8/appsecurity9163,,?,,Met,Given only https: URLs.,?,,?,,Met,"Projects on GitHub by default use issues and pull requests, as encouraged by documentation such as <https://guides.github.com/activities/contributing-to-open-source/>.",?,,Unmet,// No license location file found.,?,,?,,Unmet,// No appropriate folder found for documentation basics.,?,,Met,"Repository on GitHub, which provides public git repositories with URLs.",Met,"Repository on GitHub, which uses git. git can track the changes, who made them, and when they were made.",?,,Met,"Repository on GitHub, which uses git. git is distributed.",?,,?,,?,,Unmet,// No release notes file found.,?,,?,,?,,?,,?,,?,,?,,?,,?,,?,,?,,?,,?,,?,,?,,?,,?,,?,,?,,?,,?,,?,,?,,?,,?,,?,,?,,?,,?,,?,,?,,?,,?,,?,,?,,?,,?,,?,,?,,?,,?,,?,,?,,?,,,2019-09-06 17:09:49 UTC,2019-09-06 17:11:13 UTC,?,,?,,,Met,GitHub supports discussions on issues and pull requests.,?,,?,,?,,?,,?,,?,,?,,Met,Found all required security hardening headers.,?,,?,,10,,,2022-04-04 23:00:47 UTC,False,,13,0,?,,?,,?,,?,,?,,?,,?,,?,,?,,?,,?,,?,,?,,?,,?,,?,,?,,?,,?,,?,,?,,?,,?,,?,,?,,?,,?,,?,,?,,?,,?,,?,,?,,?,,?,,?,,?,,?,,?,,?,,4,?,,?,,?,,?,,?,,?,,?,,?,,?,,?,,?,,?,,Unmet,,Unmet,,10,,,,,,,,,Met,
5,3160,4252,DymamicAuthProviders,Store and manage Microsoft.AspNetCore.Authentication providers dynamicaly,https://github.com/aguacongas/DymamicAuthProviders,https://github.com/aguacongas/DymamicAuthProviders,MIT,?,,Met,Given only https: URLs.,Met,"This is library, is the website content",Met,The wiki provide doc,Met,Non-trivial contribution file in repository: <https://github.com/aguacongas/DymamicAuthProviders/blob/master/CONTRIBUTING.md>.,Met,https://github.com/aguacongas/DymamicAuthProviders/blob/master/CONTRIBUTING.md,Met,Non-trivial license location file in repository: <https://github.com/aguacongas/DymamicAuthProviders/blob/master/LICENSE>.,Met,The MIT license is approved by the Open Source Initiative (OSI).,Met,The MIT license is approved by the Open Source Initiative (OSI).,Met,https://github.com/aguacongas/DymamicAuthProviders/wiki,Met,https://github.com/aguacongas/DymamicAuthProviders/wiki,Met,"Repository on GitHub, which provides public git repositories with URLs.",Met,"Repository on GitHub, which uses git. git can track the changes, who made them, and when they were made.",Met,https://github.com/aguacongas/DymamicAuthProviders/blob/master/CONTRIBUTING.md,Met,"Repository on GitHub, which uses git. git is distributed.",Met,semantic-release create the versioning,Met,,Met,semantic-release create the versioning,Met,Non-trivial release notes file in repository: <https://github.com/aguacongas/DymamicAuthProviders/blob/master/CHANGELOG.md>.,Met,"release not generate by semantic-release
",?,,Met,github issues,Met,https://github.com/aguacongas/DymamicAuthProviders/issues,Met,,Met,,Met,https://github.com/aguacongas/DymamicAuthProviders/issues,Met,https://github.com/aguacongas/DymamicAuthProviders/blob/master/.github/ISSUE_TEMPLATE/bug_report.md,Met,https://github.com/aguacongas/DymamicAuthProviders/blob/master/.github/ISSUE_TEMPLATE/bug_report.md,Met,,Met,appveyor,Met,,,,Met,,Met,,Met,,Met,,Met,,Met,,Met,,Met,,Met,,Met,,Met,,Met,,Met,,Met,,Met,,Met,,Met,,Met,,Met,,Met,,Met,,Met,,Met,,Met,MS code analyzer,Met,,Met,,Met,,Met,,Met,,Met,,Met,,,2019-09-07 09:17:40 UTC,2019-11-20 10:26:43 UTC,Met,,Met,,,Met,GitHub supports discussions on issues and pull requests.,Met,,Met,https://github.com/aguacongas/DymamicAuthProviders/wiki,?,,?,,?,,?,,?,,Met,Found all required security hardening headers.,?,,?,,100,2019-11-20 10:26:43 UTC,,2019-11-19 23:00:28 UTC,False,"C#, Shell, PowerShell, Batchfile",9,5,?,,?,,?,,?,,?,,?,,?,,?,,?,,?,,?,,?,,?,,?,,?,,?,,?,,?,,?,,?,,?,,?,,?,,?,,?,,?,,?,,?,,?,,?,,?,,?,,?,,?,,?,,?,,?,,?,,?,,?,,4,?,,?,,?,,?,,?,,?,,?,,?,,?,,?,,?,,?,,Met,,Unmet,,105,,,,,,2019-11-20 10:26:43 UTC,,,Met,
6,3161,4254,.github,Organization-wide GitHub configuration files,https://github.com/mu-box/.github,https://github.com/mu-box/.github,,?,,Met,Given only https: URLs.,?,,?,,Met,"Projects on GitHub by default use issues and pull requests, as encouraged by documentation such as <https://guides.github.com/activities/contributing-to-open-source/>.",?,,Unmet,// No license location file found.,?,,?,,Unmet,// No appropriate folder found for documentation basics.,?,,Met,"Repository on GitHub, which provides public git repositories with URLs.",Met,"Repository on GitHub, which uses git. git can track the changes, who made them, and when they were made.",?,,Met,"Repository on GitHub, which uses git. git is distributed.",?,,?,,?,,Unmet,// No release notes file found.,?,,?,,?,,?,,?,,?,,?,,?,,?,,?,,?,,?,,?,,?,,?,,?,,?,,?,,?,,?,,?,,?,,?,,?,,?,,?,,?,,?,,?,,?,,?,,?,,?,,?,,?,,?,,?,,?,,?,,?,,?,,?,,?,,?,,,2019-09-07 18:31:35 UTC,2019-09-07 18:31:35 UTC,?,,?,,,Met,GitHub supports discussions on issues and pull requests.,?,,?,,?,,?,,?,,?,,?,,Met,Found all required security hardening headers.,?,,?,,10,,,2022-04-05 23:00:37 UTC,False,,12,0,?,,?,,?,,?,,?,,?,,?,,?,,?,,?,,?,,?,,?,,?,,?,,?,,?,,?,,?,,?,,?,,?,,?,,?,,?,,?,,?,,?,,?,,?,,?,,?,,?,,?,,?,,?,,?,,?,,?,,?,,4,?,,?,,?,,?,,?,,?,,?,,?,,?,,?,,?,,?,,Unmet,,Unmet,,10,,,,,,,,,Met,
