,id,user_id,name,description,homepage_url,repo_url,license,homepage_url_status,homepage_url_justification,sites_https_status,sites_https_justification,description_good_status,description_good_justification,interact_status,interact_justification,contribution_status,contribution_justification,contribution_requirements_status,contribution_requirements_justification,license_location_status,license_location_justification,floss_license_status,floss_license_justification,floss_license_osi_status,floss_license_osi_justification,documentation_basics_status,documentation_basics_justification,documentation_interface_status,documentation_interface_justification,repo_public_status,repo_public_justification,repo_track_status,repo_track_justification,repo_interim_status,repo_interim_justification,repo_distributed_status,repo_distributed_justification,version_unique_status,version_unique_justification,version_semver_status,version_semver_justification,version_tags_status,version_tags_justification,release_notes_status,release_notes_justification,release_notes_vulns_status,release_notes_vulns_justification,report_url_status,report_url_justification,report_tracker_status,report_tracker_justification,report_process_status,report_process_justification,report_responses_status,report_responses_justification,enhancement_responses_status,enhancement_responses_justification,report_archive_status,report_archive_justification,vulnerability_report_process_status,vulnerability_report_process_justification,vulnerability_report_private_status,vulnerability_report_private_justification,vulnerability_report_response_status,vulnerability_report_response_justification,build_status,build_justification,build_common_tools_status,build_common_tools_justification,build_floss_tools_status,build_floss_tools_justification,test_status,test_justification,test_invocation_status,test_invocation_justification,test_most_status,test_most_justification,test_policy_status,test_policy_justification,tests_are_added_status,tests_are_added_justification,tests_documented_added_status,tests_documented_added_justification,warnings_status,warnings_justification,warnings_fixed_status,warnings_fixed_justification,warnings_strict_status,warnings_strict_justification,know_secure_design_status,know_secure_design_justification,know_common_errors_status,know_common_errors_justification,crypto_published_status,crypto_published_justification,crypto_call_status,crypto_call_justification,crypto_floss_status,crypto_floss_justification,crypto_keylength_status,crypto_keylength_justification,crypto_working_status,crypto_working_justification,crypto_pfs_status,crypto_pfs_justification,crypto_password_storage_status,crypto_password_storage_justification,crypto_random_status,crypto_random_justification,delivery_mitm_status,delivery_mitm_justification,delivery_unsigned_status,delivery_unsigned_justification,vulnerabilities_fixed_60_days_status,vulnerabilities_fixed_60_days_justification,vulnerabilities_critical_fixed_status,vulnerabilities_critical_fixed_justification,static_analysis_status,static_analysis_justification,static_analysis_common_vulnerabilities_status,static_analysis_common_vulnerabilities_justification,static_analysis_fixed_status,static_analysis_fixed_justification,static_analysis_often_status,static_analysis_often_justification,dynamic_analysis_status,dynamic_analysis_justification,dynamic_analysis_unsafe_status,dynamic_analysis_unsafe_justification,dynamic_analysis_enable_assertions_status,dynamic_analysis_enable_assertions_justification,dynamic_analysis_fixed_status,dynamic_analysis_fixed_justification,general_comments,created_at,updated_at,crypto_weaknesses_status,crypto_weaknesses_justification,test_continuous_integration_status,test_continuous_integration_justification,cpe,discussion_status,discussion_justification,no_leaked_credentials_status,no_leaked_credentials_justification,english_status,english_justification,hardening_status,hardening_justification,crypto_used_network_status,crypto_used_network_justification,crypto_tls12_status,crypto_tls12_justification,crypto_certificate_verification_status,crypto_certificate_verification_justification,crypto_verification_private_status,crypto_verification_private_justification,hardened_site_status,hardened_site_justification,installation_common_status,installation_common_justification,build_reproducible_status,build_reproducible_justification,badge_percentage_0,achieved_passing_at,lost_passing_at,last_reminder_at,disabled_reminders,implementation_languages,lock_version,badge_percentage_1,dco_status,dco_justification,governance_status,governance_justification,code_of_conduct_status,code_of_conduct_justification,roles_responsibilities_status,roles_responsibilities_justification,access_continuity_status,access_continuity_justification,bus_factor_status,bus_factor_justification,documentation_roadmap_status,documentation_roadmap_justification,documentation_architecture_status,documentation_architecture_justification,documentation_security_status,documentation_security_justification,documentation_quick_start_status,documentation_quick_start_justification,documentation_current_status,documentation_current_justification,documentation_achievements_status,documentation_achievements_justification,accessibility_best_practices_status,accessibility_best_practices_justification,internationalization_status,internationalization_justification,sites_password_security_status,sites_password_security_justification,maintenance_or_update_status,maintenance_or_update_justification,vulnerability_report_credit_status,vulnerability_report_credit_justification,vulnerability_response_process_status,vulnerability_response_process_justification,coding_standards_status,coding_standards_justification,coding_standards_enforced_status,coding_standards_enforced_justification,build_standard_variables_status,build_standard_variables_justification,build_preserve_debug_status,build_preserve_debug_justification,build_non_recursive_status,build_non_recursive_justification,build_repeatable_status,build_repeatable_justification,installation_standard_variables_status,installation_standard_variables_justification,installation_development_quick_status,installation_development_quick_justification,external_dependencies_status,external_dependencies_justification,dependency_monitoring_status,dependency_monitoring_justification,updateable_reused_components_status,updateable_reused_components_justification,interfaces_current_status,interfaces_current_justification,automated_integration_testing_status,automated_integration_testing_justification,regression_tests_added50_status,regression_tests_added50_justification,test_statement_coverage80_status,test_statement_coverage80_justification,test_policy_mandated_status,test_policy_mandated_justification,implement_secure_design_status,implement_secure_design_justification,input_validation_status,input_validation_justification,crypto_algorithm_agility_status,crypto_algorithm_agility_justification,crypto_credential_agility_status,crypto_credential_agility_justification,signed_releases_status,signed_releases_justification,version_tags_signed_status,version_tags_signed_justification,badge_percentage_2,contributors_unassociated_status,contributors_unassociated_justification,copyright_per_file_status,copyright_per_file_justification,license_per_file_status,license_per_file_justification,small_tasks_status,small_tasks_justification,require_2FA_status,require_2FA_justification,secure_2FA_status,secure_2FA_justification,code_review_standards_status,code_review_standards_justification,two_person_review_status,two_person_review_justification,test_statement_coverage90_status,test_statement_coverage90_justification,test_branch_coverage80_status,test_branch_coverage80_justification,security_review_status,security_review_justification,assurance_case_status,assurance_case_justification,achieve_passing_status,achieve_passing_justification,achieve_silver_status,achieve_silver_justification,tiered_percentage,repo_url_updated_at,achieved_silver_at,lost_silver_at,achieved_gold_at,lost_gold_at,first_achieved_passing_at,first_achieved_silver_at,first_achieved_gold_at,maintained_status,maintained_justification
0,2031,2691,cregg,"Simple Conjoint Analyses, Tidying, and Visualization",https://github.com/leeper/cregg,https://github.com/leeper/cregg,MIT,?,,Met,Given only https: URLs.,Met,https://www.thomasleeper.com/cregg,Met,https://github.com/leeper/cregg/blob/master/.github/CONTRIBUTING.md,Met,"Projects on GitHub by default use issues and pull requests, as encouraged by documentation such as <https://guides.github.com/activities/contributing-to-open-source/>.",Met,https://github.com/leeper/cregg/blob/master/.github/CONTRIBUTING.md,Met,Non-trivial license location file in repository: <https://github.com/leeper/cregg/blob/master/LICENSE>.,Met,The MIT license is approved by the Open Source Initiative (OSI).,Met,The MIT license is approved by the Open Source Initiative (OSI).,Met,Some documentation basics file contents found.,Met,,Met,"Repository on GitHub, which provides public git repositories with URLs.",Met,"Repository on GitHub, which uses git. git can track the changes, who made them, and when they were made.",Met,,Met,"Repository on GitHub, which uses git. git is distributed.",Met,,Met,,Met,,Met,Non-trivial release notes file in repository: <https://github.com/leeper/cregg/blob/master/NEWS.md>.,?,,?,,Met,https://github.com/leeper/cregg/issues,Met,https://github.com/leeper/cregg/issues,Met,,Met,,?,,?,,?,,?,,Met,Non-trivial build file in repository: <https://github.com/leeper/cregg/blob/master/Makefile>.,Met,Non-trivial build file in repository: <https://github.com/leeper/cregg/blob/master/Makefile>.,Met,,Met,,Met,,Met,,?,,?,,?,,?,,?,,?,,?,,?,,?,,?,,?,,?,,?,,?,,?,,?,,?,,?,,?,,?,,?,,?,,?,,?,,?,,?,,?,,?,,,2018-07-30 17:47:07 UTC,2018-07-30 17:58:08 UTC,?,,Met,,,Met,GitHub supports discussions on issues and pull requests.,?,,Met,,?,,?,,?,,?,,?,,Met,Found all required security hardening headers.,?,,?,,48,,,2022-04-17 23:00:28 UTC,False,R,23,4,?,,?,,?,,?,,?,,?,,?,,?,,?,,?,,?,,?,,?,,?,,?,,?,,?,,?,,?,,?,,?,,?,,?,,?,,?,,?,,?,,?,,?,,?,,?,,?,,?,,?,,?,,?,,?,,?,,?,,?,,4,?,,?,,?,,?,,?,,?,,?,,?,,?,,?,,?,,?,,Unmet,,Unmet,,48,,,,,,,,,Met,
1,2033,2673,pade,"An R package which when given a vector of Taylor series coefficients of sufficient length as input, the function returns the numerator and denominator coefficients for the Padé approximant of appropriate order.",https://bitbucket.org/aadler/pade,https://bitbucket.org/aadler/pade,GPL-2.0-or-later OR BSD 2-Clause,?,,Met,Given only https: URLs.,Met,,Met,,Met,https://bitbucket.org/aadler/pade/src/master/README.md,Met,https://bitbucket.org/aadler/pade/src/master/README.md,Met,"https://bitbucket.org/aadler/pade/src/master/DESCRIPTION

https://bitbucket.org/aadler/pade/src/master/LICENSE",Met,,Met,Disjucntively licensed; both OSI approved,Met,,Met,,Met,,Met,,Met,,Met,,Met,,Met,,Met,,Met,https://bitbucket.org/aadler/pade/src/master/inst/NEWS.Rd,,No known vulnerabilities,?,,Met,https://bitbucket.org/aadler/pade/issues,Met,https://bitbucket.org/aadler/pade/issues,Met,,Met,,Met,https://bitbucket.org/aadler/pade/issues,Met,https://bitbucket.org/aadler/pade/issues,,,,,Met,Can be built by standard R package routines,Met,Can be built by standard R package routines,Met,,Met,Uses testthat package to run a suite of tests,Met,,Met,,Met,,Met,,Met,https://github.com/aadler/Pade/blob/master/README.md,Met,These flags can be passed during the R package building routine,Met,,Met,R CMD Check/Build has its defined warning parameters it passes on compilation,Met,Studied http://web.mit.edu/Saltzer/www/publications/protection/,Met,None of the top-10 errors listed here https://www.owasp.org/images/7/72/OWASP_Top_10-2017_%28en%29.pdf.pdf apply to this software.,,,,,,,,,,,,,,,,,Met,,Met,Cryptographic hashes are not provided in the CRAN ecosystem.,Met,,Met,,Met,R CMD check is the language equivalent,Met,"Uses R CMD check mechanism using win-builder and rhub, and the more restrictive --as-cran setting.",Met,,,,Met,No compiled code; all interpreted R code,Met,No compiled code; all interpreted R code,Met,No compiled code; all interpreted R code,Met,,,2018-07-30 18:05:52 UTC,2022-05-01 18:10:07 UTC,,,Unmet,BitBucket does not have easily integrated CI for Windows. I test locally and using rhub before I push to CRAN,,Met,,Met,,Met,,,The software is an add-in to the R statistical platform and does no I/O in and of itself.It gets checked with memory sanitizer flags on Rhub.,,,,,,,,,Unmet,"// One or more of the required security hardening headers is missing. // X-Content-Type-Options was not set to ""nosniff"".",Met,Uses the R package building system which comes with install and uninstall.,?,,100,2018-11-21 04:27:17 UTC,,2018-11-04 23:00:33 UTC,False,R,20,100,Met,https://github.com/aadler/Pade/blob/master/README.md,Met,https://github.com/aadler/Pade/blob/master/README.md,Met,https://github.com/aadler/Pade/blob/master/CodeOfConduct.md,Met,https://github.com/aadler/Pade/blob/master/DESCRIPTION,Met,"As a FLOSS project for R, it is easy for anyone to fork/clone the project and assume maintenance even without access to the behind-the-scenes elements of the githup repository. CRAN has been known many times to allow new users to assume maintenance of orphaned projects. THIS github repo may be defunct, but it can be cloned, updated, and the corrections built into the package and pushed to CRAN seamlessly to the end user.

See https://cran.r-project.org/src/contrib/Orphaned/README
",Unmet,"As a FLOSS project for R, it is easy for anyone to fork/clone the project and assume maintenance even without access to the behind-the-scenes elements of the githup repository.",Met,https://github.com/aadler/Pade#roadmap,Met,"It is an R package, on CRAN, which means it must conform to https://cran.r-project.org/doc/manuals/r-release/R-exts.html",Met,https://github.com/aadler/Pade#security,Met,https://cran.r-project.org/web/packages/Pade/Pade.pdf,Met,https://cran.r-project.org/web/packages/Pade/Pade.pdf,Met,https://github.com/aadler/Pade/blob/master/README.md,,"Mathematical computation library, so similar to program library in details.",,Software doesn't generate text intended for end-users and doesn't sort human-readable text,,Project sites do not store passwords for this purpose. It stores SSH key but not password.,Met,https://cran.r-project.org/src/contrib/Archive/Pade/,,No vulnerabilities resolved in the last 12 months,Met,https://github.com/aadler/Pade/issues,Met,https://github.com/aadler/Pade#style,,"No automatic tool to enforce the specific requirements, although many can be set as Rstudio options or through use of a linter,",Met,Built via the R CMD system which honors relevant compiler and linker (environment) variables.,Met,Built via the R CMD system which preserves debugging information.,Met,Built via the R CMD system and doesn't use a recursive make.,Met,Tested using the tinytest suite for R.,Met,Uses the R package building system and follows its standards.,Met,Easily installed by using R and any suite of its tools. Tested on rhub.,Met,"https://github.com/aadler/Pade/blob/master/DESCRIPTION;
https://github.com/aadler/Pade/blob/master/NAMESPACE",Met,"As it only imports base R package routines, that is handled by R Core.",Met,"https://github.com/aadler/Pade/blob/master/DESCRIPTION;
https://github.com/aadler/Pade/blob/master/NAMESPACE",,Must use the R build system as it is an R package.,Met,Uses the tinytest package and a suite of tests. https://github.com/aadler/Pade/blob/master/inst/tinytest,Met,https://github.com/aadler/Pade/blob/master/inst/tinytest,Met,https://app.codecov.io/gh/aadler/Pade?branch=master,Met,https://github.com/aadler/Pade/blob/master/README.md,Met,"Installation comes from CRAN or via devtools from GitHub, both of which default to https.",,Software doesn't accept inputs from untrusted sources. Users will use it individually and pass the needed numbers to it for calculation.,,,,,Met,The actual release mechanism is not controlled by me but by CRAN as per https://CRAN.R-project.org/package=Pade,Met,https://github.com/aadler/Pade/blob/master/README.md,26,?,,?,,?,,?,,?,,?,,?,,?,,?,,?,,?,,Met,https://github.com/aadler/Pade#security,Met,,Met,,226,,2022-05-01 18:10:07 UTC,,,,2018-11-21 04:27:17 UTC,2022-05-01 18:10:07 UTC,,Met,
2,2034,2692,biolink,R package for creating hyperlinks to biological databases and resources,https://github.com/aaronwolen/biolink,https://github.com/aaronwolen/biolink,OTHER,?,,Met,Given only https: URLs.,?,,?,,Met,"Projects on GitHub by default use issues and pull requests, as encouraged by documentation such as <https://guides.github.com/activities/contributing-to-open-source/>.",?,,Met,Non-trivial license location file in repository: <https://github.com/aaronwolen/biolink/blob/master/LICENSE>.,?,,Unmet,// Did not find license in the OSI list.,Unmet,// No appropriate folder found for documentation basics.,?,,Met,"Repository on GitHub, which provides public git repositories with URLs.",Met,"Repository on GitHub, which uses git. git can track the changes, who made them, and when they were made.",?,,Met,"Repository on GitHub, which uses git. git is distributed.",?,,?,,?,,Met,Non-trivial release notes file in repository: <https://github.com/aaronwolen/biolink/blob/master/NEWS.md>.,?,,?,,?,,?,,?,,?,,?,,?,,?,,?,,?,,?,,?,,?,,?,,?,,?,,?,,?,,?,,?,,?,,?,,?,,?,,?,,?,,?,,?,,?,,?,,?,,?,,?,,?,,?,,?,,?,,?,,?,,?,,?,,?,,?,,,2018-07-30 18:11:47 UTC,2018-07-30 18:11:47 UTC,?,,?,,,Met,GitHub supports discussions on issues and pull requests.,?,,?,,?,,?,,?,,?,,?,,Met,Found all required security hardening headers.,?,,?,,15,,,2022-04-17 23:00:28 UTC,False,R (CII estimate),19,0,?,,?,,?,,?,,?,,?,,?,,?,,?,,?,,?,,?,,?,,?,,?,,?,,?,,?,,?,,?,,?,,?,,?,,?,,?,,?,,?,,?,,?,,?,,?,,?,,?,,?,,?,,?,,?,,?,,?,,?,,4,?,,?,,?,,?,,?,,?,,?,,?,,?,,?,,?,,?,,Unmet,,Unmet,,15,,,,,,,,,Met,
3,2035,2693,styler,Non-invasive pretty printing of R code,http://styler.r-lib.org,https://github.com/r-lib/styler,GPL-2.0+,?,,Unmet,// Given an http: URL.,Met,,Met,,Met,Non-trivial contribution file in repository: <https://github.com/r-lib/styler/blob/master/CONTRIBUTING.md>.,Met,https://github.com/r-lib/styler/blob/master/CONTRIBUTING.md,Unmet,// No license location file found.,Met,Through LICENCE file The GPL-2.0 license is approved by the Open Source Initiative (OSI).,Met,The GPL-2.0 license is approved by the Open Source Initiative (OSI).,Met,// No appropriate folder found for documentation basics.,Met,,Met,"Repository on GitHub, which provides public git repositories with URLs.",Met,"Repository on GitHub, which uses git. git can track the changes, who made them, and when they were made.",Met,,Met,"Repository on GitHub, which uses git. git is distributed.",Met,,Met,,Met,,Met,Non-trivial release notes file in repository: <https://github.com/r-lib/styler/blob/master/NEWS.md>.,?,,?,,?,,?,,?,,?,,?,,?,,?,,?,,?,,?,,?,,?,,?,,?,,?,,?,,?,,?,,?,,?,,?,,?,,?,,?,,?,,?,,?,,?,,?,,?,,?,,?,,?,,?,,?,,?,,?,,?,,?,,?,,?,,?,,,2018-07-30 18:20:05 UTC,2021-02-05 23:04:04 UTC,?,,?,,,Met,GitHub supports discussions on issues and pull requests.,?,,Met,,?,,?,,?,,?,,?,,Unmet,"// X-Content-Type-Options was not set to ""nosniff"".",?,,?,,28,,,2021-02-05 23:01:41 UTC,True,"R, Rebol, C++ (CII estimate)",17,2,?,,?,,?,,?,,?,,?,,?,,?,,?,,?,,?,,?,,?,,?,,?,,?,,?,,?,,?,,?,,?,,?,,?,,?,,?,,?,,?,,?,,?,,?,,?,,?,,?,,?,,?,,?,,?,,?,,?,,?,,4,?,,?,,?,,?,,?,,?,,?,,?,,?,,?,,?,,?,,Unmet,,Unmet,,28,,,,,,,,,Met,
4,2036,2694,PGRdup,Discover Probable Duplicates in Plant Genetic Resources Collections,https://aravind-j.github.io/PGRdup,https://github.com/aravind-j/PGRdup,GPL-2.0-or-later,?,,Met,Given only https: URLs.,Met,https://aravind-j.github.io/PGRdup,Met,https://aravind-j.github.io/PGRdup,Met,"Projects on GitHub by default use issues and pull requests, as encouraged by documentation such as <https://guides.github.com/activities/contributing-to-open-source/>.",Unmet,,Unmet,// No license location file found.,Met,"Published in CRAN and github with FLOSS license
https://cran.r-project.org/package=PGRdup
https://github.com/aravind-j/PGRdupThe GPL-2.0-or-later license is approved by the Open Source Initiative (OSI).",Met,The GPL-2.0-or-later license is approved by the Open Source Initiative (OSI).,Met,Some documentation basics file contents found.,Met,https://aravind-j.github.io/PGRdup/reference/index.html,Met,"Repository on GitHub, which provides public git repositories with URLs.",Met,"Repository on GitHub, which uses git. git can track the changes, who made them, and when they were made.",Met,Interim commits saved in github,Met,"Repository on GitHub, which uses git. git is distributed.",Met,https://aravind-j.github.io/PGRdup/news/index.html,Met,,Met,https://aravind-j.github.io/PGRdup/news/index.html,Met,Non-trivial release notes file in repository: <https://github.com/aravind-j/PGRdup/blob/master/NEWS.md>.,Met,https://aravind-j.github.io/PGRdup/news/index.html,?,,?,,Met,,?,,?,,?,,?,,?,,?,,?,,Met,,Met,,?,,?,,?,,?,,?,,?,,?,,?,,?,,?,,?,,?,,?,,?,,?,,?,,?,,?,,?,,?,,?,,?,,?,,?,,?,,?,,?,,?,,?,,?,,?,,,2018-07-30 18:35:54 UTC,2018-07-30 18:47:13 UTC,?,,?,,,Met,GitHub supports discussions on issues and pull requests.,?,,Met,,?,,?,,?,,?,,?,,Unmet,"// X-Content-Type-Options was not set to ""nosniff"".",?,,?,,33,,,2022-04-17 23:00:30 UTC,False,R,23,0,?,,?,,?,,?,,?,,?,,?,,?,,?,,?,,?,,?,,?,,?,,?,,?,,?,,?,,?,,?,,?,,?,,?,,?,,?,,?,,?,,?,,?,,?,,?,,?,,?,,?,,?,,?,,?,,?,,?,,?,,4,?,,?,,?,,?,,?,,?,,?,,?,,?,,?,,?,,?,,Unmet,,Unmet,,33,,,,,,,,,Met,
5,2037,2695,exuber,Econometric Analysis of Explosive Time Series,https://github.com/kvasilopoulos/exuber,https://github.com/kvasilopoulos/exuber,OTHER,?,,Met,Given only https: URLs.,?,,?,,Met,"Projects on GitHub by default use issues and pull requests, as encouraged by documentation such as <https://guides.github.com/activities/contributing-to-open-source/>.",?,,Met,Non-trivial license location file in repository: <https://github.com/kvasilopoulos/exuber/blob/master/LICENSE>.,?,,Unmet,// Did not find license in the OSI list.,Unmet,// No appropriate folder found for documentation basics.,?,,Met,"Repository on GitHub, which provides public git repositories with URLs.",Met,"Repository on GitHub, which uses git. git can track the changes, who made them, and when they were made.",?,,Met,"Repository on GitHub, which uses git. git is distributed.",?,,?,,?,,Unmet,// No release notes file found.,?,,?,,?,,?,,?,,?,,?,,?,,?,,?,,?,,?,,?,,?,,?,,?,,?,,?,,?,,?,,?,,?,,?,,?,,?,,?,,?,,?,,?,,?,,?,,?,,?,,?,,?,,?,,?,,?,,?,,?,,?,,?,,?,,?,,,2018-07-30 19:29:34 UTC,2018-07-30 19:29:34 UTC,?,,?,,,Met,GitHub supports discussions on issues and pull requests.,?,,?,,?,,?,,?,,?,,?,,Met,Found all required security hardening headers.,?,,?,,13,,,2022-04-17 23:00:31 UTC,False,"R, C++ (CII estimate)",19,0,?,,?,,?,,?,,?,,?,,?,,?,,?,,?,,?,,?,,?,,?,,?,,?,,?,,?,,?,,?,,?,,?,,?,,?,,?,,?,,?,,?,,?,,?,,?,,?,,?,,?,,?,,?,,?,,?,,?,,?,,4,?,,?,,?,,?,,?,,?,,?,,?,,?,,?,,?,,?,,Unmet,,Unmet,,13,,,,,,,,,Met,
6,2038,2696,MBSStools,Suite of tools for data manipulation and calculations for Maryland DNR MBSS program.,https://github.com/leppott/MBSStools,https://github.com/leppott/MBSStools,MIT,?,,Met,Given only https: URLs.,Met,,?,,Met,"Projects on GitHub by default use issues and pull requests, as encouraged by documentation such as <https://guides.github.com/activities/contributing-to-open-source/>.",?,,Met,Non-trivial license location file in repository: <https://github.com/leppott/MBSStools/blob/master/LICENSE>.,Met,The MIT license is approved by the Open Source Initiative (OSI).,Met,The MIT license is approved by the Open Source Initiative (OSI).,Unmet,// No appropriate folder found for documentation basics.,?,,Met,"Repository on GitHub, which provides public git repositories with URLs.",Met,"Repository on GitHub, which uses git. git can track the changes, who made them, and when they were made.",?,,Met,"Repository on GitHub, which uses git. git is distributed.",Met,,Met,,Met,,Met,Non-trivial release notes file in repository: <https://github.com/leppott/MBSStools/blob/master/NEWS>.,Met,,?,,Met,,Met,https://github.com/leppott/MBSStools/issues,Met,,Met,,?,,?,,?,,?,,,,,,,,?,,?,,?,,?,,?,,?,,?,,?,,?,,Met,,?,,,,,,,,,,,,,,,,,,?,,?,,?,,?,,Met,CodeFactor (https://www.codefactor.io/repository/github/leppott/MBSStools),?,,?,,Met,"GitHub Actions enabled for each commit.

https://github.com/leppott/MBSStools/actions",?,,?,,?,,?,,,2018-07-30 19:36:52 UTC,2021-02-22 21:14:52 UTC,,,?,,,Met,GitHub supports discussions on issues and pull requests.,?,,?,,?,,?,,?,,?,,?,,Met,Found all required security hardening headers.,?,,?,,52,,,2022-04-17 23:00:31 UTC,False,R,26,2,?,,?,,?,,?,,?,,?,,?,,?,,?,,?,,?,,?,,?,,?,,?,,?,,?,,?,,?,,?,,?,,?,,?,,?,,?,,?,,?,,?,,?,,?,,?,,?,,?,,?,,?,,?,,?,,?,,?,,?,,4,?,,?,,?,,?,,?,,?,,?,,?,,?,,?,,?,,?,,Unmet,,Unmet,,52,,,,,,,,,Met,
