16,3174,4269,Hyperledger Besu,"Hyperledger Besu is an open source Ethereum client developed under the Apache 2.0 license and written in Java. It can be run on the Ethereum public network or on private permissioned networks, as well as test networks such as Rinkeby, Ropsten, and Görli. Hyperledger Besu includes several consensus algorithms including PoW, PoA, and IBFT, and has comprehensive permissioning schemes designed specifically for uses in a consortium environment.",https://github.com/hyperledger/besu,https://github.com/hyperledger/besu,Apache-2.0,?,,Met,Given only https: URLs.,Met,https://www.hyperledger.org/projects/besu,Met,https://wiki.hyperledger.org/display/BESU/How+to+Contribute,Met,"Projects on GitHub by default use issues and pull requests, as encouraged by documentation such as <https://guides.github.com/activities/contributing-to-open-source/>.",Met,https://github.com/hyperledger/besu/blob/master/CONTRIBUTING.md,Met,The Besu homepage on GitHub provides the Apache 2.0 license reference. https://github.com/hyperledger/besu,Met,The Apache 2.0 license is approved by the Open Source Initiative (OSI). The Apache-2.0 license is approved by the Open Source Initiative (OSI).,Met,The Apache-2.0 license is approved by the Open Source Initiative (OSI).,Met,Documentation can be found here: http://besu.hyperledger.org/en/latest/,Met,API references can be found here in our docs: http://besu.hyperledger.org/en/latest/HowTo/Interact/APIs/API/#account-management,Met,"Repository on GitHub, which provides public git repositories with URLs.",Met,"Repository on GitHub, which uses git. git can track the changes, who made them, and when they were made.",Met,Every major release has a RC prior to the major Release. The release schedule can be found here: https://github.com/hyperledger/besu/releases,Met,"Repository on GitHub, which uses git. git is distributed.",Met,Release schedule and versioning can be found here: https://github.com/hyperledger/besu/releases,Met,,Met,https://github.com/hyperledger/besu/releases,Met,Non-trivial release notes file in repository: <https://github.com/hyperledger/besu/blob/master/CHANGELOG.md>.,Met,Release notes can be found here but no publicly known vulnerabilities exist to date. https://github.com/hyperledger/besu/blob/master/CHANGELOG.md,?,,Met,Issue tracker is here: https://pegasys1.atlassian.net/projects/PAN/issues,Met,Issues can be submitted here. In time name (Pantheon) and board will move to Hyperledger: https://pegasys1.atlassian.net/projects/PAN/issues,Met,,Met,,Met,Done (or archived) issues can be found here: https://pegasys1.atlassian.net/projects/PAN/issues/?filter=doneissues,Met,https://github.com/hyperledger/besu/security/advisories,Met,https://github.com/hyperledger/besu/security/advisories,Met,No vulnerabilities have been received in last six months.,Met,"Achieved by using the Gradle Build Tool

https://github.com/hyperledger/besu/blob/master/docs/development/building.md#build-from-source
https://gradle.org/",Met,"Achieved by using the Gradle Build Tool

https://github.com/hyperledger/besu/blob/master/docs/development/building.md#build-from-source
https://gradle.org/",Met,"Achieved by using the Gradle Build Tool

https://github.com/hyperledger/besu/blob/master/docs/development/building.md#build-from-source
https://github.com/gradle/gradle/blob/master/LICENSE",Met,"The code contains coverage by three levels of tests UT (Unit Test), IT (Integration Test) and AT (Acceptance Tests), all executed through the JUnit framework.

 https://github.com/hyperledger/besu/tree/master/acceptance-tests/tests
https://github.com/junit-team/junit5
https://github.com/junit-team/junit4",Met,"Tests can be executed through an IDE (with build-in JUnit integration e.g. IntelliJ / Eclipe) or using the Gradle Build Tool.

https://github.com/hyperledger/besu/blob/master/docs/development/building.md#run-tests",Unmet,"Some not all of the code branches, input fields and functionality are covered.

https://github.com/hyperledger/besu/blob/master/docs/development/code-coverage.md",Met,"Formalised in the coding conventions, using indirect language i.e. referring to 'well tested' being by unit, integration or acceptance test appropriate for the feature.

https://github.com/hyperledger/besu/blob/master/CODING-CONVENTIONS.md#32-creating-code-for-constant-refactoring-and-evolving-design",Met,"PR approval is the evidence, as Pull Request review include whether there are sufficient tests for the code being added / amended.

",Met,"The GitHub PR template (displayed to the when they raise a propose a change) contains a link to the contributing guidelines (they cite the requirement for test coverage)
```
<!-- Thanks for sending a pull request! Please check out our contribution guidelines: -->
<!-- https://github.com/hyperledger/besu/blob/master/CONTRIBUTING.md -->
```",Met,"The build tool applies Google ErrorProne to the codebase (performed in CI on master and PR builds)

https://github.com/google/error-prone",Met,On rule violation ErrorProne is set to cause an error that ceases the build.,Met,"In addition to the standard ErrorProne rules, custom rules have been added to Besu.

https://github.com/hyperledger/besu/tree/master/errorprone-checks",Met,,Met,,Met,,Met,,Met,,Met,,Met,,Met,,Met,,Met,,Met,,Met,,Met,,Met,,Met,"We use error-prone, Snyk, Google java style formatter and enforce it for every checkin.  We also treat all compiler warnings as errors.",Met,,Met,,Met,,Met,,Met,,Met,,Met,,,2019-09-10 19:47:26 UTC,2021-02-17 22:25:02 UTC,Met,,Met,"All commits to master and PRs trigger a CI build and test, currently performed on Jenkins (although the migration to another is being considered, with direction from HLF).

https://jenkins.pegasys.tech/job/Besu/",,Met,The community can engage with chat with the project at chat.hyperledger.org or https://lists.hyperledger.org/g/besu,Met,,Met,Documentation is in English: http://besu.hyperledger.org/en/latest/,?,,?,,?,,?,,?,,Met,Found all required security hardening headers.,?,,?,,100,2019-09-20 15:52:25 UTC,,,False,Java,17,9,?,,?,,?,,?,,?,,?,,?,,?,,?,,?,,?,,?,,?,,?,,?,,?,,?,,?,,?,,?,,?,,?,,?,,?,,?,,?,,?,,?,,?,,?,,?,,?,,?,,?,,?,,?,,?,,?,,?,,?,,13,?,,?,,?,,?,,?,,?,,?,,?,,?,,?,,?,,?,,Met,,Unmet,,109,,,,,,2019-09-20 15:52:25 UTC,,,Met,
17,3175,4272,api.huck.com.ar,,https://gitlab.com/huck-electronics/webs/api.huck.com.ar,https://gitlab.com/huck-electronics/webs/api.huck.com.ar,,?,,Met,Given only https: URLs.,?,,?,,?,,?,,?,,?,,?,,?,,?,,?,,?,,?,,?,,?,,?,,?,,?,,?,,?,,?,,?,,?,,?,,?,,?,,?,,?,,?,,?,,?,,?,,?,,?,,?,,?,,?,,?,,?,,?,,?,,?,,?,,?,,?,,?,,?,,?,,?,,?,,?,,?,,?,,?,,?,,?,,?,,?,,?,,?,,?,,?,,,2019-09-11 11:03:33 UTC,2019-09-11 11:03:33 UTC,?,,?,,,?,,?,,?,,?,,?,,?,,?,,?,,Met,Found all required security hardening headers.,?,,?,,3,,,2022-04-11 23:00:21 UTC,False,,12,0,?,,?,,?,,?,,?,,?,,?,,?,,?,,?,,?,,?,,?,,?,,?,,?,,?,,?,,?,,?,,?,,?,,?,,?,,?,,?,,?,,?,,?,,?,,?,,?,,?,,?,,?,,?,,?,,?,,?,,?,,0,?,,?,,?,,?,,?,,?,,?,,?,,?,,?,,?,,?,,Unmet,,Unmet,,3,,,,,,,,,Met,
18,3176,4273,WDLCT,"WDLC All-In-One Timer is a five-in-one timer application that enables users to break users away from their computers. It also has a timer, stopwatch, and alarm as well as a shutdown timer!",https://github.com/panthersdude2001/WDLCT,https://github.com/panthersdude2001/WDLCT,GPL-3.0,?,,Met,Given only https: URLs.,Met,,Met,,Met,"Projects on GitHub by default use issues and pull requests, as encouraged by documentation such as <https://guides.github.com/activities/contributing-to-open-source/>.",Met,https://github.com/panthersdude2001/WDLCT/commits/master,Met,Non-trivial license location file in repository: <https://github.com/panthersdude2001/WDLCT/blob/master/LICENSE>.,Met,The GPL-3.0 license is approved by the Open Source Initiative (OSI).,Met,The GPL-3.0 license is approved by the Open Source Initiative (OSI).,Met,"// No appropriate folder found for documentation basics. It will be added at 3pm EDT.
EDIT: Now added into https://github.com/panthersdude2001/WDLCT/blob/master/Documentation",,Is not a DLL nor Cmd prompt applet. Uses VB.NET,Met,"Repository on GitHub, which provides public git repositories with URLs.",Met,"Repository on GitHub, which uses git. git can track the changes, who made them, and when they were made.",Met,Preview releases are released before stable release.,Met,"Repository on GitHub, which uses git. git is distributed.",Met,Versions are identified by major and minor.,Unmet,"Not needed, as its uses a little later releases.",Met,Git is used.,Met,Release notes founded at https://github.com/panthersdude2001/WDLCT/blob/master/releasenotes211.txt,Met,,?,,Met,,Met,https://github.com/panthersdude2001/WDLCT/issues,Met,,Met,,Met,https://github.com/panthersdude2001/WDLCT/blob/master/releasenotes211.txt,Met,https://github.com/panthersdude2001/WDLCT/issues,Met,https://github.com/panthersdude2001/WDLCT/issues,Met,https://github.com/panthersdude2001/WDLCT/issues,Met,,Met,,Met,,Met,,Met,,Met,,Met,previews are released before stable,Met,,Met,,Met,warning flags are enabled by default in vb.net,Met,it is shown in the error log,Met,option strict,Met,i am the only developer that knows security.,Met,software had a ddos attack that resulted in reset of application settings for end user.,,,,,,,,,,,,,,,,,Met,,Met,,Met,ddos attack was fixed in 3.5.3,Met,we report security flaws automatically.,Met,Visual Studio 2019 is used.,,not used in this sequence,,,,not needed in vb.net,Met,,,program is in vb.net,Met,,,,,2019-09-11 18:03:32 UTC,2019-09-11 20:41:47 UTC,,,Met,,,Met,GitHub supports discussions on issues and pull requests.,Met,no credentials are leaked.,Met,English documentation is provided in links at https://github.com/panthersdude2001/WDLCT/blob/master/Documentation,?,,?,,?,,?,,?,,Met,Found all required security hardening headers.,?,,?,,100,2019-09-11 20:41:47 UTC,,,False,Visual Basic,7,11,?,,?,,?,,?,,?,,?,,?,,?,,?,,?,,?,,?,,?,,?,,?,,?,,?,,?,,?,,?,,?,,?,,?,,?,,?,,?,,?,,?,,?,,?,,?,,?,,?,,?,,?,,?,,?,,?,,?,,?,,4,?,,?,,?,,?,,?,,?,,?,,?,,?,,?,,?,,?,,Met,,Unmet,,111,,,,,,2019-09-11 20:41:47 UTC,,,Met,
19,3177,4274,Quadcopter,Repository for the Quadcopter project.,https://github.com/milanvarghese/Quadcopter,https://github.com/milanvarghese/Quadcopter,GPL-3.0,?,,Met,Given only https: URLs.,?,,?,,Met,"Projects on GitHub by default use issues and pull requests, as encouraged by documentation such as <https://guides.github.com/activities/contributing-to-open-source/>.",?,,Met,Non-trivial license location file in repository: <https://github.com/milanvarghese/Quadcopter/blob/master/LICENSE>.,Met,The GPL-3.0 license is approved by the Open Source Initiative (OSI).,Met,The GPL-3.0 license is approved by the Open Source Initiative (OSI).,Unmet,// No appropriate folder found for documentation basics.,?,,Met,"Repository on GitHub, which provides public git repositories with URLs.",Met,"Repository on GitHub, which uses git. git can track the changes, who made them, and when they were made.",?,,Met,"Repository on GitHub, which uses git. git is distributed.",?,,?,,?,,,// No release notes file found.,,,?,,?,,?,,?,,?,,?,,?,,,,,,,,,,,,?,,?,,?,,?,,?,,?,,,,,,,,?,,?,,?,,?,,?,,?,,?,,?,,?,,?,,?,,?,,?,,?,,Met,VSCode,,,,,,,?,,,,?,,,,,2019-09-11 19:56:56 UTC,2019-09-11 20:02:41 UTC,?,,?,,,Met,GitHub supports discussions on issues and pull requests.,?,,?,,?,,?,,?,,?,,?,,Met,Found all required security hardening headers.,?,,?,,36,,,2022-04-11 23:00:21 UTC,False,Python,17,0,?,,?,,?,,?,,?,,?,,?,,?,,?,,?,,?,,?,,?,,?,,?,,?,,?,,?,,?,,?,,?,,?,,?,,?,,?,,?,,?,,?,,?,,?,,?,,?,,?,,?,,?,,?,,?,,?,,?,,?,,4,?,,?,,?,,?,,?,,?,,?,,?,,?,,?,,?,,?,,Unmet,,Unmet,,36,,,,,,,,,Met,
20,3178,4275,msigdbr,MSigDB Gene Sets for Multiple Organisms in a Tidy Data Format,https://cran.r-project.org/web/packages/msigdbr/vignettes/msigdbr-intro.html,https://github.com/igordot/msigdbr,MIT,?,,Met,Given only https: URLs.,Met,,Met,,Met,"Projects on GitHub by default use issues and pull requests, as encouraged by documentation such as <https://guides.github.com/activities/contributing-to-open-source/>.",?,,Met,https://github.com/igordot/msigdbr/blob/master/LICENSE.md,Met,https://github.com/igordot/msigdbr/blob/master/LICENSE.md The MIT license is approved by the Open Source Initiative (OSI).,Met,// Did not find license in the OSI list. The MIT license is approved by the Open Source Initiative (OSI).,Met,// No appropriate folder found for documentation basics.,Met,,Met,"Repository on GitHub, which provides public git repositories with URLs.",Met,"Repository on GitHub, which uses git. git can track the changes, who made them, and when they were made.",?,,Met,"Repository on GitHub, which uses git. git is distributed.",Met,,?,,Met,,Met,Non-trivial release notes file in repository: <https://github.com/igordot/msigdbr/blob/master/NEWS.md>.,?,,?,,Met,https://github.com/igordot/msigdbr/issues,Met,https://github.com/igordot/msigdbr/issues,Met,,Met,,Met,https://github.com/igordot/msigdbr/issues,?,,?,,?,,Met,,Met,,Met,,Met,,Met,,Met,,Met,,?,,?,,?,,?,,?,,?,,?,,,,,,,,,,,,,,,,,,?,,?,,Met,,Met,,?,,?,,?,,?,,?,,?,,?,,?,,,2019-09-11 23:03:06 UTC,2019-09-11 23:20:04 UTC,,,Met,https://travis-ci.org/igordot/msigdbr,,Met,GitHub supports discussions on issues and pull requests.,Met,,Met,,?,,?,,?,,?,,?,,Unmet,"// X-Content-Type-Options was not set to ""nosniff"".",?,,?,,64,,,2022-04-12 23:00:28 UTC,False,R,21,4,?,,?,,?,,?,,?,,?,,?,,?,,?,,?,,?,,?,,?,,?,,?,,?,,?,,?,,?,,?,,?,,?,,?,,?,,?,,?,,?,,?,,?,,?,,?,,?,,?,,?,,?,,?,,?,,?,,?,,?,,9,?,,?,,?,,?,,?,,?,,?,,?,,?,,?,,?,,?,,Unmet,,Unmet,,64,,,,,,,,,Met,
21,3179,4276,hate_crack,A tool for automating cracking methodologies through Hashcat from the TrustedSec team.,https://www.trustedsec.com,https://github.com/kellermannrobert/hate_crack,,?,,Met,Given only https: URLs.,?,,?,,Met,"Projects on GitHub by default use issues and pull requests, as encouraged by documentation such as <https://guides.github.com/activities/contributing-to-open-source/>.",?,,Unmet,// No license location file found.,?,,?,,Unmet,// No appropriate folder found for documentation basics.,?,,Met,"Repository on GitHub, which provides public git repositories with URLs.",Met,"Repository on GitHub, which uses git. git can track the changes, who made them, and when they were made.",?,,Met,"Repository on GitHub, which uses git. git is distributed.",?,,?,,?,,Unmet,// No release notes file found.,?,,?,,?,,?,,?,,?,,?,,?,,?,,?,,?,,?,,?,,?,,?,,?,,?,,?,,?,,?,,?,,?,,?,,?,,?,,?,,?,,?,,?,,?,,?,,?,,?,,?,,?,,?,,?,,?,,?,,?,,?,,?,,?,,?,,,2019-09-12 06:35:20 UTC,2019-09-12 06:35:47 UTC,?,,?,,,Met,GitHub supports discussions on issues and pull requests.,?,,?,,?,,?,,?,,?,,?,,Unmet,// One or more of the required security hardening headers is missing.,?,,?,,10,,,2022-04-12 23:00:28 UTC,False,"Python, Perl",13,0,?,,?,,?,,?,,?,,?,,?,,?,,?,,?,,?,,?,,?,,?,,?,,?,,?,,?,,?,,?,,?,,?,,?,,?,,?,,?,,?,,?,,?,,?,,?,,?,,?,,?,,?,,?,,?,,?,,?,,?,,4,?,,?,,?,,?,,?,,?,,?,,?,,?,,?,,?,,?,,Unmet,,Unmet,,10,,,,,,,,,Met,
22,3180,4278,AzureResourceCleanup,Cleanup your azure resources automatically on a regular schedule,https://github.com/sai-manoj-kumar/AzureResourceCleanup,https://github.com/sai-manoj-kumar/AzureResourceCleanup,,?,,Met,Given only https: URLs.,?,,?,,Met,"Projects on GitHub by default use issues and pull requests, as encouraged by documentation such as <https://guides.github.com/activities/contributing-to-open-source/>.",?,,Unmet,// No license location file found.,?,,?,,Unmet,// No appropriate folder found for documentation basics.,?,,Met,"Repository on GitHub, which provides public git repositories with URLs.",Met,"Repository on GitHub, which uses git. git can track the changes, who made them, and when they were made.",?,,Met,"Repository on GitHub, which uses git. git is distributed.",?,,?,,?,,Unmet,// No release notes file found.,?,,?,,?,,?,,?,,?,,?,,?,,?,,?,,?,,?,,?,,?,,?,,?,,?,,?,,?,,?,,?,,?,,?,,?,,?,,?,,?,,?,,?,,?,,?,,?,,?,,?,,?,,?,,?,,?,,?,,?,,?,,?,,?,,?,,,2019-09-12 10:31:22 UTC,2019-09-12 10:31:22 UTC,?,,?,,,Met,GitHub supports discussions on issues and pull requests.,?,,?,,?,,?,,?,,?,,?,,Met,Found all required security hardening headers.,?,,?,,10,,,2022-04-12 23:00:29 UTC,False,"C#, PowerShell",12,0,?,,?,,?,,?,,?,,?,,?,,?,,?,,?,,?,,?,,?,,?,,?,,?,,?,,?,,?,,?,,?,,?,,?,,?,,?,,?,,?,,?,,?,,?,,?,,?,,?,,?,,?,,?,,?,,?,,?,,?,,4,?,,?,,?,,?,,?,,?,,?,,?,,?,,?,,?,,?,,Unmet,,Unmet,,10,,,,,,,,,Met,
23,3181,4280,gargar,,https://gitlab.com/kifouren/gargar,https://gitlab.com/kifouren/gargar,,?,,Met,Given only https: URLs.,?,,?,,?,,?,,?,,?,,?,,?,,?,,?,,?,,?,,?,,?,,?,,?,,?,,?,,?,,?,,?,,?,,?,,?,,?,,?,,?,,?,,?,,?,,?,,?,,?,,?,,?,,?,,?,,?,,?,,?,,?,,?,,?,,?,,?,,?,,?,,?,,?,,?,,?,,?,,?,,?,,?,,?,,?,,?,,?,,?,,?,,,2019-09-12 12:28:19 UTC,2019-09-12 12:28:19 UTC,?,,?,,,?,,?,,?,,?,,?,,?,,?,,?,,Met,Found all required security hardening headers.,?,,?,,3,,,2022-04-12 23:00:29 UTC,False,,12,0,?,,?,,?,,?,,?,,?,,?,,?,,?,,?,,?,,?,,?,,?,,?,,?,,?,,?,,?,,?,,?,,?,,?,,?,,?,,?,,?,,?,,?,,?,,?,,?,,?,,?,,?,,?,,?,,?,,?,,?,,0,?,,?,,?,,?,,?,,?,,?,,?,,?,,?,,?,,?,,Unmet,,Unmet,,3,,,,,,,,,Met,
24,3182,4287,nothing-private,"Do you think you are safe using private browsing or incognito mode?. This will prove that you're wrong. This project is a proof of concept that any website can identify and track you, even if you are using private browsing or incognito mode in your web browser. ",https://nothingprivate.ml,https://github.com/gautamkrishnar/nothing-private,GPL-3.0,?,,Met,Given only https: URLs.,Met,,Met,,Met,Non-trivial contribution file in repository: <https://github.com/gautamkrishnar/nothing-private/blob/master/CONTRIBUTING.md>.,Met,https://github.com/gautamkrishnar/nothing-private#contributing Has a set of requirements,Met,Non-trivial license location file in repository: <https://github.com/gautamkrishnar/nothing-private/blob/master/LICENSE>.,Met,The GPL-3.0 license is approved by the Open Source Initiative (OSI).,Met,The GPL-3.0 license is approved by the Open Source Initiative (OSI).,Met,https://github.com/gautamkrishnar/nothing-private/blob/master/README.md#how-to-use-the-website,Met,,Met,"Repository on GitHub, which provides public git repositories with URLs.",Met,"Repository on GitHub, which uses git. git can track the changes, who made them, and when they were made.",Met,,Met,"Repository on GitHub, which uses git. git is distributed.",Met,,Met,,Met,,Met,https://github.com/gautamkrishnar/nothing-private/releases,Met,,?,,Met,https://github.com/gautamkrishnar/nothing-private/issues,Met,https://github.com/gautamkrishnar/nothing-private/blob/master/CONTRIBUTING.md,Met,https://github.com/gautamkrishnar/nothing-private/issues,Met,https://github.com/gautamkrishnar/nothing-private/issues,Met,https://github.com/gautamkrishnar/nothing-private/issues,Met,https://github.com/gautamkrishnar/nothing-private/blob/master/SECURITY.md,Met,https://github.com/gautamkrishnar/nothing-private/blob/master/SECURITY.md,Met,https://github.com/gautamkrishnar/nothing-private/blob/master/SECURITY.md,Met,,Met,,Met,,Met,,Met,,Met,,Met,,Met,,Met,,Met,,Met,,Met,,Met,,Met,,Met,,Met,,Met,,Met,,Met,,Met,,Met,,Met,,Met,,Met,,Met,,Met,,Met,https://github.com/gautamkrishnar/nothing-private/blob/master/.github/workflows/codeql-analysis.yml,Met,,Met,,Met,,Met,,Met,,Met,,Met,,,2019-09-14 12:02:59 UTC,2020-11-14 09:05:35 UTC,Met,,Met,,,Met,GitHub supports discussions on issues and pull requests.,Met,,Met,,?,,?,,?,,?,,?,,Unmet,// One or more of the required security hardening headers is missing.,?,,?,,100,2020-11-14 09:05:35 UTC,,2020-10-31 23:00:20 UTC,False,"JavaScript, Rich Text Format, PHP, Shell, Dockerfile, HTML, CSS",12,5,?,,?,,?,,?,,?,,?,,?,,?,,?,,?,,?,,?,,?,,?,,?,,?,,?,,?,,?,,?,,?,,?,,?,,?,,?,,?,,?,,?,,?,,?,,?,,?,,?,,?,,?,,?,,?,,?,,?,,?,,4,?,,?,,?,,?,,?,,?,,?,,?,,?,,?,,?,,?,,Met,,Unmet,,105,,,,,,2020-11-14 09:05:35 UTC,,,Met,
25,3183,4288,LEDSpicer,LEDSpicer a LED Animator and Controller for Linux,https://sourceforge.net/projects/ledspicer,https://github.com/meduzapat/LEDSpicer,GPL-3.0,?,,Met,I used sourceforge tools https://sourceforge.net/p/ledspicer,Met,https://github.com/meduzapat/LEDSpicer,Met,https://github.com/meduzapat/LEDSpicer,Met,"Projects on GitHub by default use issues and pull requests, as encouraged by documentation such as <https://guides.github.com/activities/contributing-to-open-source/>.",Unmet,"is a very small project with only one developer, the code standard will be provided when more join.",Met,Non-trivial license location file in repository: <https://github.com/meduzapat/LEDSpicer/blob/development/COPYING>.,Met,The GPL-3.0 license is approved by the Open Source Initiative (OSI).,Met,The GPL-3.0 license is approved by the Open Source Initiative (OSI).,Met,"This is the wiki with all the information on how it works, how to setup the program, and a lot of examples on how to create content: https://sourceforge.net/p/ledspicer/wiki/Home/",Met,all the information on how to interface with the program is on the wiki https://sourceforge.net/p/ledspicer/wiki/Home/,Met,"Repository on GitHub, which provides public git repositories with URLs.",Met,"Repository on GitHub, which uses git. git can track the changes, who made them, and when they were made.",Met,the development branch is protected and must pass two code reviews.,Met,"Repository on GitHub, which uses git. git is distributed.",Met,The project have increasing version control and release system using tags and branches: https://github.com/meduzapat/LEDSpicer/releases,Met,,Met,Version tags,Met,Non-trivial release notes file in repository: <https://github.com/meduzapat/LEDSpicer/blob/development/ChangeLog>.,Met,When releasing the release will include a list of tickets and fixes.,?,,Met,https://sourceforge.net/p/ledspicer/tickets/,Met,https://sourceforge.net/p/ledspicer/tickets/,Met,the project is 1 year old and all the bugs and errors are fixed by lasted version.,Met,"there is a discussion board where users can request features, there is a todo list: https://sourceforge.net/p/ledspicer/discussion/",Met,https://sourceforge.net/p/ledspicer/discussion/,Met,the vulnerability section on the discussion board: https://sourceforge.net/p/ledspicer/discussion/,,all is public,,nothing to report (hope it keeps like that),Met,"check the build sections, three of them, a general one, one for PC and one for raspberry PI",Met,"everything you need to build is documented,.",Met,project uses all FLOSS tools.,?,,?,,?,,?,,?,,?,,Met,-Wall is used,,no warnings reported,,the code have no warnings and uses nothing to avoid new ones.,Met,the program uses several techniques like input sanitation an privileges drop to user level.,Met,"I (the main developer) have more that 10 years writing code for big companies, they teached me everything I need to know to create secure code, I got training on several Security couses like HIPA and PCI DSS to name some of them.",,nothing is encrypted on this program,,nothing is encrypted on this program,,,,,,,,,,no sensitive data is stored or used by the program,,,Met,the program does not present any security issue because it works on a local environment (unix socks on localhost) without external access.,Met,not used,Met,no vulnerabilities reported,Met,I will fix any if found asap.,Met,valgrind and cppcheck was used,,,,,,,?,,Met,the project uses valgrind to check memory issues.,Met,the code strongly checks few conversions it uses.,,,,2019-09-15 01:38:15 UTC,2019-09-15 02:31:24 UTC,,,?,,,Met,GitHub supports discussions on issues and pull requests.,Met,there is not sensitive data to use and to store.,Met,https://sourceforge.net/p/ledspicer/wiki/Home/,?,,?,,?,,?,,?,,Unmet,Found all required security hardening headers. // One or more of the required security hardening headers is missing.,?,,?,,88,,,2022-04-16 23:00:36 UTC,False,"C++, Makefile, M4, Shell",15,7,?,,?,,?,,?,,?,,?,,?,,?,,?,,?,,?,,?,,?,,?,,?,,?,,?,,?,,?,,?,,?,,?,,?,,?,,?,,?,,?,,?,,?,,?,,?,,?,,?,,?,,?,,?,,?,,?,,?,,?,,9,?,,?,,?,,?,,?,,?,,?,,?,,?,,?,,?,,?,,Unmet,,Unmet,,88,,,,,,,,,Met,
26,3184,4290,python-samples,Useful Python Sample Codes,https://github.com/akashtalole/python-samples,https://github.com/akashtalole/python-samples,MIT,?,,Met,Given only https: URLs.,?,,?,,Met,"Projects on GitHub by default use issues and pull requests, as encouraged by documentation such as <https://guides.github.com/activities/contributing-to-open-source/>.",?,,Met,Non-trivial license location file in repository: <https://github.com/akashtalole/python-samples/blob/master/LICENSE>.,Met,The MIT license is approved by the Open Source Initiative (OSI).,Met,The MIT license is approved by the Open Source Initiative (OSI).,Met,Some documentation basics file contents found.,?,,Met,"Repository on GitHub, which provides public git repositories with URLs.",Met,"Repository on GitHub, which uses git. git can track the changes, who made them, and when they were made.",?,,Met,"Repository on GitHub, which uses git. git is distributed.",?,,?,,?,,Unmet,// No release notes file found.,?,,?,,?,,?,,?,,?,,?,,?,,?,,?,,?,,?,,?,,?,,?,,?,,?,,?,,?,,?,,?,,?,,?,,?,,?,,?,,?,,?,,?,,?,,?,,?,,?,,?,,?,,?,,?,,?,,?,,?,,?,,?,,?,,?,,,2019-09-16 04:13:28 UTC,2019-09-16 04:15:01 UTC,?,,?,,,Met,GitHub supports discussions on issues and pull requests.,?,,?,,?,,?,,?,,?,,?,,Met,Found all required security hardening headers.,?,,?,,16,,,2022-04-17 23:00:28 UTC,False,"Python, Dockerfile",13,0,?,,?,,?,,?,,?,,?,,?,,?,,?,,?,,?,,?,,?,,?,,?,,?,,?,,?,,?,,?,,?,,?,,?,,?,,?,,?,,?,,?,,?,,?,,?,,?,,?,,?,,?,,?,,?,,?,,?,,?,,4,?,,?,,?,,?,,?,,?,,?,,?,,?,,?,,?,,?,,Unmet,,Unmet,,16,,,,,,,,,Met,
