20,5045,10329,rt-thread,RT-Thread is an open source IoT operating system.,http://www.rt-thread.io,https://github.com/RT-Thread/rt-thread,Apache-2.0,?,,Unmet,https://www.rt-thread.io/ // Given an http: URL.,Met,https://www.rt-thread.io/,Met,https://www.rt-thread.io/document/site/,Met,https://www.rt-thread.io/document/site/development-guide/github/github/,Met,https://www.rt-thread.io/document/site/development-guide/github/github/,Met,Non-trivial license location file in repository: <https://github.com/RT-Thread/rt-thread/blob/master/LICENSE>.,Met,The Apache-2.0 license is approved by the Open Source Initiative (OSI).,Met,The Apache-2.0 license is approved by the Open Source Initiative (OSI).,Met,Some documentation basics file contents found.,Met,https://www.rt-thread.io/document/site/programming-manual/basic/basic/,Met,"Repository on GitHub, which provides public git repositories with URLs.",Met,"Repository on GitHub, which uses git. git can track the changes, who made them, and when they were made.",?,,Met,"Repository on GitHub, which uses git. git is distributed.",?,,?,,?,,Met,Non-trivial release notes file in repository: <https://github.com/RT-Thread/rt-thread/blob/master/ChangeLog.md>.,?,,?,,?,,?,,?,,?,,?,,?,,?,,?,,?,,?,,?,,?,,?,,?,,?,,?,,?,,?,,?,,?,,?,,?,,?,,?,,?,,?,,?,,?,,?,,?,,?,,?,,?,,?,,?,,?,,?,,?,,?,,?,,?,,?,,,2021-07-10 13:39:30 UTC,2021-07-12 12:12:57 UTC,?,,?,,,Met,GitHub supports discussions on issues and pull requests.,?,,Met,https://www.rt-thread.io/document/site/tutorial/quick-start/introduction/introduction/,?,,?,,?,,?,,?,,Unmet,"// X-Content-Type-Options was not set to ""nosniff"".",?,,?,,24,,,2022-03-19 23:00:23 UTC,False,"C, Assembly, Python, C++, Makefile, Shell, Batchfile, Rich Text Format, CMake, Yacc, Perl, M4, RPC, GDB, LLVM, Logos, Lex, Pawn, JavaScript, Tcl",6,2,?,,?,,?,,?,,?,,?,,?,,?,,?,,?,,?,,?,,?,,?,,?,,?,,?,,?,,?,,?,,?,,?,,?,,?,,?,,?,,?,,?,,?,,?,,?,,?,,?,,?,,?,,?,,?,,?,,?,,?,,4,?,,?,,?,,?,,?,,?,,?,,?,,?,,?,,?,,?,,Unmet,,Unmet,,24,,,,,,,,,Met,
21,5046,11655,majotools,"A javascript&typescript library with basic function, structs/models and classes.",https://github.com/HalsMaulMajo/majotools,https://github.com/HalsMaulMajo/majotools,,?,,Met,Given only https: URLs.,?,,?,,Met,"Projects on GitHub by default use issues and pull requests, as encouraged by documentation such as <https://guides.github.com/activities/contributing-to-open-source/>.",?,,Unmet,// No license location file found.,?,,?,,Unmet,// No appropriate folder found for documentation basics.,?,,Met,"Repository on GitHub, which provides public git repositories with URLs.",Met,"Repository on GitHub, which uses git. git can track the changes, who made them, and when they were made.",?,,Met,"Repository on GitHub, which uses git. git is distributed.",?,,?,,?,,Unmet,// No release notes file found.,?,,?,,?,,?,,?,,?,,?,,?,,?,,?,,?,,?,,?,,?,,?,,?,,?,,?,,?,,?,,?,,?,,?,,?,,?,,?,,?,,?,,?,,?,,?,,?,,?,,?,,?,,?,,?,,?,,?,,?,,?,,?,,?,,?,,,2021-07-10 15:32:47 UTC,2021-07-10 15:32:47 UTC,?,,?,,,Met,GitHub supports discussions on issues and pull requests.,?,,?,,?,,?,,?,,?,,?,,Met,Found all required security hardening headers.,?,,?,,10,,,2022-03-17 23:00:23 UTC,False,TypeScript,3,0,?,,?,,?,,?,,?,,?,,?,,?,,?,,?,,?,,?,,?,,?,,?,,?,,?,,?,,?,,?,,?,,?,,?,,?,,?,,?,,?,,?,,?,,?,,?,,?,,?,,?,,?,,?,,?,,?,,?,,?,,4,?,,?,,?,,?,,?,,?,,?,,?,,?,,?,,?,,?,,Unmet,,Unmet,,10,,,,,,,,,Met,
22,5047,11656,Terraria Colourfull Chat,A python script to automatically generate text with rainbow or gradient effects.,https://github.com/PinkDev1/Terraria-Colourfull-Chat,https://github.com/PinkDev1/Terraria-Colourfull-Chat,GPL-3.0,?,,Met,Given only https: URLs.,Met,,Met,https://github.com/PinkDev1/Terraria-Colourfull-Chat#feedback,Met,Non-trivial contribution file in repository: <https://github.com/PinkDev1/Terraria-Colourfull-Chat/blob/main/CONTRIBUTING.md>.,Met,https://github.com/PinkDev1/Terraria-Colourfull-Chat/blob/main/CONTRIBUTING.md#pull-request-process,Met,Non-trivial license location file in repository: <https://github.com/PinkDev1/Terraria-Colourfull-Chat/blob/main/LICENSE>.,Met,The GPL-3.0 license is approved by the Open Source Initiative (OSI).,Met,The GPL-3.0 license is approved by the Open Source Initiative (OSI).,Met,https://github.com/PinkDev1/Terraria-Colourfull-Chat#usage,Met,"The project uses a very simple Terminal User Interface, explained here: https://github.com/PinkDev1/Terraria-Colourfull-Chat#usage",Met,"Repository on GitHub, which provides public git repositories with URLs.",Met,"Repository on GitHub, which uses git. git can track the changes, who made them, and when they were made.",Met,ALL releases are made publicly avalible on the Releases tab: https://github.com/PinkDev1/Terraria-Colourfull-Chat/releases,Met,"Repository on GitHub, which uses git. git is distributed.",Met,All releases follow the vX.X.X format: https://github.com/PinkDev1/Terraria-Colourfull-Chat/releases,Met,,Met,,Met,"All releases include a ""CHANGELOG"" section: https://github.com/PinkDev1/Terraria-Colourfull-Chat/releases",,There have been no publicly known vulnerabilities for the repository.,?,,Met,https://github.com/PinkDev1/Terraria-Colourfull-Chat/issues,Met,https://github.com/PinkDev1/Terraria-Colourfull-Chat/issues,Met,,Met,,Met,"https://github.com/PinkDev1/Terraria-Colourfull-Chat/issues
",Met,https://github.com/PinkDev1/Terraria-Colourfull-Chat/blob/main/SECURITY.md,Met,https://github.com/PinkDev1/Terraria-Colourfull-Chat/blob/main/SECURITY.md,Met,https://github.com/PinkDev1/Terraria-Colourfull-Chat/blob/main/SECURITY.md,Met,https://github.com/PinkDev1/Terraria-Colourfull-Chat/blob/main/setup.py,Met,https://github.com/py2exe/py2exe,Met,,Unmet,The project is not big enough / complex enough to even consider implementing Unit Testing.,Unmet,The project is not big enough / complex enough to even consider implementing Unit Testing.,Unmet,The project is not big enough / complex enough to even consider implementing Unit Testing.,Unmet,The project is not big enough / complex enough to even consider implementing Unit Testing.,Unmet,The project is not big enough / complex enough to even consider implementing Unit Testing.,Unmet,The project is not big enough / complex enough to even consider implementing Unit Testing.,Met,"CodeQL Analysis is performed on each commit: https://github.com/PinkDev1/Terraria-Colourfull-Chat/actions/workflows/codeql-analysis.yml
All new code must be warning-free & error-free on pylint scans.",Met,,Met,,Met,The main developer also studies cyber-security.,Met,The main developer also studies cyber-security.,,The software does not perform any sensitive communications on its own.,,The software does not perform any sensitive communications on its own.,,The software does not perform any sensitive communications on its own.,,The software does not perform any sensitive communications on its own.,,The software does not perform any sensitive communications on its own.,,The software does not perform any sensitive communications on its own.,,The software does not perform any sensitive communications on its own.,,The software does not perform any sensitive communications on its own.,Unmet,"Only external communication is getting version numbers from the GitHub API. This information is not sensitive, as this is all public, and even if falsified the actual update is downloaded from the MiTM-protected github servers.",Met,,Met,,Met,,Met,CodeQL is used in CI as a github action.,Met,CodeQL is used in CI as a github action.,Met,,Met,,Unmet,The project is not complex enough to warrant using dynamic analysis tools.,Unmet,The project is not complex enough to warrant using dynamic analysis tools.,Unmet,The project is not complex enough to warrant using dynamic analysis tools.,Met,,,2021-07-10 17:45:51 UTC,2021-07-10 19:36:22 UTC,,The software does not perform any sensitive communications on its own.,?,,,Met,GitHub supports discussions on issues and pull requests.,?,,Met,"All documents and comments are in English. Although Spanish is also supported, but not recommended.",?,,?,,?,,?,,?,,Met,Found all required security hardening headers.,?,,?,,91,,,2022-03-17 23:00:23 UTC,False,Python,13,7,?,,?,,?,,?,,?,,?,,?,,?,,?,,?,,?,,?,,?,,?,,?,,?,,?,,?,,?,,?,,?,,?,,?,,?,,?,,?,,?,,?,,?,,?,,?,,?,,?,,?,,?,,?,,?,,?,,?,,?,,9,?,,?,,?,,?,,?,,?,,?,,?,,?,,?,,?,,?,,Unmet,,Unmet,,91,,,,,,,,,Met,
23,5048,11661,hello-world,JUST,https://github.com/Larpyi/hello-world,https://github.com/Larpyi/hello-world,,?,,Met,Given only https: URLs.,?,,?,,Met,"Projects on GitHub by default use issues and pull requests, as encouraged by documentation such as <https://guides.github.com/activities/contributing-to-open-source/>.",?,,Unmet,// No license location file found.,?,,?,,Unmet,// No appropriate folder found for documentation basics.,?,,Met,"Repository on GitHub, which provides public git repositories with URLs.",Met,"Repository on GitHub, which uses git. git can track the changes, who made them, and when they were made.",?,,Met,"Repository on GitHub, which uses git. git is distributed.",?,,?,,?,,Unmet,// No release notes file found.,?,,?,,?,,?,,?,,?,,?,,?,,?,,?,,?,,?,,?,,?,,?,,?,,?,,?,,?,,?,,?,,?,,?,,?,,?,,?,,?,,?,,?,,?,,?,,?,,?,,?,,?,,?,,?,,?,,?,,?,,?,,?,,?,,?,,,2021-07-11 02:40:27 UTC,2021-07-11 02:40:27 UTC,?,,?,,,Met,GitHub supports discussions on issues and pull requests.,?,,?,,?,,?,,?,,?,,?,,Met,Found all required security hardening headers.,?,,?,,10,,,2022-03-18 23:00:24 UTC,False,,3,0,?,,?,,?,,?,,?,,?,,?,,?,,?,,?,,?,,?,,?,,?,,?,,?,,?,,?,,?,,?,,?,,?,,?,,?,,?,,?,,?,,?,,?,,?,,?,,?,,?,,?,,?,,?,,?,,?,,?,,?,,4,?,,?,,?,,?,,?,,?,,?,,?,,?,,?,,?,,?,,Unmet,,Unmet,,10,,,,,,,,,Met,
24,5049,11664,gaxios,An HTTP request client that provides an axios like interface over top of node-fetch. Super lightweight.  Supports proxies and all sorts of other stuff.,https://github.com/googleapis/gaxios,https://github.com/googleapis/gaxios,Apache-2.0,?,,Met,Given only https: URLs.,?,,?,,Met,Non-trivial contribution file in repository: <https://github.com/googleapis/gaxios/blob/master/CONTRIBUTING.md>.,?,,Met,Non-trivial license location file in repository: <https://github.com/googleapis/gaxios/blob/master/LICENSE>.,Met,The Apache-2.0 license is approved by the Open Source Initiative (OSI).,Met,The Apache-2.0 license is approved by the Open Source Initiative (OSI).,Unmet,// No appropriate folder found for documentation basics.,?,,Met,"Repository on GitHub, which provides public git repositories with URLs.",Met,"Repository on GitHub, which uses git. git can track the changes, who made them, and when they were made.",?,,Met,"Repository on GitHub, which uses git. git is distributed.",?,,?,,?,,Met,Non-trivial release notes file in repository: <https://github.com/googleapis/gaxios/blob/master/CHANGELOG.md>.,?,,?,,?,,?,,?,,?,,?,,?,,?,,?,,?,,?,,?,,?,,?,,?,,?,,?,,?,,?,,?,,?,,?,,?,,?,,?,,?,,?,,?,,?,,?,,?,,?,,?,,?,,?,,?,,?,,?,,?,,?,,?,,?,,?,,,2021-07-11 17:38:51 UTC,2021-07-11 17:38:51 UTC,?,,?,,,Met,GitHub supports discussions on issues and pull requests.,?,,?,,?,,?,,?,,?,,?,,Met,Found all required security hardening headers.,?,,?,,16,,,2022-03-18 23:00:24 UTC,False,"TypeScript, JavaScript, Python",3,0,?,,?,,?,,?,,?,,?,,?,,?,,?,,?,,?,,?,,?,,?,,?,,?,,?,,?,,?,,?,,?,,?,,?,,?,,?,,?,,?,,?,,?,,?,,?,,?,,?,,?,,?,,?,,?,,?,,?,,?,,4,?,,?,,?,,?,,?,,?,,?,,?,,?,,?,,?,,?,,Unmet,,Unmet,,16,,,,,,,,,Met,
25,5050,11666,OliveTin,OliveTin is a web interface for running Linux shell commands.,https://olivetin.app,https://github.com/OliveTin/OliveTin,AGPL-3.0,?,,Met,Given only https: URLs.,Met,http://olivetin.app,?,,Met,"Projects on GitHub by default use issues and pull requests, as encouraged by documentation such as <https://guides.github.com/activities/contributing-to-open-source/>.",Met,Contributors guide: https://github.com/OliveTin/OliveTin/blob/main/CONTRIBUTING.adoc,Met,Non-trivial license location file in repository: <https://github.com/OliveTin/OliveTin/blob/main/LICENSE>.,Met,The AGPL-3.0 license is approved by the Open Source Initiative (OSI).,Met,The AGPL-3.0 license is approved by the Open Source Initiative (OSI).,Met,http://docs.olivetin.app,Met,"http://docs.olivetin.app
https://docs.olivetin.app/_olivetin_api_overview.html",Met,"Repository on GitHub, which provides public git repositories with URLs.",Met,"Repository on GitHub, which uses git. git can track the changes, who made them, and when they were made.",Met,"Releases, and prereleases are published here; https://github.com/OliveTin/OliveTin/releases",Met,"Repository on GitHub, which uses git. git is distributed.",Met,OliveTin uses a variant of CalVer. ,Met,,Met,"OliveTin uses CalVer, and releases/prereleases are tagged in the Git repository. ",Unmet,// No release notes file found.,?,,?,,Met,GitHub issues is the preferred mechanism; https://github.com/OliveTin/OliveTin/issues/new/choose ,Met,GitHub issues is the preferred mechanism; https://github.com/OliveTin/OliveTin/issues/new/choose,Met,OliveTin devs respond to all issues raised. ,Met,OliveTin devs respond to all issues raised. ,Met,GitHub issues are still searchable once the issues are closed; https://github.com/OliveTin/OliveTin/issues/,Met,"The process for responsible disclosure, and branches supported, is listed here; https://github.com/OliveTin/OliveTin/security/policy ",Met,The process for responsible disclosure is listed here; https://github.com/OliveTin/OliveTin/security/policy ,,No vulnerabilities have been reported within the last 6 months. ,Met,Non-trivial build file in repository: <https://github.com/OliveTin/OliveTin/blob/main/Makefile>.,Met,Non-trivial build file in repository: <https://github.com/OliveTin/OliveTin/blob/main/Makefile>.,Met,"OliveTin can be built simply with `go build`, but a supporting tool, `goreleaser` is FLOSS under the MIT licence. ",Met,"Go unit tests, as well as several linters are run as part of the build process. All use a FLOSS license. ",Met,"Go unit tests, without any additional config needed. ",?,,?,,?,,?,,Met,"The Go compiler does not have warnings. 

gocyclo, golint, gofmt, and other tools are used to support code quality.",Met,"In Go, warnings are errors.",Met,"In Go, warnings are errors.",?,,?,,Met,"OliveTin uses the standard FLOSS Go library; ""crypo/md5"".",Met,"OliveTin uses the standard FLOSS Go library; ""crypo/md5"".",Met,"OliveTin uses the standard FLOSS Go library; ""crypo/md5"".",,OliveTin does not use cryptography with keys.,Unmet,OliveTin uses MD5. ,,Not used. ,,Not used. ,,Not used. ,?,,?,,Met,"As of Jan 2022, no vulnerabilities have yet been identified.",Met,"As of Jan 2022, no vulnerabilities have yet been identified.",Met,"gocyclo, golint, gofmt, and other tools are used to support code quality.",?,,?,,?,,?,,?,,?,,?,,,2021-07-12 00:26:25 UTC,2022-01-03 00:36:13 UTC,Unmet,OliveTin uses MD5. ,Met,GitHub actions are used to run code quality checks in an automated way. ,,Met,GitHub supports discussions on issues and pull requests.,Met,Should not have done that... yet!,Met,"https://github.com/OliveTin/OliveTin/issues/new/choose
https://docs.olivetin.app/support.html",?,,?,,?,,?,,?,,Unmet,"// X-Content-Type-Options was not set to ""nosniff"".",?,,?,,72,,,2022-03-19 23:00:23 UTC,False,"Go, JavaScript, Makefile, Dockerfile",11,5,?,,?,,?,,?,,?,,?,,?,,?,,?,,?,,?,,?,,?,,?,,?,,?,,?,,?,,?,,?,,?,,?,,?,,?,,?,,?,,?,,?,,?,,?,,?,,?,,?,,?,,?,,?,,?,,?,,?,,?,,4,?,,?,,?,,?,,?,,?,,?,,?,,?,,?,,?,,?,,Unmet,,Unmet,,72,,,,,,,,,Met,
26,5051,11667,lean-riemann-hypothesis,Riemann Hypothesis in Lean,https://github.com/bhgomes/lean-riemann-hypothesis,https://github.com/bhgomes/lean-riemann-hypothesis,MIT,?,,Met,Given only https: URLs.,?,,?,,Met,"Projects on GitHub by default use issues and pull requests, as encouraged by documentation such as <https://guides.github.com/activities/contributing-to-open-source/>.",?,,Met,Non-trivial license location file in repository: <https://github.com/bhgomes/lean-riemann-hypothesis/blob/master/LICENSE>.,Met,The MIT license is approved by the Open Source Initiative (OSI).,Met,The MIT license is approved by the Open Source Initiative (OSI).,Unmet,// No appropriate folder found for documentation basics.,?,,Met,"Repository on GitHub, which provides public git repositories with URLs.",Met,"Repository on GitHub, which uses git. git can track the changes, who made them, and when they were made.",?,,Met,"Repository on GitHub, which uses git. git is distributed.",?,,?,,?,,Unmet,// No release notes file found.,?,,?,,?,,?,,?,,?,,?,,?,,?,,?,,?,,?,,?,,?,,?,,?,,?,,?,,?,,?,,?,,?,,?,,?,,?,,?,,?,,?,,?,,?,,?,,?,,?,,?,,?,,?,,?,,?,,?,,?,,?,,?,,?,,?,,,2021-07-12 08:18:06 UTC,2021-07-12 08:18:38 UTC,?,,?,,,Met,GitHub supports discussions on issues and pull requests.,?,,?,,?,,?,,?,,?,,?,,Met,Found all required security hardening headers.,?,,?,,15,,,2022-03-19 23:00:23 UTC,False,Lean,4,0,?,,?,,?,,?,,?,,?,,?,,?,,?,,?,,?,,?,,?,,?,,?,,?,,?,,?,,?,,?,,?,,?,,?,,?,,?,,?,,?,,?,,?,,?,,?,,?,,?,,?,,?,,?,,?,,?,,?,,?,,4,?,,?,,?,,?,,?,,?,,?,,?,,?,,?,,?,,?,,Unmet,,Unmet,,15,,,,,,,,,Met,
27,5052,11668,RecordFlux,Formal message specification and generation of verifiable binary parsers and message generators,https://github.com/Componolit/RecordFlux,https://github.com/Componolit/RecordFlux,AGPL-3.0,?,,Met,Given only https: URLs.,Met,https://github.com/Componolit/RecordFlux/blob/main/README.md,Met,https://github.com/Componolit/RecordFlux/blob/main/README.md#contribution-and-feedback,Met,"Projects on GitHub by default use issues and pull requests, as encouraged by documentation such as <https://guides.github.com/activities/contributing-to-open-source/>.",Met,https://github.com/Componolit/RecordFlux/blob/main/doc/Development.md#pull-requests,Met,Non-trivial license location file in repository: <https://github.com/Componolit/RecordFlux/blob/main/LICENSE>.,Met,The AGPL-3.0 license is approved by the Open Source Initiative (OSI).,Met,The AGPL-3.0 license is approved by the Open Source Initiative (OSI).,Met,Some documentation basics file contents found.,Met,https://github.com/Componolit/RecordFlux/blob/main/doc/Language-Reference.adoc,Met,"Repository on GitHub, which provides public git repositories with URLs.",Met,"Repository on GitHub, which uses git. git can track the changes, who made them, and when they were made.",Met,Development is performed publicly on topic branches (named issue_#ISSUE) which are regularly merged into the `main` branch.,Met,"Repository on GitHub, which uses git. git is distributed.",Met,Semantic versioning is used.,Met,,Met,Releases are tagged v<version>: https://github.com/Componolit/RecordFlux/tags,Met,Release note can be found on GitHub: https://github.com/Componolit/RecordFlux/releases,,No publicly known vulnerabilities.,?,,Met,GitHub issue tracker: https://github.com/Componolit/RecordFlux-language/issues,Met,Issues can be submitted via GitHub: https://github.com/Componolit/RecordFlux/issues,Met,,Met,,Met,https://github.com/Componolit/RecordFlux/issues,Met,https://github.com/Componolit/RecordFlux/security/policy,Met,Vulnerabilities can be reported to recordflux@componolit.com as outlined in the security policy: https://github.com/Componolit/RecordFlux/security/policy,Met,,Met,Non-trivial build file in repository: <https://github.com/Componolit/RecordFlux/blob/main/Makefile>.,Met,Non-trivial build file in repository: <https://github.com/Componolit/RecordFlux/blob/main/Makefile>.,Met,,Met,Make targets (including test targets) are documented in docs/Development.md.,Met,Tests can be run directly using pytest (https://docs.pytest.org),Met,100% statement coverage is achieved. This is enforced in the CI and when running make test.,Met,The policy is to create an issue on GitHub for every significant feature. Enough tests must be implemented to reach 100% statement coverage. All checkers / linters must pass successfully on new code. This is enforced in the CI.,Met,The CI checks for 100% statement coverage. Issues and all resulting pull requests are reviewed by the core team before merging.,Met,"- https://github.com/Componolit/RecordFlux/blob/main/doc/Development.md#pull-requests
- https://github.com/Componolit/RecordFlux/blob/main/tests/README.md",Met,"We use flake8, pylint, mypy, isort, black and icontract-lint on the source code. SPARK code is proven using gnatprove.",Met,We have a zero-warning policy enforced by the CI and the Makefile. Suppressed legitimate warnings must be justified in a comment.,Met,We treat warnings as errors.,Met,,Met,,,,,,,,,,,,,,,,,,Met,Pythons package manage pip uses HTTPS by default. The GitHub website is HTTPS-protected.,Met,,Met,,Met,,Met,"pylint, mypy, gnatprove",Met,CodeQL is run in the CI.,Met,,Met,Analysis tools run in the CI on every git push and nightly.,Met,Hypothesis (https://hypothesis.works) is used for property-based testing in the CI.,,Python is used as an implementation language.,Met,"Tests are run with and without optimizations, the production tool is run without optimizations.",Met,,,2021-07-12 08:43:02 UTC,2021-09-16 23:16:10 UTC,,,Met,GitHub actions are used on every check-in and pull-request can be merged only after a successful CI run (https://github.com/Componolit/RecordFlux/actions).,,Met,GitHub supports discussions on issues and pull requests.,Met,,Met,,?,,,,,,,,,,Met,Found all required security hardening headers (https://github.com/Componolit/RecordFlux),Met,pip is used for installation.,,Developed in Python.,100,2021-07-13 17:55:03 UTC,,,False,"Python, SPARK",20,55,?,,?,,?,,?,,?,,?,,?,,?,,?,,?,,?,,?,,?,,?,,?,,?,,,No reported vulnerabilities in the last 12 months.,?,,Met,Code passing `black --check --line-length 100` is accepted (https://black.readthedocs.io/en/stable/the_black_code_style/current_style.html),Met,Code is checked automatically in the Makefile and CI using black.,,The software is implemented in Python.,,The software is implemented in Python.,,Pythons package manager pip is used for dependency resolution and building.,,The software is implemented in Python.,Met,pip defaults are used for installation.,Met,All required dependencies can be installed from the source repository as documented in `docs/Development.md`.,Met,Contained in https://github.com/Componolit/RecordFlux/blob/main/setup.py,Met,https://github.com/Componolit/RecordFlux/security/dependabot,Met,Dependencies managed by pip (contained in https://github.com/Componolit/RecordFlux/blob/main/setup.py),?,,Met,GitHub actions are run on every check-in and before merging a pull-request.,?,,Met,100% test coverage achieved and enforced by automatic checks using pytest.,Met,- https://github.com/Componolit/RecordFlux/blob/main/doc/Development.md#pull-requests,?,,?,,,,,,?,,?,,48,?,,?,,?,,?,,?,,?,,?,,Met,All code is review by at least one other person. This policy is enforced through GitHub's protected branches.,Met,100% statement coverage enforced in the Makefile and the CI using pytest.,?,,?,,?,,Met,,Unmet,,155,,,,,,2021-07-13 17:55:03 UTC,,,Met,
28,5053,11669,AspNetCore_MicroBlog,"Mongo DB, Angular CLI, .Net Core",https://github.com/odktech/AspNetCore_MicroBlog,https://github.com/odktech/AspNetCore_MicroBlog,MIT,?,,Met,Given only https: URLs.,Met,,Met,,Met,"Projects on GitHub by default use issues and pull requests, as encouraged by documentation such as <https://guides.github.com/activities/contributing-to-open-source/>.",?,,Met,// No license location file found.,Met,The MIT license is approved by the Open Source Initiative (OSI).,Met,The MIT license is approved by the Open Source Initiative (OSI).,Met,// No appropriate folder found for documentation basics.,Met,,Met,"Repository on GitHub, which provides public git repositories with URLs.",Met,"Repository on GitHub, which uses git. git can track the changes, who made them, and when they were made.",Met,,Met,"Repository on GitHub, which uses git. git is distributed.",Met,,Met,,Met,,,// No release notes file found.,Met,,?,,Met,,?,,Met,,Met,,?,,Unmet,,,,,,Met,,,,,,Met,,Met,,Met,,Met,,Met,,Met,,,,,,,,Met,,Met,,,,,,,,?,,,,,,,,,,Met,,Met,,Met,,Met,,?,,?,,?,,?,,?,,?,,?,,?,,,2021-07-12 09:25:26 UTC,2021-07-12 09:33:40 UTC,,,Met,,,Met,GitHub supports discussions on issues and pull requests.,Met,,Met,,?,,?,,?,,?,,?,,Met,Found all required security hardening headers.,?,,?,,78,,,,True,"C#, TypeScript, JavaScript, SCSS",6,2,?,,?,,?,,?,,?,,?,,?,,?,,?,,?,,?,,?,,?,,?,,?,,?,,?,,?,,?,,?,,?,,?,,?,,?,,?,,?,,?,,?,,?,,?,,?,,?,,?,,?,,?,,?,,?,,?,,?,,?,,4,?,,?,,?,,?,,?,,?,,?,,?,,?,,?,,?,,?,,Unmet,,Unmet,,78,,,,,,,,,Met,
