26,4008,2300,CPython,The Python programming language,https://www.python.org,https://github.com/python/cpython,Python Software Foundation License,?,,Met,Given only https: URLs.,Met,https://www.python.org/doc/,Met,https://docs.python.org/,Met,"Projects on GitHub by default use issues and pull requests, as encouraged by documentation such as <https://guides.github.com/activities/contributing-to-open-source/>.",Met,The Python devguide https://devguide.python.org/ explains how to contribute to CPython. It includes coding standard information.,Met,Non-trivial license location file in repository: <https://github.com/python/cpython/blob/master/LICENSE>.,Met,"Python Software Foundation License is a BSD-style, permissive free software license.",Met,https://opensource.org/licenses/Python-2.0,Met,The official Python documentation is located at https://docs.python.org/,Met,The official Python documentation at https://docs.python.org/ provides API documentation for Python and C/C++ APIs,Met,"Repository on GitHub, which provides public git repositories with URLs.",Met,"Repository on GitHub, which uses git. git can track the changes, who made them, and when they were made.",Met,"alpha, beta, and release candidates are tagged in git and released at https://www.python.org/downloads/.",Met,"Repository on GitHub, which uses git. git is distributed.",Met,,Unmet,Python does not use SemVer. There are API changes between minor releases.,Met,,Met,"Major changes are listed in the official documentation, e.g. https://docs.python.org/3/whatsnew/3.8.html for Python 3.8. CPython also has a more detailed changelog https://docs.python.org/3/whatsnew/changelog.html",Met,"Security fixes and CVE numbers are mentioned in the whatsnew text and in the more detailed changelog, https://docs.python.org/3/whatsnew/changelog.html",?,,Met,The issue tracker is https://bugs.python.org/,Met,Python hosts an instance of Roundup issue tracker at https://bugs.python.org/,Met,,Met,A developer or reviewer usually responds within a couple of hours to days.,Met,Issues are archived at https://bugs.python.org/,Met,"https://www.python.org/dev/security/
The page is linked from the footer of every page on https://www.python.org/",Met,https://www.python.org/dev/security/ lists the public GPG key of the Python Security Response Team.,Met,,Met,CPython sources come with autoconf/automake build system and Visual Studio project files.,Met,"CPython uses automake, autoconf, standard C compiler (GCC, clang), and supports Visual Studio.",Met,"autoconf, automake, GCC",Met,CPython comes with a full unit test suite built-in.,Met,CPython uses the default Python unittest framework to run tests.,Met,,Met,The policy is documented in the development guide https://devguide.python.org/ and enforced by reviewers.,Met,See https://github.com/python/cpython/commits/master/Lib/test,Met,https://devguide.python.org/pullrequest/#making-good-prs,Met,The default Makefile enables warnings like -Wall -Wextra and several other compiler specific warnings like -Wno-unused-result -Wsign-compare  -Wno-unused-result -Wno-unused-parameter -Wno-missing-field-initializers -Werror=implicit-function-declaration,Met,CPython's C code generally compiles without warnings. Warnings are addressed in new releases.,Met,CPython enables most C warnings flags (-Wall -Wextra and several additional flags). Warnings are considered bugs and are usually fixed before the next release.,Met,The Python Core Developer team has several members with security background.,Met,,Met,"CPython uses OpenSSL for hashing, HMAC and TLS. It only supports widely accepted protocols and algorithns.",Unmet,"CPython ships with fallback modules for some hashing algorithms like MD5, SHA1, and SHA2 family. The code is only used when OpenSSL bindings are not available.",Met,,,CPython relies on OpenSSL for TLS and does not enforce additional restrictions on top of OpenSSL.,Met,"MD4, DES, and RC4 are not supported and disabled for TLS protocol. MD5 is available but no longer used except for few legacy protocols like DIGEST auth.",Met,PFS key agreement is used by default for TLS.,Met,CPython provides wrappers for OpenSSL's PBKDF2-HMAC and scrypt implementation.,Met,Python uses the operation systems CSPRNG and OpenSSL's DRBG for TLS.,Met,,Met,,Met,,Met,,Met,"CPython uses LGTM (https://lgtm.com/projects/g/python/cpython), Coverity Scan, and some developers check the C code with clang scan-build",Met,,Met,"As of today LGTM and Coverity don't list any errors, only some warnings, recommendations, or false positives",Met,LGTM scans the code regularly. ,Met,"CPython is part of OSS-Fuzz
https://github.com/google/oss-fuzz/tree/master/projects/python3-libraries",Met,,Met,,Met,,,2020-06-10 21:38:05 UTC,2020-06-12 12:16:04 UTC,Met,"CPython configures strong, secure defaults for TLS.",Met,"Pull requests on Github are tested with Travis CI, Azure Pipelines, and AppVeyor. Additional testing is performed with buildbots (https://www.python.org/dev/buildbot/).",cpe:2.3:a:python:python,Met,"GitHub supports discussions on issues and pull requests.
Python has a bug tracker at https://bugs.python.org/, mailman mailing lists at https://mail.python.org/mailman/, and a Discourse server at https://discuss.python.org/",Met,,Met,"English is the default language for all documentation, bug tracker, pull requests, and other forms of communication.",?,,Met,CPython's stdlib supports HTTPS with TLS 1.2 and newer. It also supports insecure protocols like plain HTTP and FTP if the user chooses to.,Met,Python's builtin ssl module supports TLS 1.2 and 1.3.,Met,CPython verifies certificate and hostnames for HTTPS and recommended SSLContext by default.,Met,CPython relies on OpenSSL for certificate validation and hostname verification. OpenSSL performs these checks during TLS handshake.,Unmet,"// X-Content-Type-Options was not set to ""nosniff"".",?,,?,,100,2020-06-11 07:06:54 UTC,,,False,"Python, C, Objective-C, C++, M4, Batchfile, Shell, Assembly, Makefile, Common Lisp, PLSQL, PowerShell, Rich Text Format, DTrace, XSLT, VBScript",24,69,Met,CPython uses CLA https://www.python.org/psf/contrib/contrib-form/,Met,"The Python Language Governance is defined in PEP 13, https://www.python.org/dev/peps/pep-0013/",Met,The code of conduct for CPython and PSF is https://www.python.org/psf/codeofconduct/,Met,All responsibilities and roles are explained in the developer guide. The responsibilities of Python core developers are explained at https://devguide.python.org/coredev/ and release manager at https://devguide.python.org/devcycle/ . A list of core developers is available at https://devguide.python.org/developers/. Release managers and members of the steering council are listed at https://www.python.org/dev/peps/ ,Met,CPython has a over 100 core developers. Admin access to repositories and resources is shared across multiple people. https://devguide.python.org/developers/,Met,https://devguide.python.org/developers/,?,,Met,"The design, architecture, and core semantics of Python are explained in the official documentation, e.g. https://docs.python.org/3/reference/index.html",?,,Met,"The Python documentation has a beginners guide, https://www.python.org/doc/",?,,?,,?,,Met,"The official documentation is internationalized and currently translated to 5 languages (French, Japanese, Korean, Brazilian Portuguese, Simplified Chinese). More languages are added in the future. https://docs.python.org/
",Met,"Python's package index https://pypi.org/ secures passwords with bcrypt. Other subsystems use recommended password KDFs, too.
",Met,"CPython maintains several older stable versions for several years. The release schedule for every release is describes as a PEP, https://www.python.org/dev/peps/",?,,?,,Met,"The coding style are PEP 7 for C code and PEP 8 for Python code, https://www.python.org/dev/peps/. They are references from the developer guide.",Unmet,CPython does not automatically enforce styles because it would be too disruptive. Older code does not comply.,Met,The configure script https://github.com/python/cpython/blob/master/configure.ac extends base flags.,Met,The Makefile https://github.com/python/cpython/blob/master/Makefile.pre.in does not strip debugging information.,Met,Python has only one auto-generated Makefile to build the main interpreter.,?,,Met,"CPython uses standard  autoconf / automake, which supports DESTDIR.",Met,CPython does not require an installation to run tests.,?,,Met,Release managers and core developers regularly update external dependencies before a release.,Met,Python uses standard components on Linux and BSD-like platforms. For Windows and macOS the dependencies are regularly updated,Met,CPython uses only FLOSS components,Met,CPython uses GitHub with mandatory CI checks on every pull request.,Met,CPython requires that every new feature and bug fix is accompanied by an automatic regression test.,Met,"CPython uses several tools to automatically measure code coverage. Code coverage is currently around 82%, https://codecov.io/gh/python/cpython",Met,"The formal policy is part of the pull request workflow documentation, https://devguide.python.org/pullrequest",Met,,?,,Met,"CPython includes SHA2 family, SHA3 family, and Blake2. Further more it supports several algorithms that are supported by OpenSSL.",,,Met,"Releases are signed with the release manager's personal GPG key, see https://www.python.org/downloads/",Met,Release tags are signed with the personal GPG key of the release manager.,26,?,,?,,?,,?,,?,,?,,?,,?,,?,,?,,?,,?,,Met,,Unmet,,169,,,,,,2020-06-11 07:06:54 UTC,,,Met,
27,4010,5620,TestableHttpClient,A simple library to make testing with HttpClient and related classes easier,https://github.com/dnperfors/TestableHttpClient,https://github.com/dnperfors/TestableHttpClient,MIT,?,,Met,Given only https: URLs.,Met,"https://github.com/dnperfors/TestableHttpClient/

Although a website other than the github project page might be prefered.",Met,Non-trivial contribution file in repository: <https://github.com/dnperfors/TestableHttpClient/blob/master/CONTRIBUTING.md>.,Met,Non-trivial contribution file in repository: <https://github.com/dnperfors/TestableHttpClient/blob/master/CONTRIBUTING.md>.,Met,"This should be met by the pull request template, although it might be more useful to add this in the normal documentation for better referencing.
https://github.com/dnperfors/TestableHttpClient/blob/master/.github/pull_request_template.md
",Met,Non-trivial license location file in repository: <https://github.com/dnperfors/TestableHttpClient/blob/master/LICENSE.md>.,Met,The MIT license is approved by the Open Source Initiative (OSI).,Met,The MIT license is approved by the Open Source Initiative (OSI).,Met,Some documentation basics file contents found.,Unmet,"There is documentation on the API itself, which is visible in most IDE's. Besides that the API should be relatively self explanatory. 
Examples can be found in the IntegrationTest project.",Met,"Repository on GitHub, which provides public git repositories with URLs.",Met,"Repository on GitHub, which uses git. git can track the changes, who made them, and when they were made.",Met,"Repository in GitHub is the only repository for this project, all changes are tracked by git.",Met,"Repository on GitHub, which uses git. git is distributed.",Met,We use SemVer,Met,,Met,Release process is described https://github.com/dnperfors/TestableHttpClient/blob/master/docs/release-process.md,Met,Non-trivial release notes file in repository: <https://github.com/dnperfors/TestableHttpClient/blob/master/CHANGELOG.md>.,,There are no known vulnerabilities yet.,?,,Met,The GitHub issue tracker is used: https://github.com/dnperfors/TestableHttpClient/issues,Met,"This is described in the contribution document and in the github templates.

https://github.com/dnperfors/TestableHttpClient/blob/master/CONTRIBUTING.md",Met,,Met,,Met,https://github.com/dnperfors/TestableHttpClient/issues,Met,https://github.com/dnperfors/TestableHttpClient/blob/master/SECURITY.md,,,,There are no vulnerability reports yet.,Met,The project is build by using standard dotnet tooling.,Met,The library is build using the dotnet tooling and tested using XUnit,Met,The dotnet tooling and XUnit is OpenSource,Met,Every library has it's own Test project and an integrationtest project is also available all placed in the folder 'test': https://github.com/dnperfors/TestableHttpClient/tree/master/test,Met,All test can be run using `dotnet test`: https://github.com/dnperfors/TestableHttpClient/actions?query=workflow%3ACI,Met,"Allthough there is no prove for this yet, the project is created using a test first approach.",Met,This polict is documented in our CONTRIBUTING.md,Met,All Pull Requests have changes in tests.,Met,This is documented in our CONTRIBUTING.md: https://github.com/dnperfors/TestableHttpClient/blob/master/CONTRIBUTING.md and the PR template.,Met,Compiler warnings are turned on and extra code analyzers are added.,Met,During reviews the code is checked for warnings and a comment is given when warnings are not addressed.,Met,"Although warnings are not shown as errors, they are registered by SonarQube and this will prevent PR's to be merged.",Met,,Met,,,,,,,,,,,,,,,,,,Met,"Packages can only be downloaded via NuGet, which only supports https.
Source code is only downloadable from GitHub, which only supports https.",Met,,Met,There are no known vulnerabilities.,Met,,Met,FxCopAnalyzer and SonarQube are used in the CI pipeline,Met,SonarQube is used in the CI pipeline: https://sonarcloud.io/dashboard?id=dnperfors_TestableHttpClient,Met,"vulnerabilities discovered by static code analysis in dotnet will result in a warnings or errors, which are solved immediately.",Met,"Static code analysis is performed with every build, locally and on the server.",Unmet,Dynamic analysis tools don't seem to be very useful in the scope of a library that is only used during unittesting.,,TestableHttpClient is written using .NET and doesn't use any memory-unsafe functionality.,Unmet,https://github.com/dnperfors/TestableHttpClient,,,,2020-06-11 17:25:05 UTC,2020-12-09 14:28:52 UTC,,,Met,"CI is provided by GitHub Workflow, which builds every commit on the repository, but also every Pull Request.
https://github.com/dnperfors/TestableHttpClient/actions?query=workflow%3ACI",,Met,GitHub supports discussions on issues and pull requests.,Met,,Met,"All project information is in English, code comments are written in English.",,This library is intended to be used in unittests,,This library isn't responsible for network communications.,,This library isn't responsible for TLS support.,,This library isn't responsible for TLS support.,,This library isn't responsible for TLS support.,Met,Found all required security hardening headers. https://github.com/dnperfors/TestableHttpClient,Met,NuGet packages are provided which perform the installation,Met,The CI is responsible for this: https://github.com/dnperfors/TestableHttpClient/actions?query=workflow%3ACI,99,,,2022-03-23 23:00:25 UTC,False,C#,30,75,?,,?,,?,,?,,?,,?,,?,,,"The component is a library with a single responsibility, it doesn't contain a describable architecture like a program.",?,,Met,"The ""quick start"" guide is provided in the README.md: https://github.com/dnperfors/TestableHttpClient/blob/master/README.md",Met,This is generally checked and addressed during reviews.,?,,?,,,"The library does produce error messages, but these are for developers only and we assume that every developer knows enough English.",,No passwords are stored.,Met,Versions are backwards compatible and follow the semver standard.,,There has been no vulnerabilities reported yet.,?,,Met,Coding standards are enforced using the .editorconfig: https://github.com/dnperfors/TestableHttpClient/blob/master/.editorconfig,Met,dotnet build issues warnings when code doesn't follow the guidelines specified in the .editorconfig. Besides that the CI pipeline runs dotnet format to ensure that formatting is correct as well.,,Only .NET assemblies are generated which are not native.,Met,This is part of the default build system of .NET. The provide packages have debug information and sourcelink support.,Met,Only projects that are specified in the solution are build.,Met,The build pipeline is specified in Git and is repeatable.,Met,NuGet packages are used,Met,Project can easily be setup using the dotnet cli.,Met,"The list of requirements are listed by nuget:
https://www.nuget.org/packages/testablehttpclient
https://www.nuget.org/packages/testablehttpclient.nfluent",Met,We make use of GitHubs dependabot: https://github.com/dnperfors/TestableHttpClient/network/alerts,Met,The NuGet package manager is used.,Met,"TestableHttpClient is build on top of the .NET stack, which in itself is open source.",Met,The CI runs all the tests for every build. The build will fail whenever (one of) the tests fails.,,"Currently no bugs have been reported/fixed, since we are still in an early stage of development. However, since we are working with PullRequests, the reviewer will check that tests are added for a bug.",Met,"Coverlet is used during test run and SonarQube reports the coverage: https://sonarcloud.io/component_measures?id=dnperfors_TestableHttpClient&metric=coverage&view=list
By default SonarQube will prevent merging PR's when the coverage is under 80%",Met,This is documented in our CONTRIBUTING.md: https://github.com/dnperfors/TestableHttpClient/blob/master/CONTRIBUTING.md,Met,"The library is designed to save data in memory, as it comes in.",,"This library is not intended to be used in production environments, but for use in unittests, therefore it doesn't have untrusted sources.",,There is no cryptography support in the library,,Authentication credentials en cryptographic keys are not processed in this library.,Unmet,"Ultimately the nuget package should be signed, however, we don't have the resources and the knowledge yet to do this.",Met,"By creating tags in GitHub, the tags are automatically cryptographically signed. However it might be better to use developer GPG keys instead.",43,?,,?,,?,,Met,"Issues that can be picked up by new contributors are marked with ""good first issue"": https://github.com/dnperfors/TestableHttpClient/issues?q=is%3Aopen+is%3Aissue+label%3A%22good+first+issue%22",?,,?,,?,,Unmet,There is currently only a single contributer,?,,?,,Unmet,"Not done yet, will be done before first release.",Unmet,This should still be documented.,Unmet,,Unmet,,99,,,,,,,,,Met,
28,4012,5711,druzhba,"Druzhba is a friendly framework for building data pipelines. It efficiently copies data from your production/transactional databases to your data warehouse.

A Druzhba pipeline connects one or more source databases to a target database. It pulls data incrementally from each configured source table and writes to a target table (which is automatically created in most cases), tracking incremental state and history in the target database. Druzhba may also be configured to pull using custom SQL, which supports Jinja templating of pipeline metadata.

In a typical deployment, Druzhba serves the extract and load steps of an ELT pipeline, although it is capable of limited in-flight transformations through custom extract SQL.",https://github.com/seatgeek/druzhba,https://github.com/seatgeek/druzhba,MIT,?,,Met,Given only https: URLs.,Met,https://github.com/seatgeek/druzhba/blob/master/README.rst,Met,https://github.com/seatgeek/druzhba/issues as stated on both GitHub readme and docs cover page,Met,"Projects on GitHub by default use issues and pull requests, as encouraged by documentation such as <https://guides.github.com/activities/contributing-to-open-source/>.

See also: https://druzhba.readthedocs.io/en/latest/contributing.html",Met,We request using an included set of code quality tools as described at https://druzhba.readthedocs.io/en/latest/contributing.html,Met,Non-trivial license location file in repository: <https://github.com/seatgeek/druzhba/blob/master/LICENSE>.,Met,The MIT license is approved by the Open Source Initiative (OSI).,Met,The MIT license is approved by the Open Source Initiative (OSI).,Met,"Some documentation basics file contents found.

Built docs hosted at https://druzhba.readthedocs.io/en/latest/",Met,,Met,"Repository on GitHub, which provides public git repositories with URLs.",Met,"Repository on GitHub, which uses git. git can track the changes, who made them, and when they were made.",Met,,Met,"Repository on GitHub, which uses git. git is distributed.",Met,,Unmet,Druzhba uses a slightly modified version of SemVar described at https://github.com/seatgeek/druzhba/blob/master/docs/release.rst#versioning-system that project maintainers believe better fits Duzhba's execution model.,Met,https://github.com/seatgeek/druzhba/releases,Met,"https://github.com/seatgeek/druzhba/blob/master/CHANGELOG.rst

Also in the docs",,There are currently no publicly known vulnerabilities,?,,Met,https://github.com/seatgeek/druzhba/issues,Met,https://github.com/seatgeek/druzhba/issues,Met,,Met,,Met,https://github.com/seatgeek/druzhba/issues,Met,Contained in the readme at https://github.com/seatgeek/druzhba and the docs at https://druzhba.readthedocs.io/en/latest/,Met,Contained in the readme at https://github.com/seatgeek/druzhba and the docs at https://druzhba.readthedocs.io/en/latest/. There is an option to open a public issue and email sensitive information to the maintainers. Email supports TLS.,Met,There are currently no reported vulnerabilities.,,,,,,,Met,Unit test suite is run by Nose which is licensed LGPL. There is also an integration test suite that requires special equipment.,Met,python setup.py test,Unmet,"There is extensive unit and integration testing, but we do not currently have an automated coverage report.",Met,Informal policy and added to the docs,Met,Tests are maintained in the same source control repository as the application source so a new feature's pull request will show both changes to the application code and the test suite.,Met,https://druzhba.readthedocs.io/en/latest/contributing.html#testing,Met,,Met,,Met,We reject code change with pylint errors or warnings. We use black for code formatting so disable style conventions in pylint.,Met,,Met,,Met,Druzhba does not implement cryptographic protocols,Met,,Met,,Unmet,We don't currently set any key lengths nor verify them for ssl mode in odbc connections. We should probably support sslmode=require at a minimum.,Met,,,,,,,,Met,Source code can be downloaded from GitLab with https or git+ssh. Packages can be downloaded from https://pypi.org/project/druzhba/#files with https.,Met,Cryptographic hashes are not distributed by http,Met,There are no known unpatched vulnerabilities at this time,Met,There are no known unpatched vulnerabilities at this time,Met,Release instructions specify to run bandit before release.,Met,Release instructions specify to run bandit before release.,,,Unmet,The nature of druzhba will cause bandit to flag a large number of sql statements that need to be manually examined. ,Unmet,,,Python is a managed memory language,Unmet,Our unit tests check runtime assertions but we do not use a dynamic analysis tool,,,,2020-06-12 14:35:20 UTC,2020-06-17 16:23:06 UTC,Met,No such algorithms are used,Met,Currently implemented with Travis CI.,,Met,GitHub supports discussions on issues and pull requests.,Met,,Met,Currently all documentation is in English and the GitHub issue tracker is monitored by English speakers,?,,?,,?,,?,,?,,Met,Found all required security hardening headers.,?,,?,,99,,,2022-03-02 23:00:39 UTC,False,"Python, SQL",25,20,?,,?,,?,,?,,?,,?,,?,,?,,?,,?,,?,,?,,?,,?,,?,,?,,?,,?,,?,,?,,,No compiled code,,"Python application with no build system
",,"Python application with no build system
",?,,?,,?,,?,,?,,?,,?,,?,,?,,?,,?,,?,,?,,?,,Met,Passwords may be passed through environment variables and keys are read from external files.,?,,?,,9,?,,?,,?,,?,,?,,?,,?,,?,,?,,?,,?,,?,,Unmet,,Unmet,,99,,,,,,,,,Met,
