10,1794,2365,PitE-TicTacToe,"2nd Assignment of the course ""Python in the Enterprise""",https://github.com/mark91m12/PitE-TicTacToe,https://github.com/mark91m12/PitE-TicTacToe,,?,,Met,Given only https: URLs.,?,,?,,Met,"Projects on GitHub by default use issues and pull requests, as encouraged by documentation such as <https://guides.github.com/activities/contributing-to-open-source/>.",?,,Unmet,// No license location file found.,?,,?,,Unmet,// No appropriate folder found for documentation basics.,?,,Met,"Repository on GitHub, which provides public git repositories with URLs.",Met,"Repository on GitHub, which uses git. git can track the changes, who made them, and when they were made.",?,,Met,"Repository on GitHub, which uses git. git is distributed.",?,,?,,?,,Unmet,// No release notes file found.,?,,?,,?,,?,,?,,?,,?,,?,,?,,?,,?,,?,,?,,?,,?,,?,,?,,?,,?,,?,,?,,?,,?,,?,,?,,?,,?,,?,,?,,?,,?,,?,,?,,?,,?,,?,,?,,?,,?,,?,,?,,?,,?,,?,,,2018-04-19 08:51:51 UTC,2018-04-19 08:52:58 UTC,?,,?,,,Met,GitHub supports discussions on issues and pull requests.,?,,?,,?,,?,,?,,?,,?,,Met,Found all required security hardening headers.,?,,?,,10,,,2022-05-12 23:00:46 UTC,False,Python,22,0,?,,?,,?,,?,,?,,?,,?,,?,,?,,?,,?,,?,,?,,?,,?,,?,,?,,?,,?,,?,,?,,?,,?,,?,,?,,?,,?,,?,,?,,?,,?,,?,,?,,?,,?,,?,,?,,?,,?,,?,,4,?,,?,,?,,?,,?,,?,,?,,?,,?,,?,,?,,?,,Unmet,,Unmet,,10,,,,,,,,,Met,
11,1797,2375,techfantasm,,http://techfantasm.cf,http://techfantasm.cf,,?,,Unmet,// Given an http: URL.,?,,?,,?,,?,,?,,?,,?,,?,,?,,?,,?,,?,,?,,?,,?,,?,,?,,?,,?,,?,,?,,?,,?,,?,,?,,?,,?,,?,,?,,?,,?,,?,,?,,?,,?,,?,,?,,?,,?,,?,,?,,?,,?,,?,,?,,?,,?,,?,,?,,?,,?,,?,,?,,?,,?,,?,,?,,?,,?,,?,,?,,,2018-04-23 07:03:02 UTC,2018-04-23 07:03:02 UTC,?,,?,,,?,,?,,?,,?,,?,,?,,?,,?,,Unmet,// One or more of the required security hardening headers is missing.,?,,?,,1,,,2022-05-18 23:00:26 UTC,False,,21,0,?,,?,,?,,?,,?,,?,,?,,?,,?,,?,,?,,?,,?,,?,,?,,?,,?,,?,,?,,?,,?,,?,,?,,?,,?,,?,,?,,?,,?,,?,,?,,?,,?,,?,,?,,?,,?,,?,,?,,?,,0,?,,?,,?,,?,,?,,?,,?,,?,,?,,?,,?,,?,,Unmet,,Unmet,,1,,,,,,,,,Met,
12,1798,2378,gan-hattra-api,,https://github.com/rayandrews/gan-hattra-api,https://github.com/rayandrews/gan-hattra-api,,?,,Met,Given only https: URLs.,?,,?,,Met,"Projects on GitHub by default use issues and pull requests, as encouraged by documentation such as <https://guides.github.com/activities/contributing-to-open-source/>.",?,,Unmet,// No license location file found.,?,,?,,Unmet,// No appropriate folder found for documentation basics.,?,,Met,"Repository on GitHub, which provides public git repositories with URLs.",Met,"Repository on GitHub, which uses git. git can track the changes, who made them, and when they were made.",?,,Met,"Repository on GitHub, which uses git. git is distributed.",?,,?,,?,,Unmet,// No release notes file found.,?,,?,,?,,?,,?,,?,,?,,?,,?,,?,,?,,?,,?,,?,,?,,?,,?,,?,,?,,?,,?,,?,,?,,?,,?,,?,,?,,?,,?,,?,,?,,?,,?,,?,,?,,?,,?,,?,,?,,?,,?,,?,,?,,?,,,2018-04-23 18:10:53 UTC,2018-04-23 18:10:53 UTC,?,,?,,,Met,GitHub supports discussions on issues and pull requests.,?,,?,,?,,?,,?,,?,,?,,Met,Found all required security hardening headers.,?,,?,,10,,,2022-05-18 23:00:26 UTC,False,JavaScript (CII estimate),21,0,?,,?,,?,,?,,?,,?,,?,,?,,?,,?,,?,,?,,?,,?,,?,,?,,?,,?,,?,,?,,?,,?,,?,,?,,?,,?,,?,,?,,?,,?,,?,,?,,?,,?,,?,,?,,?,,?,,?,,?,,4,?,,?,,?,,?,,?,,?,,?,,?,,?,,?,,?,,?,,Unmet,,Unmet,,10,,,,,,,,,Met,
13,1799,2381,ONAP AAI Rest Client,This library provides a single client implementation to be used by AAI micro services for communicating via its REST API.,https://gerrit.onap.org/r/#/admin/projects/aai/rest-client,https://gerrit.onap.org/r/#/admin/projects/aai/rest-client,Apache-2.0,?,,Met,Given only https: URLs.,Met,https://gerrit.onap.org/r/#/admin/projects/aai/rest-client,Met,https://wiki.onap.org/display/DW/Active+and+Available+Inventory+Project,Met,The process could be found in the following URL: https://wiki.onap.org/display/DW/Development+Procedures+and+Policies,Met,"https://wiki.onap.org/display/DW/Development+Procedures+and+Policies describes requirements for acceptable contributions and is linked from the AAI project page. https://wiki.onap.org/display/DW/Java+code+style shows java code style.
https://wiki.onap.org/display/DW/Developer+Best+Practices",Met,Licence can be found in: https://gerrit.onap.org/r/gitweb?p=aai/rest-client.git;a=blob;f=License.txt;h=c97ccb2ef72c2f18a5299fa8e8c380e01fcc109a;hb=HEAD,Met,The Apache-2.0 license is approved by the Open Source Initiative (OSI). The Apache-2.0 license is approved by the Open Source Initiative (OSI).,Met,The Apache-2.0 license is approved by the Open Source Initiative (OSI).,Met,,Met,,Met,https://gerrit.onap.org/r/#/admin/projects/aai/rest-client,Met,"Tracking is provided by using a combination of JIRA and git history. Every commit has an user and a Jira number attached to it.

Git history for AAI Rest client's master branch:
https://gerrit.onap.org/r/gitweb?p=aai/rest-client.git;a=shortlog;h=refs/heads/master

Jira for ONAP: https://jira.onap.org/secure/Dashboard.jspa",Met,"Gerrit provides an temperate branch for reviewing and providing comments. Once approved, the code will be merged and the temperate branch will be removed",Met,,Met,Release version is with format ${major}.${minor}.${patch} and will be updated accordingly for each release.,Met,,Met,,Met,Release note can be found in http://onap.readthedocs.io/en/latest/submodules/aai/aai-common.git/docs/release-notes.html,Met,,?,,Met,Jira is used to track issues. https://wiki.onap.org/display/DW/Tracking+Issues+with+JIRA,Met,The description of the process could be found in the following URL: https://wiki.onap.org/display/DW/Tracking+Issues+with+JIRA,Met,,Met,,Met,The report of issues are listed here: https://wiki.onap.org/display/DW/Issue+Reports,Met,Process on how to report a vulnerability can be found in https://wiki.onap.org/display/DW/ONAP+Vulnerability+Management,,Private vulnerability reports are not supported.,,There's no vulnerabilities reported so far.,Met,Jenkins is used to build the artifact. https://jenkins.onap.org/view/aai-rest-client/job/aai-rest-client-master-release-version-java-daily/,Met,Maven are used to build the project,Met,Maven is under Apache 2.0 license,Met,The project uses junit to run the unit tests.,Met,"Tests can be run, by running the command ""mvn clean install""",Met,,Met,Sonar covers the Java code,Met,,Met,This is documented on our wiki: https://wiki.onap.org/display/DW/Code+Coverage+and+Static+Code+Analysis,Met,,Met,The application logs the relevant warnings.,Met,Build systems run the compile with test flag enabled by default. So any failure in test cases will fail the ci and the merge request.,Met,,Met,,Met,,Met,,Met,,Met,,Met,,Met,,Met,,Met,,Met,,Met,,Met,,Met,,Met,https://sonar.onap.org/dashboard?id=org.onap.aai%3Arest-client,Met,https://sonar.onap.org/dashboard?id=org.onap.aai%3Arest-client,,,Met,This is part of Continuous Integration on a daily basis,Met,,Unmet,,Unmet,,Met,,,2018-04-24 14:43:36 UTC,2021-09-13 14:31:10 UTC,,,Met,"For each pull request, the project needs to be built successfully before the Merge option becomes activated. The test will be run automatically during the building process as well. Once build successfully and all tests has past, the Merge option will be activated.",,Met,,Met,,Met,,Met,The project tries to use hardening mechanism whenever possible. Eg we use transaction id for tracking transactions through multiple services and also we use http headers to identify the application where possible,Met,"The projects supports secure TLS and HTTPS and Insecure protocols are disabled by default in these applications, they cab be over-ridden by user configuration",Met,The products support TLS version 1.2,,,,,Unmet,"// X-Content-Type-Options was not set to ""nosniff"".",Met,"All packages are delivered either as an jar artifact or a docker image. Incase of maven artifacts, they can be removed using the pom file. In case of docker container. We can delete the container we dont want. Also control the orchestration in Kubernetes if you want to exclude certain docker images.",?,,100,2018-04-30 14:20:50 UTC,,,False,Java,18,82,Met,"https://wiki.onap.org/display/DW/Development+Procedures+and+Policies describes requirements for acceptable contributions and is linked from the AAI project page. https://wiki.onap.org/display/DW/Java+code+style
shows java code style. https://wiki.onap.org/display/DW/Developer+Best+Practices",Met,"ONAP requires both a Developer Certificate of Origin (DCO), and a Contributor License Agreement (CLA).

https://wiki.onap.org/display/DW/Contribution+Agreements",Met,"ONAP adheres to the Linux Foundation Code of Conduct, found at https://lfprojects.org/policies/code-of-conduct/",Met,"The key roles in the project and their responsibilities are described at

https://wiki.onap.org/display/DW/Community+Offices+and+Governance

Current members are listed at

https://wiki.onap.org/pages/viewpage.action?pageId=8226539",Met,"For AAI-Rest client we have 4 committers and multiple contributes who are listed in https://wiki.onap.org/display/DW/Resources+and+Repositories#ResourcesandRepositories-ActiveandAvailableInventory All 4 committers have access and rights to maintain the code base, approve and review incoming changes and release a new version of the artifact. This will let the project continue with minimal to no interruption if one person is incapacitated. Also this project is controlled by the linux foundation so we can add more committers if needed",Met,The project covered in this report have more than 2 persons who actively contribute and maintain code. The following link provides with list of commit owners for the project https://gerrit.onap.org/r/#/q/project:aai/rest-client+branch:master,Met,Road map for AAI can be found in https://wiki.onap.org/display/DW/AAI+R3+Platform+Maturity?preview=%2F35523310%2F35523289%2FAAI+Roadmap+2018-01-05.pdf,Met,Architecture of AAI can be found in https://wiki.onap.org/pages/viewpage.action?pageId=1015836,?,,Met,Information on setting up ONAP can be found at https://onap.readthedocs.io/en/latest/guides/onap-developer/settingup/index.html,Met,Documentation is updated on a regular basis when needed.,?,,?,,Met,It is not applicable at this point in time as the software will only be used by technical people and not by general public,Met,The library does not store any password,,"This is a library API rather than a microservice, therefore upgrading would mean up versioning maven POM dependency.",Met,"Vulnerabilities can be reported using the link https://wiki.onap.org/pages/viewpage.action?pageId=6591711 Currently we dont have any vulnerabilities reported, but the wiki page explains on how to report a vulnerability and how to report anonymously if you do not want the credit for it.",Met,Vulnerabilities handling is documented in https://wiki.onap.org/pages/viewpage.action?pageId=6591711,Met,Google coding style is used in ONAP https://github.com/google/styleguide,?,,Met,"The application does not create native binaries. (Some of the libraries it depends on do, but those are external.)",Met,"The application does not create native binaries. (Some of the libraries it depends on do, but those are external.)",Met,"The application does not create native binaries. (Some of the libraries it depends on do, but those are external.)",Met,"All releases are tagged in gerrit(git), and the builds are controlled using jenkins. By providing the git tag information the same image can be build over and over again with same bit-for-bit result.",Met,"The library is packaged as a jar, and referenced as a maven dependency defined in the main application's pom file",Met,"All the components require only java and maven to begin with for a developer to quickly install and test it. Even for deployment using OOM and the right amount of resources, we can deploy the full AAI/ONAP suite in less than a day. The steps are documented in https://onap.readthedocs.io/en/latest/submodules/oom.git/docs/oom_quickstart_guide.html",Met,"External dependencies are controlled using the pom file, which can be found in the root folder for the projects",Met,NexusIQ sonar scan is run on all the projects on a weekly basis,Met,External components are maintained through Maven. The user can get a list of all included components using the maven dependency tree and can update or reuse as they see fit,Met,We avoid depending on deprecated/obsolete functions.,Met,The library contains JUnit tests and executed during each maven build,Met,"When regressions occur, we add tests for them.",?,,Met,Contributing guide lines for development is recorded in https://wiki.onap.org/display/DW/Development+Procedures+and+Policies,Met,The project strives to implement secure design principles.,Met,The project strives to validate all input to functions,Met,Certificates are managed through AAF micro-service which will be deployed with ONAP suite,,,Unmet,,?,,13,?,,?,,?,,?,,?,,?,,?,,?,,?,,?,,?,,Unmet,Will work on for next release,Met,,Unmet,,182,,,,,,2018-04-30 14:20:50 UTC,,,Met,
14,1803,2385,commons-text,Mirror of Apache Commons Text,https://github.com/chtompki/commons-text,https://github.com/chtompki/commons-text,OTHER,?,,Met,Given only https: URLs.,?,,?,,Met,Non-trivial contribution file in repository: <https://github.com/chtompki/commons-text/blob/master/CONTRIBUTING.md>.,?,,Met,Non-trivial license location file in repository: <https://github.com/chtompki/commons-text/blob/master/LICENSE.txt>.,?,,Unmet,// Did not find license in the OSI list.,Unmet,// No appropriate folder found for documentation basics.,?,,Met,"Repository on GitHub, which provides public git repositories with URLs.",Met,"Repository on GitHub, which uses git. git can track the changes, who made them, and when they were made.",?,,Met,"Repository on GitHub, which uses git. git is distributed.",?,,?,,?,,Unmet,// No release notes file found.,?,,?,,?,,?,,?,,?,,?,,?,,?,,?,,Met,Non-trivial build file in repository: <https://github.com/chtompki/commons-text/blob/master/pom.xml>.,Met,Non-trivial build file in repository: <https://github.com/chtompki/commons-text/blob/master/pom.xml>.,?,,?,,?,,?,,?,,?,,?,,?,,?,,?,,?,,?,,?,,?,,?,,?,,?,,?,,?,,?,,?,,?,,?,,?,,?,,?,,?,,?,,?,,?,,?,,?,,,2018-04-25 15:41:34 UTC,2018-04-25 15:41:34 UTC,?,,?,,,Met,GitHub supports discussions on issues and pull requests.,?,,?,,?,,?,,?,,?,,?,,Met,Found all required security hardening headers.,?,,?,,16,,,2022-02-23 23:00:27 UTC,False,"Java, Shell (CII estimate)",20,0,?,,?,,?,,?,,?,,?,,?,,?,,?,,?,,?,,?,,?,,?,,?,,?,,?,,?,,?,,?,,?,,?,,?,,?,,?,,?,,?,,?,,?,,?,,?,,?,,?,,?,,?,,?,,?,,?,,?,,?,,4,?,,?,,?,,?,,?,,?,,?,,?,,?,,?,,?,,?,,Unmet,,Unmet,,16,,,,,,,,,Met,
15,1804,2386,dummyDoll,just a dummy doll,https://github.com/mohamedmahmoud97/dummyDoll,https://github.com/mohamedmahmoud97/dummyDoll,MIT,?,,Met,Given only https: URLs.,?,,?,,Met,"Projects on GitHub by default use issues and pull requests, as encouraged by documentation such as <https://guides.github.com/activities/contributing-to-open-source/>.",?,,Met,Non-trivial license location file in repository: <https://github.com/mohamedmahmoud97/dummyDoll/blob/master/LICENSE>.,Met,The MIT license is approved by the Open Source Initiative (OSI).,Met,The MIT license is approved by the Open Source Initiative (OSI).,Unmet,// No appropriate folder found for documentation basics.,?,,Met,"Repository on GitHub, which provides public git repositories with URLs.",Met,"Repository on GitHub, which uses git. git can track the changes, who made them, and when they were made.",?,,Met,"Repository on GitHub, which uses git. git is distributed.",?,,?,,?,,Unmet,// No release notes file found.,?,,?,,?,,?,,?,,?,,?,,?,,?,,?,,?,,?,,?,,?,,?,,?,,?,,?,,?,,?,,?,,?,,?,,?,,?,,?,,?,,?,,?,,?,,?,,?,,?,,?,,?,,?,,?,,?,,?,,?,,?,,?,,?,,?,,,2018-04-25 20:34:38 UTC,2018-04-25 20:34:38 UTC,?,,?,,,Met,GitHub supports discussions on issues and pull requests.,?,,?,,?,,?,,?,,?,,?,,Met,Found all required security hardening headers.,?,,?,,15,,,2022-02-24 23:00:42 UTC,False,,20,0,?,,?,,?,,?,,?,,?,,?,,?,,?,,?,,?,,?,,?,,?,,?,,?,,?,,?,,?,,?,,?,,?,,?,,?,,?,,?,,?,,?,,?,,?,,?,,?,,?,,?,,?,,?,,?,,?,,?,,?,,4,?,,?,,?,,?,,?,,?,,?,,?,,?,,?,,?,,?,,Unmet,,Unmet,,15,,,,,,,,,Met,
16,1805,2389,bottle-cork,Authentication module for the Bottle and Flask web frameworks,http://cork.firelet.net,https://github.com/FedericoCeratto/bottle-cork,LGPL-3.0,?,,Unmet,// Given an http: URL.,Met,,Met,,Met,"Projects on GitHub by default use issues and pull requests, as encouraged by documentation such as <https://guides.github.com/activities/contributing-to-open-source/>.",Unmet,,Met,Non-trivial license location file in repository: <https://github.com/FedericoCeratto/bottle-cork/blob/master/LICENSE.txt>.,Met,The LGPL-3.0 license is approved by the Open Source Initiative (OSI).,Met,The LGPL-3.0 license is approved by the Open Source Initiative (OSI).,Met,Some documentation basics file contents found.,Unmet,,Met,"Repository on GitHub, which provides public git repositories with URLs.",Met,"Repository on GitHub, which uses git. git can track the changes, who made them, and when they were made.",?,,Met,"Repository on GitHub, which uses git. git is distributed.",Met,,?,,Met,,Met,Non-trivial release notes file in repository: <https://github.com/FedericoCeratto/bottle-cork/blob/master/CHANGELOG>.,?,,?,,?,,?,,?,,?,,?,,?,,?,,?,,Met,Non-trivial build file in repository: <https://github.com/FedericoCeratto/bottle-cork/blob/master/makefile>.,Met,Non-trivial build file in repository: <https://github.com/FedericoCeratto/bottle-cork/blob/master/makefile>.,Met,,Met,,Met,,Met,,?,,?,,?,,?,,?,,?,,Met,,Met,,Met,,Met,,Met,,Met,,Met,,?,,?,,?,,Met,,?,,?,,?,,?,,?,,?,,?,,?,,?,,?,,?,,,2018-04-27 10:40:54 UTC,2018-04-27 10:45:21 UTC,Met,,?,,,Met,GitHub supports discussions on issues and pull requests.,Met,,Met,,?,,?,,?,,?,,?,,Unmet,"// X-Content-Type-Options was not set to ""nosniff"".",?,,?,,48,,,2022-02-24 23:00:42 UTC,False,"Python, Makefile, Shell (CII estimate)",24,0,?,,?,,?,,?,,?,,?,,?,,?,,?,,?,,?,,?,,?,,?,,?,,?,,?,,?,,?,,?,,?,,?,,?,,?,,?,,?,,?,,?,,?,,?,,?,,?,,?,,?,,?,,?,,?,,?,,?,,?,,4,?,,?,,?,,?,,?,,?,,?,,?,,?,,?,,?,,?,,Unmet,,Unmet,,48,,,,,,,,,Met,
17,1807,2391,vinnie,VIN decoder,https://github.com/clpo13/vinnie,https://github.com/clpo13/vinnie,MIT,?,,Met,Given only https: URLs.,Met,https://github.com/clpo13/vinnie/blob/master/README.md,Met,https://github.com/clpo13/vinnie/blob/master/README.md,Met,"Projects on GitHub by default use issues and pull requests, as encouraged by documentation such as <https://guides.github.com/activities/contributing-to-open-source/>.",Met,https://github.com/clpo13/vinnie/blob/master/README.md,Met,Non-trivial license location file in repository: <https://github.com/clpo13/vinnie/blob/master/LICENSE>.,Met,The MIT license is approved by the Open Source Initiative (OSI).,Met,The MIT license is approved by the Open Source Initiative (OSI).,Met,Basic documentation on installing and using the project is provided in the README.,Met,API documentation can be generated with Doxygen.,Met,"Repository on GitHub, which provides public git repositories with URLs.",Met,"Repository on GitHub, which uses git. git can track the changes, who made them, and when they were made.",Met,// No releases yet,Met,"Repository on GitHub, which uses git. git is distributed.",Met,"// No releases yet, but unique release versions will be used",Met,"// No releases yet, but SemVer will be used",Met,"// No releases yet, but git tags will be used",,Release notes will be found at https://github.com/clpo13/vinnie/releases,,No known vulnerabilities,?,,Met,GitHub issue tracker: https://github.com/clpo13/vinnie/issues,Met,GitHub issue tracker: https://github.com/clpo13/vinnie/issues,Met,,Met,,Met,GitHub issue tracker: https://github.com/clpo13/vinnie/issues,Met,Vulnerabilities can be reported via the GitHub issue tracker: https://github.com/clpo13/vinnie/issues,,// No private reports,,// No vulnerability reports yet,Met,Project uses Meson and Ninja.,Met,Meson and Ninja are both easily acquired from package managers.,Met,Meson and Ninja are both licensed Apache-2.0.,Met,A test suite using Check is distributed with the project.,Met,Tests can be run with Ninja (ninja test).,Unmet,,Met,,Met,,Unmet,,Met,Compiler warnings enabled.,Met,,Met,,Met,,Met,,,,,,,,,,,,,,,,,,Met,Project delivered over HTTPS.,Met,,Met,,Met,,Met,Clang static analyzer,Met,,Met,,Met,,Unmet,,Met,Valgrind is used to detect memory issues.,Unmet,,,// No vulnerabilities found yet,,2018-04-27 22:10:37 UTC,2018-04-27 23:43:20 UTC,,,Met,Continuous integration is run with both Travis CI and Appveyor.,,Met,GitHub supports discussions on issues and pull requests.,Met,,Met,,?,,?,,?,,?,,?,,Met,Found all required security hardening headers.,?,,?,,100,2018-04-27 23:43:20 UTC,,,False,C,15,9,?,,?,,?,,?,,?,,?,,?,,?,,?,,?,,?,,?,,?,,?,,?,,?,,?,,?,,?,,?,,?,,?,,?,,?,,?,,?,,?,,?,,?,,?,,?,,?,,?,,?,,?,,?,,?,,?,,?,,?,,4,?,,?,,?,,?,,?,,?,,?,,?,,?,,?,,?,,?,,Met,,Unmet,,109,,,,,,2018-04-27 23:43:20 UTC,,,Met,
18,1808,2392,dotemacs,My .emacs.el file.,https://github.com/bzg/dotemacs,https://github.com/bzg/dotemacs,,?,,Met,Given only https: URLs.,?,,?,,Met,"Projects on GitHub by default use issues and pull requests, as encouraged by documentation such as <https://guides.github.com/activities/contributing-to-open-source/>.",?,,Unmet,// No license location file found.,?,,?,,Unmet,// No appropriate folder found for documentation basics.,?,,Met,"Repository on GitHub, which provides public git repositories with URLs.",Met,"Repository on GitHub, which uses git. git can track the changes, who made them, and when they were made.",?,,Met,"Repository on GitHub, which uses git. git is distributed.",?,,?,,?,,Unmet,// No release notes file found.,?,,?,,?,,?,,?,,?,,?,,?,,?,,?,,?,,?,,?,,?,,?,,?,,?,,?,,?,,?,,?,,?,,?,,?,,?,,?,,?,,?,,?,,?,,?,,?,,?,,?,,?,,?,,?,,?,,?,,?,,?,,?,,?,,?,,,2018-04-29 11:21:39 UTC,2018-04-29 11:21:39 UTC,?,,?,,,Met,GitHub supports discussions on issues and pull requests.,?,,?,,?,,?,,?,,?,,?,,Met,Found all required security hardening headers.,?,,?,,10,,,2022-02-26 23:00:31 UTC,False,Emacs Lisp (CII estimate),20,0,?,,?,,?,,?,,?,,?,,?,,?,,?,,?,,?,,?,,?,,?,,?,,?,,?,,?,,?,,?,,?,,?,,?,,?,,?,,?,,?,,?,,?,,?,,?,,?,,?,,?,,?,,?,,?,,?,,?,,?,,4,?,,?,,?,,?,,?,,?,,?,,?,,?,,?,,?,,?,,Unmet,,Unmet,,10,,,,,,,,,Met,
19,1809,2393,TinyLanding,Your landing page and leads manager out-of-the-box with Node.js+Express,https://www.tinylanding.site,https://github.com/pasalino/TinyLanding,MIT,?,,Met,Given only https: URLs.,Met,,?,,Met,Non-trivial contribution file in repository: <https://github.com/pasalino/TinyLanding/blob/master/CONTRIBUTING.md>.,?,,Met,Non-trivial license location file in repository: <https://github.com/pasalino/TinyLanding/blob/master/LICENSE.md>.,Met,The MIT license is approved by the Open Source Initiative (OSI).,Met,The MIT license is approved by the Open Source Initiative (OSI).,Met,// No appropriate folder found for documentation basics.,?,,Met,"Repository on GitHub, which provides public git repositories with URLs.",Met,"Repository on GitHub, which uses git. git can track the changes, who made them, and when they were made.",?,,Met,"Repository on GitHub, which uses git. git is distributed.",?,,?,,?,,Unmet,// No release notes file found.,?,,?,,?,,?,,?,,?,,?,,?,,?,,?,,?,,?,,?,,?,,?,,?,,?,,?,,?,,?,,?,,?,,?,,?,,?,,?,,?,,?,,?,,?,,?,,?,,?,,?,,?,,?,,?,,?,,?,,?,,?,,?,,?,,?,,,2018-04-29 21:06:39 UTC,2018-04-29 21:07:21 UTC,?,,?,,,Met,GitHub supports discussions on issues and pull requests.,?,,?,,?,,?,,?,,?,,?,,Unmet,// One or more of the required security hardening headers is missing.,?,,?,,18,,,2022-02-26 23:00:31 UTC,False,"JavaScript, Dockerfile (CII estimate)",21,0,?,,?,,?,,?,,?,,?,,?,,?,,?,,?,,?,,?,,?,,?,,?,,?,,?,,?,,?,,?,,?,,?,,?,,?,,?,,?,,?,,?,,?,,?,,?,,?,,?,,?,,?,,?,,?,,?,,?,,?,,4,?,,?,,?,,?,,?,,?,,?,,?,,?,,?,,?,,?,,Unmet,,Unmet,,18,,,,,,,,,Met,
20,1810,2395,prometheus-msteams,,https://github.com/bzon/prometheus-msteams,https://github.com/bzon/prometheus-msteams,MIT,?,,Met,Given only https: URLs.,?,,?,,Met,"Projects on GitHub by default use issues and pull requests, as encouraged by documentation such as <https://guides.github.com/activities/contributing-to-open-source/>.",?,,Met,Non-trivial license location file in repository: <https://github.com/bzon/prometheus-msteams/blob/master/LICENSE>.,Met,The MIT license is approved by the Open Source Initiative (OSI).,Met,The MIT license is approved by the Open Source Initiative (OSI).,Unmet,// No documentation basics file(s) found.,?,,Met,"Repository on GitHub, which provides public git repositories with URLs.",Met,"Repository on GitHub, which uses git. git can track the changes, who made them, and when they were made.",?,,Met,"Repository on GitHub, which uses git. git is distributed.",?,,?,,?,,Unmet,// No release notes file found.,?,,?,,?,,?,,?,,?,,?,,?,,?,,?,,Met,Non-trivial build file in repository: <https://github.com/bzon/prometheus-msteams/blob/master/Makefile>.,Met,Non-trivial build file in repository: <https://github.com/bzon/prometheus-msteams/blob/master/Makefile>.,?,,?,,?,,?,,?,,?,,?,,?,,?,,?,,?,,?,,?,,?,,?,,?,,?,,?,,?,,?,,?,,?,,?,,?,,?,,?,,?,,?,,?,,?,,?,,?,,,2018-04-30 05:09:00 UTC,2018-04-30 05:09:00 UTC,?,,?,,,Met,GitHub supports discussions on issues and pull requests.,?,,?,,?,,?,,?,,?,,?,,Met,Found all required security hardening headers.,?,,?,,18,,,2022-02-27 23:00:25 UTC,False,"Go, Makefile, Dockerfile (CII estimate)",20,0,?,,?,,?,,?,,?,,?,,?,,?,,?,,?,,?,,?,,?,,?,,?,,?,,?,,?,,?,,?,,?,,?,,?,,?,,?,,?,,?,,?,,?,,?,,?,,?,,?,,?,,?,,?,,?,,?,,?,,?,,4,?,,?,,?,,?,,?,,?,,?,,?,,?,,?,,?,,?,,Unmet,,Unmet,,18,,,,,,,,,Met,
