,id,user_id,name,description,homepage_url,repo_url,license,homepage_url_status,homepage_url_justification,sites_https_status,sites_https_justification,description_good_status,description_good_justification,interact_status,interact_justification,contribution_status,contribution_justification,contribution_requirements_status,contribution_requirements_justification,license_location_status,license_location_justification,floss_license_status,floss_license_justification,floss_license_osi_status,floss_license_osi_justification,documentation_basics_status,documentation_basics_justification,documentation_interface_status,documentation_interface_justification,repo_public_status,repo_public_justification,repo_track_status,repo_track_justification,repo_interim_status,repo_interim_justification,repo_distributed_status,repo_distributed_justification,version_unique_status,version_unique_justification,version_semver_status,version_semver_justification,version_tags_status,version_tags_justification,release_notes_status,release_notes_justification,release_notes_vulns_status,release_notes_vulns_justification,report_url_status,report_url_justification,report_tracker_status,report_tracker_justification,report_process_status,report_process_justification,report_responses_status,report_responses_justification,enhancement_responses_status,enhancement_responses_justification,report_archive_status,report_archive_justification,vulnerability_report_process_status,vulnerability_report_process_justification,vulnerability_report_private_status,vulnerability_report_private_justification,vulnerability_report_response_status,vulnerability_report_response_justification,build_status,build_justification,build_common_tools_status,build_common_tools_justification,build_floss_tools_status,build_floss_tools_justification,test_status,test_justification,test_invocation_status,test_invocation_justification,test_most_status,test_most_justification,test_policy_status,test_policy_justification,tests_are_added_status,tests_are_added_justification,tests_documented_added_status,tests_documented_added_justification,warnings_status,warnings_justification,warnings_fixed_status,warnings_fixed_justification,warnings_strict_status,warnings_strict_justification,know_secure_design_status,know_secure_design_justification,know_common_errors_status,know_common_errors_justification,crypto_published_status,crypto_published_justification,crypto_call_status,crypto_call_justification,crypto_floss_status,crypto_floss_justification,crypto_keylength_status,crypto_keylength_justification,crypto_working_status,crypto_working_justification,crypto_pfs_status,crypto_pfs_justification,crypto_password_storage_status,crypto_password_storage_justification,crypto_random_status,crypto_random_justification,delivery_mitm_status,delivery_mitm_justification,delivery_unsigned_status,delivery_unsigned_justification,vulnerabilities_fixed_60_days_status,vulnerabilities_fixed_60_days_justification,vulnerabilities_critical_fixed_status,vulnerabilities_critical_fixed_justification,static_analysis_status,static_analysis_justification,static_analysis_common_vulnerabilities_status,static_analysis_common_vulnerabilities_justification,static_analysis_fixed_status,static_analysis_fixed_justification,static_analysis_often_status,static_analysis_often_justification,dynamic_analysis_status,dynamic_analysis_justification,dynamic_analysis_unsafe_status,dynamic_analysis_unsafe_justification,dynamic_analysis_enable_assertions_status,dynamic_analysis_enable_assertions_justification,dynamic_analysis_fixed_status,dynamic_analysis_fixed_justification,general_comments,created_at,updated_at,crypto_weaknesses_status,crypto_weaknesses_justification,test_continuous_integration_status,test_continuous_integration_justification,cpe,discussion_status,discussion_justification,no_leaked_credentials_status,no_leaked_credentials_justification,english_status,english_justification,hardening_status,hardening_justification,crypto_used_network_status,crypto_used_network_justification,crypto_tls12_status,crypto_tls12_justification,crypto_certificate_verification_status,crypto_certificate_verification_justification,crypto_verification_private_status,crypto_verification_private_justification,hardened_site_status,hardened_site_justification,installation_common_status,installation_common_justification,build_reproducible_status,build_reproducible_justification,badge_percentage_0,achieved_passing_at,lost_passing_at,last_reminder_at,disabled_reminders,implementation_languages,lock_version,badge_percentage_1,dco_status,dco_justification,governance_status,governance_justification,code_of_conduct_status,code_of_conduct_justification,roles_responsibilities_status,roles_responsibilities_justification,access_continuity_status,access_continuity_justification,bus_factor_status,bus_factor_justification,documentation_roadmap_status,documentation_roadmap_justification,documentation_architecture_status,documentation_architecture_justification,documentation_security_status,documentation_security_justification,documentation_quick_start_status,documentation_quick_start_justification,documentation_current_status,documentation_current_justification,documentation_achievements_status,documentation_achievements_justification,accessibility_best_practices_status,accessibility_best_practices_justification,internationalization_status,internationalization_justification,sites_password_security_status,sites_password_security_justification,maintenance_or_update_status,maintenance_or_update_justification,vulnerability_report_credit_status,vulnerability_report_credit_justification,vulnerability_response_process_status,vulnerability_response_process_justification,coding_standards_status,coding_standards_justification,coding_standards_enforced_status,coding_standards_enforced_justification,build_standard_variables_status,build_standard_variables_justification,build_preserve_debug_status,build_preserve_debug_justification,build_non_recursive_status,build_non_recursive_justification,build_repeatable_status,build_repeatable_justification,installation_standard_variables_status,installation_standard_variables_justification,installation_development_quick_status,installation_development_quick_justification,external_dependencies_status,external_dependencies_justification,dependency_monitoring_status,dependency_monitoring_justification,updateable_reused_components_status,updateable_reused_components_justification,interfaces_current_status,interfaces_current_justification,automated_integration_testing_status,automated_integration_testing_justification,regression_tests_added50_status,regression_tests_added50_justification,test_statement_coverage80_status,test_statement_coverage80_justification,test_policy_mandated_status,test_policy_mandated_justification,implement_secure_design_status,implement_secure_design_justification,input_validation_status,input_validation_justification,crypto_algorithm_agility_status,crypto_algorithm_agility_justification,crypto_credential_agility_status,crypto_credential_agility_justification,signed_releases_status,signed_releases_justification,version_tags_signed_status,version_tags_signed_justification,badge_percentage_2,contributors_unassociated_status,contributors_unassociated_justification,copyright_per_file_status,copyright_per_file_justification,license_per_file_status,license_per_file_justification,small_tasks_status,small_tasks_justification,require_2FA_status,require_2FA_justification,secure_2FA_status,secure_2FA_justification,code_review_standards_status,code_review_standards_justification,two_person_review_status,two_person_review_justification,test_statement_coverage90_status,test_statement_coverage90_justification,test_branch_coverage80_status,test_branch_coverage80_justification,security_review_status,security_review_justification,assurance_case_status,assurance_case_justification,achieve_passing_status,achieve_passing_justification,achieve_silver_status,achieve_silver_justification,tiered_percentage,repo_url_updated_at,achieved_silver_at,lost_silver_at,achieved_gold_at,lost_gold_at,first_achieved_passing_at,first_achieved_silver_at,first_achieved_gold_at,maintained_status,maintained_justification
0,5025,11432,gamesense-client,Minecraft 1.12.2 Utility Mod for Anarchy and Crystal PvP,https://github.com/IUDevman/gamesense-client,https://github.com/IUDevman/gamesense-client,GPL-3.0,?,,Met,Given only https: URLs.,?,,?,,Met,"Projects on GitHub by default use issues and pull requests, as encouraged by documentation such as <https://guides.github.com/activities/contributing-to-open-source/>.",?,,Met,Non-trivial license location file in repository: <https://github.com/IUDevman/gamesense-client/blob/master/LICENSE>.,Met,The GPL-3.0 license is approved by the Open Source Initiative (OSI).,Met,The GPL-3.0 license is approved by the Open Source Initiative (OSI).,Unmet,// No appropriate folder found for documentation basics.,?,,Met,"Repository on GitHub, which provides public git repositories with URLs.",Met,"Repository on GitHub, which uses git. git can track the changes, who made them, and when they were made.",?,,Met,"Repository on GitHub, which uses git. git is distributed.",?,,?,,?,,Unmet,// No release notes file found.,?,,?,,?,,?,,?,,?,,?,,?,,?,,?,,?,,?,,?,,?,,?,,?,,?,,?,,?,,?,,?,,?,,?,,?,,?,,?,,?,,?,,?,,?,,?,,?,,?,,?,,?,,?,,?,,?,,?,,?,,?,,?,,?,,?,,,2021-07-06 01:37:17 UTC,2021-07-06 01:37:17 UTC,?,,?,,,Met,GitHub supports discussions on issues and pull requests.,?,,?,,?,,?,,?,,?,,?,,Met,Found all required security hardening headers.,?,,?,,15,,,2022-03-12 23:00:31 UTC,False,Java,3,0,?,,?,,?,,?,,?,,?,,?,,?,,?,,?,,?,,?,,?,,?,,?,,?,,?,,?,,?,,?,,?,,?,,?,,?,,?,,?,,?,,?,,?,,?,,?,,?,,?,,?,,?,,?,,?,,?,,?,,?,,4,?,,?,,?,,?,,?,,?,,?,,?,,?,,?,,?,,?,,Unmet,,Unmet,,15,,,,,,,,,Met,
1,5026,11479,GaNDLF,"A generalizable application framework for segmentation, regression, and classification using PyTorch",https://github.com/CBICA/GaNDLF,https://github.com/CBICA/GaNDLF,OTHER,?,,Met,Given only https: URLs.,Met,,Met,,Met,Non-trivial contribution file in repository: <https://github.com/CBICA/GaNDLF/blob/master/CONTRIBUTING.md>.,Met,https://github.com/CBICA/GaNDLF/blob/master/CONTRIBUTING.md,Met,Non-trivial license location file in repository: <https://github.com/CBICA/GaNDLF/blob/master/LICENSE>.,Met,,Unmet,"BSD-style open source license, with added clause that the software is NOT FDA approved or CE marked.",Met,Some documentation basics file contents found.,Met,,Met,"Repository on GitHub, which provides public git repositories with URLs.",Met,"Repository on GitHub, which uses git. git can track the changes, who made them, and when they were made.",Met,,Met,"Repository on GitHub, which uses git. git is distributed.",Met,,Met,,Met,,Met,https://github.com/CBICA/GaNDLF/blob/master/HISTORY.md,Met,,?,,Met,,Met,https://github.com/CBICA/GaNDLF/issues/new?assignees=&labels=&template=---bug-report.md&title=,Met,,Met,,Met,https://github.com/CBICA/GaNDLF/issues?q=is%3Aissue+is%3Aclosed,Met,https://github.com/CBICA/GaNDLF/issues/new?assignees=&labels=&template=---bug-report.md&title=,Met,https://github.com/CBICA/GaNDLF/security/policy,Met,,Met,,Met,,Met,,Met,,Met,,Met,,Met,,Met,,Met,,Met,,Met,,Met,,Met,,Met,,Met,,Met,,Met,,Met,,Met,,Met,,Met,,Met,,Met,,Met,,Met,,Met,,Met,Codacy,Met,,Met,,Met,,Met,,Met,,Met,,Met,,,2021-07-06 15:25:52 UTC,2021-12-18 00:14:26 UTC,Met,,Met,,,Met,GitHub supports discussions on issues and pull requests.,Met,,Met,,?,,?,,?,,?,,?,,Met,Found all required security hardening headers.,?,,?,,100,2021-12-18 00:14:26 UTC,,2021-12-17 23:00:45 UTC,False,Python,10,4,?,,?,,?,,?,,?,,?,,?,,?,,?,,?,,?,,?,,?,,?,,?,,?,,?,,?,,?,,?,,?,,?,,?,,?,,?,,?,,?,,?,,?,,?,,?,,?,,?,,?,,?,,?,,?,,?,,?,,?,,4,?,,?,,?,,?,,?,,?,,?,,?,,?,,?,,?,,?,,Met,,Unmet,,104,,,,,,2021-12-18 00:14:26 UTC,,,Met,
2,5027,11602,pixie,"Pixie is an open source observability tool for Kubernetes applications. Using Pixie, developers can view the high-level state of their cluster (service maps, cluster resources, application traffic) and also drill-down into more detailed views (pod state, flame graphs, individual application requests). Pixie uses eBPF to automatically capture its telemetry data without the need for manual instrumentation. ",https://px.dev,https://github.com/pixie-io/pixie,Apache-2.0,?,,Met,Given only https: URLs.,Met,https://docs.px.dev/about-pixie/what-is-pixie/,Met,https://github.com/pixie-io/pixie/blob/main/CONTRIBUTING.md,Met,Non-trivial contribution file in repository: <https://github.com/pixie-io/pixie/blob/main/CONTRIBUTING.md>.,Met,https://github.com/pixie-io/pixie/blob/main/CONTRIBUTING.md Asks users to refer to our style guide (https://github.com/pixie-io/pixie/tree/main/styleguide),Met,Non-trivial license location file in repository: <https://github.com/pixie-io/pixie/blob/main/LICENSE>.,Met,The Apache-2.0 license is approved by the Open Source Initiative (OSI).,Met,The Apache-2.0 license is approved by the Open Source Initiative (OSI).,Met,https://docs.px.dev/,Met,API docs: https://docs.px.dev/reference/api/overview/,Met,"Repository on GitHub, which provides public git repositories with URLs.",Met,"Repository on GitHub, which uses git. git can track the changes, who made them, and when they were made.",Met,Every change is committed into source control and periodically releases are cut and tagged.,Met,"Repository on GitHub, which uses git. git is distributed.",Met,,Met,,Met,Tags are used for all releases. For example: https://github.com/pixie-io/pixie/tree/release/vizier/v0.10.21.,Met,Release notes are in annotated git tags. https://github.com/pixie-io/pixie/releases.,,There have been no publicly known vulnerabilities.,?,,Met,https://github.com/pixie-io/pixie/issues,Met,https://github.com/pixie-io/pixie/issues,Met,,Met,,Met,https://github.com/pixie-io/pixie/issues,Met,https://github.com/pixie-io/pixie/blob/main/SECURITY.md,Met,https://github.com/pixie-io/pixie/blob/main/SECURITY.md,Met,,Met,We use a Bagel build system. See example BUILD file at https://github.com/pixie-io/pixie/blob/main/BUILD.bazel,Met,Built with Bazel https://github.com/bazelbuild/bazel,Met,Built with Bazel https://github.com/bazelbuild/bazel,Met,Tests are included and can be run with `bazel test`,Met,`bazel test //...` runs all tests in the project.,Met,,Met,"https://github.com/pixie-io/pixie/blob/main/CONTRIBUTING.md
Requires that a test must be added for the bug/feature in question.",Met,,Met,"Test are required part of changes, though exemptions are allowed under certain circumstances. Code coverage is tracked.",Met,Lint rules are defined in https://github.com/pixie-io/pixie/blob/main/.arclint and https://github.com/pixie-io/pixie/blob/main/.yamllint,Met,,Met,We try to always address warnings. Any exceptions are noted with comments for why the exception is necessary.,Met,,Met,,Met,,Met,,Met,,Met,,Met,,Met,,Met,We don't store usernames and passwords ourselves. We use OAuth with Auth0 or Ory's Hydra+Kratos for use management.,Met,"""crypto/rand"" in Golang",Met,,Met,,Met,,Met,,Met,"cpplint, aslant, flake8, golangci-lint, golint, govet, jshint, shellcheck",Met,We use `snyk` and `yarn audit` to look for common vulnerabilities.,Met,,Met,Run on every commit via Jenkins CI,Met,"asan, tsan, msan",Met,"asan, msan",Met,We use the go race detector https://blog.golang.org/race-detector and ASAN/TSAN,Met,,,2021-07-07 00:57:35 UTC,2022-04-21 03:55:05 UTC,Met,,Met,We use Jenkins CI to run tests on every PR and every commit to the main branch.,,Met,GitHub supports discussions on issues and pull requests.,Met,,Met,https://docs.px.dev/,?,,?,,?,,?,,?,,Unmet,"// X-Content-Type-Options was not set to ""nosniff"".",?,,?,,100,2022-04-21 03:55:05 UTC,,2022-02-25 23:00:28 UTC,False,"C++, Go, TypeScript, Starlark, JavaScript, Python, C, Shell, PHP, Ruby, Makefile, Dockerfile, Java, PLpgSQL, HCL",24,13,?,,?,,?,,?,,?,,?,,?,,?,,?,,?,,?,,?,,?,,?,,?,,?,,?,,?,,?,,?,,?,,?,,?,,?,,?,,?,,?,,?,,?,,?,,?,,?,,?,,?,,?,,?,,?,,?,,?,,?,,13,?,,?,,?,,?,,?,,?,,?,,?,,?,,?,,?,,?,,Met,,Unmet,,113,2021-09-09 22:14:33 UTC,,,,,2022-04-21 03:55:05 UTC,,,Met,
3,5028,11623,toca,Toca,https://github.com/acafons/toca,https://github.com/acafons/toca,BSD-2-Clause,?,,Met,Given only https: URLs.,?,,?,,Met,"Projects on GitHub by default use issues and pull requests, as encouraged by documentation such as <https://guides.github.com/activities/contributing-to-open-source/>.",?,,Met,Non-trivial license location file in repository: <https://github.com/acafons/toca/blob/master/LICENSE>.,Met,The BSD-2-Clause license is approved by the Open Source Initiative (OSI).,Met,The BSD-2-Clause license is approved by the Open Source Initiative (OSI).,Unmet,// No appropriate folder found for documentation basics.,?,,Met,"Repository on GitHub, which provides public git repositories with URLs.",Met,"Repository on GitHub, which uses git. git can track the changes, who made them, and when they were made.",?,,Met,"Repository on GitHub, which uses git. git is distributed.",?,,?,,?,,Unmet,// No release notes file found.,?,,?,,?,,?,,?,,?,,?,,?,,?,,?,,?,,?,,?,,?,,?,,?,,?,,?,,?,,?,,?,,?,,?,,?,,?,,?,,?,,?,,?,,?,,?,,?,,?,,?,,?,,?,,?,,?,,?,,?,,?,,?,,?,,?,,,2021-07-07 12:15:31 UTC,2021-07-07 12:17:52 UTC,?,,?,,,Met,GitHub supports discussions on issues and pull requests.,?,,?,,?,,?,,?,,?,,?,,Met,Found all required security hardening headers.,?,,?,,15,,,2022-03-13 23:00:21 UTC,False,"C, Meson, Shell",4,0,?,,?,,?,,?,,?,,?,,?,,?,,?,,?,,?,,?,,?,,?,,?,,?,,?,,?,,?,,?,,?,,?,,?,,?,,?,,?,,?,,?,,?,,?,,?,,?,,?,,?,,?,,?,,?,,?,,?,,?,,4,?,,?,,?,,?,,?,,?,,?,,?,,?,,?,,?,,?,,Unmet,,Unmet,,15,,,,,,,,,Met,
4,5029,3019,matro,Matro is a code generator,https://github.com/firstcontributions/matro,https://github.com/firstcontributions/matro,MIT,?,,Met,Given only https: URLs.,?,,?,,Met,"Projects on GitHub by default use issues and pull requests, as encouraged by documentation such as <https://guides.github.com/activities/contributing-to-open-source/>.",?,,Met,Non-trivial license location file in repository: <https://github.com/firstcontributions/matro/blob/main/LICENSE>.,Met,The MIT license is approved by the Open Source Initiative (OSI).,Met,The MIT license is approved by the Open Source Initiative (OSI).,Unmet,// No appropriate folder found for documentation basics.,?,,Met,"Repository on GitHub, which provides public git repositories with URLs.",Met,"Repository on GitHub, which uses git. git can track the changes, who made them, and when they were made.",?,,Met,"Repository on GitHub, which uses git. git is distributed.",?,,?,,?,,Unmet,// No release notes file found.,?,,?,,?,,?,,?,,?,,?,,?,,?,,?,,Met,Non-trivial build file in repository: <https://github.com/firstcontributions/matro/blob/main/Makefile>.,Met,Non-trivial build file in repository: <https://github.com/firstcontributions/matro/blob/main/Makefile>.,?,,?,,?,,?,,?,,?,,?,,?,,?,,?,,?,,?,,?,,?,,?,,?,,?,,?,,?,,?,,?,,?,,?,,?,,?,,?,,?,,?,,?,,?,,?,,?,,,2021-07-07 15:13:00 UTC,2021-07-07 15:13:00 UTC,?,,?,,,Met,GitHub supports discussions on issues and pull requests.,?,,?,,?,,?,,?,,?,,?,,Met,Found all required security hardening headers.,?,,?,,18,,,2022-03-13 23:00:21 UTC,False,"Go, Makefile",3,0,?,,?,,?,,?,,?,,?,,?,,?,,?,,?,,?,,?,,?,,?,,?,,?,,?,,?,,?,,?,,?,,?,,?,,?,,?,,?,,?,,?,,?,,?,,?,,?,,?,,?,,?,,?,,?,,?,,?,,?,,4,?,,?,,?,,?,,?,,?,,?,,?,,?,,?,,?,,?,,Unmet,,Unmet,,18,,,,,,,,,Met,
5,5030,11625,FastAPI-project-pattern,Project pattern for using FastAPI,https://fastapi.project.pattern.saleta.fun/redoc,https://github.com/Sang2306/FastAPI-project-pattern,GPL-3.0,?,,Met,Given only https: URLs.,?,,?,,Met,"Projects on GitHub by default use issues and pull requests, as encouraged by documentation such as <https://guides.github.com/activities/contributing-to-open-source/>.",?,,Met,Non-trivial license location file in repository: <https://github.com/Sang2306/FastAPI-project-pattern/blob/main/LICENSE>.,Met,The GPL-3.0 license is approved by the Open Source Initiative (OSI).,Met,The GPL-3.0 license is approved by the Open Source Initiative (OSI).,Unmet,// No appropriate folder found for documentation basics.,?,,Met,"Repository on GitHub, which provides public git repositories with URLs.",Met,"Repository on GitHub, which uses git. git can track the changes, who made them, and when they were made.",?,,Met,"Repository on GitHub, which uses git. git is distributed.",?,,?,,?,,Unmet,// No release notes file found.,?,,?,,?,,?,,?,,?,,?,,?,,?,,?,,?,,?,,?,,?,,?,,?,,?,,?,,?,,?,,?,,?,,?,,?,,?,,?,,?,,?,,?,,?,,?,,?,,?,,?,,?,,?,,?,,?,,?,,?,,?,,?,,?,,?,,,2021-07-07 16:43:42 UTC,2021-07-07 16:43:42 UTC,?,,?,,,Met,GitHub supports discussions on issues and pull requests.,?,,?,,?,,?,,?,,?,,?,,Unmet,"// X-Content-Type-Options was not set to ""nosniff"".",?,,?,,15,,,2022-03-13 23:00:21 UTC,False,"Python, Shell, Dockerfile",3,0,?,,?,,?,,?,,?,,?,,?,,?,,?,,?,,?,,?,,?,,?,,?,,?,,?,,?,,?,,?,,?,,?,,?,,?,,?,,?,,?,,?,,?,,?,,?,,?,,?,,?,,?,,?,,?,,?,,?,,?,,4,?,,?,,?,,?,,?,,?,,?,,?,,?,,?,,?,,?,,Unmet,,Unmet,,15,,,,,,,,,Met,
6,5031,11626,oso,Oso is a batteries-included library for building authorization in your application.,https://docs.osohq.com,https://github.com/osohq/oso,Apache-2.0,?,,Met,Given only https: URLs.,Met,,Met,,Met,Non-trivial contribution file in repository: <https://github.com/osohq/oso/blob/main/CONTRIBUTING.md>.,?,,Met,Non-trivial license location file in repository: <https://github.com/osohq/oso/blob/main/LICENSE>.,Met,The Apache-2.0 license is approved by the Open Source Initiative (OSI).,Met,The Apache-2.0 license is approved by the Open Source Initiative (OSI).,Met,Some documentation basics file contents found.,Met,,Met,"Repository on GitHub, which provides public git repositories with URLs.",Met,"Repository on GitHub, which uses git. git can track the changes, who made them, and when they were made.",Met,,Met,"Repository on GitHub, which uses git. git is distributed.",Met,,Met,,Met,,Met,https://docs.osohq.com/project/changelogs.html,Met,,?,,?,,?,,?,,?,,?,,?,,?,,?,,Met,Non-trivial build file in repository: <https://github.com/osohq/oso/blob/main/Makefile>.,Met,Non-trivial build file in repository: <https://github.com/osohq/oso/blob/main/Makefile>.,?,,?,,?,,?,,?,,?,,?,,?,,?,,?,,?,,?,,?,,?,,?,,?,,?,,?,,?,,?,,?,,?,,?,,?,,?,,?,,?,,?,,?,,?,,?,,?,,,2021-07-08 02:16:44 UTC,2021-07-08 02:19:04 UTC,?,,?,,,Met,GitHub supports discussions on issues and pull requests.,?,,Met,,?,,?,,?,,?,,?,,Unmet,"// X-Content-Type-Options was not set to ""nosniff"".",?,,?,,34,,,2022-03-14 23:00:24 UTC,False,"Rust, Python, Go, TypeScript, Java, Ruby, Makefile, C, JavaScript, Shell",5,0,?,,?,,?,,?,,?,,?,,?,,?,,?,,?,,?,,?,,?,,?,,?,,?,,?,,?,,?,,?,,?,,?,,?,,?,,?,,?,,?,,?,,?,,?,,?,,?,,?,,?,,?,,?,,?,,?,,?,,?,,4,?,,?,,?,,?,,?,,?,,?,,?,,?,,?,,?,,?,,Unmet,,Unmet,,34,,,,,,,,,Met,
7,5032,11627,chaosblade,An easy to use and powerful chaos engineering experiment toolkit.（阿里巴巴开源的一款简单易用、功能强大的混沌实验注入工具）,https://github.com/chaosblade-io/chaosblade,https://github.com/chaosblade-io/chaosblade,Apache-2.0,?,,Met,Given only https: URLs.,Met,https://chaosblade.io/,Met,https://github.com/chaosblade-io/chaosblade#bugs-and-feedback,Met,https://github.com/chaosblade-io/chaosblade/blob/master/CONTRIBUTING.md,Met,https://github.com/chaosblade-io/chaosblade/blob/master/CODE_OF_CONDUCT.md,Met,Non-trivial license location file in repository: <https://github.com/chaosblade-io/chaosblade/blob/master/LICENSE>.,Met,The Apache-2.0 license is approved by the Open Source Initiative (OSI).,Met,The Apache-2.0 license is approved by the Open Source Initiative (OSI).,Met,Some documentation basics file contents found.,Met,https://chaosblade-io.gitbook.io/chaosblade-help-zh-cn/,Met,"Repository on GitHub, which provides public git repositories with URLs.",Met,"Repository on GitHub, which uses git. git can track the changes, who made them, and when they were made.",Met,,Met,"Repository on GitHub, which uses git. git is distributed.",Met,,Met,,Met,,Met,https://github.com/chaosblade-io/chaosblade/releases/,?,,?,,Met,,Met,https://github.com/chaosblade-io/chaosblade/issues,Met,,Met,,Met,https://github.com/chaosblade-io/chaosblade/issues,?,,?,,?,,Met,Non-trivial build file in repository: <https://github.com/chaosblade-io/chaosblade/blob/master/Makefile>.,Met,Non-trivial build file in repository: <https://github.com/chaosblade-io/chaosblade/blob/master/Makefile>.,Met,,Met,,Met,,Met,,?,,?,,?,,?,,?,,?,,Met,,Met,,Met,,Met,,Met,,Met,,Met,,Met,,Met,,Met,,?,,?,,Met,,Met,,?,,?,,?,,?,,?,,?,,?,,?,,,2021-07-08 03:16:04 UTC,2021-07-08 03:31:30 UTC,Met,,Met,,,Met,GitHub supports discussions on issues and pull requests.,Met,,?,,?,,?,,?,,?,,?,,Met,Found all required security hardening headers.,?,,?,,69,,,2022-03-14 23:00:24 UTC,False,"Go, Makefile, Dockerfile",8,2,?,,?,,?,,?,,?,,?,,?,,?,,?,,?,,?,,?,,?,,?,,?,,?,,?,,?,,?,,?,,?,,?,,?,,?,,?,,?,,?,,?,,?,,?,,?,,?,,?,,?,,?,,?,,?,,?,,?,,?,,4,?,,?,,?,,?,,?,,?,,?,,?,,?,,?,,?,,?,,Unmet,,Unmet,,69,,,,,,,,,Met,
