5,535,341,SaltyRTC Java implementation.,This is a SaltyRTC v1 implementation for Java 7+.,http://saltyrtc.org,https://github.com/saltyrtc/saltyrtc-client-java,(Apache-2.0 OR MIT),?,,Unmet,"https://saltyrtc.org/
https://github.com/saltyrtc/saltyrtc-client-java Given an http: URL.",Met,http://saltyrtc.org/,Met,https://saltyrtc.org/,Met,"Projects on GitHub by default use issues and pull requests, as encouraged by documentation such as <https://guides.github.com/activities/contributing-to-open-source/>.",Met,https://github.com/saltyrtc/saltyrtc-client-java/blob/master/CONTRIBUTING.md,Met,"https://github.com/saltyrtc/saltyrtc-client-java/blob/master/LICENSE-APACHE
https://github.com/saltyrtc/saltyrtc-client-java/blob/master/LICENSE-MIT",Met,Both the Apache-2.0 license as well as the MIT license are approved by the Open Source Initiative (OSI).,Met,Both the Apache-2.0 license as well as the MIT license areapproved by the Open Source Initiative (OSI).,Met,https://saltyrtc.github.io/saltyrtc-client-java/,Unmet,"No API docs so far, but usage docs here: https://saltyrtc.github.io/saltyrtc-client-java/usage/",Met,"Repository on GitHub, which provides public git repositories with URLs.",Met,"Repository on GitHub, which uses git. git can track the changes, who made them, and when they were made.",Met,All development happens directly on Github.,Met,"Repository on GitHub, which uses git. git is distributed.",Met,The project uses semantic versioning: https://github.com/saltyrtc/saltyrtc-client-java/blob/master/CHANGELOG.md,Met,,Met,GPG signed git tags,Met,Non-trivial release notes file in repository: https://github.com/saltyrtc/saltyrtc-client-java/blob/master/CHANGELOG.md.,Met,,?,,Met,https://github.com/saltyrtc/saltyrtc-client-java/issues,Met,https://github.com/saltyrtc/saltyrtc-client-java/issues,Met,,Met,,Met,https://github.com/saltyrtc/saltyrtc-client-java/issues,Met,"https://saltyrtc.org/pages/security.html
https://github.com/saltyrtc/saltyrtc-client-java/blob/master/README.md#responsible-disclosure--reporting-security-issues",Met,"Can be submitted via GPG or Threema.

https://saltyrtc.org/pages/security.html
https://github.com/saltyrtc/saltyrtc-client-java/blob/master/README.md#responsible-disclosure--reporting-security-issues",Met,No vulnerability reports so far.,Met,Gradle,Met,Gradle,Met,Gradle and OpenJDK,Met,"https://github.com/saltyrtc/saltyrtc-client-java/tree/master/src/test/java/org/saltyrtc/client/tests
https://travis-ci.org/saltyrtc/saltyrtc-client-java",Met,gradle test,?,,Met,The CONTRIBUTING.md file requests that new code is covered by tests.,?,,Met,The CONTRIBUTING.md file requests that new code is covered by tests.,?,,?,,?,,Met,,Met,,Met,We rely on libsodium.,Met,We rely on libsodium.,Met,We rely on libsodium.,?,,Met,,Met,The protocol creates a new session key for every session.,,No passwords are stored.,Met,"The project relies on cryptographically secure random number generators in the following cases:

- src/main/java/org/saltyrtc/client/nonce/CombinedSequence.java: java.security.SecureRandom
- src/main/java/org/saltyrtc/client/helpers/RandomHelper.java: java.security.SecureRandom
- src/main/java/org/saltyrtc/client/cookie/Cookie.java: java.security.SecureRandom
- src/main/java/org/saltyrtc/client/keystore/AuthToken.java: java.security.SecureRandom

Only tests use pseudo random number generators.",Met,"- Distribution via Bintray / jcenter which uses https
- Git tags are signed with GPG
- Hashes of distribution files are generated on developer's computer and listed in the README file",Met,,Met,None so far.,Met,None so far.,?,,?,,?,,?,,?,,,,?,,?,,,2016-12-05 12:43:31 UTC,2017-05-22 09:03:47 UTC,Met,,Met,https://travis-ci.org/saltyrtc/saltyrtc-client-java,,Met,GitHub supports discussions on issues and pull requests.,Met,,Met,https://saltyrtc.github.io/saltyrtc-client-java/,?,,Met,,Met,"The user needs to pass in an SSLContext, which can be configured to support TLS 1.2. The demo application and the docs show appropriate configuration.",Met,nv-websocket-client is doing hostname verification: https://github.com/TakahikoKawasaki/nv-websocket-client/pull/107,?,,Unmet,"X-Content-Type-Options was not set to ""nosniff"".",Met,Library can be installed via JCenter (Bintray).,Unmet,,78,,,2022-04-04 23:00:46 UTC,False,Java,35,11,?,,?,,?,,?,,?,,?,,?,,?,,?,,?,,?,,?,,?,,?,,?,,?,,?,,?,,?,,?,,?,,?,,?,,?,,?,,?,,?,,?,,?,,?,,?,,?,,?,,?,,?,,?,,?,,?,,?,,?,,13,?,,?,,?,,?,,?,,?,,?,,?,,?,,?,,?,,?,,Unmet,,Unmet,,78,,,,,,,,,Met,
6,536,341,SaltyRTC JavaScript implementation.,This is a SaltyRTC v1 implementation for JavaScript (ES5) written in TypeScript 2.0+.,http://saltyrtc.org,https://github.com/saltyrtc/saltyrtc-client-js,MIT,?,,Unmet,// Given an http: URL.,Met,,Met,https://saltyrtc.org/,Met,"Projects on GitHub by default use issues and pull requests, as encouraged by documentation such as <https://guides.github.com/activities/contributing-to-open-source/>.",Met,https://github.com/saltyrtc/saltyrtc-client-js/blob/master/CONTRIBUTING.md,Met,Non-trivial license location file in repository: <https://github.com/saltyrtc/saltyrtc-client-js/blob/master/LICENSE.md>.,Met,The MIT license is approved by the Open Source Initiative (OSI).,Met,The MIT license is approved by the Open Source Initiative (OSI).,Met,https://saltyrtc.github.io/saltyrtc-client-js/docs/,Met,"https://saltyrtc.github.io/saltyrtc-client-js/docs/
https://saltyrtc.github.io/saltyrtc-client-js/apidocs/",Met,"Repository on GitHub, which provides public git repositories with URLs.",Met,"Repository on GitHub, which uses git. git can track the changes, who made them, and when they were made.",Met,All development happens directly on Github.,Met,"Repository on GitHub, which uses git. git is distributed.",Met,The project uses semantic versioning: https://github.com/saltyrtc/saltyrtc-client-js/blob/master/CHANGELOG.md,Met,,Met,GPG signed git tags,Met,Non-trivial release notes file in repository: <https://github.com/saltyrtc/saltyrtc-client-js/blob/master/CHANGELOG.md>.,Met,,?,,Met,https://github.com/saltyrtc/saltyrtc-client-js/issues,Met,https://github.com/saltyrtc/saltyrtc-client-js/issues,Met,,Met,,Met,https://github.com/saltyrtc/saltyrtc-client-js/issues,Met,"https://saltyrtc.org/pages/security.html
https://github.com/saltyrtc/saltyrtc-client-js/blob/master/README.md#responsible-disclosure--reporting-security-issues",Met,"Can be submitted via GPG or Threema.

https://saltyrtc.org/pages/security.html
https://github.com/saltyrtc/saltyrtc-client-js/blob/master/README.md#responsible-disclosure--reporting-security-issues",Met,No vulnerability reports so far.,Met,npm build task,Met,"npm, typescript",Met,"npm, typescript",Met,"https://github.com/saltyrtc/saltyrtc-client-js/tree/master/tests
https://circleci.com/gh/saltyrtc/saltyrtc-client-js",Met,npm test,?,,Met,The CONTRIBUTING.md file requests that new code is covered by tests.,?,,Met,The CONTRIBUTING.md file requests that new code is covered by tests.,Met,tslint,Met,All code must pass tslint checks,Met,All code must pass tslint checks,Met,,Met,,Met,We rely on tweetnacl.js.,Met,We rely on tweetnacl.js.,Met,We rely on tweetnacl.js which implements NaCl.,?,,Met,,Met,The protocol creates a new session key for every session.,Met,No passwords are stored.,Met,"The project relies on cryptographically secure random number generators in the following cases:

- src/csn.ts: Web Crypto API
- src/utils.ts: Web Crypto API
- src/keystore.ts: nacl.randomBytes (which uses Web Crypto API)
- src/cookie.ts: nacl.randomBytes (which uses Web Crypto API)

Only tests use pseudo random number generators. This includes the randomString function in `src/utils.ts`.",Met,"- Distribution via npm.js which uses https
- Git tags are signed with GPG",Met,,Met,None so far.,Met,None so far.,Met,tslint,Unmet,"To my knowledge, tslint does not currently do this.",Met,Pushes to master not allowed without passing tslint checks.,Met,"Integrated into CI, tslint checked for every commit",Unmet,,,,?,,,No dynamic code analysis being done currently.,,2016-12-05 14:23:11 UTC,2018-03-07 17:04:53 UTC,Met,,Met,https://circleci.com/gh/saltyrtc/saltyrtc-client-js,,Met,GitHub supports discussions on issues and pull requests.,Met,,Met,https://saltyrtc.github.io/saltyrtc-client-js/docs/,?,,Met,,Met,SaltyRTC uses WebSockets over TLS which is provided by the browser.,Met,,?,,Unmet,"X-Content-Type-Options was not set to ""nosniff"". // X-Content-Type-Options was not set to ""nosniff"".",Met,Library can be installed via npm.,Unmet,,93,,,2022-04-04 23:00:47 UTC,False,"Typescript, Javascript",39,11,?,,?,,?,,?,,?,,?,,?,,?,,?,,?,,?,,?,,?,,?,,?,,?,,?,,?,,?,,?,,?,,?,,?,,?,,?,,?,,?,,?,,?,,?,,?,,?,,?,,?,,?,,?,,?,,?,,?,,?,,13,?,,?,,?,,?,,?,,?,,?,,?,,?,,?,,?,,?,,Unmet,,Unmet,,93,,,,,,,,,Met,
7,537,766,ahier/still,collaboration with distinct differentiation,https://github.com/ahier/laurenstill.github.io,https://github.com/ahier/laurenstill.github.io,,?,,Met,Given only https: URLs.,?,,?,,Met,"Projects on GitHub by default use issues and pull requests, as encouraged by documentation such as <https://guides.github.com/activities/contributing-to-open-source/>.",?,,Unmet,No license location file found.,?,,?,,?,,?,,Met,"Repository on GitHub, which provides public git repositories with URLs.",Met,"Repository on GitHub, which uses git. git can track the changes, who made them, and when they were made.",?,,Met,"Repository on GitHub, which uses git. git is distributed.",?,,?,,?,,Unmet,No release notes file found.,?,,?,,?,,?,,?,,?,,?,,?,,?,,?,,?,,?,,?,,?,,?,,?,,?,,?,,?,,?,,?,,?,,?,,?,,?,,?,,?,,?,,?,,?,,?,,?,,?,,?,,?,,?,,?,,?,,?,,?,,?,,?,,?,,?,,,2016-12-05 16:31:20 UTC,2016-12-05 16:33:11 UTC,?,,?,,,Met,GitHub supports discussions on issues and pull requests.,?,,?,,?,,?,,?,,?,,?,,Met,Found all required security hardening headers.,?,,?,,10,,,2022-04-04 23:00:47 UTC,False,JavaScript (CII estimate),29,0,?,,?,,?,,?,,?,,?,,?,,?,,?,,?,,?,,?,,?,,?,,?,,?,,?,,?,,?,,?,,?,,?,,?,,?,,?,,?,,?,,?,,?,,?,,?,,?,,?,,?,,?,,?,,?,,?,,?,,?,,4,?,,?,,?,,?,,?,,?,,?,,?,,?,,?,,?,,?,,Unmet,,Unmet,,10,,,,,,,,,Met,
8,538,768,SOTA Reference Implementation project - Server,"SOTA is a complete suite for uploading, managing, queueing, transmitting, validating, and deploying software updates remotely to a fleet of vehicles. It includes both a server and a client component, integrated with the rest of the GENIVI system. Its based on open standards, and designed from the ground up to be fast, secure, stable, and scalable. Its also pluggable: SOTA can integrate with existing logistics and fleet management software as part of a total security solution.",https://advancedtelematic.github.io/rvi_sota_server,https://github.com/advancedtelematic/rvi_sota_server,MPL-2.0,?,,Met,Given only https: URLs.,Met,,Met,https://advancedtelematic.github.io/rvi_sota_server/dev/contributing.html,Met,Non-trivial contribution file in repository: <https://github.com/advancedtelematic/rvi_sota_server/blob/master/CONTRIBUTING.md>.,Unmet,,Met,Non-trivial license location file in repository: <https://github.com/advancedtelematic/rvi_sota_server/blob/master/COPYING>.,Met,The MPL-2.0 license is approved by the Open Source Initiative (OSI).,Met,The MPL-2.0 license is approved by the Open Source Initiative (OSI).,Met,https://genivi.github.io/rvi_sota_server/,Met,"https://genivi.github.io/rvi_sota_server/dev/architecture.html
https://genivi.github.io/rvi_sota_server/dev/api.html",Met,"Repository on GitHub, which provides public git repositories with URLs.",Met,"Repository on GitHub, which uses git. git can track the changes, who made them, and when they were made.",?,,Met,"Repository on GitHub, which uses git. git is distributed.",?,,?,,?,,Unmet,No release notes file found.,?,,?,,?,,?,,?,,?,,?,,?,,?,,?,,Met,"Complete build instructions here: https://advancedtelematic.github.io/rvi_sota_server/doc/building-installing.html
Project builds in Travis CI: https://travis-ci.org/advancedtelematic/rvi_sota_server",Met,Project builds using SBT,Met,,Met,https://github.com/advancedtelematic/rvi_sota_server/blob/master/README.md describes how to run test suite.,Met,Tests run using `sbt test`,?,,?,,?,,?,,Met,Project uses ScalaCheck as part of build process,?,,?,,?,,?,,Met,,Met,,Met,,?,,Met,,?,,Met,,?,,Met,,?,,Met,,Met,,?,,?,,?,,?,,?,,?,,?,,?,,,2016-12-06 11:56:55 UTC,2016-12-06 12:11:41 UTC,?,,Met,Building on Travis: https://travis-ci.org/advancedtelematic/rvi_sota_server,,Met,GitHub supports discussions on issues and pull requests.,Met,,Met,,?,,?,,?,,?,,?,,Met,Found all required security hardening headers.,?,,?,,46,,,2022-04-06 23:00:43 UTC,False,"Scala, JavaScript, Shell (CII estimate)",30,0,?,,?,,?,,?,,?,,?,,?,,?,,?,,?,,?,,?,,?,,?,,?,,?,,?,,?,,?,,?,,?,,?,,?,,?,,?,,?,,?,,?,,?,,?,,?,,?,,?,,?,,?,,?,,?,,?,,?,,?,,9,?,,?,,?,,?,,?,,?,,?,,?,,?,,?,,?,,?,,Unmet,,Unmet,,46,,,,,,,,,Met,
9,539,768,C++ Implementation of SOTA Client,This is an implementation of an OTA download client to the RVI SOTA Server ( https://github.com/advancedtelematic/rvi_sota_server ),https://github.com/advancedtelematic/sota_client_cpp,https://github.com/advancedtelematic/sota_client_cpp,MPL-2.0,?,,Met,Given only https: URLs.,Met,,Met,,Met,Non-trivial contribution file in repository: <https://github.com/advancedtelematic/sota_client_cpp/blob/master/CONTRIBUTING.md>.,Met,"Coding guidelines are described in CONTRIBUTING.md
https://github.com/advancedtelematic/sota_client_cpp/blob/master/CONTRIBUTING.md",Met,Non-trivial license location file in repository: <https://github.com/advancedtelematic/sota_client_cpp/blob/master/LICENSE>.,Met,The MPL-2.0 license is approved by the Open Source Initiative (OSI).,Met,The MPL-2.0 license is approved by the Open Source Initiative (OSI).,Met,,Met,,Met,"Repository on GitHub, which provides public git repositories with URLs.",Met,"Repository on GitHub, which uses git. git can track the changes, who made them, and when they were made.",?,,Met,"Repository on GitHub, which uses git. git is distributed.",?,,?,,?,,Unmet,No release notes file found.,?,,?,,Met,https://github.com/advancedtelematic/sota_client_cpp/issues,Met,Bugs to be submitted using Github issues: https://github.com/advancedtelematic/sota_client_cpp/issues,Met,,Met,,?,,?,,?,,?,,Met,Non-trivial build file in repository: <https://github.com/advancedtelematic/sota_client_cpp/blob/master/CMakeLists.txt>.,Met,Non-trivial build file in repository: <https://github.com/advancedtelematic/sota_client_cpp/blob/master/CMakeLists.txt>.,Met,,Met,,Met,,Met,,Met,Policy described here: https://github.com/advancedtelematic/sota_client_cpp/blob/master/CONTRIBUTING.md,Met,,Met,Described here: https://github.com/advancedtelematic/sota_client_cpp/blob/master/CONTRIBUTING.md,Met,,Met,,Met,,?,,?,,Met,,Met,,Met,,?,,Met,,?,,?,,?,,Met,,?,,Met,,Met,,?,,?,,?,,?,,?,,?,,?,,?,,,2016-12-06 12:15:17 UTC,2016-12-06 12:52:59 UTC,?,,Met,https://travis-ci.org/advancedtelematic/sota_client_cpp,,Met,GitHub supports discussions on issues and pull requests.,Met,,Met,,?,,?,,?,,?,,?,,Met,Found all required security hardening headers.,?,,?,,61,,,2022-04-06 23:00:43 UTC,False,"C++, C, CMake (CII estimate)",28,5,?,,?,,?,,?,,?,,?,,?,,?,,?,,?,,?,,?,,?,,?,,?,,?,,?,,?,,?,,?,,?,,?,,?,,?,,?,,?,,?,,?,,?,,?,,?,,?,,?,,?,,?,,?,,?,,?,,?,,?,,9,?,,?,,?,,?,,?,,?,,?,,?,,?,,?,,?,,?,,Unmet,,Unmet,,61,,,,,,,,,Met,
10,540,259,HTTP web applications for Vert.x,Vert.x-Web is a tool-kit for writing sophisticated modern web applications and HTTP microservices.,http://vertx.io,https://github.com/vert-x3/vertx-web,Apache-2.0,?,,Unmet,"https://vertx.io
https://github.com/vert-x3/ and https://github.com/eclipse-vertx/
https://repo1.maven.org/maven2/io/vertx/ // Given an http: URL.",Met,Project documentation is available at <http://vertx.io/docs/>.,Met,"Project community links, support groups, contact, how to contribute are available at <http://vertx.io/community/>.",Met,"Projects on GitHub by default use issues and pull requests, as encouraged by documentation such as <https://guides.github.com/activities/contributing-to-open-source/>.",Met,The development guidelines are available in the wiki <https://github.com/vert-x3/wiki/wiki/How-to-contribute-to-Vert.x>/,Met,Non-trivial license location file in repository: <https://github.com/vert-x3/vertx-web/blob/master/LICENSE.txt>.,Met,The Apache-2.0 license is approved by the Open Source Initiative (OSI).,Met,The Apache-2.0 license is approved by the Open Source Initiative (OSI).,Met,http://vertx.io/docs/,Met,http://vertx.io/docs/apidocs/,Met,"Repository on GitHub, which provides public git repositories with URLs.",Met,"Repository on GitHub, which uses git. git can track the changes, who made them, and when they were made.",Met,All released versions are tagged on the source code repository including candidate releases: e.g.: https://github.com/vert-x3/vertx-web/tree/3.3.0.CR2 ,Met,"Repository on GitHub, which uses git. git is distributed.",Met,Versions adhere to semver and maven.,Met,,Met,All releases are available under a tag with the same name.,Met,"For each release, there is a wiki page with the notes: e.g.: https://github.com/vert-x3/wiki/wiki/3.3.3---Release-Notes ",Met,"All releases are accompanied by a release note document listing all changes, fixes, cve's: e.g.: https://github.com/vert-x3/wiki/wiki/3.5.1-Release-Notes",?,,Met,https://github.com/vert-x3/vertx-web/issues,Met,https://github.com/vert-x3/wiki/wiki/Handling-Issues,Met,,Met,,Met,https://github.com/vert-x3/vertx-web/issues?q=is%3Aissue+is%3Aclosed,Unmet,,Met,In the main project page http://vertx.io/ there is a link to private enquires: mailto:vertx-enquiries@googlegroups.com,Met,"Given a vulnerability report, the project issues a security update and a blog post urging users to upgrade.",Met,Non-trivial build file in repository: <https://github.com/vert-x3/vertx-web/blob/master/pom.xml>.,Met,Non-trivial build file in repository: <https://github.com/vert-x3/vertx-web/blob/master/pom.xml>.,Met,The project builds on openjdk + maven 3.3,Met,The tests are included with the source code.,Met,Tests are run from Maven build.,Met,any pull request is only merged if there is at least 1 test validating the change,Met,All new code must be accompanied by test to assert it works.,Met,This is verifiable by comparing the size of the test suite across each version.,Met,The changelog includes all changes and that covers tests too.,Met,The project runs regularly spotbugs,Met,Within the deprecation project rules code and examples are updates to the latest APIs and avoiding the use of deprecated APIs ,?,,Met,Vert.x Web adheres to the OWASP best practices.,Met,,Met,,Met,,Met,,Met,"The projects doesn't rely on any encryption libraries, all security related code is used from the JVM itself meaning that we never rely on old or deprecated security dependencies.",Met,,Met,All session related code follows the OWASP recommendations.,Met,Password follow OWASP recommendations and implement PBKDF2,Met,,Met,Provided by maven central repo.,Met,Provided by maven central repo.,Met,,Met,,Met,We run regularly the tool findbugs to identify potential bugs and security issues.,Met,we run regularly spotbugs and findsecbugs,Met,all CVE reports are fixed quickly and a new release and warning for users is issued.,?,,?,,?,,?,,?,,,2016-12-06 12:17:41 UTC,2022-01-25 14:35:55 UTC,Met,,Met,The CI runs for all projects on cloudbees: https://vertx.ci.cloudbees.com/,,Met,GitHub supports discussions on issues and pull requests.,Met,,Met,"https://github.com/eclipse/vert.x/blob/master/CONTRIBUTING.md
https://github.com/vert-x3/wiki/wiki/Vert.x-code-style-guidelines",?,,Met,,Met,,Met,,Met,,Unmet,"X-Content-Type-Options was not set to ""nosniff"". // X-Content-Type-Options was not set to ""nosniff"".",Met,,Met,,88,,,2022-04-19 23:00:26 UTC,False,Java,46,7,?,,?,,?,,?,,?,,?,,?,,?,,?,,?,,?,,?,,?,,?,,?,,?,,?,,?,,?,,?,,?,,?,,?,,?,,?,,?,,?,,?,,?,,?,,?,,?,,?,,?,,?,,?,,?,,?,,?,,?,,9,?,,?,,?,,?,,?,,?,,?,,?,,?,,?,,?,,?,,Unmet,,Unmet,,88,,,,,,,,,Met,
11,541,769,cs-studio,"Control System Studio is an Eclipse-based collections of tools to monitor and operate large scale control systems, such as the ones in the accelerator community. ",http://controlsystemstudio.github.com,https://github.com/ControlSystemStudio/cs-studio,EPL,?,,Unmet,"(needs cert) https://controlsystemstudio.org/
(docbook should be moved) http://cs-studio.sourceforge.net/docbook/
https://github.com/ControlSystemStudio/cs-studio",Met,http://controlsystemstudio.org/records.html,Met,https://github.com/ControlSystemStudio/cs-studio/wiki/HowToContribute,Met,"Projects on GitHub by default use issues and pull requests, as encouraged by documentation such as <https://guides.github.com/activities/contributing-to-open-source/>.",Met,"https://github.com/ControlSystemStudio/cs-studio/wiki/HowToContribute
https://github.com/ControlSystemStudio/cs-studio/wiki/CodingGuidelines",Met,https://github.com/ControlSystemStudio/cs-studio/blob/master/LICENSE,Met,https://opensource.org/licenses/EPL-1.0,Met,,Met,http://cs-studio.sourceforge.net/docbook/,Met,http://cs-studio.sourceforge.net/docbook/,Met,"Repository on GitHub, which provides public git repositories with URLs.",Met,"Repository on GitHub, which uses git. git can track the changes, who made them, and when they were made.",?,,Met,"Repository on GitHub, which uses git. git is distributed.",Met,,Met,,Unmet,"Tags are currently on the product repo.  We should trigger the product build after the main, and commit a changelog with the pull request info.",Unmet,Combined release notes are in the product repo.,Unmet,Combined release notes are in the product repo.,?,,Met,https://github.com/ControlSystemStudio/cs-studio/issues,Met,https://drive.google.com/drive/folders/0B_ikNAN_jxjPano5cnRtNXd0MWs?tid=0Bxrrhhn0aTLWNS0teDEtNzRkVnc,Met,https://github.com/ControlSystemStudio/cs-studio/pulse,Met,https://github.com/ControlSystemStudio/cs-studio/pulse,Met,"https://docs.google.com/forms/d/1XFHA-tD1oWtcQiHW3IuMpnc6n5pM-b7wxZUp7Xq8Mps/viewanalytics#start=publishanalytics
https://drive.google.com/drive/folders/0B_ikNAN_jxjPQVZsY1VIY1hsdDQ?tid=0Bxrrhhn0aTLWNS0teDEtNzRkVnc",?,,?,,?,,Met,https://travis-ci.org/ControlSystemStudio/cs-studio,Met,https://travis-ci.org/ControlSystemStudio/cs-studio,Met,https://travis-ci.org/ControlSystemStudio/cs-studio,Met,https://travis-ci.org/ControlSystemStudio/cs-studio,Met,,Met,https://travis-ci.org/ControlSystemStudio/cs-studio,?,,?,,?,,?,,?,,?,,?,,?,,?,,?,,?,,?,,?,,?,,?,,?,,?,,?,,?,,?,,?,,?,,?,,?,,?,,?,,?,,?,,,2016-12-06 14:08:04 UTC,2016-12-06 14:49:09 UTC,?,,Met,"https://travis-ci.org/ControlSystemStudio/cs-studio
Travis Ci deploys to S3:
http://download.controlsystemstudio.org/release/4.3/",,Met,GitHub supports discussions on issues and pull requests.,?,,Met,,?,,?,,?,,?,,?,,Unmet,"X-Content-Type-Options was not set to ""nosniff"".",?,,?,,45,,,2022-04-06 23:00:43 UTC,False,"Java, Python, PLSQL (CII estimate)",28,4,?,,?,,?,,?,,?,,?,,?,,?,,?,,?,,?,,?,,?,,?,,?,,?,,?,,?,,?,,?,,?,,?,,?,,?,,?,,?,,?,,?,,?,,?,,?,,?,,?,,?,,?,,?,,?,,?,,?,,?,,9,?,,?,,?,,?,,?,,?,,?,,?,,?,,?,,?,,?,,Unmet,,Unmet,,45,,,,,,,,,Met,
12,542,770,GitHub Training Kit,"This project houses GitHub Professional Services' open sourced training content, including on demand courses and cheat sheets for Git and GitHub.
",https://services.github.com/on-demand,https://github.com/github/training-kit,CC-BY-4.0,?,,Met,Given only https: URLs.,?,,?,,?,Non-trivial contribution file in repository: <https://github.com/github/training-kit/blob/master/CONTRIBUTING.md>.,?,,Met,Non-trivial license location file in repository: <https://github.com/github/training-kit/blob/master/LICENSE>.,?,,Unmet,Did not find license in the OSI list.,?,,?,,Met,"Repository on GitHub, which provides public git repositories with URLs.",Met,"Repository on GitHub, which uses git. git can track the changes, who made them, and when they were made.",?,,Met,"Repository on GitHub, which uses git. git is distributed.",?,,?,,?,,Unmet,No release notes file found.,?,,?,,?,,?,,?,,?,,?,,?,,?,,?,,Met,Non-trivial build file in repository: <https://github.com/github/training-kit/blob/master/Rakefile>.,Met,Non-trivial build file in repository: <https://github.com/github/training-kit/blob/master/Rakefile>.,?,,?,,?,,?,,?,,?,,?,,?,,?,,?,,?,,?,,?,,?,,?,,?,,?,,?,,?,,?,,?,,?,,?,,?,,?,,?,,?,,?,,?,,?,,?,,?,,,2016-12-06 20:04:44 UTC,2016-12-06 20:08:25 UTC,?,,?,,,Met,GitHub supports discussions on issues and pull requests.,?,,?,,?,,?,,?,,?,,?,,?,,?,,?,,15,,,2022-04-06 23:00:43 UTC,False,"JavaScript, Ruby, Shell (CII estimate)",29,0,?,,?,,?,,?,,?,,?,,?,,?,,?,,?,,?,,?,,?,,?,,?,,?,,?,,?,,?,,?,,?,,?,,?,,?,,?,,?,,?,,?,,?,,?,,?,,?,,?,,?,,?,,?,,?,,?,,?,,?,,4,?,,?,,?,,?,,?,,?,,?,,?,,?,,?,,?,,?,,Unmet,,Unmet,,15,,,,,,,,,Met,
