17,3999,5560,textpattern,"A flexible, elegant, fast and easy-to-use content management system written in PHP.",https://textpattern.com,https://github.com/textpattern/textpattern,GPL-2.0,?,,Met,Given only https: URLs.,Met,https://textpattern.com/about/,Met,https://textpattern.com/start/,Met,"Projects on GitHub by default use issues and pull requests, as encouraged by documentation such as <https://guides.github.com/activities/contributing-to-open-source/>.",Met,https://github.com/textpattern/textpattern/blob/main/.github/CONTRIBUTING.md,Met,Non-trivial license location file in repository: <https://github.com/textpattern/textpattern/blob/dev/LICENSE.txt>.,Met,The GPL-2.0 license is approved by the Open Source Initiative (OSI).,Met,The GPL-2.0 license is approved by the Open Source Initiative (OSI).,Met,https://github.com/textpattern/textpattern/blob/dev/README.txt,Met,https://docs.textpattern.com,Met,"Repository on GitHub, which provides public git repositories with URLs.",Met,"Repository on GitHub, which uses git. git can track the changes, who made them, and when they were made.",Met,"Minor releases include at least 1 beta releases, patch releases will include at least 1 beta release starting with 4.9 release branch. Where a minor release is being worked on, a branch is provided for anyone to review. Where a patch release is being worked on, a branch is provided for anyone to review.

https://github.com/textpattern/textpattern/network (current graph of branches)
https://github.com/textpattern/textpattern/releases/tag/4.8.0-beta.3 (beta release example)
",Met,"Repository on GitHub, which uses git. git is distributed.",Met,Semantic versioning is used. Refer to https://github.com/textpattern/textpattern/blob/main/.github/CONTRIBUTING.md,Met,,Met,Each release is tagged with its own tree (e.g. https://github.com/textpattern/textpattern/tree/4.8.4) and commit tag (e.g. https://github.com/textpattern/textpattern/commit/eb17367ddffc08ab9d7638b47b3ab700f232cd1e),Met,https://github.com/textpattern/textpattern/blob/dev/HISTORY.txt,Met,https://github.com/textpattern/textpattern/blob/dev/HISTORY.txt,?,,Met,https://github.com/textpattern/textpattern/issues,Met,https://github.com/textpattern/textpattern/issues,Met,https://github.com/textpattern/textpattern/issues,Met,https://github.com/textpattern/textpattern/issues,Met,https://github.com/textpattern/textpattern/issues,Met,https://textpattern.com/contact#security,Met,https://textpattern.com/contact#security,Met,Anonymised email audit logs available on request.,,"Provided source code is PHP with JavaScript, no build process required: https://github.com/textpattern/textpattern/blob/dev/INSTALL.txt",,"Provided source code is PHP with JavaScript, no build process required: https://github.com/textpattern/textpattern/blob/dev/INSTALL.txt",,"Provided source code is PHP with JavaScript, no build process required: https://github.com/textpattern/textpattern/blob/dev/INSTALL.txt",?,,?,,?,,?,,?,,?,,?,,?,,?,,Met,,Met,,Met,,Met,Does not require cryptographic algorithms.,Met,,,,?,,?,,?,,?,,Met,https://textpattern.com/start/ & https://github.com/textpattern/textpattern/releases are https and provide sha256 checksums for each downloadable archive.,Met,"sha256 is provided over https only, http requests are upgraded to https automatically.",Met,,Met,,?,,?,,?,,?,,?,,?,,?,,?,,,2020-06-09 14:20:39 UTC,2021-04-05 08:33:58 UTC,?,,?,,,Met,GitHub supports discussions on issues and pull requests.,Met,,Met,"https://github.com/textpattern/textpattern/issues
https://docs.textpattern.com",?,,?,,?,,?,,?,,Met,Found all required security hardening headers.,?,,?,,66,,,2022-02-22 23:00:32 UTC,False,"PHP, JavaScript, Shell",15,4,?,,?,,?,,?,,?,,?,,?,,?,,?,,?,,?,,?,,?,,?,,?,,?,,?,,?,,?,,?,,?,,?,,?,,?,,?,,?,,?,,?,,?,,?,,?,,?,,?,,?,,?,,?,,?,,?,,?,,?,,4,?,,?,,?,,?,,?,,?,,?,,?,,?,,?,,?,,?,,Unmet,,Unmet,,66,,,,,,,,,Met,
18,4000,5556,PSoC-EMS,A repository for PClub Summer of Code 2020.,https://github.com/tharun143/PSoC-EMS,https://github.com/tharun143/PSoC-EMS,MIT,?,,Met,Given only https: URLs.,?,,?,,Met,Non-trivial contribution file in repository: <https://github.com/tharun143/PSoC-EMS/blob/master/CONTRIBUTING.md>.,?,,Met,Non-trivial license location file in repository: <https://github.com/tharun143/PSoC-EMS/blob/master/LICENSE>.,Met,The MIT license is approved by the Open Source Initiative (OSI).,Met,The MIT license is approved by the Open Source Initiative (OSI).,Unmet,// No appropriate folder found for documentation basics.,?,,Met,"Repository on GitHub, which provides public git repositories with URLs.",Met,"Repository on GitHub, which uses git. git can track the changes, who made them, and when they were made.",?,,Met,"Repository on GitHub, which uses git. git is distributed.",?,,?,,?,,Unmet,// No release notes file found.,?,,?,,?,,?,,?,,?,,?,,?,,?,,?,,?,,?,,?,,?,,?,,?,,?,,?,,?,,?,,?,,?,,?,,?,,?,,?,,?,,?,,?,,?,,?,,?,,?,,?,,?,,?,,?,,?,,?,,?,,?,,?,,?,,?,,,2020-06-09 20:50:22 UTC,2020-06-09 20:50:22 UTC,?,,?,,,Met,GitHub supports discussions on issues and pull requests.,?,,?,,?,,?,,?,,?,,?,,Met,Found all required security hardening headers.,?,,?,,15,,,2022-02-22 23:00:32 UTC,False,"Python, JavaScript, C++, Mako",8,0,?,,?,,?,,?,,?,,?,,?,,?,,?,,?,,?,,?,,?,,?,,?,,?,,?,,?,,?,,?,,?,,?,,?,,?,,?,,?,,?,,?,,?,,?,,?,,?,,?,,?,,?,,?,,?,,?,,?,,?,,4,?,,?,,?,,?,,?,,?,,?,,?,,?,,?,,?,,?,,Unmet,,Unmet,,15,,,,,,,,,Met,
19,4001,5556,github-slideshow,A robot powered training repository,https://lab.github.com/githubtraining/introduction-to-github,https://github.com/tharun143/github-slideshow,MIT,?,,Met,Given only https: URLs.,?,,?,,Met,"Projects on GitHub by default use issues and pull requests, as encouraged by documentation such as <https://guides.github.com/activities/contributing-to-open-source/>.",?,,Met,Non-trivial license location file in repository: <https://github.com/tharun143/github-slideshow/blob/master/LICENSE>.,Met,The MIT license is approved by the Open Source Initiative (OSI).,Met,The MIT license is approved by the Open Source Initiative (OSI).,Unmet,// No appropriate folder found for documentation basics.,?,,Met,"Repository on GitHub, which provides public git repositories with URLs.",Met,"Repository on GitHub, which uses git. git can track the changes, who made them, and when they were made.",?,,Met,"Repository on GitHub, which uses git. git is distributed.",?,,?,,?,,Unmet,// No release notes file found.,?,,?,,?,,?,,?,,?,,?,,?,,?,,?,,?,,?,,?,,?,,?,,?,,?,,?,,?,,?,,?,,?,,?,,?,,?,,?,,?,,?,,?,,?,,?,,?,,?,,?,,?,,?,,?,,?,,?,,?,,?,,?,,?,,?,,,2020-06-09 20:53:54 UTC,2020-06-09 20:53:54 UTC,?,,?,,,Met,GitHub supports discussions on issues and pull requests.,?,,?,,?,,?,,?,,?,,?,,Met,Found all required security hardening headers.,?,,?,,15,,,2022-02-22 23:00:33 UTC,False,"Ruby, Shell",8,0,?,,?,,?,,?,,?,,?,,?,,?,,?,,?,,?,,?,,?,,?,,?,,?,,?,,?,,?,,?,,?,,?,,?,,?,,?,,?,,?,,?,,?,,?,,?,,?,,?,,?,,?,,?,,?,,?,,?,,?,,4,?,,?,,?,,?,,?,,?,,?,,?,,?,,?,,?,,?,,Unmet,,Unmet,,15,,,,,,,,,Met,
20,4002,5556,grimoirelab-hatstall,,https://github.com/tharun143/grimoirelab-hatstall,https://github.com/tharun143/grimoirelab-hatstall,GPL-3.0,?,,Met,Given only https: URLs.,?,,?,,Met,Non-trivial contribution file in repository: <https://github.com/tharun143/grimoirelab-hatstall/blob/master/CONTRIBUTING.md>.,?,,Met,Non-trivial license location file in repository: <https://github.com/tharun143/grimoirelab-hatstall/blob/master/LICENSE>.,Met,The GPL-3.0 license is approved by the Open Source Initiative (OSI).,Met,The GPL-3.0 license is approved by the Open Source Initiative (OSI).,Met,Some documentation basics file contents found.,?,,Met,"Repository on GitHub, which provides public git repositories with URLs.",Met,"Repository on GitHub, which uses git. git can track the changes, who made them, and when they were made.",?,,Met,"Repository on GitHub, which uses git. git is distributed.",?,,?,,?,,Unmet,// No release notes file found.,?,,?,,?,,?,,?,,?,,?,,?,,?,,?,,?,,?,,?,,?,,?,,?,,?,,?,,?,,?,,?,,?,,?,,?,,?,,?,,?,,?,,?,,?,,?,,?,,?,,?,,?,,?,,?,,?,,?,,?,,?,,?,,?,,?,,,2020-06-09 20:54:27 UTC,2020-06-09 20:54:27 UTC,?,,?,,,Met,GitHub supports discussions on issues and pull requests.,?,,?,,?,,?,,?,,?,,?,,Met,Found all required security hardening headers.,?,,?,,16,,,2022-02-22 23:00:33 UTC,False,"TSQL, Python, Shell, Dockerfile",8,0,?,,?,,?,,?,,?,,?,,?,,?,,?,,?,,?,,?,,?,,?,,?,,?,,?,,?,,?,,?,,?,,?,,?,,?,,?,,?,,?,,?,,?,,?,,?,,?,,?,,?,,?,,?,,?,,?,,?,,?,,4,?,,?,,?,,?,,?,,?,,?,,?,,?,,?,,?,,?,,Unmet,,Unmet,,16,,,,,,,,,Met,
21,4003,5563,logdb,,https://github.com/borer/logdb,https://github.com/borer/logdb,Apache-2.0,?,,Met,Given only https: URLs.,?,,?,,Met,"Projects on GitHub by default use issues and pull requests, as encouraged by documentation such as <https://guides.github.com/activities/contributing-to-open-source/>.",?,,Met,Non-trivial license location file in repository: <https://github.com/borer/logdb/blob/master/LICENSE.txt>.,Met,The Apache-2.0 license is approved by the Open Source Initiative (OSI).,Met,The Apache-2.0 license is approved by the Open Source Initiative (OSI).,Unmet,// No appropriate folder found for documentation basics.,?,,Met,"Repository on GitHub, which provides public git repositories with URLs.",Met,"Repository on GitHub, which uses git. git can track the changes, who made them, and when they were made.",?,,Met,"Repository on GitHub, which uses git. git is distributed.",?,,?,,?,,Unmet,// No release notes file found.,?,,?,,?,,?,,?,,?,,?,,?,,?,,?,,Met,Non-trivial build file in repository: <https://github.com/borer/logdb/blob/master/pom.xml>.,Met,Non-trivial build file in repository: <https://github.com/borer/logdb/blob/master/pom.xml>.,?,,?,,?,,?,,?,,?,,?,,?,,?,,?,,?,,?,,?,,?,,?,,?,,?,,?,,?,,?,,?,,?,,?,,?,,?,,?,,?,,?,,?,,?,,?,,?,,,2020-06-09 21:34:41 UTC,2020-06-09 21:34:41 UTC,?,,?,,,Met,GitHub supports discussions on issues and pull requests.,?,,?,,?,,?,,?,,?,,?,,Met,Found all required security hardening headers.,?,,?,,18,,,2022-02-22 23:00:33 UTC,False,"Java, Shell",8,0,?,,?,,?,,?,,?,,?,,?,,?,,?,,?,,?,,?,,?,,?,,?,,?,,?,,?,,?,,?,,?,,?,,?,,?,,?,,?,,?,,?,,?,,?,,?,,?,,?,,?,,?,,?,,?,,?,,?,,?,,4,?,,?,,?,,?,,?,,?,,?,,?,,?,,?,,?,,?,,Unmet,,Unmet,,18,,,,,,,,,Met,
22,4004,5565,ajv,The fastest JSON Schema Validator. Supports draft-04/06/07,https://ajv.js.org,https://github.com/ajv-validator/ajv,MIT,?,,Met,https://ajv.js.org/,Met,https://github.com/ajv-validator/ajv#readme,Met,https://github.com/ajv-validator/ajv/blob/master/CONTRIBUTING.md#issues,Met,Non-trivial contribution file in repository: <https://github.com/ajv-validator/ajv/blob/master/CONTRIBUTING.md>.,Met,https://github.com/ajv-validator/ajv/blob/master/CONTRIBUTING.md#pull-requests,Met,Non-trivial license location file in repository: <https://github.com/ajv-validator/ajv/blob/master/LICENSE>.,Met,The MIT license is approved by the Open Source Initiative (OSI).,Met,The MIT license is approved by the Open Source Initiative (OSI).,Met,https://github.com/ajv-validator/ajv#readme,Met,https://github.com/ajv-validator/ajv#api,Met,"Repository on GitHub, which provides public git repositories with URLs.",Met,"Repository on GitHub, which uses git. git can track the changes, who made them, and when they were made.",Met,,Met,"Repository on GitHub, which uses git. git is distributed.",Met,https://github.com/ajv-validator/ajv/releases,Met,,Met,https://github.com/ajv-validator/ajv/releases,Met,https://github.com/ajv-validator/ajv/releases,Met,https://github.com/ajv-validator/ajv/releases,?,,Met,https://github.com/ajv-validator/ajv/issues,Met,https://github.com/ajv-validator/ajv/blob/master/CONTRIBUTING.md#issues,Met,Using github issue labels and comments,Met,Using github issue labels and comments,Met,https://github.com/ajv-validator/ajv/issues,Met,https://github.com/ajv-validator/ajv#security-contact,Met,https://github.com/ajv-validator/ajv#security-contact,Met,Via email,Met,https://travis-ci.org/github/ajv-validator/ajv,Met,https://travis-ci.org/github/ajv-validator/ajv,Met,,Met,"Included: https://github.com/ajv-validator/ajv/tree/master/spec
",Met,npm test,Met,Code coverage is measured: https://coveralls.io/github/ajv-validator/ajv?branch=master,Met,https://github.com/ajv-validator/ajv/blob/master/CONTRIBUTING.md#code,Met,"Code coverage is measured: https://coveralls.io/github/ajv-validator/ajv?branch=master
E.g., the latest change: https://github.com/ajv-validator/ajv/pull/1219/files#diff-810159f3a21b8d827f981dde09136571R1",Met,,Met,npm run eslint,Met,There are no warnings,Met,Failing linting fails the automated test suite,Met,https://github.com/epoberezkin,Met,,,,,,,,,,,,,,,,,,Met,Website and github are https only,?,,Met,Via npm (npm audit) and github (shown to maintainers) vulnerability reporting,Met,,Met,"eslint
jshint",,,,,Met,,Met,Test suite,,,Met,Test suite,Met,,,2020-06-10 07:49:15 UTC,2020-06-10 08:14:52 UTC,,,Met,https://travis-ci.org/github/ajv-validator/ajv,,Met,GitHub supports discussions on issues and pull requests.,Met,,Met,,?,,?,,?,,?,,?,,Unmet,"// X-Content-Type-Options was not set to ""nosniff"".",?,,?,,99,,,2022-02-23 23:00:25 UTC,False,JavaScript,14,7,?,,?,,?,,?,,?,,?,,?,,?,,?,,?,,?,,?,,?,,?,,?,,?,,?,,?,,?,,?,,?,,?,,?,,?,,?,,?,,?,,?,,?,,?,,?,,?,,?,,?,,?,,?,,?,,?,,?,,?,,17,?,,?,,?,,?,,?,,?,,?,,?,,?,,?,,?,,?,,Unmet,,Unmet,,99,,,,,,,,,Met,
23,4005,5561,UC5-API,"Process Wrapper API. The purpose of this API is to provide a generic submit/status REST/JWT interface, to submit slurm jobs on a remote machine.",https://www.process-project.eu,https://github.com/process-project/UC5-API,MIT,?,,Met,Given only https: URLs.,?,,?,,Met,"Projects on GitHub by default use issues and pull requests, as encouraged by documentation such as <https://guides.github.com/activities/contributing-to-open-source/>.",?,,Met,Non-trivial license location file in repository: <https://github.com/process-project/UC5-API/blob/master/LICENSE>.,Met,The MIT license is approved by the Open Source Initiative (OSI).,Met,The MIT license is approved by the Open Source Initiative (OSI).,Unmet,// No appropriate folder found for documentation basics.,?,,Met,"Repository on GitHub, which provides public git repositories with URLs.",Met,"Repository on GitHub, which uses git. git can track the changes, who made them, and when they were made.",?,,Met,"Repository on GitHub, which uses git. git is distributed.",?,,?,,?,,Unmet,// No release notes file found.,?,,?,,?,,?,,?,,?,,?,,?,,?,,?,,?,,?,,?,,?,,?,,?,,?,,?,,?,,?,,?,,?,,?,,?,,?,,?,,?,,?,,?,,?,,?,,?,,?,,?,,?,,?,,?,,?,,?,,?,,?,,?,,?,,?,,,2020-06-10 09:25:11 UTC,2020-06-10 09:25:11 UTC,?,,?,,,Met,GitHub supports discussions on issues and pull requests.,?,,?,,?,,?,,?,,?,,?,,Unmet,// One or more of the required security hardening headers is missing.,?,,?,,15,,,2022-02-23 23:00:25 UTC,False,"Python, Shell, Dockerfile",8,0,?,,?,,?,,?,,?,,?,,?,,?,,?,,?,,?,,?,,?,,?,,?,,?,,?,,?,,?,,?,,?,,?,,?,,?,,?,,?,,?,,?,,?,,?,,?,,?,,?,,?,,?,,?,,?,,?,,?,,?,,4,?,,?,,?,,?,,?,,?,,?,,?,,?,,?,,?,,?,,Unmet,,Unmet,,15,,,,,,,,,Met,
24,4006,4662,autosys,System utilities for efficient Python development on macOS,https://skeptycal.github.io/autosys,https://github.com/skeptycal/autosys,MIT,?,,Met,Given only https: URLs.,?,,?,,Met,"Projects on GitHub by default use issues and pull requests, as encouraged by documentation such as <https://guides.github.com/activities/contributing-to-open-source/>.",?,,Met,Non-trivial license location file in repository: <https://github.com/skeptycal/autosys/blob/master/LICENSE>.,Met,The MIT license is approved by the Open Source Initiative (OSI).,Met,The MIT license is approved by the Open Source Initiative (OSI).,Met,Some documentation basics file contents found.,?,,Met,"Repository on GitHub, which provides public git repositories with URLs.",Met,"Repository on GitHub, which uses git. git can track the changes, who made them, and when they were made.",?,,Met,"Repository on GitHub, which uses git. git is distributed.",?,,?,,?,,Unmet,// No release notes file found.,?,,?,,?,,?,,?,,?,,?,,?,,?,,?,,?,,?,,?,,?,,?,,?,,?,,?,,?,,?,,?,,?,,?,,?,,?,,?,,?,,?,,?,,?,,?,,?,,?,,?,,?,,?,,?,,?,,?,,?,,?,,?,,?,,?,,,2020-06-10 12:34:30 UTC,2020-06-10 12:34:30 UTC,?,,?,,,Met,GitHub supports discussions on issues and pull requests.,?,,?,,?,,?,,?,,?,,?,,Unmet,"// X-Content-Type-Options was not set to ""nosniff"".",?,,?,,16,,,2022-02-23 23:00:25 UTC,False,"Python, Dockerfile",8,0,?,,?,,?,,?,,?,,?,,?,,?,,?,,?,,?,,?,,?,,?,,?,,?,,?,,?,,?,,?,,?,,?,,?,,?,,?,,?,,?,,?,,?,,?,,?,,?,,?,,?,,?,,?,,?,,?,,?,,?,,4,?,,?,,?,,?,,?,,?,,?,,?,,?,,?,,?,,?,,Unmet,,Unmet,,16,,,,,,,,,Met,
25,4007,5567,openrqm-client-desktop-nwjs,OpenRQM Cross-Plattform Desktop Client using NW.js,https://github.com/openrqm/openrqm-client-desktop-nwjs,https://github.com/openrqm/openrqm-client-desktop-nwjs,,?,,Met,Given only https: URLs.,?,,?,,Met,"Projects on GitHub by default use issues and pull requests, as encouraged by documentation such as <https://guides.github.com/activities/contributing-to-open-source/>.",?,,Unmet,// No license location file found.,?,,?,,Met,Some documentation basics file contents found.,?,,Met,"Repository on GitHub, which provides public git repositories with URLs.",Met,"Repository on GitHub, which uses git. git can track the changes, who made them, and when they were made.",?,,Met,"Repository on GitHub, which uses git. git is distributed.",?,,?,,?,,Unmet,// No release notes file found.,?,,?,,?,,?,,?,,?,,?,,?,,?,,?,,Met,Non-trivial build file in repository: <https://github.com/openrqm/openrqm-client-desktop-nwjs/blob/development/Makefile>.,Met,Non-trivial build file in repository: <https://github.com/openrqm/openrqm-client-desktop-nwjs/blob/development/Makefile>.,?,,?,,?,,?,,?,,?,,?,,?,,?,,?,,?,,?,,?,,?,,?,,?,,?,,?,,?,,?,,?,,?,,?,,?,,?,,?,,?,,?,,?,,?,,?,,?,,,2020-06-10 15:56:16 UTC,2020-06-10 15:56:16 UTC,?,,?,,,Met,GitHub supports discussions on issues and pull requests.,?,,?,,?,,?,,?,,?,,?,,Met,Found all required security hardening headers.,?,,?,,15,,,2022-02-23 23:00:25 UTC,False,"TypeScript, JavaScript, Makefile",8,0,?,,?,,?,,?,,?,,?,,?,,?,,?,,?,,?,,?,,?,,?,,?,,?,,?,,?,,?,,?,,?,,?,,?,,?,,?,,?,,?,,?,,?,,?,,?,,?,,?,,?,,?,,?,,?,,?,,?,,?,,4,?,,?,,?,,?,,?,,?,,?,,?,,?,,?,,?,,?,,Unmet,,Unmet,,15,,,,,,,,,Met,
