,id,user_id,name,description,homepage_url,repo_url,license,homepage_url_status,homepage_url_justification,sites_https_status,sites_https_justification,description_good_status,description_good_justification,interact_status,interact_justification,contribution_status,contribution_justification,contribution_requirements_status,contribution_requirements_justification,license_location_status,license_location_justification,floss_license_status,floss_license_justification,floss_license_osi_status,floss_license_osi_justification,documentation_basics_status,documentation_basics_justification,documentation_interface_status,documentation_interface_justification,repo_public_status,repo_public_justification,repo_track_status,repo_track_justification,repo_interim_status,repo_interim_justification,repo_distributed_status,repo_distributed_justification,version_unique_status,version_unique_justification,version_semver_status,version_semver_justification,version_tags_status,version_tags_justification,release_notes_status,release_notes_justification,release_notes_vulns_status,release_notes_vulns_justification,report_url_status,report_url_justification,report_tracker_status,report_tracker_justification,report_process_status,report_process_justification,report_responses_status,report_responses_justification,enhancement_responses_status,enhancement_responses_justification,report_archive_status,report_archive_justification,vulnerability_report_process_status,vulnerability_report_process_justification,vulnerability_report_private_status,vulnerability_report_private_justification,vulnerability_report_response_status,vulnerability_report_response_justification,build_status,build_justification,build_common_tools_status,build_common_tools_justification,build_floss_tools_status,build_floss_tools_justification,test_status,test_justification,test_invocation_status,test_invocation_justification,test_most_status,test_most_justification,test_policy_status,test_policy_justification,tests_are_added_status,tests_are_added_justification,tests_documented_added_status,tests_documented_added_justification,warnings_status,warnings_justification,warnings_fixed_status,warnings_fixed_justification,warnings_strict_status,warnings_strict_justification,know_secure_design_status,know_secure_design_justification,know_common_errors_status,know_common_errors_justification,crypto_published_status,crypto_published_justification,crypto_call_status,crypto_call_justification,crypto_floss_status,crypto_floss_justification,crypto_keylength_status,crypto_keylength_justification,crypto_working_status,crypto_working_justification,crypto_pfs_status,crypto_pfs_justification,crypto_password_storage_status,crypto_password_storage_justification,crypto_random_status,crypto_random_justification,delivery_mitm_status,delivery_mitm_justification,delivery_unsigned_status,delivery_unsigned_justification,vulnerabilities_fixed_60_days_status,vulnerabilities_fixed_60_days_justification,vulnerabilities_critical_fixed_status,vulnerabilities_critical_fixed_justification,static_analysis_status,static_analysis_justification,static_analysis_common_vulnerabilities_status,static_analysis_common_vulnerabilities_justification,static_analysis_fixed_status,static_analysis_fixed_justification,static_analysis_often_status,static_analysis_often_justification,dynamic_analysis_status,dynamic_analysis_justification,dynamic_analysis_unsafe_status,dynamic_analysis_unsafe_justification,dynamic_analysis_enable_assertions_status,dynamic_analysis_enable_assertions_justification,dynamic_analysis_fixed_status,dynamic_analysis_fixed_justification,general_comments,created_at,updated_at,crypto_weaknesses_status,crypto_weaknesses_justification,test_continuous_integration_status,test_continuous_integration_justification,cpe,discussion_status,discussion_justification,no_leaked_credentials_status,no_leaked_credentials_justification,english_status,english_justification,hardening_status,hardening_justification,crypto_used_network_status,crypto_used_network_justification,crypto_tls12_status,crypto_tls12_justification,crypto_certificate_verification_status,crypto_certificate_verification_justification,crypto_verification_private_status,crypto_verification_private_justification,hardened_site_status,hardened_site_justification,installation_common_status,installation_common_justification,build_reproducible_status,build_reproducible_justification,badge_percentage_0,achieved_passing_at,lost_passing_at,last_reminder_at,disabled_reminders,implementation_languages,lock_version,badge_percentage_1,dco_status,dco_justification,governance_status,governance_justification,code_of_conduct_status,code_of_conduct_justification,roles_responsibilities_status,roles_responsibilities_justification,access_continuity_status,access_continuity_justification,bus_factor_status,bus_factor_justification,documentation_roadmap_status,documentation_roadmap_justification,documentation_architecture_status,documentation_architecture_justification,documentation_security_status,documentation_security_justification,documentation_quick_start_status,documentation_quick_start_justification,documentation_current_status,documentation_current_justification,documentation_achievements_status,documentation_achievements_justification,accessibility_best_practices_status,accessibility_best_practices_justification,internationalization_status,internationalization_justification,sites_password_security_status,sites_password_security_justification,maintenance_or_update_status,maintenance_or_update_justification,vulnerability_report_credit_status,vulnerability_report_credit_justification,vulnerability_response_process_status,vulnerability_response_process_justification,coding_standards_status,coding_standards_justification,coding_standards_enforced_status,coding_standards_enforced_justification,build_standard_variables_status,build_standard_variables_justification,build_preserve_debug_status,build_preserve_debug_justification,build_non_recursive_status,build_non_recursive_justification,build_repeatable_status,build_repeatable_justification,installation_standard_variables_status,installation_standard_variables_justification,installation_development_quick_status,installation_development_quick_justification,external_dependencies_status,external_dependencies_justification,dependency_monitoring_status,dependency_monitoring_justification,updateable_reused_components_status,updateable_reused_components_justification,interfaces_current_status,interfaces_current_justification,automated_integration_testing_status,automated_integration_testing_justification,regression_tests_added50_status,regression_tests_added50_justification,test_statement_coverage80_status,test_statement_coverage80_justification,test_policy_mandated_status,test_policy_mandated_justification,implement_secure_design_status,implement_secure_design_justification,input_validation_status,input_validation_justification,crypto_algorithm_agility_status,crypto_algorithm_agility_justification,crypto_credential_agility_status,crypto_credential_agility_justification,signed_releases_status,signed_releases_justification,version_tags_signed_status,version_tags_signed_justification,badge_percentage_2,contributors_unassociated_status,contributors_unassociated_justification,copyright_per_file_status,copyright_per_file_justification,license_per_file_status,license_per_file_justification,small_tasks_status,small_tasks_justification,require_2FA_status,require_2FA_justification,secure_2FA_status,secure_2FA_justification,code_review_standards_status,code_review_standards_justification,two_person_review_status,two_person_review_justification,test_statement_coverage90_status,test_statement_coverage90_justification,test_branch_coverage80_status,test_branch_coverage80_justification,security_review_status,security_review_justification,assurance_case_status,assurance_case_justification,achieve_passing_status,achieve_passing_justification,achieve_silver_status,achieve_silver_justification,tiered_percentage,repo_url_updated_at,achieved_silver_at,lost_silver_at,achieved_gold_at,lost_gold_at,first_achieved_passing_at,first_achieved_silver_at,first_achieved_gold_at,maintained_status,maintained_justification
0,1,25,BadgeApp,"BadgeApp is the web application that allows developers to provide information about their project and (hopefully) get an Open Source Security Foundation (OpenSSF) Best Practices badge. This project was originally known as the Core Infrastructure Initiative (CII) best practices badge project.

The Open Source Security Foundation (OpenSSF) is managed by The Linux Foundation.  The OpenSSF Best Practices badge online application (aka the BadgeApp) enables developers to quickly determine whether they are following best practices and to receive a badge they can display on GitHub and other locations. The application and its criteria are an open source project to which developers can contribute.

You can see the program running, and use it to try to get a badge, by visiting: https://bestpractices.coreinfrastructure.org/

The BadgeApp is written in Ruby on Rails and Javascript.

See the development site on GitHub for more about how we secure this application.

Note that the BadgeApp gets its own badge!",https://github.com/coreinfrastructure/best-practices-badge,https://github.com/coreinfrastructure/best-practices-badge,MIT,?,,Met,"The project website and repo use GitHub, which supports HTTPS using TLS.  There's no separate download URL (use git to download from the repo).",Met,https://github.com/linuxfoundation/cii-best-practices-badge,Met,https://github.com/linuxfoundation/cii-best-practices-badge/blob/master/CONTRIBUTING.md,Met,https://github.com/linuxfoundation/cii-best-practices-badge/blob/master/CONTRIBUTING.md,Met,https://github.com/linuxfoundation/cii-best-practices-badge/blob/master/CONTRIBUTING.md,Met,It's in the LICENSE file in the top level directory.  See: https://github.com/linuxfoundation/cii-best-practices-badge/blob/master/LICENSE,Met,The MIT license is widely acknowledged as being OSS.  The license is at https://github.com/linuxfoundation/cii-best-practices-badge/blob/master/LICENSE The MIT license is approved by the Open Source Initiative (OSI).,Met,The MIT license is approved by the Open Source Initiative (OSI).,Met,"The directory ""doc"" contains most documentation. Installation information is at https://github.com/linuxfoundation/cii-best-practices-badge/tree/master/doc/INSTALL.md and other materials are at https://github.com/linuxfoundation/cii-best-practices-badge/tree/master/doc/",Met,Its interface is defined here: https://github.com/linuxfoundation/cii-best-practices-badge/blob/master/doc/implementation.md#interface,Met,"It uses git, URL is https://github.com/linuxfoundation/cii-best-practices-badge",Met,"Uses git to track this. Repository on GitHub, which uses git. git can track the changes, who made them, and when they were made.",Met,"Interim versions are put on git, not just final versions.",Met,"Uses git. Repository on GitHub, which uses git. git is distributed.",Met,The primary single user uses git commit records to identify releases.,Unmet,"BadgeApp undergoes continuous integration and is then deployed to a single site, <https://bestpractices.coreinfrastructure.org/>.  We used Semantic Versioning for a while, but SemVer is a poor fit for this kind of situation, and we eventually gave up the practice.  Every version continues to have a unique version identifier: the git commit id.",Met,Full releases are tagged using 'git tag'.,Met,"CHANGELOG file is in top directory, see: https://github.com/linuxfoundation/cii-best-practices-badge/blob/master/CHANGELOG.md",Met,"We intend to do that, though we don't know of any for-certain publicly known vulnerabilities.

Our release notes do document that commit fdb83380 on 2015-11-26 updated gem nokogiri from 1.6.6.2 to 1.6.6.4 due to CVE-2015-1819.  It's not clear if our application was actually vulnerable; it was easier to simply upgrade.  In any case, we upgraded immediately, and this is documented in our release notes.
",?,,Met,"Yes, GitHub issue tracker.",Met,"Yes, either GitHub issue tracker or mailing list.  See: https://github.com/linuxfoundation/cii-best-practices-badge/blob/master/README.md",Met,"Yes.  Not many have been submitted so far, but we've responded.",Met,The project has been responding to most enhancement requests.,Met,"Yes, via GitHub isue tracker: https://github.com/linuxfoundation/cii-best-practices-badge/issues",Met,https://github.com/linuxfoundation/cii-best-practices-badge/issues,Met,https://github.com/linuxfoundation/cii-best-practices-badge/blob/master/CONTRIBUTING.md,Met,"No external reports so far, so this is vacuously true.",,"The software is written using Ruby and Javascript, and their implementations run directly on the source code.",,Note that a Gemfile.lock file and Rake tasks are provided to enable others to quickly recreate a development environment.,,,Met,"Yes, it includes a test suite based on minitest (the test framework that comes with Rails).",Met,"Yes. ""rake test"" invokes the automated test suite. The default ""rake"" command includes ""rake test"".  This is documented in [CONTRIBUTING.md](https://github.com/coreinfrastructure/best-practices-badge/blob/master/CONTRIBUTING.md).",Met,"Met.  Currently coverage of the ruby code is over 90%, and most of the code is in Ruby.",Met,"Yes.  The CONTRIBUTING file at <https://github.com/linuxfoundation/cii-best-practices-badge/blob/master/CONTRIBUTING.md> says,  ""When adding or changing functionality, please include new tests for them as part of your contribution"". Also, the project home page shows the test coverage, which encourages adding tests as new functionality is added.",Met,Tests are added as new functionality is added.,Met,"Yes.  The CONTRIBUTING file at <https://github.com/linuxfoundation/cii-best-practices-badge/blob/master/CONTRIBUTING.md> says,  ""When adding or changing functionality, please include new tests for them as part of your contribution"".",Met,"The set of tools used for examining code quality are listed in [CONTRIBUTING.md](https://github.com/linuxfoundation/cii-best-practices-badge/blob/master/CONTRIBUTING.md).

The project uses rubocop and rails_best_practices to check for code quality errors in Ruby code; eslint is used to look for problems in Javascript.  The markdown documentation is scanned with markdownlink.",Met,In general warnings are addressed.  In some cases warnings are disabled for specific cases.,Met,The settings for the warning tools are generally fairly strict.,Met,"David A. Wheeler, lead developer, literally wrote the code on how to design secure software: http://www.dwheeler.com/secure-programs",Met,"For a discussion of security requirements, common types of security vulnerabilities, and how this application counters those common kinds of vulnerabilities, see: https://github.com/linuxfoundation/cii-best-practices-badge/blob/master/doc/security.md",Met,"The software uses bcrypt to store salted hashed iterated passwords, and https+standard crypto protocols to communicate with users.",Met,"Uses 'bcrypt' gem for bcrypt, and https implementation built into its web server.",Met,"All required functionality is implemented using FLOSS, including cryptography.",,"Note: This application uses bcrypt, which uses 128-bit salt and produces 184 bits as a salted encrypted iterated hash.  This is less than 224 bits, but that's not really what the 224 bits of hash are for.  This probably needs clarification in the criteria; see https://github.com/linuxfoundation/cii-best-practices-badge/issues/153",Met,"The only cryptographic algorithm directly used by the program is bcrypt, which is not broken.",,Nothing in the code inhibits or prevents the use of PFS; that is a property of the website's web server.,Met,Bcrypt used for storing local passwords.,Met,"The nonce for the salt is created by the bcrypt gem; its engine.rb file shows that it uses OpenSSL to get cryptographically random data for the salt (on Java it would use SecureRandom, which is still fine, but that is not the default configuration). Other nonces are part of the https implementation, which are implemented by the web server (not this application).",Met,Uses https.,Met,Does not make this mistake.,Met,No such vulnerabilities at this time.,Met,No such vulnerabilities at this time.,Met,"As noted in <https://github.com/linuxfoundation/cii-best-practices-badge/blob/master/CONTRIBUTING.md>, Brakeman, Rubocop, and rails_best_practices are used to analyze the Ruby code.  Brakeman is specifically designed to analyze Ruby on Rails code.  The Javascript client-side code is analyzed with ESLint, using over 100 rules.

These analysis tools are used as part of the default 'rake' process used in local development, as well as the ""pronto"" process run on the continuous integration server running on CircleCI.",Met,Brakeman specifically looks for common vulnerabilities in Ruby on Rails applications.,Met,"This is vacuously true, since we've had no reports of vulnerabilities that apply to a deployed system.",Met,"All commits to GitHub are run through CircleCI, which performs a number of static analysis checks (Brakeman, Rubocop, etc.).",Met,Analyzed with OWASP ZAP by Emily Ratliff,,"Application written using Ruby and Javascript, not C/C++",Unmet,"Instead of embedding run-time assertions, there are many external tests with assertions that are checked during automated testing.",Met,A few minor issues were found by OWASP ZAP during development; these have already been fixed.,"We hope to see many other projects get their badge. Please start!

Note that this badge entry is released under at least the Creative Commons Attribution version 3.0 or later license (CC-BY-3.0+).",2015-10-23 22:02:10 UTC,2021-12-23 18:04:44 UTC,Met,"The only cryptography used directly by this application is bcrypt  (used for storing passwords as salted iterated hashes).  At the time of this writing, no serious breaks are known in bcrypt.  The application also depends on the web server's https configuration, but that is out of scope for this code.",Met,"Code is frequently integrated back into GitHub; CircleCI and several other tools are then run on the result to determine if there's a problem.  If a problem is found, the tools provide feedback via GitHub.  For more information, see the [BadgeApp's status on CircleCI](https://circleci.com/gh/coreinfrastructure/best-practices-badge).",,Met,GitHub issue tracker and pull requests support discussion,Met,"No valid private credentials are leaked.  There is a [.env](https://github.com/linuxfoundation/cii-best-practices-badge/blob/master/.env) file, but it only includes stub data for testing, not the live credentials.",Met,"All documentation is in English, and the project accepts bug reports and comments in English.",Met,"We use various HTTP headers for hardening, including a rigorous Content Security Policy (CSP) setting.  For more information, see [security.md](https://github.com/linuxfoundation/cii-best-practices-badge/blob/master/doc/security.md) which discusses the hardening mechanisms.",Met,https://github.com/linuxfoundation/cii-best-practices-badge,Met,"Github uses TLS 1.2, see <https://github.com/linuxfoundation/cii-best-practices-badge>.",Met,"The software does not directly implement TLS, instead, it depends on the webserver and Ruby libraries to implement TLS - including certificate checking.  That said, there *is* a case where TLS certificate verification is necessary.

The only case where TLS certificate verification matters is that this application uses OAuth for access delegation (in this case, we contact GitHub to determine if someone is the claimed GitHub user).  In this case it *does* need to verify the TLS certificate, because if anyone could pretend to be the access delagatee (e.g., GitHub) then they could claim anything.  The application does not do this directly, instead this is done by the gems (Ruby libraries) we call for this purpose, which perform this checking.

Other than that, this application does not use TLS certificate verification.  That's because it implements a server-side application, not a client-side application, and uses name/password or GitHub authentication for user authentication (not TLS certificates).",Met,"The software does not directly implement TLS, instead, it depends on the webserver and Ruby libraries to implement TLS - including certificate checking.  That said, there *is* a case where TLS certificate verification is necessary, and this is supported (indirectly) by the systems it depends on.

The only case where TLS certificate verification matters is that this application uses OAuth for access delegation (in this case, we contact GitHub to determine if someone is the claimed GitHub user).  In this case it *does* need to verify the TLS certificate, because if anyone could pretend to be the access delagatee (e.g., GitHub) then they could claim anything.  The application does not do this directly, instead this is done by the gems (Ruby libraries) we call for this purpose, which perform this checking.

Other than that, this application does not use TLS certificate verification.  That's because it implements a server-side application, not a client-side application, and uses name/password or GitHub authentication for user authentication (not TLS certificates).",Met,"We use GitHub, and [securityheaders.io verifies that our sites meet this criterion](https://securityheaders.io/?q=https%3A%2F%2Fgithub.com%2Fcoreinfrastructure%2Fbest-practices-badge&followRedirects=on).",Met,"We include an install script, `install_badge_dev_env` which allows devs to quickly install the software for development.  This script uses calls to various package managers to install all necessary dependencies quickly and easily.  The uninstall process is documented in [doc/INSTALL.md](https://github.com/linuxfoundation/cii-best-practices-badge/blob/master/doc/INSTALL.md).",,"The code is written in Ruby and Javascript, which are not delivered as compiled executables.",100,2016-01-12 22:55:00 UTC,,,False,"Ruby, JavaScript",74,100,Met,"We require a DCO for contributions, as documented in https://github.com/linuxfoundation/cii-best-practices-badge/blob/master/CONTRIBUTING.md which says:

> All contributions (including pull requests) must agree to the [Developer Certificate of Origin (DCO) version 1.1](doc/dco.txt).
This is exactly the same one created and used by the Linux kernel developers and posted on <http://developercertificate.org/>. This is a developer's certification that he or she has the right to submit the patch for inclusion into the project.
",Met,The governance mode of the Badge app is outlined in on our GitHub repository within [doc/governance.md](https://github.com/coreinfrastructure/best-practices-badge/blob/master/doc/governance.md),Met,See [CODE_OF_CONDUCT](https://github.com/coreinfrastructure/best-practices-badge/blob/master/CODE_OF_CONDUCT.md).,Met,"The document [doc/governance.md](https://github.com/coreinfrastructure/best-practices-badge/blob/master/doc/governance.md) describes the key roles, which are basically ""technical lead"" and ""others with commit rights"".  It also identifies who has those roles.",Met,"This project is run by the Linux Foundation, a 501(c)6.  Multiple people are authorized to do all these activities (create and close issues, accept proposed changes, and release versions of software), including David A. Wheeler, Jason Dossett, Marcus Streets, Nicko van Someren, and Dan Kohn.  See [CREDITS])(https://github.com/linuxfoundation/cii-best-practices-badge/blob/master/CREDITS.md). The Linux Foundation could authorize others, if needed.  Thus, the project can continue even if any one person is incapacitated or killed.",Met,"David A. Wheeler, Jason Dossett, and Dan Kohn are all very familiar with the software and could easily continue its maintenance if necessary.  Many other people have contributed per [CREDITS](https://github.com/linuxfoundation/cii-best-practices-badge/blob/master/CREDITS.md) and several of them could also probably maintain it if absolutely necessary. See [GitHub contributors statistics](https://github.com/coreinfrastructure/best-practices-badge/graphs/contributors) for the latest statistics on contributors.",Met,"The [project roadmap](https://github.com/coreinfrastructure/best-practices-badge/blob/master/doc/roadmap.md) explains these things.  Note that the project is in sustainment, so we're focusing more on continuous smaller improvements instead of massive changes.",Met,The design is documented in [doc/implementation.md](https://github.com/linuxfoundation/cii-best-practices-badge/blob/master/doc/implementation.md),Met,The security requirements and assurance case are documented in [doc/security.md](https://github.com/linuxfoundation/cii-best-practices-badge/blob/master/doc/implementation.md).,Met,"The [doc/INSTALL.md](https://github.com/coreinfrastructure/best-practices-badge/blob/master/doc/INSTALL.md) installation manual also includes ""quick start"" information to help someone get started.  In particular, it describes how to start up the program, access it via a web browser, become an administrator, and access its internal state to perform a few tasks.",Met,"We routinely update the documentation when a new capability is added.

For example, when the software was modified on 2017-05-27 to support a separate runtime configuration environment variable to set the database pool size (originally commit 8eef5e77ec5b08bc6714e2aa5a6139e71e55ff2b), by the next day (2017-05-28) in commit 1a8bcb5c5b40751ca874bd0b550f25a6aa8d7ea5 the documentation was modified to record it.",Met,"We record on our [homepage](https://github.com/linuxfoundation/cii-best-practices-badge) that we have a CII best practices badge, good code coverage, and that we use CircleCI as our continuous integration (CI) system.",Met,"We generally follow accessibility best practices, e.g., we provide ALT values for images where relevant.

We use this website to find accessibility problems:
https://achecker.ca/checker/index.php
We've checked the following paths (these are key forms in the system): ""/"", ""/signup"", ""/login"", ""/projects"", and ""/projects/1"".  There are no known problems and no likely problems.",Met,"The software is internationalized using standard [Ruby on Rails mechanisms](http://guides.rubyonrails.org/i18n.html).  This data is then sent on to the JavaScript code where appropriate.  We use translation.io to manage the translations.
",Met,"We use [GitHub, who meet this criterion](https://help.github.com/articles/github-security/).",Met,"Normally only a single version of the product is in production use.  That said, it's important to handle upgrades, especially so that various developers can upgrade.  How to upgrade is documented in [CONTRIBUTING.md](https://github.com/linuxfoundation/cii-best-practices-badge/blob/master/CONTRIBUTING.md).

Here is a summary of common cases:
* Upgrading often involves a database migration, which is handled by running ""rake db:migration"" (if the user forgets to do this, it is detected, running stops, and this information is presented).
* Other upgrades generally involve installing updated gems (libraries), which are handled with ""bundle update"".
* In rare cases an update to the Ruby language is needed; the steps to do this are also in [CONTRIBUTING.md](https://github.com/linuxfoundation/cii-best-practices-badge/blob/master/CONTRIBUTING.md).",,"We've never had an external bug reporter.

[CONTRIBUTING.md](https://github.com/linuxfoundation/cii-best-practices-badge/blob/master/CONTRIBUTING.md) notes that:

> We will gladly give credit to anyone who reports a vulnerability so that we can fix it. If you want to remain anonymous or pseudonymous instead,  please let us know that; we will gladly respect your wishes.

This is emphasized in the vulnerability report handling process [doc/security.md](https://github.com/linuxfoundation/cii-best-practices-badge/blob/master/doc/implementation.md), where the last step is giving credit.",Met,The vulnerability report handling process is documented in [doc/security.md](https://github.com/linuxfoundation/cii-best-practices-badge/blob/master/doc/implementation.md).,Met,"[CONTRIBUTING.md](https://github.com/linuxfoundation/cii-best-practices-badge/blob/master/CONTRIBUTING.md) documents our coding style guides.

As documented there:
* For Ruby on Rails, we generally follow the [community Ruby style guide](https://github.com/bbatsov/ruby-style-guide) and the complementary [community Rails style guide](https://github.com/bbatsov/rails-style-guide).
* For JavaScript, our coding style is based on the [Node.js style guide](https://github.com/felixge/node-style-guide).",Met,"[CONTRIBUTING.md](https://github.com/linuxfoundation/cii-best-practices-badge/blob/master/CONTRIBUTING.md) documents our coding style enforcement mechanisms.

As documented there:
* For Ruby on Rails, we use rubocop and rails_best_practices for style enforcement (as well as Brakeman to find vulnerabilities)
* For JavaScript, we ESLint.",,"The application does not create native binaries.  (Some of the libraries it depends on do, but those are external.)",,"The application does not create native binaries.  (Some of the libraries it depends on do, but those are external.)",,"The application does not create native binaries.  (Some of the libraries it depends on do, but those are external.)",,"The application does not create native binaries.  (Some of the libraries it depends on do, but those are external.)  It is written in scripting languages where the source code is used directly.",,"There is no installation system for build artifacts, as it's written using scripts.

It could be said that Rails builds web application assets (e.g., minified and concatenated JavaScript, and combined CSS); under that interpretation, they are written by the Rails framework as part of the execution of the Rails asset pipeline, and this is controlled in the usual way by controlling the framework.",Met,"The software is installed using standard conventions for this kind of software.  The underlying Ruby libraries are installed using bundler (the usual Ruby package manager).  Lower-level system components are normally installed using the system package manager.

It's possible to install these quickly, using a provided installation shell script that determines which system package manager to use & tries to automatically install whatever is needed, including the tests and test environment.  The instructions for quickly installing everything is in [INSTALL.md](https://github.com/linuxfoundation/cii-best-practices-badge/blob/master/doc/INSTALL.md).",Met,External dependencies are stored in a [Gemfile](https://github.com/linuxfoundation/cii-best-practices-badge/blob/master/Gemfile).,Met,"External dependency checking is performed in two ways:

* bundle_audit.  This checks all gems for known vulnerabilities.  This is run on every execution of the ""rake"" local check task and on every run of the continuous integration task on CircleCI.
* [Gemnasium](https://gemnasium.com/linuxfoundation/cii-best-practices-badge).  This also checks gems for known vulnerabilities, and puts the current status on a badge that is displayed on the front page of the project home page.

For the few external dependencies that aren't managed as gems (e.g., PostgreSQL) the system package managers and/or the deployment system's managers are used to maintain them & periodically check them.",Met,"The project uses bundler, the standard package management solution for Ruby, for most externally-maintained components.  For the rest (e.g., PostgreSQL) it uses the system package manager.",Met,We avoid depending on deprecated/obsolete functions.,Met,"We use [CircleCI](https://circleci.com/gh/linuxfoundation/cii-best-practices-badge) to automatically test every check in to any branch in our repository.  I some circumstances experimental branches which do not yet run even in a development environment may be ignored via a custom entry in our circle.yml file.  The master, staging, and production  branches are always tested.",Met,"When regressions occur, we add tests for them.",Met,"As of this writing, we have 100% statement coverage, see [Codecov.io](https://codecov.io/gh/linuxfoundation/cii-best-practices-badge).",Met,"Yes, this is a documented policy in [CONTRIBUTING.md](https://github.com/linuxfoundation/cii-best-practices-badge/blob/master/CONTRIBUTING.md) which says:

> When adding or changing functionality, please include new tests for them as part of your contribution.",Met,"They are implemented, as described in [doc/security.md](https://github.com/linuxfoundation/cii-best-practices-badge/blob/master/doc/security.md).
",Met,"All inputs from potentially untrusted sources are checked & rejected if they are invalid.  Some, such as justifications, only have a few limitations (must be UTF-8 and have a limited length). For more information, see [security.md](https://github.com/linuxfoundation/cii-best-practices-badge/blob/master/doc/security.md).",,"This implements a web application, and the (external) web server determines what cryptographic algorithms are in use by the user.  If the web server supports multiple cryptographic algorithms (and it usually would), then the application does.  The functionality that calls out to other systems (e.g., OAUTH for GitHub, and data access for the detectives) are also external (and they support multiple algorithms anyway).",Met,"All authentication credentials can be provided via environment variables when run in production, so no useful key is stored in the source code.",,"Releases are not intended for widespread use in many different sites, so this is N/A.
",Unmet,"In production the software is run in a single site, so the need for signed versions is less.",100,Met,"There are [at least 22 contributors](https://github.com/coreinfrastructure/best-practices-badge/graphs/contributors), and at least three significant contributors today: David A. Wheeler (IDA), Jason Dossett (IDA), and Dan Kohn (Linux Foundation).  For this work, IDA works for the Core Infrastructure Initiative (CII), which is a project of the Linux Foundation (LF). However, the LF is itself a [nonprofit mutual benefit corporation (specifically a Section 501(c)(6))](https://www.linuxfoundation.org/bylaws/).  As a nonprofit mutual benefit corporation, the LF is directed by other organizations which actually provide funding to do this work, and thus the LF and CII can be viewed as ""pass through"" organizations as described in this criterion.
",Met,Each source file has a copyright statement in its header.  See [CONTRIBUTING.md](https://github.com/linuxfoundation/cii-best-practices-badge/blob/master/CONTRIBUTING.md) for the instructions for Ruby (nearly all source files are in Ruby).,Met,Each source file has a copyright statement in its header (MIT).  See [CONTRIBUTING.md](https://github.com/linuxfoundation/cii-best-practices-badge/blob/master/CONTRIBUTING.md) for the instructions for Ruby source files (nearly all source files are in Ruby).,Met,"We use the ""up-for-grabs"" tag.  This is noted on the [front page of the repo](https://github.com/coreinfrastructure/best-practices-badge).",Met,The Core Infrastructure Initiative (CII) requires two-factor authentication for all organization members and outside collaborators as described in [Requiring two-factor authentication in your organization](https://help.github.com/articles/requiring-two-factor-authentication-in-your-organization/).,Met,Project governance specifically documents that SMS is not acceptable; see [governance.md](https://github.com/coreinfrastructure/best-practices-badge/blob/master/doc/governance.md).,Met,"The file [CONTRIBUTING.md](https://github.com/coreinfrastructure/best-practices-badge/blob/master/CONTRIBUTING.md) describes the code review requirements.  E.G., changes to the code built on Rails must follow the [Rails community style guide](https://github.com/bbatsov/rails-style-guide).  The continuous integration tasks run a large number of checks, e.g., all Ruby code must go through Rubocop, and all JavaScript code must go through ESLint (with the given conditions).  We absolutely require that the Ruby code have at least 90% statement coverage, but we typically don't accept statement coverage less than 100%.",Met,"We have a policy in [CONTRIBUTING.md](https://github.com/coreinfrastructure/best-practices-badge/blob/master/CONTRIBUTING.md) that modifications other than low-risk modifications be reviewed by someone else, and a stated goal of having at least 50% of all proposed modifications to be reviewed.",Met,"As of this writing, we have 100% statement coverage, see [Codecov.io](https://codecov.io/gh/linuxfoundation/cii-best-practices-badge).",,"There are no top-to-bottom FLOSS tools available in Ruby which can measure branch coverage.   Ruby version 2.5 was the first version that enabled capturing branch coverage, and it was only released on 2017-12-25.  Other tools on top of Ruby need to be modified so that they can use this information, e.g., [simplecov issue 412](https://github.com/colszowka/simplecov/issues/412) proposed adding branch coverage support to simplecov.",Met,"We have performed a self-assessment of our security, and it is documented in [security.md](https://github.com/coreinfrastructure/best-practices-badge/blob/master/doc/security.md).  This considered the security requirements and security boundary, and examined the high-level architecture.  We used static & dynamic tools, as well as human review (especially of the major design components).  This was *not* an independent evaluation, but the criterion doesn't require that.",Met,The security requirements and assurance case are documented in [doc/security.md](https://github.com/linuxfoundation/cii-best-practices-badge/blob/master/doc/implementation.md).,Met,,Met,,300,,,,,,2016-01-12 22:55:00 UTC,,,Met,
