,id,user_id,name,description,homepage_url,repo_url,license,homepage_url_status,homepage_url_justification,sites_https_status,sites_https_justification,description_good_status,description_good_justification,interact_status,interact_justification,contribution_status,contribution_justification,contribution_requirements_status,contribution_requirements_justification,license_location_status,license_location_justification,floss_license_status,floss_license_justification,floss_license_osi_status,floss_license_osi_justification,documentation_basics_status,documentation_basics_justification,documentation_interface_status,documentation_interface_justification,repo_public_status,repo_public_justification,repo_track_status,repo_track_justification,repo_interim_status,repo_interim_justification,repo_distributed_status,repo_distributed_justification,version_unique_status,version_unique_justification,version_semver_status,version_semver_justification,version_tags_status,version_tags_justification,release_notes_status,release_notes_justification,release_notes_vulns_status,release_notes_vulns_justification,report_url_status,report_url_justification,report_tracker_status,report_tracker_justification,report_process_status,report_process_justification,report_responses_status,report_responses_justification,enhancement_responses_status,enhancement_responses_justification,report_archive_status,report_archive_justification,vulnerability_report_process_status,vulnerability_report_process_justification,vulnerability_report_private_status,vulnerability_report_private_justification,vulnerability_report_response_status,vulnerability_report_response_justification,build_status,build_justification,build_common_tools_status,build_common_tools_justification,build_floss_tools_status,build_floss_tools_justification,test_status,test_justification,test_invocation_status,test_invocation_justification,test_most_status,test_most_justification,test_policy_status,test_policy_justification,tests_are_added_status,tests_are_added_justification,tests_documented_added_status,tests_documented_added_justification,warnings_status,warnings_justification,warnings_fixed_status,warnings_fixed_justification,warnings_strict_status,warnings_strict_justification,know_secure_design_status,know_secure_design_justification,know_common_errors_status,know_common_errors_justification,crypto_published_status,crypto_published_justification,crypto_call_status,crypto_call_justification,crypto_floss_status,crypto_floss_justification,crypto_keylength_status,crypto_keylength_justification,crypto_working_status,crypto_working_justification,crypto_pfs_status,crypto_pfs_justification,crypto_password_storage_status,crypto_password_storage_justification,crypto_random_status,crypto_random_justification,delivery_mitm_status,delivery_mitm_justification,delivery_unsigned_status,delivery_unsigned_justification,vulnerabilities_fixed_60_days_status,vulnerabilities_fixed_60_days_justification,vulnerabilities_critical_fixed_status,vulnerabilities_critical_fixed_justification,static_analysis_status,static_analysis_justification,static_analysis_common_vulnerabilities_status,static_analysis_common_vulnerabilities_justification,static_analysis_fixed_status,static_analysis_fixed_justification,static_analysis_often_status,static_analysis_often_justification,dynamic_analysis_status,dynamic_analysis_justification,dynamic_analysis_unsafe_status,dynamic_analysis_unsafe_justification,dynamic_analysis_enable_assertions_status,dynamic_analysis_enable_assertions_justification,dynamic_analysis_fixed_status,dynamic_analysis_fixed_justification,general_comments,created_at,updated_at,crypto_weaknesses_status,crypto_weaknesses_justification,test_continuous_integration_status,test_continuous_integration_justification,cpe,discussion_status,discussion_justification,no_leaked_credentials_status,no_leaked_credentials_justification,english_status,english_justification,hardening_status,hardening_justification,crypto_used_network_status,crypto_used_network_justification,crypto_tls12_status,crypto_tls12_justification,crypto_certificate_verification_status,crypto_certificate_verification_justification,crypto_verification_private_status,crypto_verification_private_justification,hardened_site_status,hardened_site_justification,installation_common_status,installation_common_justification,build_reproducible_status,build_reproducible_justification,badge_percentage_0,achieved_passing_at,lost_passing_at,last_reminder_at,disabled_reminders,implementation_languages,lock_version,badge_percentage_1,dco_status,dco_justification,governance_status,governance_justification,code_of_conduct_status,code_of_conduct_justification,roles_responsibilities_status,roles_responsibilities_justification,access_continuity_status,access_continuity_justification,bus_factor_status,bus_factor_justification,documentation_roadmap_status,documentation_roadmap_justification,documentation_architecture_status,documentation_architecture_justification,documentation_security_status,documentation_security_justification,documentation_quick_start_status,documentation_quick_start_justification,documentation_current_status,documentation_current_justification,documentation_achievements_status,documentation_achievements_justification,accessibility_best_practices_status,accessibility_best_practices_justification,internationalization_status,internationalization_justification,sites_password_security_status,sites_password_security_justification,maintenance_or_update_status,maintenance_or_update_justification,vulnerability_report_credit_status,vulnerability_report_credit_justification,vulnerability_response_process_status,vulnerability_response_process_justification,coding_standards_status,coding_standards_justification,coding_standards_enforced_status,coding_standards_enforced_justification,build_standard_variables_status,build_standard_variables_justification,build_preserve_debug_status,build_preserve_debug_justification,build_non_recursive_status,build_non_recursive_justification,build_repeatable_status,build_repeatable_justification,installation_standard_variables_status,installation_standard_variables_justification,installation_development_quick_status,installation_development_quick_justification,external_dependencies_status,external_dependencies_justification,dependency_monitoring_status,dependency_monitoring_justification,updateable_reused_components_status,updateable_reused_components_justification,interfaces_current_status,interfaces_current_justification,automated_integration_testing_status,automated_integration_testing_justification,regression_tests_added50_status,regression_tests_added50_justification,test_statement_coverage80_status,test_statement_coverage80_justification,test_policy_mandated_status,test_policy_mandated_justification,implement_secure_design_status,implement_secure_design_justification,input_validation_status,input_validation_justification,crypto_algorithm_agility_status,crypto_algorithm_agility_justification,crypto_credential_agility_status,crypto_credential_agility_justification,signed_releases_status,signed_releases_justification,version_tags_signed_status,version_tags_signed_justification,badge_percentage_2,contributors_unassociated_status,contributors_unassociated_justification,copyright_per_file_status,copyright_per_file_justification,license_per_file_status,license_per_file_justification,small_tasks_status,small_tasks_justification,require_2FA_status,require_2FA_justification,secure_2FA_status,secure_2FA_justification,code_review_standards_status,code_review_standards_justification,two_person_review_status,two_person_review_justification,test_statement_coverage90_status,test_statement_coverage90_justification,test_branch_coverage80_status,test_branch_coverage80_justification,security_review_status,security_review_justification,assurance_case_status,assurance_case_justification,achieve_passing_status,achieve_passing_justification,achieve_silver_status,achieve_silver_justification,tiered_percentage,repo_url_updated_at,achieved_silver_at,lost_silver_at,achieved_gold_at,lost_gold_at,first_achieved_passing_at,first_achieved_silver_at,first_achieved_gold_at,maintained_status,maintained_justification
0,3980,5404,ftp,Basic FTP package written in Go,https://github.com/jmichalak9/ftp,https://github.com/jmichalak9/ftp,,?,,Met,Given only https: URLs.,?,,?,,Met,"Projects on GitHub by default use issues and pull requests, as encouraged by documentation such as <https://guides.github.com/activities/contributing-to-open-source/>.",?,,Unmet,// No license location file found.,?,,?,,Unmet,// No appropriate folder found for documentation basics.,?,,Met,"Repository on GitHub, which provides public git repositories with URLs.",Met,"Repository on GitHub, which uses git. git can track the changes, who made them, and when they were made.",?,,Met,"Repository on GitHub, which uses git. git is distributed.",?,,?,,?,,Unmet,// No release notes file found.,?,,?,,?,,?,,?,,?,,?,,?,,?,,?,,?,,?,,?,,?,,?,,?,,?,,?,,?,,?,,?,,?,,?,,?,,?,,?,,?,,?,,?,,?,,?,,?,,?,,?,,?,,?,,?,,?,,?,,?,,?,,?,,?,,?,,,2020-05-26 07:40:58 UTC,2020-05-26 07:40:58 UTC,?,,?,,,Met,GitHub supports discussions on issues and pull requests.,?,,?,,?,,?,,?,,?,,?,,Met,Found all required security hardening headers.,?,,?,,10,,,2022-05-07 23:00:33 UTC,False,Go,9,0,?,,?,,?,,?,,?,,?,,?,,?,,?,,?,,?,,?,,?,,?,,?,,?,,?,,?,,?,,?,,?,,?,,?,,?,,?,,?,,?,,?,,?,,?,,?,,?,,?,,?,,?,,?,,?,,?,,?,,?,,4,?,,?,,?,,?,,?,,?,,?,,?,,?,,?,,?,,?,,Unmet,,Unmet,,10,,,,,,,,,Met,
1,3981,5405,dyndns-netcup-go,Dyndns client for the netcup dns api written in go.,https://github.com/Hentra/dyndns-netcup-go,https://github.com/Hentra/dyndns-netcup-go,MIT,?,,Met,Given only https: URLs.,Met,This is met by having a describtive README on the github repository. https://github.com/Hentra/dyndns-netcup-go,Met,This is met by having a describtive README on the github repository. https://github.com/Hentra/dyndns-netcup-go,Met,"Projects on GitHub by default use issues and pull requests, as encouraged by documentation such as <https://guides.github.com/activities/contributing-to-open-source/>.",?,,Met,Non-trivial license location file in repository: <https://github.com/Hentra/dyndns-netcup-go/blob/master/LICENSE>.,Met,The MIT license is approved by the Open Source Initiative (OSI).,Met,The MIT license is approved by the Open Source Initiative (OSI).,Met,The source code of the software is documented. https://github.com/Hentra/dyndns-netcup-go,Met,The provided software does expose its interface through the cli. This is documented in the README file. https://github.com/Hentra/dyndns-netcup-go,Met,"Repository on GitHub, which provides public git repositories with URLs.",Met,"Repository on GitHub, which uses git. git can track the changes, who made them, and when they were made.",Met,This is met using the git version control system which has interim version in the form of commits.,Met,"Repository on GitHub, which uses git. git is distributed.",Met,This is met by using the release system of github where each version has its own unique version number. https://github.com/Hentra/dyndns-netcup-go/releases,Met,,Met,"This is met using git tags: Every release gets a tag in the SemVer format. Example: Initial release v0.1.0 got tag v0.1.0 https://github.com/Hentra/dyndns-netcup-go/tree/v0.1.0
",Met,The release notes are made using the git release feature. The release notes for version v0.2.0 can be found at https://github.com/Hentra/dyndns-netcup-go/releases.,,There have been no publicy known vulnerabilities. This can be seen on the Issue tracke where there is no such report https://github.com/Hentra/dyndns-netcup-go/issues.,?,,Met,This is met by using the github issue tracker https://github.com/Hentra/dyndns-netcup-go/issues.,Met,This is met by using the github issue tracker https://github.com/Hentra/dyndns-netcup-go/issues.,Met,There are no unacknowledged 2-12 month old bugs. https://github.com/Hentra/dyndns-netcup-go/issues,Met,There are no unacknowledged 2-12 month old feature requests. https://github.com/Hentra/dyndns-netcup-go/issues,Met,This is met by using the github issue tracker https://github.com/Hentra/dyndns-netcup-go/issues.,Met,This is met by using the github issue tracker https://github.com/Hentra/dyndns-netcup-go/issues.,,Vulnerability reports are always public.,, There have been no vulnerabilities reported in the last 6 months. https://github.com/Hentra/dyndns-netcup-go/issues,Met,This is met by using github actions. https://github.com/Hentra/dyndns-netcup-go/actions,Met,This is met by using the standart golang compile tools.,Met,This project uses the golang toolchain which is FLOSS.,?,,?,,?,,?,,?,,?,,?,,,The Go programming language only produces errors and no warnings.,?,,Met,This is met by having a developer who is a certifiated tester.,Met,This is met by having a developer who is a certifiated tester.,,,,,,,,,,,,,,,,,Met,This is met by usign https on all REST-Requests.,Met,This is not the case.,Met, There are no open reported vulnerabilities. https://github.com/Hentra/dyndns-netcup-go/issues,Met, There are no open reported vulnerabilities. https://github.com/Hentra/dyndns-netcup-go/issues,?,,?,,?,,?,,?,,,The software of this project is written in go which is memory safe.,?,,?,,,2020-05-26 08:25:29 UTC,2021-06-08 07:31:23 UTC,,,?,,,Met,GitHub supports discussions on issues and pull requests.,Met,Configuration files that require passwords are not checked into the git repository. ,Met,,?,,?,,?,,?,,?,,Met,Found all required security hardening headers.,?,,?,,75,,,2022-05-07 23:00:33 UTC,False,"Go, Shell",21,5,?,,?,,?,,?,,?,,?,,?,,?,,?,,?,,?,,?,,?,,?,,?,,?,,?,,?,,?,,?,,?,,?,,?,,?,,?,,?,,?,,?,,?,,?,,?,,?,,?,,?,,?,,?,,?,,?,,?,,?,,4,?,,?,,?,,?,,?,,?,,?,,?,,?,,?,,?,,?,,Unmet,,Unmet,,75,,,,,,,,,Met,
2,3982,5406,label-exporter,"Exporter of GitHub labels in the form YAML, JSON and table.",https://github.com/FrenchBen/label-exporter,https://github.com/FrenchBen/label-exporter,,?,,Met,Given only https: URLs.,?,,?,,Met,"Projects on GitHub by default use issues and pull requests, as encouraged by documentation such as <https://guides.github.com/activities/contributing-to-open-source/>.",?,,Unmet,// No license location file found.,?,,?,,Unmet,// No appropriate folder found for documentation basics.,?,,Met,"Repository on GitHub, which provides public git repositories with URLs.",Met,"Repository on GitHub, which uses git. git can track the changes, who made them, and when they were made.",?,,Met,"Repository on GitHub, which uses git. git is distributed.",?,,?,,?,,Unmet,// No release notes file found.,?,,?,,?,,?,,?,,?,,?,,?,,?,,?,,?,,?,,?,,?,,?,,?,,?,,?,,?,,?,,?,,?,,?,,?,,?,,?,,?,,?,,?,,?,,?,,?,,?,,?,,?,,?,,?,,?,,?,,?,,?,,?,,?,,?,,,2020-05-26 17:51:46 UTC,2020-05-26 17:51:46 UTC,?,,?,,,Met,GitHub supports discussions on issues and pull requests.,?,,?,,?,,?,,?,,?,,?,,Met,Found all required security hardening headers.,?,,?,,10,,,2022-05-07 23:00:33 UTC,False,Go,9,0,?,,?,,?,,?,,?,,?,,?,,?,,?,,?,,?,,?,,?,,?,,?,,?,,?,,?,,?,,?,,?,,?,,?,,?,,?,,?,,?,,?,,?,,?,,?,,?,,?,,?,,?,,?,,?,,?,,?,,?,,4,?,,?,,?,,?,,?,,?,,?,,?,,?,,?,,?,,?,,Unmet,,Unmet,,10,,,,,,,,,Met,
3,3983,5410,watcher,"🏷️ Watches the changes in the file system, variables and data records",https://github.com/racherb/watcher,https://github.com/racherb/watcher,MIT,?,,Met,"The project website and repo use GitHub, which supports HTTPS using TLS. There's no separate download URL (use git to download from the repo).",Met,"Watcher is an open source system to automate the detection of changes in the system, facilitating the integration of processes, workflows and the development of monitoring applications.",Met,https://github.com/racherb/watcher/blob/master/CONTRIBUTING.md,Met,<https://github.com/racherb/watcher/blob/master/CONTRIBUTING.md>.,Met,https://github.com/Olivine-Labs/lua-style-guide,Met,https://github.com/racherb/watcher/blob/master/LICENSE,Met,The MIT license is approved by the Open Source Initiative (OSI).,Met,The MIT license is approved by the Open Source Initiative (OSI).,Met,"The directory ""docs"" contains most documentation.To access the documentation visit https://racherb.github.io/watcher/",Met,(Under construction),Met,"Repository on GitHub, which provides public git repositories with URLs.",Met,"Repository on GitHub, which uses git. git can track the changes, who made them, and when they were made.",Met,,Met,"Repository on GitHub, which uses git. git is distributed.",Met,,Met,,Met,,Met,<https://github.com/racherb/watcher/blob/master/CHANGELOG.md>.,Met,"We intend to do that, though we don't know of any for-certain publicly known vulnerabilities.",?,,Met,"Yes, GitHub issue tracker.",Met,https://github.com/racherb/watcher/issues,Met,"Yes. Not many have been submitted so far, but we've responded.",Met,"Not many have been submitted so far, but we've responded.",Met,"Yes, via GitHub isue tracker https://github.com/racherb/watcher/issues",Met,https://github.com/racherb/watcher/issues,,,Met,"No external reports so far, so this is vacuously true.",Met,"The software is written using Lua, and their implementations run directly on the source code.",,,Met,,Met,"Yes, it includes a test suite based on tap",Met,"Yes. ""prove -v ./test/watcher.test.lua"" or ""./test/watcher.test.lua"" invokes the automated test suite.",Met,,Met,"Yes. The CONTRIBUTING file says: ""When adding or changing functionality, please include new tests for them as part of your contribution""",Met,Tests are added as new functionality is added.,Met,"When adding or changing functionality, please include new tests for them as part of your contribution",Met,,Met,In general warnings are addressed.,Met,The settings for the warning tools are generally fairly strict.,Met,"Raciel H. lead developer, literally wrote the code on how to design secure software",Met,,Met,"The software use ""digest"" tarantool module.",Met,"""dig"" tarantool",,"All required functionality is implemented using FLOSS, including cryptography.",Met,"Note: This application uses ""digest.sha256""",,"The only cryptographic algorithm directly used by the program is ""digest"", which is not broken.",,,,,,,Met,Uses https.,Met,Does not make this mistake.,Met,No such vulnerabilities at this time.,Met,No such vulnerabilities at this time.,Met,Integration with travis includes static analysis through luacheck.,Met,"Vulnerability scanning is performed with Whitesource Bolt for Github and SYHUNT.
scancode https://github.com/racherb/watcher.git
SYHUNT Scan Result: SECURE",Met,"This is vacuously true, since we've had no reports of vulnerabilities that apply to a deployed system.",Met,"All commits to GitHub are run through Travis, which performs a number of static analysis checks",Met,"Syhunt Dynamic Augmented. DAST (Dynamic Application Security Testing), OAST (Out-of-Band Application Security Testing)",Met,"Application written using Lua, not C/C++",Met,Syhunt Dynamic Augmented,,,,2020-05-27 03:02:47 UTC,2021-04-07 04:34:02 UTC,Met,,Met,,cpe:2.3:a:watcher_project:watcher:0.1.1:*:*:*:*:*,Met,"GitHub supports discussions on issues and pull requests. In addition, the GitHub Discussion option has been enabled at https://github.com/racherb/watcher/discussions",Met,,Met,"All documentation is in English, and the project accepts bug reports and comments in English.",?,,?,,?,,?,,?,,Met,Found all required security hardening headers.,?,,?,,100,2021-04-07 04:34:02 UTC,,2021-03-23 23:00:50 UTC,False,Lua,41,13,?,,?,,?,,?,,?,,?,,?,,?,,?,,?,,?,,?,,?,,?,,?,,?,,?,,?,,?,,?,,?,,?,,?,,?,,?,,?,,?,,?,,?,,?,,?,,?,,?,,?,,?,,?,,?,,?,,?,,?,,13,?,,?,,?,,?,,?,,?,,?,,?,,?,,?,,?,,?,,Met,,Unmet,,113,,,,,,2021-04-07 04:34:02 UTC,,,Met,
4,3984,5412,Ludo-The_Game,"An implementation of the famous board game Ludo, using C++",https://github.com/AdityaGupta150/Ludo-The_Game,https://github.com/AdityaGupta150/Ludo-The_Game,,?,,Met,Given only https: URLs.,?,,?,,Met,"Projects on GitHub by default use issues and pull requests, as encouraged by documentation such as <https://guides.github.com/activities/contributing-to-open-source/>.",?,,Unmet,// No license location file found.,?,,?,,Unmet,// No appropriate folder found for documentation basics.,?,,Met,"Repository on GitHub, which provides public git repositories with URLs.",Met,"Repository on GitHub, which uses git. git can track the changes, who made them, and when they were made.",?,,Met,"Repository on GitHub, which uses git. git is distributed.",?,,?,,?,,Unmet,// No release notes file found.,?,,?,,?,,?,,?,,?,,?,,?,,?,,?,,Met,Non-trivial build file in repository: <https://github.com/AdityaGupta150/Ludo-The_Game/blob/master/Makefile>.,Met,Non-trivial build file in repository: <https://github.com/AdityaGupta150/Ludo-The_Game/blob/master/Makefile>.,?,,?,,?,,?,,?,,?,,?,,?,,?,,?,,?,,?,,?,,?,,?,,?,,?,,?,,?,,?,,?,,?,,?,,?,,?,,?,,?,,?,,?,,?,,?,,?,,,2020-05-27 11:18:13 UTC,2020-05-27 11:18:13 UTC,?,,?,,,Met,GitHub supports discussions on issues and pull requests.,?,,?,,?,,?,,?,,?,,?,,Met,Found all required security hardening headers.,?,,?,,13,,,2022-05-08 23:00:33 UTC,False,"C++, Makefile",9,0,?,,?,,?,,?,,?,,?,,?,,?,,?,,?,,?,,?,,?,,?,,?,,?,,?,,?,,?,,?,,?,,?,,?,,?,,?,,?,,?,,?,,?,,?,,?,,?,,?,,?,,?,,?,,?,,?,,?,,?,,4,?,,?,,?,,?,,?,,?,,?,,?,,?,,?,,?,,?,,Unmet,,Unmet,,13,,,,,,,,,Met,
5,3985,5414,suckit,Suck the InTernet,https://github.com/Skallwar/suckit,https://github.com/Skallwar/suckit,OTHER,?,,Met,Given only https: URLs.,?,,?,,Met,"Projects on GitHub by default use issues and pull requests, as encouraged by documentation such as <https://guides.github.com/activities/contributing-to-open-source/>.",?,,Unmet,// No license location file found.,?,,Unmet,// Did not find license in the OSI list.,Unmet,// No appropriate folder found for documentation basics.,?,,Met,"Repository on GitHub, which provides public git repositories with URLs.",Met,"Repository on GitHub, which uses git. git can track the changes, who made them, and when they were made.",?,,Met,"Repository on GitHub, which uses git. git is distributed.",?,,?,,?,,Unmet,// No release notes file found.,?,,?,,?,,?,,?,,?,,?,,?,,?,,?,,?,,?,,?,,?,,?,,?,,?,,?,,?,,?,,?,,?,,?,,?,,?,,?,,?,,?,,?,,?,,?,,?,,?,,?,,?,,?,,?,,?,,?,,?,,?,,?,,?,,?,,,2020-05-27 17:59:03 UTC,2020-05-27 17:59:03 UTC,?,,?,,,Met,GitHub supports discussions on issues and pull requests.,?,,?,,?,,?,,?,,?,,?,,Met,Found all required security hardening headers.,?,,?,,12,,,2022-05-09 23:00:33 UTC,False,"Rust, Python",9,0,?,,?,,?,,?,,?,,?,,?,,?,,?,,?,,?,,?,,?,,?,,?,,?,,?,,?,,?,,?,,?,,?,,?,,?,,?,,?,,?,,?,,?,,?,,?,,?,,?,,?,,?,,?,,?,,?,,?,,?,,4,?,,?,,?,,?,,?,,?,,?,,?,,?,,?,,?,,?,,Unmet,,Unmet,,12,,,,,,,,,Met,
6,3986,5417,Merkompiler,A JavaSST compiler written in Java as a study project,https://github.com/merkrafter/Merkompiler,https://github.com/merkrafter/Merkompiler,MIT,?,,Met,Given only https: URLs.,Met,The description is at the top of README.md.,Met,"The information can be obtained from README.md, and CONTRIBUTING.md.",Met,Non-trivial contribution file in repository: <https://github.com/merkrafter/Merkompiler/blob/development/CONTRIBUTING.md>.,Met,<https://github.com/merkrafter/Merkompiler/blob/development/CONTRIBUTING.md>,Met,Non-trivial license location file in repository: <https://github.com/merkrafter/Merkompiler/blob/development/LICENSE.md>.,Met,The MIT license is approved by the Open Source Initiative (OSI).,Met,The MIT license is approved by the Open Source Initiative (OSI).,Met,"https://github.com/merkrafter/Merkompiler/blob/development/README.md
https://github.com/merkrafter/Merkompiler/wiki",?,,Met,"Repository on GitHub, which provides public git repositories with URLs.",Met,"Repository on GitHub, which uses git. git can track the changes, who made them, and when they were made.",Met,,Met,"Repository on GitHub, which uses git. git is distributed.",Met,,Met,,Met,,Met,https://github.com/merkrafter/Merkompiler/releases,,no publicly known vulnerabilities so far,?,,Met,see above,Met,GitHub issues: https://github.com/merkrafter/Merkompiler/issues,Met,,Met,,Met,"GitHub issues https://github.com/merkrafter/Merkompiler/issues AND
GitHub Pull Requests https://github.com/merkrafter/Merkompiler/pulls",Met,https://github.com/merkrafter/Merkompiler/security/policy,,"As this program is not really used by anyone for now, security vulnerabilities may be reported publicly",,no security vulnerabilities so far,Met,Non-trivial build file in repository: <https://github.com/merkrafter/Merkompiler/blob/development/pom.xml>.,Met,Non-trivial build file in repository: <https://github.com/merkrafter/Merkompiler/blob/development/pom.xml>.,Met,Apache Maven,Met,See the https://github.com/merkrafter/Merkompiler/tree/development/src/test directory,Met,mvn kotlin:compile test,Unmet,Not implemented yet,Met,It is mentioned in the CONTRIBUTING.md file that any new functionality has to be tested if applicable.,?,,Met,It is mentioned in the CONTRIBUTING.md file that any new functionality has to be tested if applicable.,?,,?,,?,,Met,I myself had several courses at university and online,Met,see above,,No cryptography necessary,,,,,,,,,,,,,,,?,,?,,Met,,Met,There haven't been any yet.,Met,SpotBugs,?,,Unmet,Currently worked on,Met,,Unmet,,,,?,,?,,,2020-05-28 23:19:03 UTC,2020-07-20 18:49:44 UTC,,,Met,https://github.com/merkrafter/Merkompiler/actions,,Met,GitHub supports discussions on issues and pull requests.,Met,,Met,,?,,?,,?,,?,,?,,Met,Found all required security hardening headers.,?,,?,,84,,,2022-04-04 23:00:45 UTC,False,"Java, Kotlin",17,7,?,,?,,?,,?,,?,,?,,?,,?,,?,,?,,?,,?,,?,,?,,?,,?,,?,,?,,?,,?,,?,,?,,?,,?,,?,,?,,?,,?,,?,,?,,?,,?,,?,,?,,?,,?,,?,,?,,?,,?,,9,?,,?,,?,,?,,?,,?,,?,,?,,?,,?,,?,,?,,Unmet,,Unmet,,84,,,,,,,,,Met,
