10,3958,4679,cash-app,,https://www.contactcustomerservice.co/cash-app,https://www.contactcustomerservice.co/cash-app,,?,,Met,Given only https: URLs.,?,,?,,?,,?,,?,,?,,?,,?,,?,,?,,?,,?,,?,,?,,?,,?,,?,,?,,?,,?,,?,,?,,?,,?,,?,,?,,?,,?,,?,,?,,?,,?,,?,,?,,?,,?,,?,,?,,?,,?,,?,,?,,?,,?,,?,,?,,?,,?,,?,,?,,?,,?,,?,,?,,?,,?,,?,,?,,?,,?,,?,,,2020-05-14 09:21:13 UTC,2020-05-14 09:21:13 UTC,?,,?,,,?,,?,,?,,?,,?,,?,,?,,?,,Unmet,"// X-Content-Type-Options was not set to ""nosniff"".",?,,?,,3,,,2022-04-23 23:00:20 UTC,False,,9,0,?,,?,,?,,?,,?,,?,,?,,?,,?,,?,,?,,?,,?,,?,,?,,?,,?,,?,,?,,?,,?,,?,,?,,?,,?,,?,,?,,?,,?,,?,,?,,?,,?,,?,,?,,?,,?,,?,,?,,?,,0,?,,?,,?,,?,,?,,?,,?,,?,,?,,?,,?,,?,,Unmet,,Unmet,,3,,,,,,,,,Met,
11,3959,5368,asu,A image on demand server for OpenWrt based distributions,https://github.com/aparcar/asu,https://github.com/aparcar/asu,GPL-2.0,?,,Met,Given only https: URLs.,?,,?,,Met,"Projects on GitHub by default use issues and pull requests, as encouraged by documentation such as <https://guides.github.com/activities/contributing-to-open-source/>.",?,,Met,Non-trivial license location file in repository: <https://github.com/aparcar/asu/blob/master/LICENSE>.,Met,The GPL-2.0 license is approved by the Open Source Initiative (OSI).,Met,The GPL-2.0 license is approved by the Open Source Initiative (OSI).,Met,Some documentation basics file contents found.,?,,Met,"Repository on GitHub, which provides public git repositories with URLs.",Met,"Repository on GitHub, which uses git. git can track the changes, who made them, and when they were made.",?,,Met,"Repository on GitHub, which uses git. git is distributed.",?,,?,,?,,Unmet,// No release notes file found.,?,,?,,?,,?,,?,,?,,?,,?,,?,,?,,?,,?,,?,,?,,?,,?,,?,,?,,?,,?,,?,,?,,?,,?,,?,,?,,?,,?,,?,,?,,?,,?,,?,,?,,?,,?,,?,,?,,?,,?,,?,,?,,?,,?,,,2020-05-14 21:50:41 UTC,2020-05-14 21:50:41 UTC,?,,?,,,Met,GitHub supports discussions on issues and pull requests.,?,,?,,?,,?,,?,,?,,?,,Met,Found all required security hardening headers.,?,,?,,16,,,2022-04-23 23:00:20 UTC,False,"Python, Makefile, Shell, Standard ML",9,0,?,,?,,?,,?,,?,,?,,?,,?,,?,,?,,?,,?,,?,,?,,?,,?,,?,,?,,?,,?,,?,,?,,?,,?,,?,,?,,?,,?,,?,,?,,?,,?,,?,,?,,?,,?,,?,,?,,?,,?,,4,?,,?,,?,,?,,?,,?,,?,,?,,?,,?,,?,,?,,Unmet,,Unmet,,16,,,,,,,,,Met,
12,3960,743,louketo-proxy,,https://github.com/arkham-labs/louketo-proxy,https://github.com/arkham-labs/louketo-proxy,Apache-2.0,?,,Met,Given only https: URLs.,?,,?,,Met,Non-trivial contribution file in repository: <https://github.com/arkham-labs/louketo-proxy/blob/master/CONTRIBUTING.md>.,?,,Met,Non-trivial license location file in repository: <https://github.com/arkham-labs/louketo-proxy/blob/master/LICENSE>.,Met,The Apache-2.0 license is approved by the Open Source Initiative (OSI).,Met,The Apache-2.0 license is approved by the Open Source Initiative (OSI).,Met,Some documentation basics file contents found.,?,,Met,"Repository on GitHub, which provides public git repositories with URLs.",Met,"Repository on GitHub, which uses git. git can track the changes, who made them, and when they were made.",?,,Met,"Repository on GitHub, which uses git. git is distributed.",?,,?,,?,,Met,Non-trivial release notes file in repository: <https://github.com/arkham-labs/louketo-proxy/blob/master/CHANGELOG.md>.,?,,?,,?,,?,,?,,?,,?,,?,,?,,?,,Met,Non-trivial build file in repository: <https://github.com/arkham-labs/louketo-proxy/blob/master/Makefile>.,Met,Non-trivial build file in repository: <https://github.com/arkham-labs/louketo-proxy/blob/master/Makefile>.,?,,?,,?,,?,,?,,?,,?,,?,,?,,?,,?,,?,,?,,?,,?,,?,,?,,?,,?,,?,,?,,?,,?,,?,,?,,?,,?,,?,,?,,?,,?,,?,,,2020-05-14 23:13:55 UTC,2020-05-14 23:14:22 UTC,?,,?,,,Met,GitHub supports discussions on issues and pull requests.,?,,?,,?,,?,,?,,?,,?,,Met,Found all required security hardening headers.,?,,?,,21,,,2022-04-24 23:00:26 UTC,False,"Go, Makefile, Shell",10,0,?,,?,,?,,?,,?,,?,,?,,?,,?,,?,,?,,?,,?,,?,,?,,?,,?,,?,,?,,?,,?,,?,,?,,?,,?,,?,,?,,?,,?,,?,,?,,?,,?,,?,,?,,?,,?,,?,,?,,?,,4,?,,?,,?,,?,,?,,?,,?,,?,,?,,?,,?,,?,,Unmet,,Unmet,,21,,,,,,,,,Met,
13,3961,5370,mantle,📒 Easy and effective communication for any team or community.,https://github.com/nektro/mantle,https://github.com/nektro/mantle,Apache-2.0,?,,Met,Given only https: URLs.,?,,?,,Met,"Projects on GitHub by default use issues and pull requests, as encouraged by documentation such as <https://guides.github.com/activities/contributing-to-open-source/>.",?,,Met,Non-trivial license location file in repository: <https://github.com/nektro/mantle/blob/master/LICENSE>.,Met,The Apache-2.0 license is approved by the Open Source Initiative (OSI).,Met,The Apache-2.0 license is approved by the Open Source Initiative (OSI).,Unmet,// No appropriate folder found for documentation basics.,?,,Met,"Repository on GitHub, which provides public git repositories with URLs.",Met,"Repository on GitHub, which uses git. git can track the changes, who made them, and when they were made.",?,,Met,"Repository on GitHub, which uses git. git is distributed.",?,,?,,?,,Unmet,// No release notes file found.,?,,?,,?,,?,,?,,?,,?,,?,,?,,?,,?,,?,,?,,?,,?,,?,,?,,?,,?,,?,,?,,?,,?,,?,,?,,?,,?,,?,,?,,?,,?,,?,,?,,?,,?,,?,,?,,?,,?,,?,,?,,?,,?,,?,,,2020-05-15 00:11:19 UTC,2020-05-15 00:11:19 UTC,?,,?,,,Met,GitHub supports discussions on issues and pull requests.,?,,?,,?,,?,,?,,?,,?,,Met,Found all required security hardening headers.,?,,?,,15,,,2022-04-24 23:00:26 UTC,False,"Go, JavaScript, Shell",9,0,?,,?,,?,,?,,?,,?,,?,,?,,?,,?,,?,,?,,?,,?,,?,,?,,?,,?,,?,,?,,?,,?,,?,,?,,?,,?,,?,,?,,?,,?,,?,,?,,?,,?,,?,,?,,?,,?,,?,,?,,4,?,,?,,?,,?,,?,,?,,?,,?,,?,,?,,?,,?,,Unmet,,Unmet,,15,,,,,,,,,Met,
14,3962,5342,cloud-sdk-ios-fiori,SwiftUI implementation of the SAP Fiori for iOS Design Language.,https://github.com/SAP/cloud-sdk-ios-fiori,https://github.com/SAP/cloud-sdk-ios-fiori,Apache-2.0,?,,Met,https://github.com/SAP/cloud-sdk-ios-fiori,Met,"This project is the SwiftUI implementation of the SAP Fiori for iOS Design Language, and is meant to augment and in some cases replace the UIKit-based implementation contained in the SAPFiori framework of the SAP Cloud Platform SDK for iOS.",Met,"https://github.com/SAP/cloud-sdk-ios-fiori#how-to-obtain-support
https://github.com/SAP/cloud-sdk-ios-fiori#contributing",Met,Non-trivial contribution file in repository: <https://github.com/SAP/cloud-sdk-ios-fiori/blob/master/CONTRIBUTING.md>.,Met,https://github.com/SAP/cloud-sdk-ios-fiori/blob/master/CONTRIBUTING.md,Met,Non-trivial license location file in repository: <https://github.com/SAP/cloud-sdk-ios-fiori/blob/master/LICENSE>.,Met,The Apache-2.0 license is approved by the Open Source Initiative (OSI).,Met,The Apache-2.0 license is approved by the Open Source Initiative (OSI).,Met,https://sap.github.io/cloud-sdk-ios-fiori/,Met,https://sap.github.io/cloud-sdk-ios-fiori/,Met,"Repository on GitHub, which provides public git repositories with URLs.",Met,"Repository on GitHub, which uses git. git can track the changes, who made them, and when they were made.",Met,,Met,"Repository on GitHub, which uses git. git is distributed.",Met,,Met,,Met,,Met,"https://github.com/SAP/cloud-sdk-ios-fiori/releases/tag/0.5.1
https://github.com/SAP/cloud-sdk-ios-fiori/blob/master/CHANGELOG.md",Met,,?,,Met,https://github.com/SAP/cloud-sdk-ios-fiori/issues,Met,"https://github.com/SAP/cloud-sdk-ios-fiori/blob/master/CONTRIBUTING.md
https://github.com/SAP/cloud-sdk-ios-fiori/issues",Met,,Met,,Met,https://github.com/SAP/cloud-sdk-ios-fiori/issues,Met,https://github.com/SAP/cloud-sdk-ios-fiori/issues,,,,,,,Met,Swift Package Manager,Met,Swift Package Manager,Met,https://github.com/SAP/cloud-sdk-ios-fiori/tree/master/Tests/FioriSwiftUITests,Met,,Unmet,,Met,"https://github.com/SAP/cloud-sdk-ios-fiori/tree/master/Tests/FioriSwiftUITests contains all tests.
https://github.com/SAP/cloud-sdk-ios-fiori/blob/master/CONTRIBUTING.md also mentions tests should be accompanied per PR.",Met,"https://github.com/SAP/cloud-sdk-ios-fiori/tree/master/Tests/FioriSwiftUITests contains all tests.
https://github.com/SAP/cloud-sdk-ios-fiori/blob/master/CONTRIBUTING.md mentions tests should be accompanied per PR.",Met,https://github.com/SAP/cloud-sdk-ios-fiori/blob/master/CONTRIBUTING.md mentions tests should be accompanied per PR.,Met,,Met,,Unmet,,Met,,Met,,,,,,,,,,,,,,,,,,Met,,Met,,Met,,Met,,Met,Xcode static analyzer / swift build,Met,,Met,,Met,,Unmet,,Unmet,,Unmet,,,,,2020-05-15 00:11:19 UTC,2020-06-09 01:08:09 UTC,,,Met,,,Met,GitHub supports discussions on issues and pull requests.,Met,,Met,,?,,,,?,,?,,?,,Met,Found all required security hardening headers.,?,,?,,100,2020-06-04 16:29:10 UTC,,,False,Swift,13,35,Met,https://cla-assistant.io/SAP/cloud-sdk-ios-fiori,Unmet,,Met,https://github.com/SAP/cloud-sdk-ios-fiori/blob/master/CODE_OF_CONDUCT.md,?,,Met,https://github.com/orgs/SAP/teams/cloud-sdk-ios-fiori-admin,Met,https://github.com/orgs/SAP/teams/cloud-sdk-ios-fiori-admin and https://github.com/orgs/SAP/teams/cloud-sdk-ios-fiori-team,?,,?,,?,,?,,?,,?,,?,,?,,Met,Covered by Github,?,,,no vulnerabilities resolved in the last 12 months,Met,https://github.com/SAP/cloud-sdk-ios-fiori/blob/master/SECURITY.md,?,,?,,?,,?,,?,,?,,?,,?,,Met,https://github.com/SAP/cloud-sdk-ios-fiori/blob/master/Package.swift,Unmet,,?,,?,,Met,https://github.com/SAP/cloud-sdk-ios-fiori/blob/master/.github/workflows/ci.yml,Unmet,,Unmet,,Unmet,,?,,?,,,,,,Met,Covered by GitHub,Met,Covered by GitHub,13,?,,?,,?,,?,,?,,?,,?,,?,,?,,?,,?,,?,,Met,,Unmet,,135,,,,,,2020-06-04 16:29:10 UTC,,,Met,
15,3963,5371,github-action-s3cmd,S3cmd GitHub Action,https://github.com/mickie1515/github-action-s3cmd,https://github.com/mickie1515/github-action-s3cmd,MIT,?,,Met,Given only https: URLs.,Unmet,,Unmet,,Met,"Projects on GitHub by default use issues and pull requests, as encouraged by documentation such as <https://guides.github.com/activities/contributing-to-open-source/>.",Unmet,,Met,Non-trivial license location file in repository: <https://github.com/mickie1515/github-action-s3cmd/blob/master/LICENSE>.,Met,The MIT license is approved by the Open Source Initiative (OSI).,Met,The MIT license is approved by the Open Source Initiative (OSI).,Unmet,// No appropriate folder found for documentation basics.,?,,Met,"Repository on GitHub, which provides public git repositories with URLs.",Met,"Repository on GitHub, which uses git. git can track the changes, who made them, and when they were made.",?,,Met,"Repository on GitHub, which uses git. git is distributed.",?,,?,,?,,Unmet,// No release notes file found.,?,,?,,?,,?,,?,,?,,?,,?,,?,,?,,?,,?,,?,,?,,?,,?,,?,,?,,?,,?,,?,,?,,?,,?,,?,,?,,?,,?,,?,,?,,?,,?,,?,,?,,?,,?,,?,,?,,?,,?,,?,,?,,?,,?,,,2020-05-15 12:50:21 UTC,2020-05-15 12:54:15 UTC,?,,?,,,Met,GitHub supports discussions on issues and pull requests.,?,,?,,?,,?,,?,,?,,?,,Met,Found all required security hardening headers.,?,,?,,15,,,2022-04-24 23:00:26 UTC,False,"Dockerfile, Shell",11,0,?,,?,,?,,?,,?,,?,,?,,?,,?,,?,,?,,?,,?,,?,,?,,?,,?,,?,,?,,?,,?,,?,,?,,?,,?,,?,,?,,?,,?,,?,,?,,?,,?,,?,,?,,?,,?,,?,,?,,?,,4,?,,?,,?,,?,,?,,?,,?,,?,,?,,?,,?,,?,,Unmet,,Unmet,,15,,,,,,,,,Met,
16,3964,5375,sicredi-librum-ex-dracones,Teste da SoftDesign / Sicredi.,https://sicredi-app.herokuapp.com,https://github.com/jmurowaniecki/sicredi-librum-ex-dracones,Unlicense,?,,Met,Given only https: URLs.,Met,README.md,Met,Github Issues,Met,"Projects on GitHub by default use issues and pull requests, as encouraged by documentation such as <https://guides.github.com/activities/contributing-to-open-source/>.",?,,Unmet,// No license location file found.,?,,Unmet,// Did not find license in the OSI list.,Met,README.md,,,Met,"Repository on GitHub, which provides public git repositories with URLs.",Met,"Repository on GitHub, which uses git. git can track the changes, who made them, and when they were made.",?,,Met,"Repository on GitHub, which uses git. git is distributed.",Met,We're using semantic versioning with tags.,Met,,Met,,Unmet,// No release notes file found.,Unmet,,?,,Met,,Met,https://app.circleci.com/pipelines/github/jmurowaniecki/sicredi-librum-ex-dracones?branch=master,Met,,Met,,Met,https://github.com/jmurowaniecki/sicredi-librum-ex-dracones/issues,?,,?,,Met,,Met,Non-trivial build file in repository: <https://github.com/jmurowaniecki/sicredi-librum-ex-dracones/blob/master/Makefile>.,Met,Non-trivial build file in repository: <https://github.com/jmurowaniecki/sicredi-librum-ex-dracones/blob/master/Makefile>.,,,?,,?,,?,,?,,?,,?,,?,,?,,?,,?,,?,,?,,?,,?,,?,,?,,?,,?,,?,,?,,?,,?,,?,,?,,?,,?,,?,,?,,?,,?,,?,,,2020-05-16 01:05:25 UTC,2020-05-16 01:23:40 UTC,?,,?,,,Met,GitHub supports discussions on issues and pull requests.,?,,Unmet,It's a work in progress. Will be offered a translated README.md and some wiki soon.,?,,?,,?,,?,,?,,Unmet,"// X-Content-Type-Options was not set to ""nosniff"".",?,,?,,36,,,2022-04-25 23:00:41 UTC,False,"TypeScript, Shell, Makefile, JavaScript, Dockerfile",13,0,?,,?,,?,,?,,?,,?,,?,,?,,?,,?,,?,,?,,?,,?,,?,,?,,?,,?,,?,,?,,?,,?,,?,,?,,?,,?,,?,,?,,?,,?,,?,,?,,?,,?,,?,,?,,?,,?,,?,,?,,4,?,,?,,?,,?,,?,,?,,?,,?,,?,,?,,?,,?,,Unmet,,Unmet,,36,,,,,,,,,Met,
17,3965,5376,go-http,Just sample http.,https://github.com/AhmedELShafaie/go-http,https://github.com/AhmedELShafaie/go-http,,?,,Met,Given only https: URLs.,Met,,Met,,Met,"Projects on GitHub by default use issues and pull requests, as encouraged by documentation such as <https://guides.github.com/activities/contributing-to-open-source/>.",Met,,Unmet,// No license location file found.,Met,,Met,,Met,// No appropriate folder found for documentation basics.,Met,,Met,"Repository on GitHub, which provides public git repositories with URLs.",Met,"Repository on GitHub, which uses git. git can track the changes, who made them, and when they were made.",?,,Met,"Repository on GitHub, which uses git. git is distributed.",?,,?,,?,,Unmet,// No release notes file found.,?,,?,,?,,?,,?,,?,,?,,?,,?,,?,,?,,?,,?,,?,,?,,?,,?,,?,,?,,?,,?,,?,,?,,?,,?,,?,,?,,?,,?,,?,,?,,?,,?,,?,,?,,?,,?,,?,,?,,?,,?,,?,,?,,?,,,2020-05-16 16:37:48 UTC,2020-05-16 16:38:53 UTC,?,,?,,,Met,GitHub supports discussions on issues and pull requests.,?,,?,,?,,?,,?,,?,,?,,Met,Found all required security hardening headers.,?,,?,,19,,,2022-04-25 23:00:41 UTC,False,"Dockerfile, Go, Shell",10,0,?,,?,,?,,?,,?,,?,,?,,?,,?,,?,,?,,?,,?,,?,,?,,?,,?,,?,,?,,?,,?,,?,,?,,?,,?,,?,,?,,?,,?,,?,,?,,?,,?,,?,,?,,?,,?,,?,,?,,?,,4,?,,?,,?,,?,,?,,?,,?,,?,,?,,?,,?,,?,,Unmet,,Unmet,,19,,,,,,,,,Met,
18,3966,5380,argos3-webviz,A Web interface plugin for ARGoS 3(https://argos-sim.info).,https://github.com/NESTlab/argos3-webviz,https://github.com/NESTlab/argos3-webviz,MIT,?,,Met,Given only https: URLs.,Met,https://github.com/NESTLab/argos3-webviz,Met,,Met,https://github.com/NESTLab/argos3-webviz/blob/master/docs/CONTRIBUTING.md,Met,https://github.com/NESTLab/argos3-webviz/blob/master/docs/CONTRIBUTING.md,Met,Non-trivial license location file in repository: <https://github.com/prajankya/argos3-webviz/blob/master/LICENSE>.,Met,The MIT license is approved by the Open Source Initiative (OSI).,Met,The MIT license is approved by the Open Source Initiative (OSI).,Met,Some documentation basics file contents found.https://github.com/NESTLab/argos3-webviz/blob/master/docs/README.md,Met,https://github.com/NESTLab/argos3-webviz/blob/master/docs/README.md,Met,"Repository on GitHub, which provides public git repositories with URLs.",Met,"Repository on GitHub, which uses git. git can track the changes, who made them, and when they were made.",Met,https://github.com/NESTLab/argos3-webviz/releases,Met,"Repository on GitHub, which uses git. git is distributed.",Met,https://github.com/NESTLab/argos3-webviz/releases,Met,,Met,https://github.com/NESTLab/argos3-webviz/releases,Unmet,// No release notes file found.,?,,?,,Met,https://github.com/NESTLab/argos3-webviz/issues,Met,https://github.com/NESTLab/argos3-webviz/blob/master/.github/ISSUE_TEMPLATE/bug_report.md,Met,https://github.com/NESTLab/argos3-webviz/blob/master/README.md,Met,https://github.com/NESTLab/argos3-webviz/blob/master/README.md,Unmet,,?,,?,,?,,Met,https://github.com/NESTLab/argos3-webviz/blob/master/.travis.yml,Met,https://github.com/NESTLab/argos3-webviz/blob/master/.travis.yml,Met,https://github.com/NESTLab/argos3-webviz/blob/master/.travis.yml,Met,https://github.com/NESTLab/argos3-webviz/blob/master/src/tests/CMakeLists.txt,Met,,Met,,Met,https://github.com/NESTLab/argos3-webviz/blob/master/.github/ISSUE_TEMPLATE/feature_request.md,Met,https://github.com/NESTLab/argos3-webviz/blob/master/.github/ISSUE_TEMPLATE/feature_request.md,Met,https://github.com/NESTLab/argos3-webviz/blob/master/.github/ISSUE_TEMPLATE/feature_request.md,Met,,Met,,Met,,Met,,Met,,Met,,Met,,Met,,Met,,Met,,Met,,Met,,Met,,Met,,Met,,Met,,Met,,Met,cppcheck,,,,,Met,"It is integrated in ctest, with travis CI integration on every commit",?,,?,,?,,?,,,2020-05-18 10:58:34 UTC,2020-05-18 11:15:44 UTC,Met,,Met,https://travis-ci.com/github/NESTLab/argos3-webviz,,Met,GitHub supports discussions on issues and pull requests.,Met,,Met,https://github.com/NESTLab/argos3-webviz,?,,?,,?,,?,,?,,Met,Found all required security hardening headers.,?,,?,,85,,,2022-04-27 23:00:30 UTC,False,"C++, CMake",15,5,?,,?,,?,,?,,?,,?,,?,,?,,?,,?,,?,,?,,?,,?,,?,,?,,?,,?,,?,,?,,?,,?,,?,,?,,?,,?,,?,,?,,?,,?,,?,,?,,?,,?,,?,,?,,?,,?,,?,,?,,9,?,,?,,?,,?,,?,,?,,?,,?,,?,,?,,?,,?,,Unmet,,Unmet,,85,2020-05-18 11:15:44 UTC,,,,,,,,Met,
19,3967,2396,spec2vec,Word2Vec based similarity measure of mass spectrometry data.,https://github.com/iomega/spec2vec,https://github.com/iomega/spec2vec,Apache-2.0,?,,Met,Given only https: URLs.,Met,https://github.com/iomega/spec2vec,Met,https://github.com/iomega/spec2vec/blob/master/CONTRIBUTING.md,Met,"Projects on GitHub by default use issues and pull requests, as encouraged by documentation such as <https://guides.github.com/activities/contributing-to-open-source/>.",?,,Met,Non-trivial license location file in repository: <https://github.com/iomega/spec2vec/blob/master/LICENSE>.,Met,The Apache-2.0 license is approved by the Open Source Initiative (OSI).,Met,The Apache-2.0 license is approved by the Open Source Initiative (OSI).,Met,https://spec2vec.readthedocs.io/en/latest/,Met,https://spec2vec.readthedocs.io/en/latest/,Met,"Repository on GitHub, which provides public git repositories with URLs.",Met,"Repository on GitHub, which uses git. git can track the changes, who made them, and when they were made.",?,,Met,"Repository on GitHub, which uses git. git is distributed.",Met,semantic versioning,Met,,Met,,Met,https://github.com/iomega/spec2vec/releases,?,,?,,Met,,?,,?,,?,,?,,?,,?,,?,,,,,,,,Met,,?,,Met,,Met,Enforced via SoundCloud,Met,Enforced via SoundCloud,?,,Met,pylint,?,,?,,?,,Met,"SoundCloud, plus senior developer for strict review procedure",,,?,,,,,,,,,,,,,,?,,?,,?,,?,,Met,SonarCloud,Met,,Met,,Met,,?,,,,?,,?,,,2020-05-18 16:09:32 UTC,2020-08-27 13:11:19 UTC,,,Met,,,Met,GitHub supports discussions on issues and pull requests.,?,,Met,,?,,?,,?,,?,,?,,Met,Found all required security hardening headers.,?,,?,,64,,,2022-04-27 23:00:30 UTC,False,"Python, Batchfile, Makefile",15,2,?,,?,,?,,?,,?,,?,,?,,?,,?,,?,,?,,?,,?,,?,,?,,?,,?,,?,,?,,?,,?,,?,,?,,?,,?,,?,,?,,?,,?,,?,,?,,?,,?,,?,,?,,?,,?,,?,,?,,?,,4,?,,?,,?,,?,,?,,?,,?,,?,,?,,?,,?,,?,,Unmet,,Unmet,,64,,,,,,,,,Met,
20,3968,5365,allAboutTest-Docs,personal repository for notes and testing works,https://github.com/xiaoya-Esther/allAboutTest-Docs,https://github.com/xiaoya-Esther/allAboutTest-Docs,Unlicense,?,,Met,Given only https: URLs.,Met,,Met,,Met,"Projects on GitHub by default use issues and pull requests, as encouraged by documentation such as <https://guides.github.com/activities/contributing-to-open-source/>.",?,,Unmet,// No license location file found.,Unmet,,Met,,Met,// No appropriate folder found for documentation basics.,Met,,Met,"Repository on GitHub, which provides public git repositories with URLs.",Met,"Repository on GitHub, which uses git. git can track the changes, who made them, and when they were made.",?,,Met,"Repository on GitHub, which uses git. git is distributed.",?,,?,,?,,Unmet,// No release notes file found.,?,,?,,Met,,Unmet,,Met,,Met,,Unmet,,Unmet,,Met,https://crowdin.com/,Met,,Met,,Met,,Met,,Met,,Met,,Met,,Met,,Met,,Met,,Met,,Met,,Met,,Met,,Met,,Met,,Met,,Met,,Met,,Met,,Met,,Met,,Met,,Met,,Met,,Met,,Met,,?,,Met,,Met,,Met,,Met,,Met,,Met,,Met,,,2020-05-19 14:18:55 UTC,2020-05-20 05:54:09 UTC,Met,,Met,,,Met,GitHub supports discussions on issues and pull requests.,Met,,Met,,?,,?,,?,,?,,?,,Met,Found all required security hardening headers.,?,,?,,81,,,2022-04-30 23:00:19 UTC,False,mark-down,11,0,?,,?,,?,,?,,?,,?,,?,,?,,?,,?,,?,,?,,?,,?,,?,,?,,?,,?,,?,,?,,?,,?,,?,,?,,?,,?,,?,,?,,?,,?,,?,,?,,?,,?,,?,,?,,?,,?,,?,,?,,4,?,,?,,?,,?,,?,,?,,?,,?,,?,,?,,?,,?,,Unmet,,Unmet,,81,,,,,,,,,Met,
21,3969,5243,worcs,Rstudio project template and convenience functions for the Workflow for Open Reproducible Code in Science (WORCS),https://osf.io/zcvbs,https://github.com/cjvanlissa/worcs,GPL-3.0,?,,Met,Given only https: URLs.,Met,,Met,,Met,"Projects on GitHub by default use issues and pull requests, as encouraged by documentation such as <https://guides.github.com/activities/contributing-to-open-source/>.",Met,The README.md file mentions the tidyverse style guide: Contributions to the package must adhere to the [tidyverse style guide](https://style.tidyverse.org/).,Met,Non-trivial license location file in repository: <https://github.com/cjvanlissa/worcs/blob/master/LICENSE.md>.,Met,The GPL-3.0 license is approved by the Open Source Initiative (OSI).,Met,The GPL-3.0 license is approved by the Open Source Initiative (OSI).,Met,Some documentation basics file contents found.,Met,,Met,"Repository on GitHub, which provides public git repositories with URLs.",Met,"Repository on GitHub, which uses git. git can track the changes, who made them, and when they were made.",Met,,Met,"Repository on GitHub, which uses git. git is distributed.",Met,,Met,,Met,,Met,https://raw.githubusercontent.com/cjvanlissa/worcs/master/news.md,,There are no publicly known vulnerabilities for this R package,?,,Met,https://github.com/cjvanlissa/worcs/issues,Met,https://github.com/cjvanlissa/worcs/issues,Met,https://github.com/cjvanlissa/worcs/issues,Met,https://github.com/cjvanlissa/worcs/issues,Met,https://github.com/cjvanlissa/worcs/issues,Met,https://github.com/cjvanlissa/worcs/issues,,,,,Met,Non-trivial build file in repository: <https://github.com/cjvanlissa/worcs/blob/master/Makefile>.,Met,Non-trivial build file in repository: <https://github.com/cjvanlissa/worcs/blob/master/Makefile>.,Met,,Met,,Met,,Met,,Met,,Met,,Met,"Readme says: When contributing code, please add tests for that contribution to the `tests/testthat` folder, and ensure that these tests pass on [Travis-CI](https://travis-ci.org/github/cjvanlissa/worcs).",Met,,Met,,Met,,Met,,Met,,Met,,Met,,Met,,,,,,,,,,,,Met,,Met,,Met,,Met,,Met,Standard CRAN test suite,,,,,Met,,Met,,,,Met,,,,,2020-05-19 14:49:56 UTC,2020-05-19 15:03:07 UTC,,,Met,,,Met,GitHub supports discussions on issues and pull requests.,Met,,Met,,?,,?,,?,,?,,?,,Unmet,"// X-Content-Type-Options was not set to ""nosniff"".",?,,?,,100,2020-05-19 15:03:07 UTC,,,False,"R, RMarkdown",6,9,?,,?,,?,,?,,?,,?,,?,,?,,?,,?,,?,,?,,?,,?,,?,,?,,?,,?,,?,,?,,?,,?,,?,,?,,?,,?,,?,,?,,?,,?,,?,,?,,?,,?,,?,,?,,?,,?,,?,,?,,4,?,,?,,?,,?,,?,,?,,?,,?,,?,,?,,?,,?,,Met,,Unmet,,109,,,,,,2020-05-19 15:03:07 UTC,,,Met,
22,3972,5388,rabbithole-rs,"JSON:API Data Structure & Query implementation, and a high performance HTTP Engine support (maybe)",https://github.com/UkonnRa/rabbithole-rs,https://github.com/UkonnRa/rabbithole-rs,MIT,?,,Met,Given only https: URLs.,?,,?,,Met,"Projects on GitHub by default use issues and pull requests, as encouraged by documentation such as <https://guides.github.com/activities/contributing-to-open-source/>.",?,,Met,Non-trivial license location file in repository: <https://github.com/UkonnRa/rabbithole-rs/blob/develop/LICENSE>.,Met,The MIT license is approved by the Open Source Initiative (OSI).,Met,The MIT license is approved by the Open Source Initiative (OSI).,Unmet,// No appropriate folder found for documentation basics.,?,,Met,"Repository on GitHub, which provides public git repositories with URLs.",Met,"Repository on GitHub, which uses git. git can track the changes, who made them, and when they were made.",?,,Met,"Repository on GitHub, which uses git. git is distributed.",?,,?,,?,,Met,Non-trivial release notes file in repository: <https://github.com/UkonnRa/rabbithole-rs/blob/develop/CHANGELOG.md>.,?,,?,,?,,?,,?,,?,,?,,?,,?,,?,,?,,?,,?,,?,,?,,?,,?,,?,,?,,?,,?,,?,,?,,?,,?,,?,,?,,?,,?,,?,,?,,?,,?,,?,,?,,?,,?,,?,,?,,?,,?,,?,,?,,?,,,2020-05-22 00:41:55 UTC,2020-05-22 00:41:55 UTC,?,,?,,,Met,GitHub supports discussions on issues and pull requests.,?,,?,,?,,?,,?,,?,,?,,Met,Found all required security hardening headers.,?,,?,,16,,,2022-05-02 23:00:49 UTC,False,"Rust, Shell, Batchfile",9,0,?,,?,,?,,?,,?,,?,,?,,?,,?,,?,,?,,?,,?,,?,,?,,?,,?,,?,,?,,?,,?,,?,,?,,?,,?,,?,,?,,?,,?,,?,,?,,?,,?,,?,,?,,?,,?,,?,,?,,?,,4,?,,?,,?,,?,,?,,?,,?,,?,,?,,?,,?,,?,,Unmet,,Unmet,,16,,,,,,,,,Met,
