,id,user_id,name,description,homepage_url,repo_url,license,homepage_url_status,homepage_url_justification,sites_https_status,sites_https_justification,description_good_status,description_good_justification,interact_status,interact_justification,contribution_status,contribution_justification,contribution_requirements_status,contribution_requirements_justification,license_location_status,license_location_justification,floss_license_status,floss_license_justification,floss_license_osi_status,floss_license_osi_justification,documentation_basics_status,documentation_basics_justification,documentation_interface_status,documentation_interface_justification,repo_public_status,repo_public_justification,repo_track_status,repo_track_justification,repo_interim_status,repo_interim_justification,repo_distributed_status,repo_distributed_justification,version_unique_status,version_unique_justification,version_semver_status,version_semver_justification,version_tags_status,version_tags_justification,release_notes_status,release_notes_justification,release_notes_vulns_status,release_notes_vulns_justification,report_url_status,report_url_justification,report_tracker_status,report_tracker_justification,report_process_status,report_process_justification,report_responses_status,report_responses_justification,enhancement_responses_status,enhancement_responses_justification,report_archive_status,report_archive_justification,vulnerability_report_process_status,vulnerability_report_process_justification,vulnerability_report_private_status,vulnerability_report_private_justification,vulnerability_report_response_status,vulnerability_report_response_justification,build_status,build_justification,build_common_tools_status,build_common_tools_justification,build_floss_tools_status,build_floss_tools_justification,test_status,test_justification,test_invocation_status,test_invocation_justification,test_most_status,test_most_justification,test_policy_status,test_policy_justification,tests_are_added_status,tests_are_added_justification,tests_documented_added_status,tests_documented_added_justification,warnings_status,warnings_justification,warnings_fixed_status,warnings_fixed_justification,warnings_strict_status,warnings_strict_justification,know_secure_design_status,know_secure_design_justification,know_common_errors_status,know_common_errors_justification,crypto_published_status,crypto_published_justification,crypto_call_status,crypto_call_justification,crypto_floss_status,crypto_floss_justification,crypto_keylength_status,crypto_keylength_justification,crypto_working_status,crypto_working_justification,crypto_pfs_status,crypto_pfs_justification,crypto_password_storage_status,crypto_password_storage_justification,crypto_random_status,crypto_random_justification,delivery_mitm_status,delivery_mitm_justification,delivery_unsigned_status,delivery_unsigned_justification,vulnerabilities_fixed_60_days_status,vulnerabilities_fixed_60_days_justification,vulnerabilities_critical_fixed_status,vulnerabilities_critical_fixed_justification,static_analysis_status,static_analysis_justification,static_analysis_common_vulnerabilities_status,static_analysis_common_vulnerabilities_justification,static_analysis_fixed_status,static_analysis_fixed_justification,static_analysis_often_status,static_analysis_often_justification,dynamic_analysis_status,dynamic_analysis_justification,dynamic_analysis_unsafe_status,dynamic_analysis_unsafe_justification,dynamic_analysis_enable_assertions_status,dynamic_analysis_enable_assertions_justification,dynamic_analysis_fixed_status,dynamic_analysis_fixed_justification,general_comments,created_at,updated_at,crypto_weaknesses_status,crypto_weaknesses_justification,test_continuous_integration_status,test_continuous_integration_justification,cpe,discussion_status,discussion_justification,no_leaked_credentials_status,no_leaked_credentials_justification,english_status,english_justification,hardening_status,hardening_justification,crypto_used_network_status,crypto_used_network_justification,crypto_tls12_status,crypto_tls12_justification,crypto_certificate_verification_status,crypto_certificate_verification_justification,crypto_verification_private_status,crypto_verification_private_justification,hardened_site_status,hardened_site_justification,installation_common_status,installation_common_justification,build_reproducible_status,build_reproducible_justification,badge_percentage_0,achieved_passing_at,lost_passing_at,last_reminder_at,disabled_reminders,implementation_languages,lock_version,badge_percentage_1,dco_status,dco_justification,governance_status,governance_justification,code_of_conduct_status,code_of_conduct_justification,roles_responsibilities_status,roles_responsibilities_justification,access_continuity_status,access_continuity_justification,bus_factor_status,bus_factor_justification,documentation_roadmap_status,documentation_roadmap_justification,documentation_architecture_status,documentation_architecture_justification,documentation_security_status,documentation_security_justification,documentation_quick_start_status,documentation_quick_start_justification,documentation_current_status,documentation_current_justification,documentation_achievements_status,documentation_achievements_justification,accessibility_best_practices_status,accessibility_best_practices_justification,internationalization_status,internationalization_justification,sites_password_security_status,sites_password_security_justification,maintenance_or_update_status,maintenance_or_update_justification,vulnerability_report_credit_status,vulnerability_report_credit_justification,vulnerability_response_process_status,vulnerability_response_process_justification,coding_standards_status,coding_standards_justification,coding_standards_enforced_status,coding_standards_enforced_justification,build_standard_variables_status,build_standard_variables_justification,build_preserve_debug_status,build_preserve_debug_justification,build_non_recursive_status,build_non_recursive_justification,build_repeatable_status,build_repeatable_justification,installation_standard_variables_status,installation_standard_variables_justification,installation_development_quick_status,installation_development_quick_justification,external_dependencies_status,external_dependencies_justification,dependency_monitoring_status,dependency_monitoring_justification,updateable_reused_components_status,updateable_reused_components_justification,interfaces_current_status,interfaces_current_justification,automated_integration_testing_status,automated_integration_testing_justification,regression_tests_added50_status,regression_tests_added50_justification,test_statement_coverage80_status,test_statement_coverage80_justification,test_policy_mandated_status,test_policy_mandated_justification,implement_secure_design_status,implement_secure_design_justification,input_validation_status,input_validation_justification,crypto_algorithm_agility_status,crypto_algorithm_agility_justification,crypto_credential_agility_status,crypto_credential_agility_justification,signed_releases_status,signed_releases_justification,version_tags_signed_status,version_tags_signed_justification,badge_percentage_2,contributors_unassociated_status,contributors_unassociated_justification,copyright_per_file_status,copyright_per_file_justification,license_per_file_status,license_per_file_justification,small_tasks_status,small_tasks_justification,require_2FA_status,require_2FA_justification,secure_2FA_status,secure_2FA_justification,code_review_standards_status,code_review_standards_justification,two_person_review_status,two_person_review_justification,test_statement_coverage90_status,test_statement_coverage90_justification,test_branch_coverage80_status,test_branch_coverage80_justification,security_review_status,security_review_justification,assurance_case_status,assurance_case_justification,achieve_passing_status,achieve_passing_justification,achieve_silver_status,achieve_silver_justification,tiered_percentage,repo_url_updated_at,achieved_silver_at,lost_silver_at,achieved_gold_at,lost_gold_at,first_achieved_passing_at,first_achieved_silver_at,first_achieved_gold_at,maintained_status,maintained_justification
0,529,757,mRemoteNG,"mRemoteNG is the next generation of mRemote, open source, tabbed, multi-protocol, remote connections manager.",https://mRemoteNG.org,https://github.com/mRemoteNG/mRemoteNG,GPL-2.0,?,,Met,https://mremoteng.org/,Met,"Available at https://mremoteng.org/ and https://github.com/mRemoteNG/mRemoteNG
",Met,"All items are top-level menu links on our home page: https://mremoteng.org/
Obtain: satisfied via the ""Download"" link
Feedback: satisfied via the ""Bugs & Feature Requests"" link
Contribute: satisfied via the ""Source Code"" link, though it could be argued that this is not enough",Met,"Projects on GitHub by default use issues and pull requests, as encouraged by documentation such as <https://guides.github.com/activities/contributing-to-open-source/>.",Met,"https://github.com/mRemoteNG/mRemoteNG/blob/develop/.github/CONTRIBUTING.md
We discuss multiple contribution methods, including acceptable bug report and feature requests, acceptable PRs, and a few code style guidelines.",Met,Non-trivial license location file in repository: <https://github.com/mRemoteNG/mRemoteNG/blob/develop/COPYING.TXT>.,Met,The GPL-2.0 license is approved by the Open Source Initiative (OSI).,Met,The GPL-2.0 license is approved by the Open Source Initiative (OSI).,Met,"Wiki for general information: https://github.com/mRemoteNG/mRemoteNG/wiki
User manual (Wiki): https://github.com/mRemoteNG/mRemoteNG/wiki/User-Manual
User manual (built into app): https://github.com/mRemoteNG/mRemoteNG/tree/develop/mRemoteV1/Resources/Help",Met,"UI documentation is covered in the user manual, though not thoroughly.
https://github.com/mRemoteNG/mRemoteNG/wiki/User-Manual

Open-ended tickets exist for improving/creating more UI documentation.
https://github.com/mRemoteNG/mRemoteNG/labels/Documentation
",Met,"Repository on GitHub, which provides public git repositories with URLs.",Met,"Repository on GitHub, which uses git. git can track the changes, who made them, and when they were made.",Met,"https://github.com/mRemoteNG/mRemoteNG/releases
We publish public alpha, beta, and release candidate (RC) versions prior to final release.",Met,"Repository on GitHub, which uses git. git is distributed.",Met,"https://github.com/mRemoteNG/mRemoteNG/releases
All versions follow Major.Minor.CodedBuildDate.CodedBuildTime. This guarantees unique version numbers for every build.",Met,The current dev team is following the version numbering convention used by the previous maintainers. Modifying the versioning scheme to follow SemVer has not been seriously discussed yet. Modifying the versioning scheme must be carefully considered before implementing.,Met,"We utilize git tags for every publicly released version (alpha, beta, RC, final)",Met,Non-trivial release notes file in repository: <https://github.com/mRemoteNG/mRemoteNG/blob/develop/CHANGELOG.TXT>.,Met,"Every known issue is documented in a ticket (previously Jira, now Github Issues) and every resolved ticket is included in the release notes along with a brief description.",?,,Met,"https://github.com/mRemoteNG/mRemoteNG/issues
GitHub Issues",Met,"https://github.com/mRemoteNG/mRemoteNG/issues
GitHub Issues",Met,"We try to answer/acknowledge most new issues the same day we receive them.
https://github.com/mRemoteNG/mRemoteNG/issues",Met,"We try to answer/acknowledge most new requests the same day we receive them, or at least within the week.
https://github.com/mRemoteNG/mRemoteNG/issues",Met,"GitHub Issues has a search feature that includes closed issues.
https://github.com/mRemoteNG/mRemoteNG/issues",Met,https://mremoteng.org/security,,,Met,No specific vulnerability reports have been made known to us within that time frame. ,Met,"As the project is in C# (with project files) users can build within Visual Studio, or directly using msbuild.",Met,Msbuild is common for our chosen language (C#),Met,"The primary build engine MSBuild is open source under the MIT license
https://github.com/Microsoft/msbuild",Met,Our tests are released in the same project/repo as the primary application and is licensed under GPL v2,Met,Tests can be run via any NUnit compatible test runner. The requirement for the NUnit test runner is documented in our wiki: https://github.com/mRemoteNG/mRemoteNG/wiki/Development%20Environment,Met,"The code base was at ~30,000 lines before the test suite was created. In some cases the code is not designed with testing in mind. All new features or improvements receive tests were feasible, though we are currently only at ~10% coverage overall.",Met,"We have an informal policy of creating test for all new functionality where possible. Some of the code base is very difficult to test, though when possible it is refactored to make it possible. The majority of recent new features have tests.",Met,"Recent major changes:
- Encryption update and its tests:
---- https://github.com/mRemoteNG/mRemoteNG/issues/157.
---- https://github.com/mRemoteNG/mRemoteNG/tree/develop/mRemoteNGTests/Security
- Connection tree update and its tests:
---- https://github.com/mRemoteNG/mRemoteNG/issues/143
---- https://github.com/mRemoteNG/mRemoteNG/tree/develop/mRemoteNGTests/Tree",Met,"We request that PRs include added/updated tests when possible
https://github.com/mRemoteNG/mRemoteNG/blob/develop/.github/CONTRIBUTING.md#pull-requests",Met,,Met,We fix the majority of warnings presented by the compiler.,Met,We currently use the recommended warning setting (not maximum).,Met,,Met,,Met,"We are utilizing the BouncyCastle library for all future cryptographic functions.
https://github.com/bcgit/bc-csharp",Met,"We are utilizing the BouncyCastle library for all future cryptographic functions.
https://github.com/bcgit/bc-csharp",Met,"We are utilizing the BouncyCastle library for all future cryptographic functions.
https://github.com/bcgit/bc-csharp",Met,Key size used: 256,Met,"As of version 1.75 beta 1, we currently support AES256, Twofish, and Serpent running in GCM, CCM, or EAX modes.
The default encryption method is AES256 in GCM mode.",,We do not utilize asymmetric encryption.,Met,"The program must keep username/password pairs in an encrypted state as the plain text is later used for authentication with external systems. However, authentication used during decryption of those values does use iterated key stretching (PBKDF2) with a variable number of iterations (set by the user). Technical guards are in place to prevent the iteration count from being set below the minimally safe value of 1000 iterations.",Met,We utilize the Org.BouncyCastle.Security.SecureRandom class for all number generation.,Met,We utilize Https,Met,We utilize Https,Met,,Met,,Met,The core dev team utilizes ReSharper for static code analysis. All refactors/updates/new code is always subjected to analysis.,Met,,,,Met,,Unmet,I am not aware of any dynamic analysis tools available for .Net,,C# is a memory-safe language.,Unmet,We do not run dynamic analysis.,Met,,,2016-12-01 18:39:12 UTC,2021-08-04 01:31:52 UTC,Met,,Met,http://jenkins.mremoteng.org:8080/,,Met,GitHub supports discussions on issues and pull requests.,Met,,Met,,?,,?,,?,,?,,?,,Unmet,"X-Content-Type-Options was not set to ""nosniff"". // One or more of the required security hardening headers is missing.",Met,We provide MSI packages for our installed version and ZIP file for our portable version.,?,,100,2021-08-04 01:31:36 UTC,,2021-07-26 23:01:01 UTC,False,"C#, PowerShell, Batchfile (CII estimate)",31,13,?,,?,,?,,?,,?,,?,,?,,?,,?,,?,,?,,?,,?,,?,,?,,?,,?,,?,,?,,?,,?,,?,,?,,?,,?,,?,,?,,?,,?,,?,,?,,?,,?,,?,,?,,?,,?,,?,,?,,?,,17,?,,?,,?,,?,,?,,?,,?,,?,,?,,?,,?,,?,,Met,,Unmet,,113,,,,,,2021-08-04 01:31:36 UTC,,,Met,
1,530,758,Craftr -- Meta build system based on Ninja and Python,"Craftr is a cross-platform meta build system that aims to be ""write once, compile anywhere"". It's still in the early stages",https://craftr.net,https://github.com/craftr-build/craftr,GPL-3.0,?,,Met,Given an https:// URL.,Met,,Met,Installation instructions are available in the project README file. Please issue bug reports via GitHub's Issue Tracker.,Met,"Projects on GitHub by default use issues and pull requests, as encouraged by documentation such as <https://guides.github.com/activities/contributing-to-open-source/>.",Unmet,No coding guidelines available.,Met,Non-trivial license location file in repository: <https://github.com/craftr-build/craftr/blob/master/LICENSE.txt>.,Met,The GPL-3.0 license is approved by the Open Source Initiative (OSI).,Met,The GPL-3.0 license is approved by the Open Source Initiative (OSI).,Unmet,Still needs to be enhanced.,Unmet,Still needs to be enhanced.,Met,"Repository on GitHub, which provides public git repositories with URLs.",Met,"Repository on GitHub, which uses git. git can track the changes, who made them, and when they were made.",Met,All versions are on GitHub.,Met,"Repository on GitHub, which uses git. git is distributed.",Met,,Met,,Met,,Unmet,No release notes file found.,?,,?,,Met,Uses GitHub Issue Tracker.,Met,Report issues on https://github.com/craftr-build/craftr/issues,Met,,Met,,Met,Uses GitHub Issue Tracker. https://github.com/craftr-build/craftr/issues,Unmet,,,,Met,,,,,,,,Unmet,There is little testing ground.,Met,,Unmet,,Unmet,,Unmet,,Unmet,,Unmet,,,,Unmet,,Met,,Met,,,,,,,,,,,,,,,,,,Met,The Craftr package manage communicates over HTTPS.,Met,,Met,,Met,,,,,,,,,,Unmet,,,,Met,,Met,,,2016-12-01 23:00:04 UTC,2016-12-01 23:30:41 UTC,,,Met,,,Met,GitHub supports discussions on issues and pull requests.,Met,,Met,Project and documentation is written entirely in english.,Unmet,,Met,Craftr and the Craftr standard library uses HTTPS wherever possible. The user can change URLs where source file archives are downloaded via command-line options and thus choose to use HTTP instead.,,,,,,,Unmet,"X-Content-Type-Options was not set to ""nosniff"".",Met,Recommended installation using a Python virtualenv and Pip.,Met,,85,,,2022-04-04 23:00:44 UTC,False,"Python, C, Makefile (CII estimate)",28,13,?,,?,,?,,?,,?,,?,,?,,?,,?,,?,,?,,?,,?,,?,,?,,?,,?,,?,,?,,?,,?,,?,,?,,?,,?,,?,,?,,?,,?,,?,,?,,?,,?,,?,,?,,?,,?,,?,,?,,?,,13,?,,?,,?,,?,,?,,?,,?,,?,,?,,?,,?,,?,,Unmet,,Unmet,,85,,,,,,,,,Met,
