7,4906,10694,Tanzu Community Edition,"Tanzu Community Edition is a fully-featured, easy to manage, Kubernetes platform for learners and users. It is a freely available, community supported, and open source distribution of VMware Tanzu.",https://github.com/vmware-tanzu/community-edition,https://github.com/vmware-tanzu/community-edition,Apache-2.0,?,,Met,https://tanzucommunityedition.io,Met,,Met,,Met,https://github.com/vmware-tanzu/community-edition/blob/main/CONTRIBUTING.md,Met,https://github.com/vmware-tanzu/community-edition/blob/main/CONTRIBUTING.md,Met,https://github.com/vmware-tanzu/community-edition/blob/main/SECURITY.md,Met,The Apache-2.0 license is approved by the Open Source Initiative (OSI).,Met,The Apache-2.0 license is approved by the Open Source Initiative (OSI).,Met,https://tanzucommunityedition.io/docs/latest/,Met,https://tanzucommunityedition.io/docs/latest/,Met,"Repository on GitHub, which provides public git repositories with URLs.",Met,"Repository on GitHub, which uses git. git can track the changes, who made them, and when they were made.",Met,,Met,"Repository on GitHub, which uses git. git is distributed.",Met,,Met,,Met,,Met,https://github.com/vmware-tanzu/community-edition/releases,Met,,?,,Met,https://github.com/vmware-tanzu/community-edition/issues,Met,https://github.com/vmware-tanzu/community-edition/issues,Met,,Met,,Met,http://github.com/,Met,https://github.com/vmware-tanzu/community-edition/blob/main/SECURITY.md,Met,https://github.com/vmware-tanzu/community-edition/blob/main/SECURITY.md,Met,https://github.com/vmware-tanzu/community-edition/blob/main/SECURITY.md,Met,,Met,,Met,,Met,Ginkgo and Gomega,Met,,Met,,Met,We have an informal policy for testing new features and major functionality.,Met,,Unmet,"As the project matures and number of contributors grow, this will be explicit.",Met,golangci-lint,Met,,Met,,Met,,Met,,,,,,,,,,,,,,,,,,Met,,Met,,Met,,Met,,Met,golangcli-lint,Met,,Met,,Met,,Unmet,,,"We do not use any memory-unsafe languages.
",Unmet,,,,,2021-05-28 14:29:36 UTC,2021-10-06 18:47:29 UTC,,,Met,,,Met,GitHub supports discussions on issues and pull requests.,Met,,Met,,?,,?,,?,,?,,?,,Met,Found all required security hardening headers.,?,,?,,100,2021-10-06 18:43:49 UTC,,,False,"Shell, Go, Makefile, PowerShell, Batchfile, Dockerfile",24,9,?,,?,,?,,?,,?,,?,,?,,?,,?,,?,,?,,?,,?,,?,,?,,?,,?,,?,,?,,?,,?,,?,,?,,?,,?,,?,,?,,?,,?,,?,,?,,?,,?,,?,,?,,?,,?,,?,,?,,?,,4,?,,?,,?,,?,,?,,?,,?,,?,,?,,?,,?,,?,,Met,,Unmet,,109,2021-10-06 18:43:10 UTC,,,,,2021-10-06 18:43:49 UTC,,,Met,
8,4939,10934,setup-browser,Set up your GitHub Actions workflow with a specific version of browser,https://github.com/abhi1693/setup-browser,https://github.com/abhi1693/setup-browser,MIT,?,,Met,Given only https: URLs.,?,,?,,Met,"Projects on GitHub by default use issues and pull requests, as encouraged by documentation such as <https://guides.github.com/activities/contributing-to-open-source/>.",?,,Met,Non-trivial license location file in repository: <https://github.com/abhi1693/setup-browser/blob/main/LICENSE>.,Met,The MIT license is approved by the Open Source Initiative (OSI).,Met,The MIT license is approved by the Open Source Initiative (OSI).,Unmet,// No appropriate folder found for documentation basics.,?,,Met,"Repository on GitHub, which provides public git repositories with URLs.",Met,"Repository on GitHub, which uses git. git can track the changes, who made them, and when they were made.",?,,Met,"Repository on GitHub, which uses git. git is distributed.",?,,?,,?,,Unmet,// No release notes file found.,?,,?,,?,,?,,?,,?,,?,,?,,?,,?,,?,,?,,?,,?,,?,,?,,?,,?,,?,,?,,?,,?,,?,,?,,?,,?,,?,,?,,?,,?,,?,,?,,?,,?,,?,,?,,?,,?,,?,,?,,?,,?,,?,,?,,,2021-05-30 14:54:44 UTC,2021-05-30 14:54:44 UTC,?,,?,,,Met,GitHub supports discussions on issues and pull requests.,?,,?,,?,,?,,?,,?,,?,,Met,Found all required security hardening headers.,?,,?,,15,,,2022-04-27 23:00:30 UTC,False,TypeScript,4,0,?,,?,,?,,?,,?,,?,,?,,?,,?,,?,,?,,?,,?,,?,,?,,?,,?,,?,,?,,?,,?,,?,,?,,?,,?,,?,,?,,?,,?,,?,,?,,?,,?,,?,,?,,?,,?,,?,,?,,?,,4,?,,?,,?,,?,,?,,?,,?,,?,,?,,?,,?,,?,,Unmet,,Unmet,,15,,,,,,,,,Met,
9,4940,10890,FHIR-to-CAPACITY,,https://github.com/FAIR-data-for-CAPACITY/FHIR-to-CAPACITY,https://github.com/FAIR-data-for-CAPACITY/FHIR-to-CAPACITY,Apache-2.0,?,,Met,Given only https: URLs.,?,,?,,Met,"Projects on GitHub by default use issues and pull requests, as encouraged by documentation such as <https://guides.github.com/activities/contributing-to-open-source/>.",?,,Met,Non-trivial license location file in repository: <https://github.com/FAIR-data-for-CAPACITY/FHIR-to-CAPACITY/blob/master/LICENSE>.,Met,The Apache-2.0 license is approved by the Open Source Initiative (OSI).,Met,The Apache-2.0 license is approved by the Open Source Initiative (OSI).,Unmet,// No appropriate folder found for documentation basics.,?,,Met,"Repository on GitHub, which provides public git repositories with URLs.",Met,"Repository on GitHub, which uses git. git can track the changes, who made them, and when they were made.",?,,Met,"Repository on GitHub, which uses git. git is distributed.",?,,?,,?,,Unmet,// No release notes file found.,?,,?,,?,,?,,?,,?,,?,,?,,?,,?,,?,,?,,?,,?,,?,,?,,?,,?,,?,,?,,?,,?,,?,,?,,?,,?,,?,,?,,?,,?,,?,,?,,?,,?,,?,,?,,?,,?,,?,,?,,?,,?,,?,,?,,,2021-05-31 12:01:19 UTC,2021-05-31 12:01:19 UTC,?,,?,,,Met,GitHub supports discussions on issues and pull requests.,?,,?,,?,,?,,?,,?,,?,,Met,Found all required security hardening headers.,?,,?,,15,,,2022-04-28 23:00:17 UTC,False,"Jupyter Notebook, Python",4,0,?,,?,,?,,?,,?,,?,,?,,?,,?,,?,,?,,?,,?,,?,,?,,?,,?,,?,,?,,?,,?,,?,,?,,?,,?,,?,,?,,?,,?,,?,,?,,?,,?,,?,,?,,?,,?,,?,,?,,?,,4,?,,?,,?,,?,,?,,?,,?,,?,,?,,?,,?,,?,,Unmet,,Unmet,,15,,,,,,,,,Met,
10,4941,10942,GraphScope,GraphScope: A One-Stop Large-Scale Graph Computing System from Alibaba,https://graphscope.io,https://github.com/alibaba/GraphScope,Apache-2.0,?,,Met,Given only https: URLs.,Met,https://graphscope.io/docs/,Met,"Obtain: <https://graphscope.io/docs/installation.html>
Feedback: <https://github.com/alibaba/GraphScope#contributing>",Met,Non-trivial contribution file in repository: <https://github.com/alibaba/GraphScope/blob/main/CONTRIBUTING.md>.,Met,https://graphscope.io/docs/developer_guide.html,Met,Non-trivial license location file in repository: <https://github.com/alibaba/GraphScope/blob/main/LICENSE>.,Met,The Apache-2.0 license is approved by the Open Source Initiative (OSI).,Met,The Apache-2.0 license is approved by the Open Source Initiative (OSI).,Met,Some documentation basics file contents found.,Met,How to load a graph from external data sources: <https://graphscope.io/docs/loading_graph.html#building-a-graph>,Met,"Repository on GitHub, which provides public git repositories with URLs.",Met,"Repository on GitHub, which uses git. git can track the changes, who made them, and when they were made.",?,,Met,"Repository on GitHub, which uses git. git is distributed.",Met,https://github.com/alibaba/GraphScope/releases,Met,,Met,https://github.com/alibaba/GraphScope/releases,Met,"e.g., <https://github.com/alibaba/GraphScope/releases/tag/v0.4.0>",?,,?,,Met,https://github.com/alibaba/GraphScope/issues,Met,https://github.com/alibaba/GraphScope#contributing,Met,,Met,,Met,https://github.com/alibaba/GraphScope/issues?q=,Met,https://github.com/alibaba/GraphScope/security,,,Met,,Met,Non-trivial build file in repository: <https://github.com/alibaba/GraphScope/blob/main/Makefile>.,Met,Non-trivial build file in repository: <https://github.com/alibaba/GraphScope/blob/main/Makefile>.,Met,,Met,https://github.com/alibaba/GraphScope/blob/main/.github/workflows/ci.yml,Met,https://github.com/alibaba/GraphScope/blob/main/.github/workflows/ci.yml,Met,https://github.com/alibaba/GraphScope/blob/main/.github/workflows/ci.yml,Met,,Met,,Unmet,,Met,https://github.com/alibaba/GraphScope/blob/main/analytical_engine/.clang-format,Met,,Met,,Met,,Met,,,,Met,,,,,,,,,,,,,,Met,,Met,,Met,,Met,,?,,?,,?,,?,,?,,?,,?,,?,,,2021-06-01 03:52:09 UTC,2021-06-01 08:36:20 UTC,Met,,Met,https://github.com/alibaba/GraphScope/blob/main/.github/workflows/ci.yml,,Met,GitHub supports discussions on issues and pull requests.,Met,,Met,https://graphscope.io/docs,?,,?,,?,,?,,?,,Unmet,"// X-Content-Type-Options was not set to ""nosniff"".",?,,?,,85,,,2022-04-29 23:00:24 UTC,False,"Java, Rust, C++, Python, Jupyter Notebook, Shell, CMake, C, Dockerfile, Smarty, Makefile, TypeScript, JavaScript",9,4,?,,?,,?,,?,,?,,?,,?,,?,,?,,?,,?,,?,,?,,?,,?,,?,,?,,?,,?,,?,,?,,?,,?,,?,,?,,?,,?,,?,,?,,?,,?,,?,,?,,?,,?,,?,,?,,?,,?,,?,,13,?,,?,,?,,?,,?,,?,,?,,?,,?,,?,,?,,?,,Unmet,,Unmet,,85,,,,,,,,,Met,
11,4942,10943,Project Lockdown,"Project Lockdown (an initiative from The IO Foundation) is a civic tech, interactive platform providing an overview of the state of Human and Digital Rights around the globe. It evaluates policies obtained from official sources that may impact their observance. It provides, among other tools, a layered map interface that allows for a visual representation of the policies adopted, assisting a broad range of stakeholders in understanding the global state of their Rights. This empowers them to become active agents of global change.",https://ProjectLockdown.world,https://github.com/TheIOFoundation/ProjectLockdown,GPL-3.0,?,,Met,Given only https: URLs.,Met,,Met,,Met,Non-trivial contribution file in repository: <https://github.com/TheIOFoundation/ProjectLockdown/blob/master/CONTRIBUTING.md>.,?,,Met,Non-trivial license location file in repository: <https://github.com/TheIOFoundation/ProjectLockdown/blob/master/LICENSE>.,Met,The GPL-3.0 license is approved by the Open Source Initiative (OSI).,Met,The GPL-3.0 license is approved by the Open Source Initiative (OSI).,Met,Some documentation basics file contents found.,Met,https://theiofoundation.stoplight.io/docs/projectlockdown,Met,"Repository on GitHub, which provides public git repositories with URLs.",Met,"Repository on GitHub, which uses git. git can track the changes, who made them, and when they were made.",?,,Met,"Repository on GitHub, which uses git. git is distributed.",?,,?,,?,,Unmet,// No release notes file found.,?,,?,,?,,?,,?,,?,,?,,?,,?,,?,,?,,?,,?,,?,,?,,?,,?,,?,,?,,?,,?,,?,,?,,?,,?,,?,,?,,?,,?,,?,,?,,?,,?,,?,,?,,?,,?,,?,,?,,?,,?,,?,,?,,?,,,2021-06-01 12:20:26 UTC,2021-06-01 12:24:12 UTC,?,,?,,cpe:2.3:a:jaea:mapping_tool:2.0.1.8:*:*:*:*:*:*:*,Met,GitHub supports discussions on issues and pull requests.,?,,Met,,?,,?,,?,,?,,?,,Unmet,"// X-Content-Type-Options was not set to ""nosniff"".",?,,?,,22,,,2022-04-29 23:00:24 UTC,False,"JavaScript, SCSS, Typescript",5,0,?,,?,,?,,?,,?,,?,,?,,?,,?,,?,,?,,?,,?,,?,,?,,?,,?,,?,,?,,?,,?,,?,,?,,?,,?,,?,,?,,?,,?,,?,,?,,?,,?,,?,,?,,?,,?,,?,,?,,?,,4,?,,?,,?,,?,,?,,?,,?,,?,,?,,?,,?,,?,,Unmet,,Unmet,,22,,,,,,,,,Met,
12,4943,10889,OEEGrafanaVisualizer,"The plugin built with React.js for Grafana Panel and provides representation of the results of OEE (Overall Equipment Effectiveness) for specific device in bar chart and additionnaly lines for Availability, Performance, Quality.",https://github.com/Exsensio-Ltd/OEEGrafanaVisualizer,https://github.com/Exsensio-Ltd/OEEGrafanaVisualizer,Apache-2.0,?,,Met,Given only https: URLs.,Met,https://github.com/Exsensio-Ltd/OEEGrafanaVisualizer/blob/master/README.md,Unmet,Currently it's not open to contribution,Met,"Projects on GitHub by default use issues and pull requests, as encouraged by documentation such as <https://guides.github.com/activities/contributing-to-open-source/>.",Unmet,Currently it's not open to contribution,Met,Non-trivial license location file in repository: <https://github.com/Exsensio-Ltd/OEEGrafanaVisualizer/blob/master/LICENSE>.,Met,The Apache-2.0 license is approved by the Open Source Initiative (OSI).,Met,The Apache-2.0 license is approved by the Open Source Initiative (OSI).,Met,https://github.com/Exsensio-Ltd/OEEGrafanaVisualizer/blob/master/README.md,Met,https://github.com/Exsensio-Ltd/OEEGrafanaVisualizer/blob/master/README.md,Met,"Repository on GitHub, which provides public git repositories with URLs.",Met,"Repository on GitHub, which uses git. git can track the changes, who made them, and when they were made.",?,,Met,"Repository on GitHub, which uses git. git is distributed.",?,,?,,?,,Met,Non-trivial release notes file in repository: <https://github.com/Exsensio-Ltd/OEEGrafanaVisualizer/blob/master/CHANGELOG.md>.,?,,?,,Met,https://github.com/Exsensio-Ltd/OEEGrafanaVisualizer/issues,Met,https://github.com/Exsensio-Ltd/OEEGrafanaVisualizer/issues,Unmet,No major bugs as the project is being setup,Unmet,No major bugs as the project is being setup,Met,https://github.com/Exsensio-Ltd/OEEGrafanaVisualizer/issues,?,,?,,?,,?,,Met,It uses Node.js npm/yarn to build the project,Met,It uses Node.js npm/yarn to build the project,?,,?,,?,,?,,?,,?,,,,,,,,?,,?,,?,,?,,?,,?,,?,,?,,?,,?,,?,,?,,?,,?,,?,,?,,?,,?,,?,,?,,?,,?,,,2021-06-01 15:03:09 UTC,2021-06-01 15:10:32 UTC,?,,?,,,Met,GitHub supports discussions on issues and pull requests.,?,,Met,,?,,?,,?,,?,,?,,Met,Found all required security hardening headers.,?,,?,,37,,,2022-04-29 23:00:24 UTC,False,"TypeScript, JavaScript",7,2,?,,?,,?,,?,,?,,?,,?,,?,,?,,?,,?,,?,,?,,?,,?,,?,,?,,?,,?,,?,,?,,?,,?,,?,,?,,?,,?,,?,,?,,?,,?,,?,,?,,?,,?,,?,,?,,?,,?,,?,,4,?,,?,,?,,?,,?,,?,,?,,?,,?,,?,,?,,?,,Unmet,,Unmet,,37,,,,,,,,,Met,
13,4944,10945,Apache CloudStack,"Apache CloudStack is open source software designed to deploy and manage large networks of virtual machines, as a highly available, highly scalable Infrastructure as a Service (IaaS) cloud computing platform. CloudStack is used by a number of service providers to offer public cloud services, and by many companies to provide an on-premises (private) cloud offering, or as part of a hybrid cloud solution.

CloudStack is a turnkey solution that includes the entire ""stack"" of features most organizations want with an IaaS cloud: compute orchestration, Network-as-a-Service, user and account management, a full and open native API, resource accounting, and a first-class User Interface (UI).

CloudStack currently supports the most popular hypervisors: VMware, KVM, Citrix XenServer, Xen Cloud Platform (XCP), Oracle VM server and Microsoft Hyper-V.

Users can manage their cloud with an easy to use Web interface, command line tools, and/or a full-featured RESTful API. In addition, CloudStack provides an API that's compatible with AWS EC2 and S3 for organizations that wish to deploy hybrid clouds.",https://cloudstack.apache.org,https://github.com/apache/cloudstack,Apache-2.0,?,,Met,Given only https: URLs.,Met,http://cloudstack.apache.org/,Met,https://cloudstack.apache.org/downloads.html,Met,Non-trivial contribution file in repository: <https://github.com/apache/cloudstack/blob/master/CONTRIBUTING.md>.,Met,https://github.com/apache/cloudstack/blob/master/CONTRIBUTING.md,Met,Non-trivial license location file in repository: <https://github.com/apache/cloudstack/blob/master/LICENSE>.,Met,The Apache-2.0 license is approved by the Open Source Initiative (OSI).,Met,The Apache-2.0 license is approved by the Open Source Initiative (OSI).,Met,https://docs.cloudstack.apache.org/en/latest/,Met,https://cloudstack.apache.org/api.html,Met,"Repository on GitHub, which provides public git repositories with URLs.",Met,"Repository on GitHub, which uses git. git can track the changes, who made them, and when they were made.",Met,,Met,"Repository on GitHub, which uses git. git is distributed.",Met,,Met,,Met,,Met,https://docs.cloudstack.apache.org/en/latest/releasenotes/index.html,Met,https://docs.cloudstack.apache.org/en/latest/releasenotes/index.html,?,,Met,https://github.com/apache/cloudstack/issues,Met,"https://cloudstack.apache.org/contribute.html
https://cloudstack.apache.org/security.html",Met,https://github.com/apache/cloudstack/issues,?,,?,,Met,https://cloudstack.apache.org/security.html,Met,https://cloudstack.apache.org/security.html,Met,https://cloudstack.apache.org/security.html,Met,Non-trivial build file in repository: <https://github.com/apache/cloudstack/blob/master/pom.xml>.,Met,Non-trivial build file in repository: <https://github.com/apache/cloudstack/blob/master/pom.xml>.,Met,,Met,,Met,,Met,,Met,,Met,,Met,,,,,,,,Met,,Met,,Met,,Met,,Met,,Met,,Met,,Met,,Met,,Met,,Met,,Met,,Met,,Met,,Met,sonar,Met,,,,,,Unmet,,,,Unmet,,,,,2021-06-01 17:33:34 UTC,2021-06-01 17:43:23 UTC,Met,,Met,,,Met,GitHub supports discussions on issues and pull requests.,Met,,Met,https://docs.cloudstack.apache.org/en/latest/,?,,?,,?,,?,,?,,Unmet,"// X-Content-Type-Options was not set to ""nosniff"".",?,,?,,97,,,2022-04-29 23:00:24 UTC,False,"Java, Python, Vue, JavaScript, Shell",10,4,?,,?,,?,,?,,?,,?,,?,,?,,?,,?,,?,,?,,?,,?,,?,,?,,?,,?,,?,,?,,?,,?,,?,,?,,?,,?,,?,,?,,?,,?,,?,,?,,?,,?,,?,,?,,?,,?,,?,,?,,4,?,,?,,?,,?,,?,,?,,?,,?,,?,,?,,?,,?,,Unmet,,Unmet,,97,,,,,,,,,Met,
14,4946,10951,open_ttt_lib,Rust library containing common Tic Tac Toe functionality.,https://github.com/j-richey/open_ttt_lib,https://github.com/j-richey/open_ttt_lib,MIT,?,,Met,Given only https: URLs.,Met,The README and the library API documentation introduce rules of Tic Tac Toe and how the library provides logic related to Tic Tac Toe.,Met,The README contains a section for how to submit bug reports and feature requests. GitHub issue templates help users quickly describe their issue or suggest a feature.  The CONTRIBUTING file contains details on how to provide additional contributions. ,Met,Non-trivial contribution file in repository: <https://github.com/j-richey/open_ttt_lib/blob/main/CONTRIBUTING.md>.,?,,Met,Non-trivial license location file in repository: <https://github.com/j-richey/open_ttt_lib/blob/main/LICENSE.txt>.,Met,The MIT license is approved by the Open Source Initiative (OSI).,Met,The MIT license is approved by the Open Source Initiative (OSI).,Met,The README and library API introductory material provides high level getting stated documentation.  Example applications with detailed comments provide additional reference material.,Met,"The public API is fully documented.  All public types being documented is enforced by the build system. Additionally, the build system ensures all example code builds and runs as expected. ",Met,"Repository on GitHub, which provides public git repositories with URLs.",Met,"Repository on GitHub, which uses git. git can track the changes, who made them, and when they were made.",Met,"Work is done on branches them merged to the ""main"" branch after review. Releases are created from the ""main"" branch.  ",Met,"Repository on GitHub, which uses git. git is distributed.",Met,All releases published to crates.io have a unique version number with a corresponding git tag. ,Met,,Met,Every release has a git tag. See https://github.com/j-richey/open_ttt_lib/tags,Met,Non-trivial release notes file in repository: <https://github.com/j-richey/open_ttt_lib/blob/main/CHANGELOG.md>.,,There have been no publicly known vulnerabilities. If a vulnerability is found it will be included in the change log. ,?,,Met,The project uses Github's issue tracker at https://github.com/j-richey/open_ttt_lib/issues,Met,The project uses Github's issue tracker at https://github.com/j-richey/open_ttt_lib/issues,?,,?,,Met,The project uses Github's issue tracker which includes a search feature. See https://github.com/j-richey/open_ttt_lib/issues,?,,?,,?,,Met,"The project uses cargo, the standard Rust build system.",Met,"The project uses cargo, the standard Rust build system.",Met,"The project uses cargo, the standard Rust build system.  Rust and its build tools are licensed under the MIT license and the Apache License.",Met,"The project includes a fully automated test suite to run unit tests, documentation tests, and other tests. The CONTRIBUTING.md file contains instructions on how to run the tests. Additionally, the test suite is run via the CI system for every pull request and merge. ",Met,"The tests are run with ""cargo test"", the standard invocation for Rust projects.",Met,Over 90% of the lines are covered with tests.  Uncovered lines typically are for asserts that validate invariants.  See https://coveralls.io/github/j-richey/open_ttt_lib,?,,?,,?,,Met,"This project uses Rust which warns about many types of issues by default.  Additionally the Rust linter tool, clippy, is used to find potential issues. ",Met,The CI system treats warnings as errors. The build fails and rejects any associated pull requests if there are any warnings emitted by Rust or the linter tool clippy.,?,,Met,The project's primary developer is familiar with design principles that promote secure software. ,Met,The project's primary developer knows of common vulnerabilities that can occur in the library and has proactively taken steps to help ensure these do not occur in the library.  ,,,,,,,,,,,,,,,,,?,,?,,?,,?,,Met,"Rust's static analysis tool, clippy, is automatically run on every commit pushed to GItHub and every pull request. All warnings must be addressed before pull requests are accepted. ",Met,,Met,"Rust's static analysis tool, clippy, is automatically run on every commit pushed to GItHub and every pull request. All warnings must be addressed before pull requests are accepted. This includes security related warnings. ",Met,"Rust's static analysis tool, clippy, is automatically run on every commit pushed to GItHub and every pull request. All warnings must be addressed before pull requests are accepted. ",?,,,"The application is written in Rust, a safe language.  The project strictly forbids usage of Rust's unsafe features.  Pull requests containing unsafe code are automatically rejected.   ",?,,?,,,2021-06-02 02:56:50 UTC,2021-06-21 04:15:38 UTC,,,Met,"The project uses TravisCI to automatically build and run tests on Linux, MacOS, and Windows.  See https://travis-ci.com/j-richey/open_ttt_lib",,Met,GitHub supports discussions on issues and pull requests.,?,,Met,,?,,?,,?,,?,,?,,Met,Found all required security hardening headers.,?,,?,,73,,,2022-02-23 23:00:28 UTC,False,Rust,10,5,?,,?,,?,,?,,?,,?,,?,,?,,?,,?,,?,,?,,?,,?,,?,,?,,?,,?,,?,,?,,?,,?,,?,,?,,?,,?,,?,,?,,?,,?,,?,,?,,?,,?,,?,,?,,?,,?,,?,,?,,9,?,,?,,?,,?,,?,,?,,?,,?,,?,,?,,?,,?,,Unmet,,Unmet,,73,,,,,,,,,Met,
15,4947,10952,Bramble,Bramble is a hacking Open source suite.,https://github.com/marcrow/Bramble,https://github.com/marcrow/Bramble,BSD-3-Clause,?,,Met,Given only https: URLs.,?,,?,,Met,"Projects on GitHub by default use issues and pull requests, as encouraged by documentation such as <https://guides.github.com/activities/contributing-to-open-source/>.",?,,Met,Non-trivial license location file in repository: <https://github.com/marcrow/Bramble/blob/master/LICENSE>.,Met,The BSD-3-Clause license is approved by the Open Source Initiative (OSI).,Met,The BSD-3-Clause license is approved by the Open Source Initiative (OSI).,Unmet,// No appropriate folder found for documentation basics.,?,,Met,"Repository on GitHub, which provides public git repositories with URLs.",Met,"Repository on GitHub, which uses git. git can track the changes, who made them, and when they were made.",?,,Met,"Repository on GitHub, which uses git. git is distributed.",?,,?,,?,,Unmet,// No release notes file found.,?,,?,,?,,?,,?,,?,,?,,?,,?,,?,,Met,Non-trivial build file in repository: <https://github.com/marcrow/Bramble/blob/master/Makefile>.,Met,Non-trivial build file in repository: <https://github.com/marcrow/Bramble/blob/master/Makefile>.,?,,?,,?,,?,,?,,?,,?,,?,,?,,?,,?,,?,,?,,?,,?,,?,,?,,?,,?,,?,,?,,?,,?,,?,,?,,?,,?,,?,,?,,?,,?,,?,,,2021-06-02 07:55:36 UTC,2021-06-02 07:55:36 UTC,?,,?,,,Met,GitHub supports discussions on issues and pull requests.,?,,?,,?,,?,,?,,?,,?,,Met,Found all required security hardening headers.,?,,?,,18,,,2022-04-30 23:00:20 UTC,False,"JavaScript, Shell, C++, Python, Makefile",4,0,?,,?,,?,,?,,?,,?,,?,,?,,?,,?,,?,,?,,?,,?,,?,,?,,?,,?,,?,,?,,?,,?,,?,,?,,?,,?,,?,,?,,?,,?,,?,,?,,?,,?,,?,,?,,?,,?,,?,,?,,4,?,,?,,?,,?,,?,,?,,?,,?,,?,,?,,?,,?,,Unmet,,Unmet,,18,,,,,,,,,Met,
