27,3185,4290,python-flask-restful-api,Restful Python Flask API,https://github.com/akashtalole/python-flask-restful-api,https://github.com/akashtalole/python-flask-restful-api,MIT,?,,Met,Given only https: URLs.,?,,?,,Met,"Projects on GitHub by default use issues and pull requests, as encouraged by documentation such as <https://guides.github.com/activities/contributing-to-open-source/>.",?,,Met,Non-trivial license location file in repository: <https://github.com/akashtalole/python-flask-restful-api/blob/master/LICENSE>.,Met,The MIT license is approved by the Open Source Initiative (OSI).,Met,The MIT license is approved by the Open Source Initiative (OSI).,Unmet,// No documentation basics file(s) found.,?,,Met,"Repository on GitHub, which provides public git repositories with URLs.",Met,"Repository on GitHub, which uses git. git can track the changes, who made them, and when they were made.",?,,Met,"Repository on GitHub, which uses git. git is distributed.",?,,?,,?,,Unmet,// No release notes file found.,?,,?,,?,,?,,?,,?,,?,,?,,?,,?,,?,,?,,?,,?,,?,,?,,?,,?,,?,,?,,?,,?,,?,,?,,?,,?,,?,,?,,?,,?,,?,,?,,?,,?,,?,,?,,?,,?,,?,,?,,?,,?,,?,,?,,,2019-09-16 04:15:48 UTC,2019-09-16 04:16:09 UTC,?,,?,,,Met,GitHub supports discussions on issues and pull requests.,?,,?,,?,,?,,?,,?,,?,,Met,Found all required security hardening headers.,?,,?,,15,,,2022-04-17 23:00:28 UTC,False,"Python, Shell, Dockerfile",13,0,?,,?,,?,,?,,?,,?,,?,,?,,?,,?,,?,,?,,?,,?,,?,,?,,?,,?,,?,,?,,?,,?,,?,,?,,?,,?,,?,,?,,?,,?,,?,,?,,?,,?,,?,,?,,?,,?,,?,,?,,4,?,,?,,?,,?,,?,,?,,?,,?,,?,,?,,?,,?,,Unmet,,Unmet,,15,,,,,,,,,Met,
28,3186,4294,Open Alliance for Cloud Adoption,"The OACA is community-led Linux Foundation project to enable innovative, safe and agile use of cloud computing for business value. 

OACA is driven by the mission to share cloud adoption practices and continuously improve maturity, security, and optimize cloud usage. 

Our goal is to create a highly engaged and vibrant community of cloud practitioners collaborating to drive interoperability of practices and creation of value.
",https://www.oaca-project.org,https://github.com/OACA-project,Creative Commons Attribution +ShareAlike (BY-SA),?,,Met,Given only https: URLs.,Met,https://www.oaca-project.org,Met,"Note that the OACA is not developing software. Our group authors content (White Papers, PDFs, Excel Spreadsheets, Web/Blog content, Podcasts, etc.)
https://www.oaca-project.org/contact/",Met,"Note that the OACA is not developing software. Our group authors content (White Papers, PDFs, Excel Spreadsheets, Web/Blog content, Podcasts, etc.)
https://www.oaca-project.org/contact/ provides a mechanism to communicate to the existing OACA members, and if individuals wish to join the OACA as a contributor (author of new content), they can request to join the OACA at https://www.oaca-project.org/join-us/",Met,"Note that the OACA is not developing software. Our group authors content (White Papers, PDFs, Excel Spreadsheets, Web/Blog content, Podcasts, etc.)
https://www.oaca-project.org/contact/ provides a mechanism to communicate to the existing OACA members, and if individuals wish to join the OACA as a contributor (author of new content), they can request to join the OACA at https://www.oaca-project.org/join-us/",Unmet,"The OACA is not developing software, our group authors content (White Pagers, PDFs, Excel Spreadsheets, Web/Blog content, Podcasts, etc.) . In our published written content, we state that each document is licensed under the Creative Commons Attribution +ShareAlike (BY-SA) License.",Unmet,"The OACA is not developing software. Our group authors content (White Papers, PDFs, Excel Spreadsheets, Web/Blog content, Podcasts, etc.)",Unmet,"The OACA is not developing software. Our group authors content (White Pagers, PDFs, Excel Spreadsheets, Web/Blog content, Podcasts, etc.)",,"The OACA is not developing software. Our group authors content (White Pagers, PDFs, Excel Spreadsheets, Web/Blog content, Podcasts, etc.)",,"The OACA is not developing software.  Our group authors content (White Pagers, PDFs, Excel Spreadsheets, Web/Blog content, Podcasts, etc.)",Met,"The OACA is not developing software or source-code. Our group authors content (White Pagers, PDFs, Excel Spreadsheets, Web/Blog content, Podcasts, etc.).  However, we do have a GitHub project that is public and is home to some previously released content.  https://github.com/OACA-project",Met,The OACA is not developing software or source-code.,Unmet,The OACA is not developing software or source-code.,Unmet,The OACA is not developing software or source-code.,Unmet,The OACA is not developing software or source-code.,Unmet,The OACA is not developing software or source-code.,Unmet,The OACA is not developing software or source-code.,,The OACA is not developing software or source-code.,,The OACA is not developing software or source-code.,?,,Unmet,The OACA is not developing software or source-code.,Met,"https://www.oaca-project.org/join-us/. 
There is also a mailing list that be posted to or joined.  
mailto:pen-alliance-for-cloud-adoption@googlegroups.com",Met,The OACA is not developing software or source-code.,Met,The OACA is not developing software or source-code.,Met,"https://groups.google.com/forum/#!forum/open-alliance-for-cloud-adoption
Errors and omissions can be reported and found here.",Met,"https://groups.google.com/forum/#!forum/open-alliance-for-cloud-adoption
The OACA is not developing software or source-code.",,The OACA is not developing software or source-code.,,The OACA is not developing software or source-code.,,The OACA is not developing software or source-code.,,The OACA is not developing software or source-code.,,The OACA is not developing software or source-code.,Unmet,The OACA is not developing software or source-code.,Unmet,The OACA is not developing software or source-code.,Unmet,The OACA is not developing software or source-code.,Unmet,The OACA is not developing software or source-code.,Unmet,The OACA is not developing software or source-code.,Unmet,The OACA is not developing software or source-code.,,The OACA is not developing software or source-code.,,The OACA is not developing software or source-code.,,The OACA is not developing software or source-code.,Unmet,The OACA is not developing software or source-code.,Unmet,The OACA is not developing software or source-code.,,The OACA is not developing software or source-code.,,The OACA is not developing software or source-code.,,The OACA is not developing software or source-code.,,The OACA is not developing software or source-code.,,The OACA is not developing software or source-code.,,The OACA is not developing software or source-code.,,The OACA is not developing software or source-code.,,The OACA is not developing software or source-code.,Unmet,The OACA is not developing software or source-code.,Unmet,The OACA is not developing software or source-code.,Unmet,The OACA is not developing software or source-code.,Unmet,The OACA is not developing software or source-code.,,The OACA is not developing software or source-code.,,The OACA is not developing software or source-code.,,The OACA is not developing software or source-code.,,The OACA is not developing software or source-code.,Unmet,The OACA is not developing software or source-code.,,The OACA is not developing software or source-code.,Unmet,The OACA is not developing software or source-code.,,The OACA is not developing software or source-code.,,2019-09-16 20:27:10 UTC,2020-02-13 02:56:46 UTC,,The OACA is not developing software or source-code.,Unmet,The OACA is not developing software or source-code.,,Met,"Note that the OACA is not developing software. Our group authors content (PDFs, Excel Spreadsheets, Web/Blog content, Podcasts, etc.)
https://www.oaca-project.org/contact/ provides a mechanism to communicate to the existing OACA members, and if individuals wish to join the OACA as a contributor (author of new content), they can request to join the OACA at https://www.oaca-project.org/join-us/",Met,,Met,Our published content (though not code) is in English.,?,,?,,?,,?,,?,,Unmet,"// X-Content-Type-Options was not set to ""nosniff"".",?,,?,,82,,,2022-05-21 23:00:16 UTC,False,-,18,9,?,,?,,?,,?,,?,,?,,?,,?,,?,,?,,?,,?,,?,,?,,?,,?,,?,,?,,?,,?,,?,,?,,?,,?,,?,,?,,?,,?,,?,,?,,?,,?,,?,,?,,?,,?,,?,,?,,?,,?,,4,?,,?,,?,,?,,?,,?,,?,,?,,?,,?,,?,,?,,Unmet,,Unmet,,82,,,,,,,,,Met,
29,3188,4299,data-as-a-science,"Lesson guide and textbook for ""Data as a Science"" course.",https://github.com/whythawk/data-as-a-science,https://github.com/whythawk/data-as-a-science,,?,,Met,Given only https: URLs.,?,,?,,Met,"Projects on GitHub by default use issues and pull requests, as encouraged by documentation such as <https://guides.github.com/activities/contributing-to-open-source/>.",?,,Unmet,// No license location file found.,?,,?,,Unmet,// No appropriate folder found for documentation basics.,?,,Met,"Repository on GitHub, which provides public git repositories with URLs.",Met,"Repository on GitHub, which uses git. git can track the changes, who made them, and when they were made.",?,,Met,"Repository on GitHub, which uses git. git is distributed.",?,,?,,?,,Unmet,// No release notes file found.,?,,?,,?,,?,,?,,?,,?,,?,,?,,?,,?,,?,,?,,?,,?,,?,,?,,?,,?,,?,,?,,?,,?,,?,,?,,?,,?,,?,,?,,?,,?,,?,,?,,?,,?,,?,,?,,?,,?,,?,,?,,?,,?,,?,,,2019-09-17 15:47:05 UTC,2019-09-17 15:47:05 UTC,?,,?,,,Met,GitHub supports discussions on issues and pull requests.,?,,?,,?,,?,,?,,?,,?,,Met,Found all required security hardening headers.,?,,?,,10,,,2022-04-18 23:00:15 UTC,False,"Jupyter Notebook, TeX",12,0,?,,?,,?,,?,,?,,?,,?,,?,,?,,?,,?,,?,,?,,?,,?,,?,,?,,?,,?,,?,,?,,?,,?,,?,,?,,?,,?,,?,,?,,?,,?,,?,,?,,?,,?,,?,,?,,?,,?,,?,,4,?,,?,,?,,?,,?,,?,,?,,?,,?,,?,,?,,?,,Unmet,,Unmet,,10,,,,,,,,,Met,
