7,3162,4254,Microbox,"Microbox (aka µbox, mu-box, or mi-box, depending on who you talk to) is an open-source ""fork"" of Nanobox (https://nanobox.io), focusing initially on feature-parity with Nanobox v1 (boxfiles), then on adding features and maintaining the boxfile approach moving forward. Doing this will require making some changes to some of the tooling and Docker images used - for example, to switch package managers to something that will take less time to maintain when new package versions are released.",https://github.com/mu-box,https://github.com/mu-box/core,MIT,?,,Met,Given only https: URLs.,Met,https://github.com/mu-box/core,Met,https://github.com/mu-box/.github/blob/master/CONTRIBUTING.md,Met,"Projects on GitHub by default use issues and pull requests, as encouraged by documentation such as <https://guides.github.com/activities/contributing-to-open-source/>.",Met,https://github.com/mu-box/.github/blob/master/CONTRIBUTING.md,Met,Non-trivial license location file in repository: <https://github.com/mu-box/core/blob/master/LICENSE.md>.,Met,The MIT license is approved by the Open Source Initiative (OSI).,Met,The MIT license is approved by the Open Source Initiative (OSI).,Unmet,// No documentation basics file(s) found.,Met,,Met,"Repository on GitHub, which provides public git repositories with URLs.",Met,"Repository on GitHub, which uses git. git can track the changes, who made them, and when they were made.",Met,,Met,"Repository on GitHub, which uses git. git is distributed.",Met,,Met,,Met,,,// No releases yet,,// No releases yet,?,,Met,,Met,https://github.com/mu-box/core/issues,Met,,Met,,Met,https://github.com/mu-box/core/issues?q=is%3Aissue+is%3Aclosed,Met,https://github.com/mu-box/.github/blob/master/SECURITY.md,Met,https://github.com/mu-box/.github/blob/master/SECURITY.md,Met,,Met,,Met,,Met,,Met,,Met,,Met,,Met,,Met,,Met,,Met,,Met,,Met,,?,,Met,,,,,,,,,,,,,,,,,,Met,,Met,,Met,,Met,,?,,?,,?,,?,,?,,,,?,,Met,,,2019-09-07 18:32:18 UTC,2019-09-11 20:53:45 UTC,,,Met,,,Met,GitHub supports discussions on issues and pull requests.,Met,,Met,,?,,?,,?,,?,,?,,Met,Found all required security hardening headers.,?,,?,,85,,,2022-04-11 23:00:22 UTC,False,"Elixir, JavaScript",19,4,?,,?,,?,,?,,?,,?,,?,,?,,?,,?,,?,,?,,?,,?,,?,,?,,?,,?,,?,,?,,?,,?,,?,,?,,?,,?,,?,,?,,?,,?,,?,,?,,?,,?,,?,,?,,?,,?,,?,,?,,4,?,,?,,?,,?,,?,,?,,?,,?,,?,,?,,?,,?,,Unmet,,Unmet,,85,,,,,,,,,Met,
8,3163,4256,Elastic Deep Learning,Elastic Deep Learning using PaddlePaddle and Kubernetes,https://github.com/PaddlePaddle/edl,https://github.com/PaddlePaddle/edl,Apache-2.0,?,,Met,Given only https: URLs.,Met,,Met,,Met,"Projects on GitHub by default use issues and pull requests, as encouraged by documentation such as <https://guides.github.com/activities/contributing-to-open-source/>.",?,,Met,Non-trivial license location file in repository: <https://github.com/PaddlePaddle/edl/blob/develop/LICENSE>.,Met,The Apache-2.0 license is approved by the Open Source Initiative (OSI).,Met,The Apache-2.0 license is approved by the Open Source Initiative (OSI).,Met,Some documentation basics file contents found.,?,,Met,"Repository on GitHub, which provides public git repositories with URLs.",Met,"Repository on GitHub, which uses git. git can track the changes, who made them, and when they were made.",Met,,Met,"Repository on GitHub, which uses git. git is distributed.",Met,,Met,,Met,,Unmet,// No release notes file found.,?,,?,,Met,,Met,https://github.com/PaddlePaddle/edl/issues,Met,,Met,,Unmet,,?,,?,,?,,Unmet,,?,,?,,?,,?,,?,,?,,?,,?,,Met,,Met,,Met,,Met,,Met,,Met,,Met,,Met,,Met,,Unmet,,Met,,Met,,Met,,Met,,Met,,Met,,Met,,Unmet,,Unmet,,Met,,Met,,Unmet,,Met,,Met,,Met,,,2019-09-08 02:29:17 UTC,2019-09-08 02:37:05 UTC,Met,,?,,,Met,GitHub supports discussions on issues and pull requests.,Met,,Met,,?,,?,,?,,?,,?,,Met,Found all required security hardening headers.,?,,?,,70,,,,True,"Go, Python, Shell, Dockerfile",6,0,?,,?,,?,,?,,?,,?,,?,,?,,?,,?,,?,,?,,?,,?,,?,,?,,?,,?,,?,,?,,?,,?,,?,,?,,?,,?,,?,,?,,?,,?,,?,,?,,?,,?,,?,,?,,?,,?,,?,,?,,4,?,,?,,?,,?,,?,,?,,?,,?,,?,,?,,?,,?,,Unmet,,Unmet,,70,,,,,,,,,Met,
9,3164,4257,pycoincap,:chart_with_upwards_trend: Python module for getting cryptocurrency data from Coinmarketcap :chart_with_downwards_trend:,https://github.com/ZoranPandovski/pycoincap,https://github.com/ZoranPandovski/pycoincap,MIT,?,,Met,Given only https: URLs.,?,,?,,Met,"Projects on GitHub by default use issues and pull requests, as encouraged by documentation such as <https://guides.github.com/activities/contributing-to-open-source/>.",?,,Met,Non-trivial license location file in repository: <https://github.com/ZoranPandovski/pycoincap/blob/master/LICENSE>.,Met,The MIT license is approved by the Open Source Initiative (OSI).,Met,The MIT license is approved by the Open Source Initiative (OSI).,Unmet,// No appropriate folder found for documentation basics.,?,,Met,"Repository on GitHub, which provides public git repositories with URLs.",Met,"Repository on GitHub, which uses git. git can track the changes, who made them, and when they were made.",?,,Met,"Repository on GitHub, which uses git. git is distributed.",?,,?,,?,,Unmet,// No release notes file found.,?,,?,,?,,?,,?,,?,,?,,?,,?,,?,,?,,?,,?,,?,,?,,?,,?,,?,,?,,?,,?,,?,,?,,?,,?,,?,,?,,?,,?,,?,,?,,?,,?,,?,,?,,?,,?,,?,,?,,?,,?,,?,,?,,?,,,2019-09-08 13:24:46 UTC,2019-09-08 13:24:46 UTC,?,,?,,,Met,GitHub supports discussions on issues and pull requests.,?,,?,,?,,?,,?,,?,,?,,Met,Found all required security hardening headers.,?,,?,,15,,,2022-04-07 23:00:25 UTC,False,Python,12,0,?,,?,,?,,?,,?,,?,,?,,?,,?,,?,,?,,?,,?,,?,,?,,?,,?,,?,,?,,?,,?,,?,,?,,?,,?,,?,,?,,?,,?,,?,,?,,?,,?,,?,,?,,?,,?,,?,,?,,?,,4,?,,?,,?,,?,,?,,?,,?,,?,,?,,?,,?,,?,,Unmet,,Unmet,,15,,,,,,,,,Met,
10,3168,4263,saber,()==[:::::::::::::> A static website generator for building blazing fast websites with Vue.js,https://saber.land,https://github.com/saberland/saber,MIT,?,,Met,Given only https: URLs.,?,,?,,Met,Non-trivial contribution file in repository: <https://github.com/saberland/saber/blob/master/CONTRIBUTING.md>.,?,,Met,Non-trivial license location file in repository: <https://github.com/saberland/saber/blob/master/LICENSE>.,Met,The MIT license is approved by the Open Source Initiative (OSI).,Met,The MIT license is approved by the Open Source Initiative (OSI).,Unmet,// No appropriate folder found for documentation basics.,?,,Met,"Repository on GitHub, which provides public git repositories with URLs.",Met,"Repository on GitHub, which uses git. git can track the changes, who made them, and when they were made.",?,,Met,"Repository on GitHub, which uses git. git is distributed.",?,,?,,?,,Unmet,// No release notes file found.,?,,?,,?,,?,,?,,?,,?,,?,,?,,?,,?,,?,,?,,?,,?,,?,,?,,?,,?,,?,,?,,?,,?,,?,,?,,?,,?,,?,,?,,?,,?,,?,,?,,?,,?,,?,,?,,?,,?,,?,,?,,?,,?,,?,,,2019-09-10 10:33:23 UTC,2019-09-10 10:33:23 UTC,?,,?,,,Met,GitHub supports discussions on issues and pull requests.,?,,?,,?,,?,,?,,?,,?,,Unmet,"// X-Content-Type-Options was not set to ""nosniff"".",?,,?,,15,,,2022-04-09 23:00:21 UTC,False,"JavaScript, Vue",12,0,?,,?,,?,,?,,?,,?,,?,,?,,?,,?,,?,,?,,?,,?,,?,,?,,?,,?,,?,,?,,?,,?,,?,,?,,?,,?,,?,,?,,?,,?,,?,,?,,?,,?,,?,,?,,?,,?,,?,,?,,4,?,,?,,?,,?,,?,,?,,?,,?,,?,,?,,?,,?,,Unmet,,Unmet,,15,,,,,,,,,Met,
11,3169,4264,ProjectHC,Problem solving with C#,https://github.com/Milkado/ProjectHC,https://github.com/Milkado/ProjectHC,,?,,Met,Given only https: URLs.,?,,?,,Met,"Projects on GitHub by default use issues and pull requests, as encouraged by documentation such as <https://guides.github.com/activities/contributing-to-open-source/>.",?,,Unmet,// No license location file found.,?,,?,,Unmet,// No appropriate folder found for documentation basics.,?,,Met,"Repository on GitHub, which provides public git repositories with URLs.",Met,"Repository on GitHub, which uses git. git can track the changes, who made them, and when they were made.",?,,Met,"Repository on GitHub, which uses git. git is distributed.",?,,?,,?,,Unmet,// No release notes file found.,?,,?,,?,,?,,?,,?,,?,,?,,?,,?,,?,,?,,?,,?,,?,,?,,?,,?,,?,,?,,?,,?,,?,,?,,?,,?,,?,,?,,?,,?,,?,,?,,?,,?,,?,,?,,?,,?,,?,,?,,?,,?,,?,,?,,,2019-09-10 12:23:11 UTC,2019-09-10 12:23:11 UTC,?,,?,,,Met,GitHub supports discussions on issues and pull requests.,?,,?,,?,,?,,?,,?,,?,,Met,Found all required security hardening headers.,?,,?,,10,,,2022-04-09 23:00:21 UTC,False,"C#, PLSQL",12,0,?,,?,,?,,?,,?,,?,,?,,?,,?,,?,,?,,?,,?,,?,,?,,?,,?,,?,,?,,?,,?,,?,,?,,?,,?,,?,,?,,?,,?,,?,,?,,?,,?,,?,,?,,?,,?,,?,,?,,?,,4,?,,?,,?,,?,,?,,?,,?,,?,,?,,?,,?,,?,,Unmet,,Unmet,,10,,,,,,,,,Met,
12,3170,4264,milkado.github.io,,https://github.com/Milkado/milkado.github.io,https://github.com/Milkado/milkado.github.io,,?,,Met,Given only https: URLs.,?,,?,,Met,"Projects on GitHub by default use issues and pull requests, as encouraged by documentation such as <https://guides.github.com/activities/contributing-to-open-source/>.",?,,Unmet,// No license location file found.,?,,?,,Unmet,// No appropriate folder found for documentation basics.,?,,Met,"Repository on GitHub, which provides public git repositories with URLs.",Met,"Repository on GitHub, which uses git. git can track the changes, who made them, and when they were made.",?,,Met,"Repository on GitHub, which uses git. git is distributed.",?,,?,,?,,Unmet,// No release notes file found.,?,,?,,?,,?,,?,,?,,?,,?,,?,,?,,,,?,,?,,?,,?,,?,,?,,?,,?,,?,,?,,?,,Met,,Met,,?,,?,,?,,?,,?,,?,,?,,?,,?,,?,,?,,?,,?,,?,,?,,?,,?,,?,,?,,?,,,2019-09-10 12:24:33 UTC,2019-09-10 12:28:05 UTC,?,,?,,,Met,GitHub supports discussions on issues and pull requests.,?,,?,,?,,?,,?,,?,,?,,Met,Found all required security hardening headers.,?,,?,,15,,,2022-04-09 23:00:22 UTC,False,JavaScript,13,0,?,,?,,?,,?,,?,,?,,?,,?,,?,,?,,?,,?,,?,,?,,?,,?,,?,,?,,?,,?,,?,,?,,?,,?,,?,,?,,?,,?,,?,,?,,?,,?,,?,,?,,?,,?,,?,,?,,?,,?,,4,?,,?,,?,,?,,?,,?,,?,,?,,?,,?,,?,,?,,Unmet,,Unmet,,15,,,,,,,,,Met,
13,3171,4209,virtualmin,,https://github.com/jallegri/virtualmin,https://github.com/jallegri/virtualmin,MIT,?,,Met,Given only https: URLs.,?,,?,,Met,"Projects on GitHub by default use issues and pull requests, as encouraged by documentation such as <https://guides.github.com/activities/contributing-to-open-source/>.",?,,Met,https://github.com/jallegri/virtualmin/blob/base/LICENSE,Met,MIT The MIT license is approved by the Open Source Initiative (OSI).,Met,The MIT license is approved by the Open Source Initiative (OSI).,Met,https://github.com/jallegri/virtualmin/blob/base/README.md,?,,Met,"Repository on GitHub, which provides public git repositories with URLs.",Met,"Repository on GitHub, which uses git. git can track the changes, who made them, and when they were made.",?,,Met,"Repository on GitHub, which uses git. git is distributed.",?,,?,,?,,Unmet,// No release notes file found.,?,,?,,?,,?,,?,,?,,?,,?,,?,,?,,?,,?,,?,,?,,?,,?,,?,,?,,?,,?,,?,,?,,?,,?,,?,,?,,?,,?,,?,,?,,?,,?,,?,,?,,?,,?,,?,,?,,?,,?,,?,,?,,?,,?,,,2019-09-10 12:46:28 UTC,2019-11-21 17:19:20 UTC,?,,?,,,Met,GitHub supports discussions on issues and pull requests.,?,,Met,,?,,?,,?,,?,,?,,Met,Found all required security hardening headers.,?,,?,,18,,,2022-04-08 23:00:15 UTC,False,Dockerfile,14,0,?,,?,,?,,?,,?,,?,,?,,?,,?,,?,,?,,?,,?,,?,,?,,?,,?,,?,,?,,?,,?,,?,,?,,?,,?,,?,,?,,?,,?,,?,,?,,?,,?,,?,,?,,?,,?,,?,,?,,?,,4,?,,?,,?,,?,,?,,?,,?,,?,,?,,?,,?,,?,,Unmet,,Unmet,,18,,,,,,,,,Met,
14,3172,4267,Medical Imaging Diagnosis Assistant,"The goal of this project is to propose a new methodology for fully automated breast cancer detection and segmentation from multi-modal medical images introducing clinical covariates. This protocol provides the following novelties. First, it lies on the use of deep convolutional neural networks (CNNs) that will incorporate several image modalities: 3D magnetic resonance images (MRI), ultrasound (US) or Mammography (MG) views. This is the first methodology that is able to classify a whole exam, containing all the above image modalities.

In this project, we are interested to develop a new assistant (i.e. a system that will provide diagnosis support as a second opinion), for other human tissues, besides the breast. This will embrace other anatomies such as the aorta, spinal column, epicardial fat, body fat, heart, lungs, and muscle.",https://github.com/mida-project,https://github.com/mida-project/meta,GPL-3.0,?,,Met,Given only https: URLs.,Met,https://mida-project.github.io,Met,https://github.com/mida-project,Met,"Projects on GitHub by default use issues and pull requests, as encouraged by documentation such as <https://guides.github.com/activities/contributing-to-open-source/>.",Met,https://github.com/mida-project,Met,Non-trivial license location file in repository: <https://github.com/mida-project/meta/blob/master/LICENSE>.,Met,The GPL-3.0 license is approved by the Open Source Initiative (OSI).,Met,The GPL-3.0 license is approved by the Open Source Initiative (OSI).,Met,https://github.com/mida-project,Met,https://github.com/mida-project,Met,"Repository on GitHub, which provides public git repositories with URLs.",Met,"Repository on GitHub, which uses git. git can track the changes, who made them, and when they were made.",Met,https://github.com/mida-project,Met,"Repository on GitHub, which uses git. git is distributed.",Met,https://github.com/mida-project,Met,,Met,https://github.com/mida-project,Met,https://github.com/mida-project,Met,https://github.com/mida-project,?,,Met,https://github.com/mida-project,Met,https://github.com/mida-project,Met,https://github.com/mida-project,Met,https://github.com/mida-project,Met,https://github.com/mida-project,Met,https://github.com/mida-project,Met,https://github.com/mida-project,Met,https://github.com/mida-project,Met,https://github.com/mida-project,Met,https://github.com/mida-project,Met,https://github.com/mida-project,Met,https://github.com/mida-project,Met,https://github.com/mida-project,Met,https://github.com/mida-project,Met,https://github.com/mida-project,Met,https://github.com/mida-project,Met,https://github.com/mida-project,Met,https://github.com/mida-project,Met,https://github.com/mida-project,Met,https://github.com/mida-project,Met,https://github.com/mida-project,Met,https://github.com/mida-project,Met,https://github.com/mida-project,Met,https://github.com/mida-project,Met,https://github.com/mida-project,Met,https://github.com/mida-project,Met,https://github.com/mida-project,Met,https://github.com/mida-project,Met,https://github.com/mida-project,Met,https://github.com/mida-project,Met,https://github.com/mida-project,Met,https://github.com/mida-project,Met,https://github.com/mida-project,Met,https://github.com/mida-project,Met,https://github.com/mida-project,Met,https://github.com/mida-project,Met,https://github.com/mida-project,Met,https://github.com/mida-project,Met,https://github.com/mida-project,Met,https://github.com/mida-project,Met,https://github.com/mida-project,Met,https://github.com/mida-project,,2019-09-10 15:29:20 UTC,2019-09-10 15:41:38 UTC,Met,https://github.com/mida-project,Met,https://github.com/mida-project,,Met,GitHub supports discussions on issues and pull requests.,Met,https://github.com/mida-project,Met,https://github.com/mida-project,?,,?,,?,,?,,?,,Met,Found all required security hardening headers.,?,,?,,100,2019-09-10 15:41:38 UTC,,,False,JavaScript,6,15,?,,?,,?,,?,,?,,?,,?,,?,,?,,?,,?,,?,,?,,?,,?,,?,,?,,?,,?,,?,,?,,?,,?,,?,,?,,?,,?,,?,,?,,?,,?,,?,,?,,?,,?,,?,,?,,?,,?,,?,,22,?,,?,,?,,?,,?,,?,,?,,?,,?,,?,,?,,?,,Met,,Unmet,,115,,,,,,2019-09-10 15:41:38 UTC,,,Met,
15,3173,4268,metallb,A network load-balancer implementation for Kubernetes using standard routing protocols.,https://metallb.universe.tf,https://github.com/danderson/metallb,Apache-2.0,?,,Met,"https://metallb.universe.tf is only available over HTTPS, with strict transport security (HSTS) enabled.",Met,https://metallb.universe.tf,Met,https://metallb.universe.tf/community/,Met,https://metallb.universe.tf/community/,Met,"https://metallb.universe.tf/community/#contributing
https://metallb.universe.tf/community/code-of-conduct/
https://github.com/danderson/metallb/blob/master/.github/issue_template.md
https://github.com/danderson/metallb/blob/master/.github/pull_request_template.md",Met,Non-trivial license location file in repository: <https://github.com/danderson/metallb/blob/master/LICENSE>.,Met,The Apache-2.0 license is approved by the Open Source Initiative (OSI).,Met,The Apache-2.0 license is approved by the Open Source Initiative (OSI).,Met,"https://metallb.universe.tf , present in the Git repository as the website source code: https://github.com/danderson/metallb/tree/master/website/content",Met,MetalLB is a Kubernetes software component. As such the interface consists of Kubernetes configuration and status objects. The objects relevant to configuring and using MetalLB are documented at https://metallb.universe.tf/configuration/ and https://metallb.universe.tf/usage/ .,Met,"Repository on GitHub, which provides public git repositories with URLs.

https://github.com/danderson/metallb",Met,"Repository on GitHub, which uses git. git can track the changes, who made them, and when they were made.",Met,"The master branch of https://github.com/danderson/metallb is the very latest code, including unreleased changes. Releases are tagged from master.",Met,"Repository on GitHub, which uses git. git is distributed.",Met,"MetalLB logs its Semver version (for release code) or git commit hash (for development builds). Example: {""branch"":""HEAD"",""caller"":""main.go:72"",""commit"":""v0.8.1"",""msg"":""MetalLB speaker starting version 0.8.1 (commit v0.8.1, branch HEAD)"",""ts"":""2019-08-27T04:37:31.972293077Z"",""version"":""0.8.1""}",Met,,Met,"Git branches for major.minor release branches, and tags fully identifying each major.minor.patch release.",Met,"Release notes are linked off the website's homepage. They are also pointed to with each release announcement.

https://metallb.universe.tf/release-notes/",,No known vulnerabilities to date.,?,,Met,https://github.com/danderson/metallb/issues,Met,https://github.com/danderson/metallb/issues,Met,"Bugs are acknowledged within the specified timeframe, and usually also fixed in that timeframe. Feature requests and requests for free labor in the form of tech support may not be answered in that timeframe.",Met,,Met,"Issue tracker keeps a record of bugs, feature requests, and discussions. https://github.com/danderson/metallb/issues",Met,https://github.com/danderson/metallb#reporting-security-issues,,"Vulnerabilities can be disclosed on the issue tracker, or by non-encrypted email to the author. The project doesn't have a pipeline for secure disclosure at this time.",,No vulnerabilities reported to date.,Met,MetalLB uses https://www.pyinvoke.org as a build system. https://metallb.universe.tf/community/ describes how to build the code.,Met,"MetalLB uses Invoke, an open-source task orchestration system.",Met,Invoke is OSS.,Met,MetalLB is written in go and uses standard `go test` tests.,Met,Tests are run with `go test`.,Met,"We aim for widespread code coverage, and most source packages have extensive tests.",Met,,Met,Example of a new feature in MetalLB 0.8.0: https://github.com/danderson/metallb/pull/314/files . The change to the code includes tests covering the new behavior.,Met,,Met,"Tests are run with the race condition detector enabled. We also run lint tools. Go itself doesn't have any warnings, the compiler only ever reports errors.",Met,"Race conditions, and lint errors cause CI failure and require fixing. The Go language has no concept of compile warnings, so that's N/A.",Met,We enable all lint warnings that have acceptable signal-to-noise ratio.,Met,,Met,,,,,,,,,,,,,,,,,,Met,,Met,,Met,,Met,,Met,gometalinter with a variety of checks.,,There are no FLOSS tools that I'm aware of that do this for Go code.,,No vulnerabilities ever found or reported.,Met,gometalinter runs during CI.,Unmet,"Optional criterion. Would be nice to have, but I'm not made of time or money.",,Go is a memory safe language.,Met,"The software includes a lot of internal consistency self-checks that are always run, even in production, and the software fails safe if such an assertion is tripped.",,No vulnerabilities reported. Disclosure guidelines talk about prompt fixes.,,2019-09-10 16:31:48 UTC,2019-09-10 17:01:03 UTC,,,Met,CI at https://circleci.com/gh/danderson/metallb/tree/master . Also does continuous deployment of test binaries.,,Met,"https://metallb.universe.tf/community/ lists 4 communication methods: Slack (proprietary, but accessible through a browser UI), IRC, a mailing list, and Github issues/pull requests.",Met,,Met,"https://metallb.universe.tf is all in English, and all project communication happens in English.",?,,?,,?,,?,,?,,Unmet,"// X-Content-Type-Options was not set to ""nosniff"".",?,,?,,100,2019-09-10 17:01:03 UTC,,,False,Go,6,13,?,,?,,?,,?,,?,,?,,?,,?,,?,,?,,?,,?,,?,,?,,?,,?,,?,,?,,?,,?,,?,,?,,?,,?,,?,,?,,?,,?,,?,,?,,?,,?,,?,,?,,?,,?,,?,,?,,?,,?,,13,?,,?,,?,,?,,?,,?,,?,,?,,?,,?,,?,,?,,Met,,Unmet,,113,,,,,,2019-09-10 17:01:03 UTC,,,Met,
