16,4948,10953,CoatRack,"CoatRack is a framework to manage backend-to-backend communication via REST services, consisting of:
- distributed, lightweight API gateways and
- a centralized web application to generate and manage those API gateways.",https://coatrack.eu,https://github.com/coatrack/coatrack,Apache-2.0,?,,Met,Given only https: URLs.,Met,https://github.com/coatrack/coatrack,Met,,Met,"Projects on GitHub by default use issues and pull requests, as encouraged by documentation such as <https://guides.github.com/activities/contributing-to-open-source/>.",Met,https://github.com/coatrack/coatrack/wiki/CoatRack-Developer-Guidelines,Met,Non-trivial license location file in repository: <https://github.com/coatrack/coatrack/blob/master/LICENSE>.,Met,The Apache-2.0 license is approved by the Open Source Initiative (OSI).,Met,The Apache-2.0 license is approved by the Open Source Initiative (OSI).,Met,https://github.com/coatrack/coatrack/wiki,Met,,Met,"Repository on GitHub, which provides public git repositories with URLs.",Met,"Repository on GitHub, which uses git. git can track the changes, who made them, and when they were made.",Met,Releases are first released as candidates using the postfix RC (for example 1.0-RC1),Met,"Repository on GitHub, which uses git. git is distributed.",Met,"Each release is tagged using git, see: https://github.com/coatrack/coatrack/releases",Met,,Met,"Each release is tagged using git, see: https://github.com/coatrack/coatrack/releases",Met,"Release notes are in the Github release page, see: 
https://github.com/coatrack/coatrack/releases",Met,,?,,Met,See https://github.com/coatrack/coatrack/issues,Met,Everyone with a Github user account is able to submit bug reports via: https://github.com/coatrack/coatrack/issues,Met,,Met,,Met,https://github.com/coatrack/coatrack/issues,Met,https://github.com/coatrack/coatrack/wiki,Met,https://github.com/coatrack/coatrack/wiki,Met,,Met,Non-trivial build file in repository: <https://github.com/coatrack/coatrack/blob/master/pom.xml>.,Met,Non-trivial build file in repository: <https://github.com/coatrack/coatrack/blob/master/pom.xml>.,Met,,Met,,Met,,Met,,Met,,Met,,Met,,Met,,Met,,Met,,Met,,Met,,Met,,Met,,Met,,Met,,Met,,Met,,Met,,Met,,Met,,Met,,Met,,Met,,Met,sonarcube,Met,,Met,,Met,,Met,,Met,,Met,,Met,,,2021-06-02 11:51:31 UTC,2021-12-02 12:29:30 UTC,Met,,Met,,,Met,GitHub supports discussions on issues and pull requests.,Met,,Met,"Documentation, wiki and issue tracker on https://github.com/coatrack/coatrack/ are all in English.",?,,?,,?,,?,,?,,Unmet,// One or more of the required security hardening headers is missing.,?,,?,,100,2021-10-07 10:21:01 UTC,,2021-08-19 23:00:38 UTC,False,"Java, JavaScript, HTML, CSS",12,5,?,,?,,?,,?,,?,,?,,?,,?,,?,,?,,?,,?,,?,,?,,?,,?,,?,,?,,?,,?,,?,,?,,?,,?,,?,,?,,?,,?,,?,,?,,?,,?,,?,,?,,?,,?,,?,,?,,?,,?,,4,?,,?,,?,,?,,?,,?,,?,,?,,?,,?,,?,,?,,Met,,Unmet,,105,,,,,,2021-10-07 10:21:01 UTC,,,Met,
17,4949,5719,liquidctl,Cross-platform CLI and Python drivers for AIO liquid coolers and other devices,https://github.com/liquidctl/liquidctl,https://github.com/liquidctl/liquidctl,GPL-3.0,?,,Met,Given only https: URLs.,Met,https://github.com/liquidctl/liquidctl,Met,https://github.com/liquidctl/liquidctl/blob/main/README.md,Met,https://github.com/liquidctl/liquidctl/blob/main/CONTRIBUTING.md,Met,https://github.com/liquidctl/liquidctl/blob/main/CONTRIBUTING.md,Met,https://github.com/liquidctl/liquidctl/blob/main/LICENSE.txt,Met,The GPL-3.0 license is approved by the Open Source Initiative (OSI).,Met,The GPL-3.0 license is approved by the Open Source Initiative (OSI).,Met,"https://github.com/liquidctl/liquidctl
https://github.com/liquidctl/liquidctl/blob/main/README.md
https://github.com/liquidctl/liquidctl/tree/main/docs",Met,https://github.com/liquidctl/liquidctl/blob/main/README.md,Met,"Repository on GitHub, which provides public git repositories with URLs.",Met,"Repository on GitHub, which uses git. git can track the changes, who made them, and when they were made.",Met,,Met,"Repository on GitHub, which uses git. git is distributed.",Met,,Met,,Met,,Met,https://github.com/jonasmalacofilho/liquidctl/blob/master/CHANGELOG.md.,,"So far, there have been no publicly known vulnerabilities.",?,,Met,https://github.com/liquidctl/liquidctl/issues,Met,https://github.com/liquidctl/liquidctl/issues,Met,,Met,,Met,https://github.com/liquidctl/liquidctl/issues,Met,https://github.com/liquidctl/liquidctl/security/policy,Met,https://github.com/liquidctl/liquidctl/security/policy,,There have been no vulnerabilities reported in the last 6 months.,Met,"The project uses a PEP 517 build, and is compatible with common tools like pip, as well as PyPA build and installer.",Met,"The project uses a PEP 517 build, and is compatible with common tools like pip, as well as PyPA build and installer.",Met,,Met,python -m pytest,Met,https://github.com/liquidctl/liquidctl#working-locally,Met,"While not rigorously measured, the test suite covers most methods, in them, most branches.  This is especially true in the case of the drivers.",Met,https://github.com/liquidctl/liquidctl/blob/main/.github/pull_request_template.md,Met,Major functionality is not merged unless there are tests; there are no recent major changes that have failed to meet this standard.,Met,https://github.com/liquidctl/liquidctl/blob/main/.github/pull_request_template.md,Unmet,"flake8 .
It runs in CI: https://github.com/liquidctl/liquidctl/blob/816380322f4e/.github/workflows/test-from-sources.yml#L53-L59",Unmet,,Unmet,,Met,,Met,,,,,,,,,,,,,,,,,,Met,,Met,,Met,,Met,,Unmet,,Unmet,,Unmet,,Unmet,,Unmet,,,The project does not produce software written in a memory-unsafe language.,Unmet,,,Not running dynamic code analysis.,,2021-06-02 17:10:35 UTC,2022-02-27 06:12:37 UTC,,,Met,"https://github.com/liquidctl/liquidctl/actions
https://ci.appveyor.com/project/jonasmalacofilho/liquidctl/branch/main",,Met,GitHub supports discussions on issues and pull requests.,Met,,Met,,Unmet,,,,,,,,,,Met,"https://github.com/liquidctl/liquidctl
https://pypi.org/project/liquidctl/",Met,pip or PEP 517 compatible tools.,,"Not applicable, the project uses Python.",94,,,2022-04-30 23:00:21 UTC,False,"Python, Shell",20,56,Unmet,,Unmet,,Met,https://github.com/liquidctl/liquidctl/blob/main/CODE_OF_CONDUCT.md,Unmet,,Unmet,,Unmet,,Unmet,,Unmet,,Unmet,,Met,"https://github.com/liquidctl/liquidctl#introducing-the-command-line-interface
https://github.com/liquidctl/liquidctl#supported-devices",Met,"Documentation is versioned alongside the source code.  Additionally, new features, or changes to existing features, are highlighted in the documentation.",Unmet,,Met,"The application is a command-line interface, and all functionality is available from a keyboard.",Unmet,,,The project sites do not store passwords.,Met,"Care is taken for new versions to be transparently backward-compatible with previous ones.  When there are changes that (while still allowed by our versioning policy, e.g. a bug fix) may break some uses cases, documentation is provided to assist the upgrade, and relevant third parties (such as significant downstream users of the APIs) are contacted and assisted directly.",,There have been no vulnerabilities resolved in the last 12 months.,Unmet,,Met,https://github.com/liquidctl/liquidctl/blob/main/docs/developer/style-guide.md,Unmet,,,No native binaries are being generated.,,There is no build or installation system.,,There is no build or installation system.,,There is no build or installation system.,,There is no build or installation system.,?,,Met,https://github.com/liquidctl/liquidctl/blob/816380322f4e/setup.cfg#L41-L46,Unmet,,Met,This is already taken care of pip or PEP 517 compatible tools.,Met,Deprecated or obsolete functions and APIs are not used.,Unmet,,Unmet,,Unmet,,Unmet,,Met,"For example: all input is checked, and care is taken so that the software doesn't allow an attacker to use it to bypass OS access controls.",Met,This is done.,,,,,Unmet,,Unmet,,52,Met,https://github.com/liquidctl/liquidctl/graphs/contributors?from=2021-02-27&type=c&to=2022-02-26,Met,https://github.com/liquidctl/liquidctl/blob/main/docs/developer/process.md#license-and-copyright,Met,https://github.com/liquidctl/liquidctl/blob/main/docs/developer/process.md#license-and-copyright,Unmet,,Met,Require two-factor authentication for everyone in the liquidctl organization has been enabled on GitHub.,Unmet,"We use GitHub 2FA, which supports TOTP.  But I'm not aware of any way of blocking SMS-based variant of 2FA.",?,,?,,Unmet,,Unmet,,Unmet,,Unmet,,Unmet,,Unmet,,94,,,,,,,,,Met,
18,4950,10960,face_unlock_linux,Face unlocking utility for Linux based on PAM,https://github.com/useafter-free/face_unlock_linux,https://github.com/useafter-free/face_unlock_linux,MIT,?,,Met,Given only https: URLs.,Met,,Met,,Met,"Projects on GitHub by default use issues and pull requests, as encouraged by documentation such as <https://guides.github.com/activities/contributing-to-open-source/>.",?,,Met,Non-trivial license location file in repository: <https://github.com/useafter-free/face_unlock_linux/blob/main/LICENSE>.,Met,The MIT license is approved by the Open Source Initiative (OSI).,Met,The MIT license is approved by the Open Source Initiative (OSI).,Met,// No appropriate folder found for documentation basics.,?,,Met,"Repository on GitHub, which provides public git repositories with URLs.",Met,"Repository on GitHub, which uses git. git can track the changes, who made them, and when they were made.",?,,Met,"Repository on GitHub, which uses git. git is distributed.",?,,?,,?,,Unmet,// No release notes file found.,?,,?,,?,,?,,?,,?,,?,,?,,?,,?,,Met,Non-trivial build file in repository: <https://github.com/useafter-free/face_unlock_linux/blob/main/Makefile>.,Met,Non-trivial build file in repository: <https://github.com/useafter-free/face_unlock_linux/blob/main/Makefile>.,?,,?,,?,,?,,?,,?,,?,,?,,?,,?,,?,,?,,?,,?,,?,,?,,?,,?,,?,,?,,?,,?,,?,,?,,?,,?,,?,,?,,?,,?,,?,,?,,,2021-06-03 01:43:32 UTC,2021-06-03 01:46:09 UTC,?,,?,,,Met,GitHub supports discussions on issues and pull requests.,?,,Met,,?,,?,,?,,?,,?,,Met,Found all required security hardening headers.,?,,?,,24,,,2022-05-02 23:00:44 UTC,False,"C++, Makefile",5,0,?,,?,,?,,?,,?,,?,,?,,?,,?,,?,,?,,?,,?,,?,,?,,?,,?,,?,,?,,?,,?,,?,,?,,?,,?,,?,,?,,?,,?,,?,,?,,?,,?,,?,,?,,?,,?,,?,,?,,?,,4,?,,?,,?,,?,,?,,?,,?,,?,,?,,?,,?,,?,,Unmet,,Unmet,,24,,,,,,,,,Met,
19,4951,10964,huff-tree-tap,Huffman Encoder and Decoder Library,https://github.com/chimbosonic/huff-tree-tap,https://github.com/chimbosonic/huff-tree-tap,MIT,?,,Met,Given only https: URLs.,?,,?,,Met,"Projects on GitHub by default use issues and pull requests, as encouraged by documentation such as <https://guides.github.com/activities/contributing-to-open-source/>.",?,,Met,Non-trivial license location file in repository: <https://github.com/chimbosonic/huff-tree-tap/blob/main/LICENSE>.,Met,The MIT license is approved by the Open Source Initiative (OSI).,Met,The MIT license is approved by the Open Source Initiative (OSI).,Unmet,// No appropriate folder found for documentation basics.,?,,Met,"Repository on GitHub, which provides public git repositories with URLs.",Met,"Repository on GitHub, which uses git. git can track the changes, who made them, and when they were made.",?,,Met,"Repository on GitHub, which uses git. git is distributed.",?,,?,,?,,Unmet,// No release notes file found.,?,,?,,?,,?,,?,,?,,?,,?,,?,,?,,?,,?,,?,,?,,?,,?,,?,,?,,?,,?,,?,,?,,?,,?,,?,,?,,?,,?,,?,,?,,?,,?,,?,,?,,?,,?,,?,,?,,?,,?,,?,,?,,?,,?,,,2021-06-03 14:15:06 UTC,2021-06-03 14:15:06 UTC,?,,?,,,Met,GitHub supports discussions on issues and pull requests.,?,,?,,?,,?,,?,,?,,?,,Met,Found all required security hardening headers.,?,,?,,15,,,2022-05-02 23:00:44 UTC,False,Rust,4,0,?,,?,,?,,?,,?,,?,,?,,?,,?,,?,,?,,?,,?,,?,,?,,?,,?,,?,,?,,?,,?,,?,,?,,?,,?,,?,,?,,?,,?,,?,,?,,?,,?,,?,,?,,?,,?,,?,,?,,?,,4,?,,?,,?,,?,,?,,?,,?,,?,,?,,?,,?,,?,,Unmet,,Unmet,,15,,,,,,,,,Met,
20,4952,10673,FlexHex-Rose-AP,ROSE-AP of the FlexHex project tries to make data gathering from Orion Context Broker entities to influx-db easier.,https://github.com/Factobotics/FlexHex-Rose-AP,https://github.com/Factobotics/FlexHex-Rose-AP,Apache-2.0,?,,Met,Given only https: URLs.,Met,https://github.com/Factobotics/FlexHex-Rose-AP/blob/master/docs/README.md,Unmet,,Unmet,,Unmet,,Met,https://github.com/Factobotics/FlexHex-Rose-AP/blob/master/LICENSE,Met,The Apache-2.0 license is approved by the Open Source Initiative (OSI).,Met,The Apache-2.0 license is approved by the Open Source Initiative (OSI).,Met,https://flexhex-rose-ap.readthedocs.io/en/latest/,Met,https://github.com/Factobotics/FlexHex-Rose-AP/blob/master/docs/step-by-step.md,Met,"Repository on GitHub, which provides public git repositories with URLs.",Met,"Repository on GitHub, which uses git. git can track the changes, who made them, and when they were made.",?,,Met,"Repository on GitHub, which uses git. git is distributed.",?,,?,,?,,Unmet,// No release notes file found.,?,,?,,Met,https://github.com/Factobotics/FlexHex-Rose-AP/issues,Met,https://github.com/Factobotics/FlexHex-Rose-AP/issues,Met,,Met,,Met,https://github.com/Factobotics/FlexHex-Rose-AP/issues,Met,https://github.com/Factobotics/FlexHex-Rose-AP/issues,,,Met,,,,,,,,?,,?,,?,,?,,?,,?,,?,,?,,?,,?,,?,,,,,,,,,,,,,,,,,,?,,?,,Met,,Met,,Met,Pylint. Trying to reach 9+ score.,?,,?,,Met,,?,,,,?,,?,,,2021-06-03 14:37:51 UTC,2021-06-07 11:31:36 UTC,,,?,,,Met,https://github.com/Factobotics/FlexHex-Rose-AP/issues,Met,,Met,"All of the documentation is written in English.
https://github.com/Factobotics/FlexHex-Rose-AP/tree/master/docs",?,,?,,?,,?,,?,,Met,Found all required security hardening headers.,?,,?,,58,,,2022-05-07 23:00:32 UTC,False,"Python, javascript",13,4,?,,?,,?,,?,,?,,?,,?,,?,,?,,?,,?,,?,,?,,?,,?,,?,,?,,?,,?,,?,,?,,?,,?,,?,,?,,?,,?,,?,,?,,?,,?,,?,,?,,?,,?,,?,,?,,?,,?,,?,,4,?,,?,,?,,?,,?,,?,,?,,?,,?,,?,,?,,?,,Unmet,,Unmet,,58,2021-06-03 14:44:51 UTC,,,,,,,,Met,
21,4953,10968,xkye_python,Standard Python Library For Xkye Language,https://github.com/RahmanAnsari/xkye_python,https://github.com/RahmanAnsari/xkye_python,MIT,?,,Met,Given only https: URLs.,?,,?,,Met,"Projects on GitHub by default use issues and pull requests, as encouraged by documentation such as <https://guides.github.com/activities/contributing-to-open-source/>.",?,,Met,Non-trivial license location file in repository: <https://github.com/RahmanAnsari/xkye_python/blob/main/LICENSE>.,Met,The MIT license is approved by the Open Source Initiative (OSI).,Met,The MIT license is approved by the Open Source Initiative (OSI).,Unmet,// No appropriate folder found for documentation basics.,?,,Met,"Repository on GitHub, which provides public git repositories with URLs.",Met,"Repository on GitHub, which uses git. git can track the changes, who made them, and when they were made.",?,,Met,"Repository on GitHub, which uses git. git is distributed.",?,,?,,?,,Unmet,// No release notes file found.,?,,?,,?,,?,,?,,?,,?,,?,,?,,?,,Met,Non-trivial build file in repository: <https://github.com/RahmanAnsari/xkye_python/blob/main/Makefile>.,Met,Non-trivial build file in repository: <https://github.com/RahmanAnsari/xkye_python/blob/main/Makefile>.,?,,?,,?,,?,,?,,?,,?,,?,,?,,?,,?,,?,,?,,?,,?,,?,,?,,?,,?,,?,,?,,?,,?,,?,,?,,?,,?,,?,,?,,?,,?,,?,,,2021-06-03 19:07:49 UTC,2021-06-03 19:08:26 UTC,?,,?,,,Met,GitHub supports discussions on issues and pull requests.,?,,?,,?,,?,,?,,?,,?,,Met,Found all required security hardening headers.,?,,?,,18,,,2022-05-02 23:00:44 UTC,False,"Python, Makefile",5,0,?,,?,,?,,?,,?,,?,,?,,?,,?,,?,,?,,?,,?,,?,,?,,?,,?,,?,,?,,?,,?,,?,,?,,?,,?,,?,,?,,?,,?,,?,,?,,?,,?,,?,,?,,?,,?,,?,,?,,?,,4,?,,?,,?,,?,,?,,?,,?,,?,,?,,?,,?,,?,,Unmet,,Unmet,,18,,,,,,,,,Met,
22,4954,10975,ecg200-device-firmware,,https://gitlab.teltonika.lt/allprojects/ecg/ecg200/ecg200-device-firmware,https://gitlab.teltonika.lt/allprojects/ecg/ecg200/ecg200-device-firmware,,?,,Met,Given only https: URLs.,?,,?,,?,,?,,?,,?,,?,,?,,?,,?,,?,,?,,?,,?,,?,,?,,?,,?,,?,,?,,?,,?,,?,,?,,?,,?,,?,,?,,?,,?,,?,,?,,?,,?,,?,,?,,?,,?,,?,,?,,?,,?,,?,,?,,?,,?,,?,,?,,?,,?,,?,,?,,?,,?,,?,,?,,?,,?,,?,,?,,?,,,2021-06-04 09:00:24 UTC,2021-06-04 09:00:24 UTC,?,,?,,,?,,?,,?,,?,,?,,?,,?,,?,,Unmet,"// X-Content-Type-Options was not set to ""nosniff"".",?,,?,,3,,,2022-05-03 23:00:23 UTC,False,,4,0,?,,?,,?,,?,,?,,?,,?,,?,,?,,?,,?,,?,,?,,?,,?,,?,,?,,?,,?,,?,,?,,?,,?,,?,,?,,?,,?,,?,,?,,?,,?,,?,,?,,?,,?,,?,,?,,?,,?,,?,,0,?,,?,,?,,?,,?,,?,,?,,?,,?,,?,,?,,?,,Unmet,,Unmet,,3,,,,,,,,,Met,
23,4955,10984,QuasselDroid-ng,Next Generation of the QuasselDroid IRC client.,https://quasseldroid.info,https://github.com/justjanne/QuasselDroid-ng,GPL-3.0,?,,Met,Given only https: URLs.,?,,?,,Met,"Projects on GitHub by default use issues and pull requests, as encouraged by documentation such as <https://guides.github.com/activities/contributing-to-open-source/>.",?,,Met,Non-trivial license location file in repository: <https://github.com/justjanne/QuasselDroid-ng/blob/main/LICENSE.md>.,Met,The GPL-3.0 license is approved by the Open Source Initiative (OSI).,Met,The GPL-3.0 license is approved by the Open Source Initiative (OSI).,Unmet,// No appropriate folder found for documentation basics.,?,,Met,"Repository on GitHub, which provides public git repositories with URLs.",Met,"Repository on GitHub, which uses git. git can track the changes, who made them, and when they were made.",?,,Met,"Repository on GitHub, which uses git. git is distributed.",?,,?,,?,,Unmet,// No release notes file found.,?,,?,,?,,?,,?,,?,,?,,?,,?,,?,,?,,?,,?,,?,,?,,?,,?,,?,,?,,?,,?,,?,,?,,?,,?,,?,,?,,?,,?,,?,,?,,?,,?,,?,,?,,?,,?,,?,,?,,?,,?,,?,,?,,?,,,2021-06-06 00:01:06 UTC,2021-06-06 00:01:06 UTC,?,,?,,,Met,GitHub supports discussions on issues and pull requests.,?,,?,,?,,?,,?,,?,,?,,Unmet,"// X-Content-Type-Options was not set to ""nosniff"".",?,,?,,15,,,2022-05-06 23:00:27 UTC,False,"Kotlin, Java",4,0,?,,?,,?,,?,,?,,?,,?,,?,,?,,?,,?,,?,,?,,?,,?,,?,,?,,?,,?,,?,,?,,?,,?,,?,,?,,?,,?,,?,,?,,?,,?,,?,,?,,?,,?,,?,,?,,?,,?,,?,,4,?,,?,,?,,?,,?,,?,,?,,?,,?,,?,,?,,?,,Unmet,,Unmet,,15,,,,,,,,,Met,
24,4956,10985,chasquid,"[chasquid](https://blitiri.com.ar/p/chasquid/) is an SMTP (email) server with a focus on simplicity, security, and ease of operation.",https://blitiri.com.ar/p/chasquid,https://blitiri.com.ar/repos/chasquid,Apache-2.0,?,,Met,Given only https: URLs.,Met,https://blitiri.com.ar/p/chasquid/,Met,https://blitiri.com.ar/p/chasquid/ (Contact section),Met,https://blitiri.com.ar/p/chasquid/ (Contact section),Unmet,"Go has its own coding style, and the project is small and doesn't mind incomplete patches.",Met,https://blitiri.com.ar/git/r/chasquid/b/master/t/f=LICENSE.html,Met,"https://blitiri.com.ar/p/chasquid/
https://blitiri.com.ar/git/r/chasquid/b/master/t/f=LICENSE.html The Apache-2.0 license is approved by the Open Source Initiative (OSI).",Met,The Apache-2.0 license is approved by the Open Source Initiative (OSI).,Met,https://blitiri.com.ar/p/chasquid/,Met,It's an SMTP software so most input/output is via SMTP protocol. There is also a non-trivial configuration. Both aspects are covered in the documentation.,Met,,Met,,Met,,Met,,Met,,Unmet,"Project uses SemVer but skips the patch version, as it hasn't been needed so far.",Met,Each release is tagged in git.,Met,https://blitiri.com.ar/p/chasquid/relnotes/,Met,https://blitiri.com.ar/p/chasquid/relnotes/,?,,Met,https://github.com/albertito/chasquid/issues,Met,https://blitiri.com.ar/p/chasquid/ - Contact section.,Met,,Met,,Met,"https://groups.google.com/g/chasquid
https://github.com/albertito/chasquid/issues",Met,https://blitiri.com.ar/p/chasquid/#contact,Met,https://blitiri.com.ar/p/chasquid/#contact,Met,,Met,,Met,Go and make.,Met,,Met,https://blitiri.com.ar/p/chasquid/tests/,Met,,Met,"https://blitiri.com.ar/p/chasquid/tests/#coverage
Coverage is kept at >90%.",Met,,Met,"Examples:
https://blitiri.com.ar/git/r/chasquid/c/fa651e74e370fb788a79d1ae11ec804e77179d7e/
https://blitiri.com.ar/git/r/chasquid/c/e79586a014dcabf3cdaae02b080ad7b96c94e018/
https://blitiri.com.ar/git/r/chasquid/c/d9d56552f396a3a3cc0014c70b77089bf917bc32/",Unmet,,Met,Automated tests run the Go linter.,Met,,Met,,Met,,Met,,Met,,Met,,Met,,Met,,Met,,Met,,Met,,Met,,Met,,Met,,Met,,Met,,Met,"https://golangci-lint.run/ which runs >10 static analysis tools, including all de-facto standard linters and checkers for Go.",,,Met,,Met,https://blitiri.com.ar/p/chasquid/tests/#automated-tests,Met,https://blitiri.com.ar/p/chasquid/tests/#fuzz-tests,,,Met,,Met,,,2021-06-06 00:34:58 UTC,2021-06-06 01:13:26 UTC,Met,,Met,https://blitiri.com.ar/p/chasquid/tests/#automated-tests,,Met,Mailing list at https://groups.google.com/g/chasquid is the main discussion forum.,Met,,Met,,?,,?,,?,,?,,?,,Unmet,"// X-Content-Type-Options was not set to ""nosniff"".",?,,?,,100,2021-06-06 01:13:26 UTC,,,False,Go,7,4,?,,?,,?,,?,,?,,?,,?,,?,,?,,?,,?,,?,,?,,?,,?,,?,,?,,?,,?,,?,,?,,?,,?,,?,,?,,?,,?,,?,,?,,?,,?,,?,,?,,?,,?,,?,,?,,?,,?,,?,,9,?,,?,,?,,?,,?,,?,,?,,?,,?,,?,,?,,?,,Met,,Unmet,,104,,,,,,2021-06-06 01:13:26 UTC,,,Met,
25,4957,10988,cerebro-cli,A novel recruiting tool using GitHub events.,https://github.com/aphelionz/cerebro-cli,https://github.com/aphelionz/cerebro-cli,AGPL-3.0,?,,Met,Given only https: URLs.,?,,?,,Met,"Projects on GitHub by default use issues and pull requests, as encouraged by documentation such as <https://guides.github.com/activities/contributing-to-open-source/>.",Met,,Met,Non-trivial license location file in repository: <https://github.com/aphelionz/cerebro-cli/blob/main/LICENSE>.,Met,The AGPL-3.0 license is approved by the Open Source Initiative (OSI).,Met,The AGPL-3.0 license is approved by the Open Source Initiative (OSI).,Unmet,// No appropriate folder found for documentation basics.,?,,Met,"Repository on GitHub, which provides public git repositories with URLs.",Met,"Repository on GitHub, which uses git. git can track the changes, who made them, and when they were made.",?,,Met,"Repository on GitHub, which uses git. git is distributed.",Met,GitHub Releases for each unique version available here: https://github.com/aphelionz/cerebro-cli/releases,Met,,Met,GitHub Releases automatically tag each version: https://github.com/aphelionz/cerebro-cli/releases,Unmet,// No release notes file found.,?,,?,,Met,Users can track individual issues using GitHub Issues: https://github.com/aphelionz/cerebro-cli/issues,Met,Users can submit bug reports via GitHub Issues: https://github.com/aphelionz/cerebro-cli/issues,?,,?,,?,,?,,?,,?,,?,,?,,?,,?,,?,,?,,?,,?,,?,,?,,?,,?,,?,,?,,?,,?,,?,,?,,?,,?,,?,,?,,?,,?,,?,,?,,?,,?,,?,,?,,?,,?,,?,,?,,,2021-06-06 14:07:42 UTC,2021-06-06 14:20:55 UTC,?,,?,,,Met,GitHub supports discussions on issues and pull requests.,?,,?,,?,,?,,?,,?,,?,,Met,Found all required security hardening headers.,?,,?,,22,,,2022-05-06 23:00:27 UTC,False,"JavaScript, Dockerfile",7,2,?,,?,,?,,?,,?,,?,,?,,?,,?,,?,,?,,?,,?,,?,,?,,?,,?,,?,,?,,?,,?,,?,,?,,?,,?,,?,,?,,?,,?,,?,,?,,?,,?,,?,,?,,?,,?,,?,,?,,?,,4,?,,?,,?,,?,,?,,?,,?,,?,,?,,?,,?,,?,,Unmet,,Unmet,,22,,,,,,,,,Met,
26,4959,5365,hypertrons-crx,Hypertrons chrome extension,https://github.com/hypertrons/hypertrons-crx,https://github.com/hypertrons/hypertrons-crx,Apache-2.0,?,,Met,Given only https: URLs.,?,,?,,Met,Non-trivial contribution file in repository: <https://github.com/hypertrons/hypertrons-crx/blob/master/CONTRIBUTING.md>.,?,,Met,Non-trivial license location file in repository: <https://github.com/hypertrons/hypertrons-crx/blob/master/LICENSE>.,Met,The Apache-2.0 license is approved by the Open Source Initiative (OSI).,Met,The Apache-2.0 license is approved by the Open Source Initiative (OSI).,Unmet,// No appropriate folder found for documentation basics.,?,,Met,"Repository on GitHub, which provides public git repositories with URLs.",Met,"Repository on GitHub, which uses git. git can track the changes, who made them, and when they were made.",?,,Met,"Repository on GitHub, which uses git. git is distributed.",?,,?,,?,,Unmet,// No release notes file found.,?,,?,,?,,?,,?,,?,,?,,?,,?,,?,,?,,?,,?,,?,,?,,?,,?,,?,,?,,?,,?,,?,,?,,?,,?,,?,,?,,?,,?,,?,,?,,?,,?,,?,,?,,?,,?,,?,,?,,?,,?,,?,,?,,?,,,2021-06-07 02:35:08 UTC,2021-06-07 02:35:08 UTC,?,,?,,,Met,GitHub supports discussions on issues and pull requests.,?,,?,,?,,?,,?,,?,,?,,Met,Found all required security hardening headers.,?,,?,,15,,,2022-05-07 23:00:32 UTC,False,"TypeScript, JavaScript",4,0,?,,?,,?,,?,,?,,?,,?,,?,,?,,?,,?,,?,,?,,?,,?,,?,,?,,?,,?,,?,,?,,?,,?,,?,,?,,?,,?,,?,,?,,?,,?,,?,,?,,?,,?,,?,,?,,?,,?,,?,,4,?,,?,,?,,?,,?,,?,,?,,?,,?,,?,,?,,?,,Unmet,,Unmet,,15,,,,,,,,,Met,
