8,5033,11628,Todo,A cross-platform TODO terminal app,https://todo.ghostvaibhav.me,https://github.com/GhostVaibhav/Todo,MIT,?,,Met,Given only https: URLs.,?,,?,,Met,"Projects on GitHub by default use issues and pull requests, as encouraged by documentation such as <https://guides.github.com/activities/contributing-to-open-source/>.",?,,Met,Non-trivial license location file in repository: <https://github.com/GhostVaibhav/Todo/blob/master/LICENSE>.,Met,The MIT license is approved by the Open Source Initiative (OSI).,Met,The MIT license is approved by the Open Source Initiative (OSI).,Unmet,// No appropriate folder found for documentation basics.,?,,Met,"Repository on GitHub, which provides public git repositories with URLs.",Met,"Repository on GitHub, which uses git. git can track the changes, who made them, and when they were made.",?,,Met,"Repository on GitHub, which uses git. git is distributed.",?,,?,,?,,Unmet,// No release notes file found.,?,,?,,?,,?,,?,,?,,?,,?,,?,,?,,Met,Non-trivial build file in repository: <https://github.com/GhostVaibhav/Todo/blob/master/CMakeLists.txt>.,Met,Non-trivial build file in repository: <https://github.com/GhostVaibhav/Todo/blob/master/CMakeLists.txt>.,?,,?,,?,,?,,?,,?,,?,,?,,?,,?,,?,,?,,?,,?,,?,,?,,?,,?,,?,,?,,?,,?,,?,,?,,?,,?,,?,,?,,?,,?,,?,,?,,,2021-07-08 05:46:58 UTC,2021-07-08 05:46:58 UTC,?,,?,,,Met,GitHub supports discussions on issues and pull requests.,?,,?,,?,,?,,?,,?,,?,,Unmet,"// X-Content-Type-Options was not set to ""nosniff"".",?,,?,,18,,,2022-03-14 23:00:25 UTC,False,"C++, C, Batchfile, CMake",3,0,?,,?,,?,,?,,?,,?,,?,,?,,?,,?,,?,,?,,?,,?,,?,,?,,?,,?,,?,,?,,?,,?,,?,,?,,?,,?,,?,,?,,?,,?,,?,,?,,?,,?,,?,,?,,?,,?,,?,,?,,4,?,,?,,?,,?,,?,,?,,?,,?,,?,,?,,?,,?,,Unmet,,Unmet,,18,,,,,,,,,Met,
9,5034,11630,kube-vip,Kubernetes Control Plane Virtual IP and Load-Balancer,https://github.com/kube-vip/kube-vip,https://github.com/kube-vip/kube-vip,Apache-2.0,?,,Met,Given only https: URLs.,Met,,Met,,Met,Non-trivial contribution file in repository: <https://github.com/kube-vip/kube-vip/blob/main/CONTRIBUTING.md>.,?,,Met,Non-trivial license location file in repository: <https://github.com/kube-vip/kube-vip/blob/main/LICENSE>.,Met,The Apache-2.0 license is approved by the Open Source Initiative (OSI).,Met,The Apache-2.0 license is approved by the Open Source Initiative (OSI).,Met,Some documentation basics file contents found.,Met,All additional documentation is on https://kube-vip.io,Met,"Repository on GitHub, which provides public git repositories with URLs.",Met,"Repository on GitHub, which uses git. git can track the changes, who made them, and when they were made.",?,,Met,"Repository on GitHub, which uses git. git is distributed.",?,,?,,?,,Unmet,// No release notes file found.,?,,?,,?,,?,,?,,?,,?,,?,,?,,?,,Met,Non-trivial build file in repository: <https://github.com/kube-vip/kube-vip/blob/main/Makefile>.,Met,Non-trivial build file in repository: <https://github.com/kube-vip/kube-vip/blob/main/Makefile>.,?,,?,,?,,?,,?,,?,,?,,?,,?,,?,,?,,?,,?,,?,,?,,?,,?,,?,,?,,?,,?,,?,,?,,?,,?,,?,,?,,?,,?,,?,,?,,?,,,2021-07-08 09:03:23 UTC,2021-07-08 09:05:22 UTC,?,,?,,,Met,GitHub supports discussions on issues and pull requests.,?,,Met,All documentation is in English,?,,?,,?,,?,,?,,Met,Found all required security hardening headers.,?,,?,,25,,,,False,"Go, Shell, Makefile, Dockerfile",1,0,?,,?,,?,,?,,?,,?,,?,,?,,?,,?,,?,,?,,?,,?,,?,,?,,?,,?,,?,,?,,?,,?,,?,,?,,?,,?,,?,,?,,?,,?,,?,,?,,?,,?,,?,,?,,?,,?,,?,,?,,4,?,,?,,?,,?,,?,,?,,?,,?,,?,,?,,?,,?,,Unmet,,Unmet,,25,,,,,,,,,Met,
10,5035,11631,DisroopEmbeddedHipster,A showcase  C/C++ embedded project demonstrating CI/CD practices,https://disroop.github.io/DisroopEmbeddedHipster,https://github.com/disroop/DisroopEmbeddedHipster,Apache-2.0,?,,Met,Given only https: URLs.,Met,https://disroop.github.io/DisroopEmbeddedHipster/ -- on the landig page.,Met,"Report bug, enhancement through pull requests 
 or contribute through github functionalities https://github.com/disroop/DisroopEmbeddedHipster/issues
https://github.com/disroop/DisroopEmbeddedHipster/pulls",Met,"Projects on GitHub by default use issues and pull requests, as encouraged by documentation such as <https://guides.github.com/activities/contributing-to-open-source/>.",Unmet,,Met,Non-trivial license location file in repository: <https://github.com/disroop/DisroopEmbeddedHipster/blob/main/LICENSE>.,Met,The Apache-2.0 license is approved by the Open Source Initiative (OSI).,Met,The Apache-2.0 license is approved by the Open Source Initiative (OSI).,Met,Some documentation basics file contents found.,Met,all dependencies are managed with docker and conan,Met,"Repository on GitHub, which provides public git repositories with URLs.",Met,"Repository on GitHub, which uses git. git can track the changes, who made them, and when they were made.",?,,Met,"Repository on GitHub, which uses git. git is distributed.",?,,?,,?,,Unmet,// No release notes file found.,?,,?,,?,,?,,?,,?,,?,,?,,?,,?,,?,,?,,?,,?,,?,,?,,?,,?,,?,,?,,?,,?,,?,,?,,?,,?,,?,,?,,?,,?,,?,,?,,?,,?,,?,,?,,Met,"SONAR Qube, iwyu, cpptest, clang-tidy",?,,?,,?,,?,,?,,?,,?,,,2021-07-08 09:51:32 UTC,2021-07-08 09:58:31 UTC,?,,?,,,Met,GitHub supports discussions on issues and pull requests.,?,,Met,The documentation is located here https://github.com/disroop/DisroopEmbeddedHipster/blob/main/doc/doc.adoc,?,,?,,?,,?,,?,,Unmet,"// X-Content-Type-Options was not set to ""nosniff"".",?,,?,,24,,,2022-03-14 23:00:25 UTC,False,"Python, C, CMake, C++, Shell",5,0,?,,?,,?,,?,,?,,?,,?,,?,,?,,?,,?,,?,,?,,?,,?,,?,,?,,?,,?,,?,,?,,?,,?,,?,,?,,?,,?,,?,,?,,?,,?,,?,,?,,?,,?,,?,,?,,?,,?,,?,,4,?,,?,,?,,?,,?,,?,,?,,?,,?,,?,,?,,?,,Unmet,,Unmet,,24,,,,,,,,,Met,
11,5036,11637,K8s Discovery,Auto discovers the running environment and serves the Kubernetes clientSet interface for interaction.,https://gkarthiks.github.io/k8s-discovery,https://github.com/gkarthiks/k8s-discovery,MIT,?,,Met,Given only https: URLs.,Met,gkarthiks.github.io/k8s-discovery/,Met,,Met,"Projects on GitHub by default use issues and pull requests, as encouraged by documentation such as <https://guides.github.com/activities/contributing-to-open-source/>.",Met,https://github.com/gkarthiks/k8s-discovery/blob/master/CONTRIBUTING.md,Met,Non-trivial license location file in repository: <https://github.com/gkarthiks/k8s-discovery/blob/master/LICENSE>.,Met,The MIT license is approved by the Open Source Initiative (OSI).,Met,The MIT license is approved by the Open Source Initiative (OSI).,Met,https://github.com/gkarthiks/k8s-discovery/blob/master/README.md,,This is a go module for Kubernetes.,Met,"Repository on GitHub, which provides public git repositories with URLs.",Met,"Repository on GitHub, which uses git. git can track the changes, who made them, and when they were made.",?,,Met,"Repository on GitHub, which uses git. git is distributed.",Met,,Met,,Met,,Met,Non-trivial release notes file in repository: <https://github.com/gkarthiks/k8s-discovery/blob/master/CHANGELOG.md>.,,This is a go module,?,,Met,,Met,https://github.com/gkarthiks/k8s-discovery/blob/master/CONTRIBUTING.md#contributing,Met,,Met,,?,,?,,,,Met,,,,Met,,,,Met,,Met,,Met,,Met,,Met,https://github.com/gkarthiks/k8s-discovery/blob/master/.github/workflows/test.yml,?,,,,,,,,Met,,Met,,,,Met,,Met,,,,,,,,,,,,?,,Met,,Met,,Met,,Met,gofmt,Met,,Met,,Met,,?,,?,,?,,Met,,,2021-07-09 02:40:58 UTC,2022-03-14 15:54:20 UTC,,,Met,https://github.com/gkarthiks/k8s-discovery/blob/master/.github/workflows/test.yml,,Met,GitHub supports discussions on issues and pull requests.,Met,,Met,,?,,?,,?,,?,,?,,Unmet,"// X-Content-Type-Options was not set to ""nosniff"".",?,,?,,88,,,2022-04-13 23:00:16 UTC,False,Go,13,4,?,,?,,?,,?,,?,,?,,?,,?,,?,,?,,?,,?,,?,,?,,?,,?,,?,,?,,?,,?,,?,,?,,?,,?,,?,,?,,?,,?,,?,,?,,?,,?,,?,,?,,?,,?,,?,,?,,?,,?,,9,?,,?,,?,,?,,?,,?,,?,,?,,?,,?,,?,,?,,Unmet,,Unmet,,88,,,,,,,,,Met,
12,5037,11638,Corrfunc,⚡️⚡️⚡️Blazing fast correlation functions on the CPU.,https://github.com/manodeep/Corrfunc,https://github.com/manodeep/Corrfunc,MIT,?,,Met,Given only https: URLs.,Met,"Project description - ""This repo contains a suite of codes to calculate correlation functions and other clustering statistics for simulated galaxies in a cosmological box (co-moving XYZ) and on observed galaxies with on-sky positions (RA, DEC, CZ). Read the documentation on corrfunc.rtfd.io.""",Met,Feedback is through GitHub issues. Not explicitly stated but implied as general practice within OSS,Met,"Projects on GitHub by default use issues and pull requests, as encouraged by documentation such as <https://guides.github.com/activities/contributing-to-open-source/>.",Met,https://corrfunc.readthedocs.io/en/master/development/contributing.html,Met,Non-trivial license location file in repository: <https://github.com/manodeep/Corrfunc/blob/master/LICENSE>.,Met,The MIT license is approved by the Open Source Initiative (OSI).,Met,The MIT license is approved by the Open Source Initiative (OSI).,Met,Some documentation basics file contents found.,Met,corrfunc.readthedocs.io/,Met,"Repository on GitHub, which provides public git repositories with URLs.",Met,"Repository on GitHub, which uses git. git can track the changes, who made them, and when they were made.",Met,The repo is open-development - all source is available,Met,"Repository on GitHub, which uses git. git is distributed.",Met,https://github.com/manodeep/Corrfunc/releases,Met,,Met,https://github.com/manodeep/Corrfunc/releases,Met,Changes.rst (version-controlled in the repo) contains all major/minor changes. Plus release notes on GitHub that accompany every release https://github.com/manodeep/Corrfunc/releases,,"Scientific software, does not really have a CVE",?,,Met,https://github.com/manodeep/Corrfunc/issues,Met,GitHub issues - https://github.com/manodeep/Corrfunc/issues,Met,"https://github.com/manodeep/Corrfunc/issues. The maintainers usually respond within hours, if not sooner",Met,,Met,Closed GitHub issues - https://github.com/manodeep/Corrfunc/issues?q=is%3Aissue+is%3Aclosed,Met,"Since this scientific research software, we do not expect to have vulnerabilities in the traditional sense. However, any perceived vulnerabilities can be reported as issues - https://github.com/manodeep/Corrfunc/issues",,Out of scope,,"We do not have any specific targets for vulnerabilities - however, issues are discussed on a much shorter timescale than 2 weeks",Met,Non-trivial build file in repository: <https://github.com/manodeep/Corrfunc/blob/master/Makefile>.,Met,Non-trivial build file in repository: <https://github.com/manodeep/Corrfunc/blob/master/Makefile>.,Met,"Needs a compiler, the make command-line tool, `and the GSL library for building the command-line executables within Corrfunc. Building (and using) the python bindings additionally requires python and numpy. All of these are FLOSS",Met,Tested on GitHub actions and TRAVIS CI,Met,,Met,"The entire API is tested on multiple platforms, with multiple software combinations",Met,Any new functionality is tested against all combinations of user-specifiable options (through an inbuilt exhaustive testing framework for integration testing),Met,Major functionality changes are done through a pull request with code review and testing,Unmet,,Met,The code enables a broad range of compiler warning flags and treats warnings as errors within CI,Met,See above - code can not be merged that has warnings,Met,See above. Warnings emitted by newer compilers also get fixed,Unmet,Research software - security is not a concern,Met,,,Scientific research software - not really relevant,,,,,,,,,,,,,,,Unmet,,Unmet,,?,,?,,Met,Two code quality apps have been used (landscape.io and codacy) - we are looking for a new one at the moment,Met,See above,Met,Severe issues are immediately fixed,Met,The code quality checks run on each update to GitHub,Unmet,Not deemed to be within the scope of the project,Met,We rely on the compiler to warn about buffer-overflows and the code-quality checkers,Unmet,Out of scope,Unmet,Out of scope,,2021-07-09 04:35:59 UTC,2021-07-10 03:29:18 UTC,,,Met,,,Met,GitHub supports discussions on issues and pull requests.,?,,Met,corrfunc.readthedocs.io/,?,,?,,?,,?,,?,,Met,Found all required security hardening headers.,?,,?,,90,,,2022-03-17 23:00:23 UTC,False,"C, Python, Makefile, TeX",13,11,?,,?,,?,,?,,?,,?,,?,,?,,?,,?,,?,,?,,?,,?,,?,,?,,?,,?,,?,,?,,?,,?,,?,,?,,?,,?,,?,,?,,?,,?,,?,,?,,?,,?,,?,,?,,?,,?,,?,,?,,9,?,,?,,?,,?,,?,,?,,?,,?,,?,,?,,?,,?,,Unmet,,Unmet,,90,,,,,,,,,Met,
13,5038,11643,webdav,Simple Go WebDAV server.,https://github.com/sxueck/webdav,https://github.com/sxueck/webdav,MIT,?,,Met,Given only https: URLs.,?,,?,,Met,"Projects on GitHub by default use issues and pull requests, as encouraged by documentation such as <https://guides.github.com/activities/contributing-to-open-source/>.",?,,Met,Non-trivial license location file in repository: <https://github.com/sxueck/webdav/blob/master/LICENSE>.,Met,The MIT license is approved by the Open Source Initiative (OSI).,Met,The MIT license is approved by the Open Source Initiative (OSI).,Unmet,// No appropriate folder found for documentation basics.,?,,Met,"Repository on GitHub, which provides public git repositories with URLs.",Met,"Repository on GitHub, which uses git. git can track the changes, who made them, and when they were made.",?,,Met,"Repository on GitHub, which uses git. git is distributed.",?,,?,,?,,Unmet,// No release notes file found.,?,,?,,?,,?,,?,,?,,?,,?,,?,,?,,?,,?,,?,,?,,?,,?,,?,,?,,?,,?,,?,,?,,?,,?,,?,,?,,?,,?,,?,,?,,?,,?,,?,,?,,?,,?,,?,,?,,?,,?,,?,,?,,?,,?,,,2021-07-09 09:43:32 UTC,2021-07-09 09:43:32 UTC,?,,?,,,Met,GitHub supports discussions on issues and pull requests.,?,,?,,?,,?,,?,,?,,?,,Met,Found all required security hardening headers.,?,,?,,15,,,2022-03-15 23:00:47 UTC,False,"Go, Dockerfile",3,0,?,,?,,?,,?,,?,,?,,?,,?,,?,,?,,?,,?,,?,,?,,?,,?,,?,,?,,?,,?,,?,,?,,?,,?,,?,,?,,?,,?,,?,,?,,?,,?,,?,,?,,?,,?,,?,,?,,?,,?,,4,?,,?,,?,,?,,?,,?,,?,,?,,?,,?,,?,,?,,Unmet,,Unmet,,15,,,,,,,,,Met,
14,5039,11645,astsearch,Intelligently search in Python code,https://astsearch.readthedocs.io/en/latest,https://github.com/takluyver/astsearch,MIT,?,,Met,Given only https: URLs.,?,,?,,Met,"Projects on GitHub by default use issues and pull requests, as encouraged by documentation such as <https://guides.github.com/activities/contributing-to-open-source/>.",?,,Met,Non-trivial license location file in repository: <https://github.com/takluyver/astsearch/blob/master/LICENSE>.,Met,The MIT license is approved by the Open Source Initiative (OSI).,Met,The MIT license is approved by the Open Source Initiative (OSI).,Met,Some documentation basics file contents found.,?,,Met,"Repository on GitHub, which provides public git repositories with URLs.",Met,"Repository on GitHub, which uses git. git can track the changes, who made them, and when they were made.",?,,Met,"Repository on GitHub, which uses git. git is distributed.",?,,?,,?,,Unmet,// No release notes file found.,?,,?,,?,,?,,?,,?,,?,,?,,?,,?,,?,,?,,?,,?,,?,,?,,?,,?,,?,,?,,?,,?,,?,,?,,?,,?,,?,,?,,?,,?,,?,,?,,?,,?,,?,,?,,?,,?,,?,,?,,?,,?,,?,,?,,,2021-07-09 12:18:03 UTC,2021-07-09 12:18:03 UTC,?,,?,,,Met,GitHub supports discussions on issues and pull requests.,?,,?,,?,,?,,?,,?,,?,,Unmet,"// X-Content-Type-Options was not set to ""nosniff"".",?,,?,,16,,,2022-03-15 23:00:47 UTC,False,Python,3,0,?,,?,,?,,?,,?,,?,,?,,?,,?,,?,,?,,?,,?,,?,,?,,?,,?,,?,,?,,?,,?,,?,,?,,?,,?,,?,,?,,?,,?,,?,,?,,?,,?,,?,,?,,?,,?,,?,,?,,?,,4,?,,?,,?,,?,,?,,?,,?,,?,,?,,?,,?,,?,,Unmet,,Unmet,,16,,,,,,,,,Met,
15,5040,11647,pyDeprecate,Simple tooling for marking deprecated functions or classes and re-routing to the new successors' instance.,https://borda.github.io/pyDeprecate,https://github.com/Borda/pyDeprecate,BSD-3-Clause,?,,Met,Given only https: URLs.,?,,?,,Met,"Projects on GitHub by default use issues and pull requests, as encouraged by documentation such as <https://guides.github.com/activities/contributing-to-open-source/>.",?,,Met,Non-trivial license location file in repository: <https://github.com/Borda/pyDeprecate/blob/main/LICENSE>.,Met,The BSD-3-Clause license is approved by the Open Source Initiative (OSI).,Met,The BSD-3-Clause license is approved by the Open Source Initiative (OSI).,Unmet,// No appropriate folder found for documentation basics.,?,,Met,"Repository on GitHub, which provides public git repositories with URLs.",Met,"Repository on GitHub, which uses git. git can track the changes, who made them, and when they were made.",?,,Met,"Repository on GitHub, which uses git. git is distributed.",?,,?,,?,,Unmet,// No release notes file found.,?,,?,,?,,?,,?,,?,,?,,?,,?,,?,,?,,?,,?,,?,,?,,?,,?,,?,,?,,?,,?,,?,,?,,?,,?,,?,,?,,?,,?,,?,,?,,?,,?,,?,,?,,?,,?,,?,,?,,?,,?,,?,,?,,?,,,2021-07-09 15:02:54 UTC,2021-07-09 15:02:54 UTC,?,,?,,,Met,GitHub supports discussions on issues and pull requests.,?,,?,,?,,?,,?,,?,,?,,Unmet,"// X-Content-Type-Options was not set to ""nosniff"".",?,,?,,15,,,2022-03-15 23:00:48 UTC,False,Python,3,0,?,,?,,?,,?,,?,,?,,?,,?,,?,,?,,?,,?,,?,,?,,?,,?,,?,,?,,?,,?,,?,,?,,?,,?,,?,,?,,?,,?,,?,,?,,?,,?,,?,,?,,?,,?,,?,,?,,?,,?,,4,?,,?,,?,,?,,?,,?,,?,,?,,?,,?,,?,,?,,Unmet,,Unmet,,15,,,,,,,,,Met,
16,5041,11647,pytorch-lightning,"The lightweight PyTorch wrapper for high-performance AI research. Scale your models, not the boilerplate.",https://pytorchlightning.ai,https://github.com/Borda/pytorch-lightning,Apache-2.0,?,,Met,Given only https: URLs.,?,,?,,Met,"Projects on GitHub by default use issues and pull requests, as encouraged by documentation such as <https://guides.github.com/activities/contributing-to-open-source/>.",?,,Met,Non-trivial license location file in repository: <https://github.com/Borda/pytorch-lightning/blob/master/LICENSE>.,Met,The Apache-2.0 license is approved by the Open Source Initiative (OSI).,Met,The Apache-2.0 license is approved by the Open Source Initiative (OSI).,Met,Some documentation basics file contents found.,?,,Met,"Repository on GitHub, which provides public git repositories with URLs.",Met,"Repository on GitHub, which uses git. git can track the changes, who made them, and when they were made.",?,,Met,"Repository on GitHub, which uses git. git is distributed.",?,,?,,?,,Met,Non-trivial release notes file in repository: <https://github.com/Borda/pytorch-lightning/blob/master/CHANGELOG.md>.,?,,?,,?,,?,,?,,?,,?,,?,,?,,?,,Met,Non-trivial build file in repository: <https://github.com/Borda/pytorch-lightning/blob/master/Makefile>.,Met,Non-trivial build file in repository: <https://github.com/Borda/pytorch-lightning/blob/master/Makefile>.,?,,?,,?,,?,,?,,?,,?,,?,,?,,?,,?,,?,,?,,?,,?,,?,,?,,?,,?,,?,,?,,?,,?,,?,,?,,?,,?,,?,,?,,?,,?,,?,,,2021-07-09 15:04:04 UTC,2021-07-09 15:04:04 UTC,?,,?,,,Met,GitHub supports discussions on issues and pull requests.,?,,?,,?,,?,,?,,?,,?,,Unmet,"// X-Content-Type-Options was not set to ""nosniff"".",?,,?,,21,,,2022-03-15 23:00:48 UTC,False,"Python, Dockerfile, Shell, Jsonnet, Makefile",3,0,?,,?,,?,,?,,?,,?,,?,,?,,?,,?,,?,,?,,?,,?,,?,,?,,?,,?,,?,,?,,?,,?,,?,,?,,?,,?,,?,,?,,?,,?,,?,,?,,?,,?,,?,,?,,?,,?,,?,,?,,4,?,,?,,?,,?,,?,,?,,?,,?,,?,,?,,?,,?,,Unmet,,Unmet,,21,,,,,,,,,Met,
17,5042,11649,cloudFunctions,Repositório destinado ao versionamento do Cloud Functions,https://github.com/BeerXP/cloudFunctions,https://github.com/BeerXP/cloudFunctions,,?,,Met,Given only https: URLs.,?,,?,,Met,"Projects on GitHub by default use issues and pull requests, as encouraged by documentation such as <https://guides.github.com/activities/contributing-to-open-source/>.",?,,Unmet,// No license location file found.,?,,?,,Unmet,// No appropriate folder found for documentation basics.,?,,Met,"Repository on GitHub, which provides public git repositories with URLs.",Met,"Repository on GitHub, which uses git. git can track the changes, who made them, and when they were made.",?,,Met,"Repository on GitHub, which uses git. git is distributed.",?,,?,,?,,Unmet,// No release notes file found.,?,,?,,?,,?,,?,,?,,?,,?,,?,,?,,?,,?,,?,,?,,?,,?,,?,,?,,?,,?,,?,,?,,?,,?,,?,,?,,?,,?,,?,,?,,?,,?,,?,,?,,?,,?,,?,,?,,?,,?,,?,,?,,?,,?,,,2021-07-09 16:49:58 UTC,2021-07-09 16:49:58 UTC,?,,?,,,Met,GitHub supports discussions on issues and pull requests.,?,,?,,?,,?,,?,,?,,?,,Met,Found all required security hardening headers.,?,,?,,10,,,2022-03-15 23:00:48 UTC,False,JavaScript,3,0,?,,?,,?,,?,,?,,?,,?,,?,,?,,?,,?,,?,,?,,?,,?,,?,,?,,?,,?,,?,,?,,?,,?,,?,,?,,?,,?,,?,,?,,?,,?,,?,,?,,?,,?,,?,,?,,?,,?,,?,,4,?,,?,,?,,?,,?,,?,,?,,?,,?,,?,,?,,?,,Unmet,,Unmet,,10,,,,,,,,,Met,
18,5043,11650,go-kong,Go binding for Kong's admin API,https://github.com/kong/go-kong,https://github.com/kong/go-kong,Apache-2.0,?,,Met,Given only https: URLs.,?,,?,,Met,"Projects on GitHub by default use issues and pull requests, as encouraged by documentation such as <https://guides.github.com/activities/contributing-to-open-source/>.",?,,Met,Non-trivial license location file in repository: <https://github.com/Kong/go-kong/blob/main/LICENSE>.,Met,The Apache-2.0 license is approved by the Open Source Initiative (OSI).,Met,The Apache-2.0 license is approved by the Open Source Initiative (OSI).,Unmet,// No appropriate folder found for documentation basics.,?,,Met,"Repository on GitHub, which provides public git repositories with URLs.",Met,"Repository on GitHub, which uses git. git can track the changes, who made them, and when they were made.",?,,Met,"Repository on GitHub, which uses git. git is distributed.",?,,?,,?,,Met,Non-trivial release notes file in repository: <https://github.com/Kong/go-kong/blob/main/CHANGELOG.md>.,?,,?,,?,,?,,?,,?,,?,,?,,?,,?,,Met,Non-trivial build file in repository: <https://github.com/Kong/go-kong/blob/main/Makefile>.,Met,Non-trivial build file in repository: <https://github.com/Kong/go-kong/blob/main/Makefile>.,?,,?,,?,,?,,?,,?,,?,,?,,?,,?,,?,,?,,?,,?,,?,,?,,?,,?,,?,,?,,?,,?,,?,,?,,?,,?,,?,,?,,?,,?,,?,,?,,,2021-07-09 21:58:19 UTC,2021-07-09 21:58:19 UTC,?,,?,,,Met,GitHub supports discussions on issues and pull requests.,?,,?,,?,,?,,?,,?,,?,,Met,Found all required security hardening headers.,?,,?,,19,,,2022-03-16 23:00:17 UTC,False,"Go, Shell, Makefile",3,0,?,,?,,?,,?,,?,,?,,?,,?,,?,,?,,?,,?,,?,,?,,?,,?,,?,,?,,?,,?,,?,,?,,?,,?,,?,,?,,?,,?,,?,,?,,?,,?,,?,,?,,?,,?,,?,,?,,?,,?,,4,?,,?,,?,,?,,?,,?,,?,,?,,?,,?,,?,,?,,Unmet,,Unmet,,19,,,,,,,,,Met,
19,5044,11651,dapr,"Dapr is a portable, event-driven, runtime for building distributed applications across cloud and edge.",https://dapr.io,https://github.com/dapr/dapr,MIT,?,,Met,"https://docs.dapr.io
https://github.com/dapr/dapr/releases",Met,,Met,,Met,Non-trivial contribution file in repository: <https://github.com/dapr/dapr/blob/master/CONTRIBUTING.md>.,Met,https://docs.dapr.io/contributing/,Met,Non-trivial license location file in repository: <https://github.com/dapr/dapr/blob/master/LICENSE>.,Met,The MIT license is approved by the Open Source Initiative (OSI).,Met,The MIT license is approved by the Open Source Initiative (OSI).,Met,https://docs.dapr.io,Met,https://docs.dapr.io/reference/,Met,"Repository on GitHub, which provides public git repositories with URLs.",Met,"Repository on GitHub, which uses git. git can track the changes, who made them, and when they were made.",Met,We have RC releases prior to the final RC: https://github.com/dapr/dapr/releases,Met,"Repository on GitHub, which uses git. git is distributed.",Met,https://github.com/dapr/dapr/releases,Met,,Met,We use git tags: https://github.com/dapr/dapr/releases,Met,https://github.com/dapr/dapr/tree/master/docs/release_notes,?,,?,,Met,https://github.com/dapr/dapr/issues,Met,https://github.com/dapr/dapr/issues,Met,https://github.com/dapr/dapr/issues,Met,https://github.com/dapr/dapr/issues,Met,https://github.com/dapr/dapr/issues,Met,https://docs.dapr.io/operations/support/support-security-issues/,Met,https://docs.dapr.io/operations/support/support-security-issues/,Met,https://docs.dapr.io/operations/support/support-security-issues/,Met,"Non-trivial build file in repository: <https://github.com/dapr/dapr/blob/master/Makefile>.
https://github.com/dapr/dapr/actions/workflows/dapr.yml",Met,Non-trivial build file in repository: <https://github.com/dapr/dapr/blob/master/Makefile>.,Met,Dapr does not require buying any software to build.,Met,"https://github.com/dapr/dapr/actions/workflows/dapr.yml
https://github.com/dapr/dapr/actions/workflows/dapr-e2e-kind.yml
https://github.com/dapr/dapr/actions.html?page=1&workflow_file_name=dapr-test.yml",Met,make test,Unmet,The project does not target 100% code coverage as a success metric.,Met,,Met,https://github.com/dapr/dapr/pull/3297,Unmet,,Met,,Met,,Unmet,,Met,,Met,,Met,,Met,,Met,,Met,,Met,,?,,,,Met,,Met,,Unmet,Dapr does not validate checksum file on installation or sidecar download.,Met,,Met,,Met,golangci-lint,Met,,Met,,Met,,Unmet,,Unmet,,Unmet,,Unmet,,,2021-07-10 00:16:08 UTC,2021-07-10 00:38:14 UTC,Met,,Met,https://github.com/dapr/dapr/actions/workflows/dapr.yml,,Met,GitHub supports discussions on issues and pull requests.,Met,,Met,"https://github.com/dapr/dapr
https://docs.dapr.io",?,,?,,?,,?,,?,,Unmet,"// X-Content-Type-Options was not set to ""nosniff"".",?,,?,,94,,,2022-03-17 23:00:23 UTC,False,"Go, Shell, Makefile, Python, Java, Mustache, C#, Dockerfile, PHP",9,4,?,,?,,?,,?,,?,,?,,?,,?,,?,,?,,?,,?,,?,,?,,?,,?,,?,,?,,?,,?,,?,,?,,?,,?,,?,,?,,?,,?,,?,,?,,?,,?,,?,,?,,?,,?,,?,,?,,?,,?,,9,?,,?,,?,,?,,?,,?,,?,,?,,?,,?,,?,,?,,Unmet,,Unmet,,94,,,,,,,,,Met,
