29,1820,2404,ONAP Champ,ONAP Champ is an abstraction from underlying graph storage systems that A&AI would otherwise interface with.,https://gerrit.onap.org/r/#/admin/projects/aai/champ,https://gerrit.onap.org/r/#/admin/projects/aai/champ,Apache-2.0,?,,Met,Given only https: URLs.,Met,https://gerrit.onap.org/r/gitweb?p=aai/champ.git;a=blob;f=README.md;h=98e47f54a8ebcb29280ed2f803781eca265395d6;hb=HEAD,Met,"https://wiki.onap.org/display/DW/Tracking+Issues+with+JIRA
https://wiki.onap.org/display/DW/Developing+ONAP
",Met,https://wiki.onap.org/display/DW/Development+Procedures+and+Policies,Met,https://wiki.onap.org/display/DW/Development+Procedures+and+Policies describes requirements for acceptable contributions and is linked from the AAI project page. https://wiki.onap.org/display/DW/Java+code+style shows java code style. https://wiki.onap.org/display/DW/Developer+Best+Practices ,Met,https://gerrit.onap.org/r/gitweb?p=aai/champ.git;a=blob;f=champ-service/License.txt;h=714bbd4354b70fbb04601d61f82efc2e056e968b;hb=HEAD,Met,Apache-2.0 The Apache-2.0 license is approved by the Open Source Initiative (OSI).,Met,The Apache-2.0 license is approved by the Open Source Initiative (OSI).,Met,https://gerrit.onap.org/r/gitweb?p=aai/champ.git;a=blob;f=README.md;h=98e47f54a8ebcb29280ed2f803781eca265395d6;hb=HEAD,Met,https://gerrit.onap.org/r/gitweb?p=aai/champ.git;a=blob;f=README.md;h=98e47f54a8ebcb29280ed2f803781eca265395d6;hb=HEAD,Met,https://gerrit.onap.org/r/#/admin/projects/aai/champ,Met,"https://jira.onap.org/secure/Dashboard.jspa
https://gerrit.onap.org/r/gitweb?p=aai/champ.git;a=tree;h=HEAD;hb=HEAD",Met,,Met,Git and Gerrit are used,Met,Release version is with format ${major}.${minor}.${patch} and will be updated accordingly for each release.,Met,,Met,Each release is tagged within the Gerrit repository,Met,http://onap.readthedocs.io/en/latest/submodules/aai/aai-common.git/docs/release-notes.html,Met,"http://onap.readthedocs.io/en/latest/submodules/aai/aai-common.git/docs/release-notes.html
",?,,Met,Jira is used to track issues. https://jira.onap.org/projects/AAI/issues/AAI-671?filter=allopenissues,Met,The description of the process can be found in the following URL: https://wiki.onap.org/display/DW/Tracking+Issues+with+JIRA,Met,,Met,The reported issues are being handled as soon as possible.,Met,https://wiki.onap.org/display/DW/Tracking+Issues+with+JIRA,Met,"The process on how to report a vulnerability can be found in
https://wiki.onap.org/display/DW/ONAP+Vulnerability+Management",,Private vulnerability reports are not supported.,,,Met,Jenkins is used to build the war file. https://jenkins.onap.org/view/aai/job/aai-sparky-fe-master-release-version-java-daily-no-sonar/,Met,Maven and npm are used to build the project,Met,Maven is under Apache 2.0 license. And NPM is licensed under The Artistic License 2.0,Met,The project uses junit to run the unit tests.,Met,"Tests can be run, by running the command ""mvn clean install""",Met,,Met,Sonar covers the Java code,Met,,Met,This is documented on our wiki: https://wiki.onap.org/display/DW/Code+Coverage+and+Static+Code+Analysis,Met,,Met,The application logs the relevant warnings.,Met,Build systems run the compile with test flag enabled by default. So any failure in test cases will fail the ci and the merge request.,Met,,Met,,Met,,,,,,,,,,,,,,,,Met,,Met,,Met,Nexus IQ Scans,Met,Nexus IQ Scans,,See https://sonar.onap.org/dashboard?id=org.onap.aai%3Achamp,,We use Sonar with common quality gates: https://sonar.onap.org/dashboard?id=org.onap.aai%3Achamp,Met,See https://sonar.onap.org/dashboard?id=org.onap.aai%3Achamp,,This is part of Continuous Integration on a daily basis.,Unmet,,,,Unmet,,Met,Check Sonar.,,2018-05-03 08:43:56 UTC,2019-08-05 14:18:55 UTC,Met,We disallow SHA-1 or other insecure cryptographic algorithms.,Met,"For each pull request, the project needs to be built successfully before the Merge option becomes activated. The test will be run automatically during the building process as well. Once build successfully and all tests has past, the Merge option will be activated.",,Met,https://wiki.onap.org/display/DW/Joining+the+ONAP+Technical+Community,Met,,Met,https://wiki.onap.org/display/DW/Tracking+Issues+with+JIRA,?,,Met,We use ssh2 internal to the cluster and TLS1.2+ for the external interfaces.,Met,We only allow TLS1.2+,Met,We perform certificate verfication.,Met,We support TLS certification verification before exchange of private information.,Unmet,"// X-Content-Type-Options was not set to ""nosniff"".",Met,"All packages are delivered either as an jar artifact or a docker image. Incase of maven artifacts, they can be removed using the pom file. In case of docker container. We can delete the container we dont want. Also control the orchestration in Kubernetes if you want to exclude certain docker images.",?,,100,2019-05-15 13:35:49 UTC,,2019-04-06 23:00:57 UTC,False,Java,23,85,Met,https://wiki.onap.org/display/DW/Development+Procedures+and+Policies describes requirements for acceptable contributions and is linked from the AAI project page. https://wiki.onap.org/display/DW/Java+code+style shows java code style. https://wiki.onap.org/display/DW/Developer+Best+Practices,Met,"ONAP requires both a Developer Certificate of Origin (DCO), and a Contributor License Agreement (CLA).

https://wiki.onap.org/display/DW/Contribution+Agreements",Met,"ONAP adheres to the Linux Foundation Code of Conduct, found at https://lfprojects.org/policies/code-of-conduct/",Met,"The key roles in the project and their responsibilities are described at

https://wiki.onap.org/display/DW/Community+Offices+and+Governance

Current members are listed at

https://wiki.onap.org/pages/viewpage.action?pageId=8226539",Met,"For AAI we have multiple committers and multiple contributes who are listed in https://wiki.onap.org/display/DW/Resources+and+Repositories#ResourcesandRepositories-ActiveandAvailableInventory All committers have access and rights to maintain the code base, approve and review incoming changes and release a new version of the artifact. This will let the project continue with minimal to no interruption if one person is incapacitated. Also this project is controlled by the linux foundation so we can add more committers if needed",Met,The project covered in this report have more than 2 persons who actively contribute and maintain code. https://wiki.onap.org/display/DW/Resources+and+Repositories#ResourcesandRepositories-ActiveandAvailableInventory,Met,Road map for AAI can be found in https://wiki.onap.org/display/DW/AAI+R3+Platform+Maturity?preview=%2F35523310%2F35523289%2FAAI+Roadmap+2018-01-05.pdf,Met,Architecture of AAI can be found in https://wiki.onap.org/pages/viewpage.action?pageId=1015836,Met,,Met,Information on setting up ONAP can be found at https://onap.readthedocs.io/en/latest/guides/onap-developer/settingup/index.html,Met,Documentation is updated on a regular bases when needed.,Met,https://wiki.onap.org/display/DW/Active+and+Available+Inventory+Project,Met,No user interfaces; the project site is configurable for font size/colors.,Met,It is not applicable at this point in time as the software will only be used by technical people and not by general public,?,,Met,All major releases are tagged in gerrit and the artifacts are stored with the release information on onap.nexus. So we can access all old versions of the artifact. If and when a upgrade requires certain steps to be followed they are being added to the release documents as needed,Met,"Vulnerabilities can be reported using the link https://wiki.onap.org/pages/viewpage.action?pageId=6591711 Currently we dont have any vulnerabilities reported, but the wiki page explains on how to report a vulnerability and how to report anonymously if you do not want the credit for it.",Met,Vulnerability handling is documented in https://wiki.onap.org/pages/viewpage.action?pageId=6591711,Met,Google coding style is used in ONAP https://github.com/google/styleguide,Met,maven-checkstyle-plugin,,The application does not create native binaries.,,The application does not create native binaries.,,The application does not create native binaries.,,"All releases are tagged in gerrit(git), and the builds are controlled using jenkins. By providing the git tag information the same image can be build over and over again with same bit-for-bit result.",Met,The compiled docker images and jar files can be installed/used as the user sees fit. Both run on JVM or docker.,Met,"All the components require only java and maven to begin with for a developer to quickly install and test it. Even for deployment using OOM and the right amount of resources, we can deploy the full AAI/ONAP suite in less than a day. The steps are documented in https://onap.readthedocs.io/en/latest/submodules/oom.git/docs/oom_quickstart_guide.html",Met,"External dependencies are controlled using the pom file, which can be found in the root folder for the projects",Met,We use sonatype CLM https://nexus-iq.wl.linuxfoundation.org/ and https://sonar.onap.org,Met,External components are maintained through Maven. The user can get a list of all included components using the maven dependency tree and can update or reuse as they see fit,Met,We choose free open source solutions in every case and choose up-to-date versions of the components.,Met,"https://jenkins.onap.org - on every commit, a verification job runs which runs an automated test suite. The code check in cannot pass with out jenkins posting a +1 on the review.",Met,We add tests in these cases.,Unmet,AAI is working toward additional coverage but lack of resources prevent us from achieving it: https://sonar.onap.org,Met,Contributing guide lines for development is recorded in https://wiki.onap.org/display/DW/Development+Procedures+and+Policies,Met,"AAI strives to implement secure design principles. We encrypt data where possible, and run security scans on the code and its dependencies.",Met,The project strives to validate all input,Met,We support mutiple cryptographic algorithms.,Met,Credentials are separate and can be replaced without code compilation,Unmet,,Unmet,,17,?,,?,,?,,?,,?,,?,,?,,?,,?,,?,,?,,?,,Met,,Unmet,,185,,,,,,2019-05-15 13:35:49 UTC,,,Met,
