,id,user_id,name,description,homepage_url,repo_url,license,homepage_url_status,homepage_url_justification,sites_https_status,sites_https_justification,description_good_status,description_good_justification,interact_status,interact_justification,contribution_status,contribution_justification,contribution_requirements_status,contribution_requirements_justification,license_location_status,license_location_justification,floss_license_status,floss_license_justification,floss_license_osi_status,floss_license_osi_justification,documentation_basics_status,documentation_basics_justification,documentation_interface_status,documentation_interface_justification,repo_public_status,repo_public_justification,repo_track_status,repo_track_justification,repo_interim_status,repo_interim_justification,repo_distributed_status,repo_distributed_justification,version_unique_status,version_unique_justification,version_semver_status,version_semver_justification,version_tags_status,version_tags_justification,release_notes_status,release_notes_justification,release_notes_vulns_status,release_notes_vulns_justification,report_url_status,report_url_justification,report_tracker_status,report_tracker_justification,report_process_status,report_process_justification,report_responses_status,report_responses_justification,enhancement_responses_status,enhancement_responses_justification,report_archive_status,report_archive_justification,vulnerability_report_process_status,vulnerability_report_process_justification,vulnerability_report_private_status,vulnerability_report_private_justification,vulnerability_report_response_status,vulnerability_report_response_justification,build_status,build_justification,build_common_tools_status,build_common_tools_justification,build_floss_tools_status,build_floss_tools_justification,test_status,test_justification,test_invocation_status,test_invocation_justification,test_most_status,test_most_justification,test_policy_status,test_policy_justification,tests_are_added_status,tests_are_added_justification,tests_documented_added_status,tests_documented_added_justification,warnings_status,warnings_justification,warnings_fixed_status,warnings_fixed_justification,warnings_strict_status,warnings_strict_justification,know_secure_design_status,know_secure_design_justification,know_common_errors_status,know_common_errors_justification,crypto_published_status,crypto_published_justification,crypto_call_status,crypto_call_justification,crypto_floss_status,crypto_floss_justification,crypto_keylength_status,crypto_keylength_justification,crypto_working_status,crypto_working_justification,crypto_pfs_status,crypto_pfs_justification,crypto_password_storage_status,crypto_password_storage_justification,crypto_random_status,crypto_random_justification,delivery_mitm_status,delivery_mitm_justification,delivery_unsigned_status,delivery_unsigned_justification,vulnerabilities_fixed_60_days_status,vulnerabilities_fixed_60_days_justification,vulnerabilities_critical_fixed_status,vulnerabilities_critical_fixed_justification,static_analysis_status,static_analysis_justification,static_analysis_common_vulnerabilities_status,static_analysis_common_vulnerabilities_justification,static_analysis_fixed_status,static_analysis_fixed_justification,static_analysis_often_status,static_analysis_often_justification,dynamic_analysis_status,dynamic_analysis_justification,dynamic_analysis_unsafe_status,dynamic_analysis_unsafe_justification,dynamic_analysis_enable_assertions_status,dynamic_analysis_enable_assertions_justification,dynamic_analysis_fixed_status,dynamic_analysis_fixed_justification,general_comments,created_at,updated_at,crypto_weaknesses_status,crypto_weaknesses_justification,test_continuous_integration_status,test_continuous_integration_justification,cpe,discussion_status,discussion_justification,no_leaked_credentials_status,no_leaked_credentials_justification,english_status,english_justification,hardening_status,hardening_justification,crypto_used_network_status,crypto_used_network_justification,crypto_tls12_status,crypto_tls12_justification,crypto_certificate_verification_status,crypto_certificate_verification_justification,crypto_verification_private_status,crypto_verification_private_justification,hardened_site_status,hardened_site_justification,installation_common_status,installation_common_justification,build_reproducible_status,build_reproducible_justification,badge_percentage_0,achieved_passing_at,lost_passing_at,last_reminder_at,disabled_reminders,implementation_languages,lock_version,badge_percentage_1,dco_status,dco_justification,governance_status,governance_justification,code_of_conduct_status,code_of_conduct_justification,roles_responsibilities_status,roles_responsibilities_justification,access_continuity_status,access_continuity_justification,bus_factor_status,bus_factor_justification,documentation_roadmap_status,documentation_roadmap_justification,documentation_architecture_status,documentation_architecture_justification,documentation_security_status,documentation_security_justification,documentation_quick_start_status,documentation_quick_start_justification,documentation_current_status,documentation_current_justification,documentation_achievements_status,documentation_achievements_justification,accessibility_best_practices_status,accessibility_best_practices_justification,internationalization_status,internationalization_justification,sites_password_security_status,sites_password_security_justification,maintenance_or_update_status,maintenance_or_update_justification,vulnerability_report_credit_status,vulnerability_report_credit_justification,vulnerability_response_process_status,vulnerability_response_process_justification,coding_standards_status,coding_standards_justification,coding_standards_enforced_status,coding_standards_enforced_justification,build_standard_variables_status,build_standard_variables_justification,build_preserve_debug_status,build_preserve_debug_justification,build_non_recursive_status,build_non_recursive_justification,build_repeatable_status,build_repeatable_justification,installation_standard_variables_status,installation_standard_variables_justification,installation_development_quick_status,installation_development_quick_justification,external_dependencies_status,external_dependencies_justification,dependency_monitoring_status,dependency_monitoring_justification,updateable_reused_components_status,updateable_reused_components_justification,interfaces_current_status,interfaces_current_justification,automated_integration_testing_status,automated_integration_testing_justification,regression_tests_added50_status,regression_tests_added50_justification,test_statement_coverage80_status,test_statement_coverage80_justification,test_policy_mandated_status,test_policy_mandated_justification,implement_secure_design_status,implement_secure_design_justification,input_validation_status,input_validation_justification,crypto_algorithm_agility_status,crypto_algorithm_agility_justification,crypto_credential_agility_status,crypto_credential_agility_justification,signed_releases_status,signed_releases_justification,version_tags_signed_status,version_tags_signed_justification,badge_percentage_2,contributors_unassociated_status,contributors_unassociated_justification,copyright_per_file_status,copyright_per_file_justification,license_per_file_status,license_per_file_justification,small_tasks_status,small_tasks_justification,require_2FA_status,require_2FA_justification,secure_2FA_status,secure_2FA_justification,code_review_standards_status,code_review_standards_justification,two_person_review_status,two_person_review_justification,test_statement_coverage90_status,test_statement_coverage90_justification,test_branch_coverage80_status,test_branch_coverage80_justification,security_review_status,security_review_justification,assurance_case_status,assurance_case_justification,achieve_passing_status,achieve_passing_justification,achieve_silver_status,achieve_silver_justification,tiered_percentage,repo_url_updated_at,achieved_silver_at,lost_silver_at,achieved_gold_at,lost_gold_at,first_achieved_passing_at,first_achieved_silver_at,first_achieved_gold_at,maintained_status,maintained_justification
0,4899,10873,depalletization-agent-rose-ap,"This is the ROSE-AP implementation of the depalletization IoT agent for the Contra2.0 project, as per the DIH2 project requirements.

The Depalletization IoT Agent for RS232 and MODBUS TCP protocol is both infrastructural and functional component supporting warehousing and production (de)palletization processess. It provides data about (de)palletization processss performance automated by machines (e.g. approx. time remaining to finish a pile, number of remaining pile layers etc.)

An IoT Agent for RS232 and MODBUS TCP protocol is designed to be a bridge between RS232 ASCII based custom protocol or MODBUS TCP protocol and the NGSI interface of a context broker.

It is based on the IoT Agent Node.js Library. Further general information about the FIWARE IoT Agents framework, its architecture and the common interaction model can be found in the library's GitHub repository.",https://github.com/itti-pl/depalletization-agent-rose-ap,https://github.com/itti-pl/depalletization-agent-rose-ap,Apache-2.0,?,,Met,Given only https: URLs.,Met,https://github.com/itti-pl/depalletization-agent-rose-ap/blob/main/README.md,Met,https://github.com/itti-pl/depalletization-agent-rose-ap/blob/main/README.md,Met,"Projects on GitHub by default use issues and pull requests, as encouraged by documentation such as <https://guides.github.com/activities/contributing-to-open-source/>.",?,,Met,https://github.com/itti-pl/depalletization-agent-rose-ap/blob/main/LICENSE,Met,The Apache 2.0 license is approved by the Open Source Initiative (OSI). The Apache-2.0 license is approved by the Open Source Initiative (OSI).,Met,The Apache 2.0 license is approved by the Open Source Initiative (OSI). The Apache-2.0 license is approved by the Open Source Initiative (OSI).,Met,Documentation is available in the project repository: https://github.com/itti-pl/depalletization-agent-rose-ap/tree/main/docs,?,,Met,"Repository on GitHub, which provides public git repositories with URLs.",Met,"Repository on GitHub, which uses git. git can track the changes, who made them, and when they were made.",Met,"The project uses standard Git flow approach. All changes are visible through commits list https://github.com/itti-pl/depalletization-agent-rose-ap/commits/main
or branches list https://github.com/itti-pl/depalletization-agent-rose-ap/branches",Met,"Repository on GitHub, which uses git. git is distributed.",?,,?,,?,,Unmet,// No release notes file found.,?,,?,,Met,Contributors can submit bug reports using the Github issue tracker: https://github.com/itti-pl/depalletization-agent-rose-ap/issues,Met,Contributors can submit bug reports using the Github issue tracker: https://github.com/itti-pl/depalletization-agent-rose-ap/issues,Met,No bug reports the have been acknowledged yet.,Met,No enhancement requests in the last 2-12 months have been submitted yet.,Met,Contributors can submit bug reports using the Github issue tracker: https://github.com/itti-pl/depalletization-agent-rose-ap/issues,?,,?,,Met,No vulnerability report received in the last 6 months. ,Met,The project uses npm install as a default build system,Met,npm and Docker is used for building and instantiation  purposes,,,Met,The project uses npm test / Jest as a test automation framework.,Met,The project uses npm test / Jest as a test automation framework.,?,,?,,?,,?,,?,,,,?,,?,,?,,,,,,,,,,,,,,,,,,Met,The project is hosted on Github which uses SSL certificates for secure connection by default,Met,The project is hosted on Github which uses SSL certificates for secure connection by default,Met,No such vulnerabilities yet,Met,No such vulnerabilities yet,?,,?,,?,,,"The development team did not configure any automatic, scheduled CI/CD-like jobs including static code analysis",?,,,JavaScript is used,?,,?,,,2021-05-25 22:12:43 UTC,2021-06-02 13:52:32 UTC,,,?,,,Met,GitHub supports discussions on issues and pull requests.,Met,No docker files and source code contains any credentials,Met,,?,,?,,?,,?,,?,,Met,Found all required security hardening headers.,?,,?,,64,,,2022-04-30 23:00:20 UTC,False,"JavaScript, Dockerfile, CSS, HTML",25,5,?,,?,,?,,?,,?,,?,,?,,?,,?,,?,,?,,?,,?,,?,,?,,?,,?,,?,,?,,?,,?,,?,,?,,?,,?,,?,,?,,?,,?,,?,,?,,?,,?,,?,,?,,?,,?,,?,,?,,?,,4,?,,?,,?,,?,,?,,?,,?,,?,,?,,?,,?,,?,,Unmet,,Unmet,,64,,,,,,,,,Met,
1,4900,6684,YAODAQ,Yet An Other DAQ,https://github.com/flagarde/YAODAQ,https://github.com/flagarde/YAODAQ,MIT,?,,Met,Given only https: URLs.,?,,?,,Met,"Projects on GitHub by default use issues and pull requests, as encouraged by documentation such as <https://guides.github.com/activities/contributing-to-open-source/>.",?,,Met,Non-trivial license location file in repository: <https://github.com/flagarde/YAODAQ/blob/main/LICENSE>.,Met,The MIT license is approved by the Open Source Initiative (OSI).,Met,The MIT license is approved by the Open Source Initiative (OSI).,Met,Some documentation basics file contents found.,?,,Met,"Repository on GitHub, which provides public git repositories with URLs.",Met,"Repository on GitHub, which uses git. git can track the changes, who made them, and when they were made.",?,,Met,"Repository on GitHub, which uses git. git is distributed.",?,,?,,?,,Unmet,// No release notes file found.,?,,?,,?,,?,,?,,?,,?,,?,,?,,?,,Met,Non-trivial build file in repository: <https://github.com/flagarde/YAODAQ/blob/main/CMakeLists.txt>.,Met,Non-trivial build file in repository: <https://github.com/flagarde/YAODAQ/blob/main/CMakeLists.txt>.,?,,?,,?,,?,,?,,?,,?,,?,,?,,?,,?,,?,,?,,?,,?,,?,,?,,?,,?,,?,,?,,?,,?,,?,,?,,?,,?,,?,,?,,?,,?,,?,,,2021-05-26 01:52:16 UTC,2021-05-26 01:53:14 UTC,?,,?,,,Met,GitHub supports discussions on issues and pull requests.,?,,?,,?,,?,,?,,?,,?,,Met,Found all required security hardening headers.,?,,?,,19,,,2022-04-22 23:00:19 UTC,False,"C++, CMake",5,0,?,,?,,?,,?,,?,,?,,?,,?,,?,,?,,?,,?,,?,,?,,?,,?,,?,,?,,?,,?,,?,,?,,?,,?,,?,,?,,?,,?,,?,,?,,?,,?,,?,,?,,?,,?,,?,,?,,?,,?,,4,?,,?,,?,,?,,?,,?,,?,,?,,?,,?,,?,,?,,Unmet,,Unmet,,19,,,,,,,,,Met,
2,4901,10885,go-bencode,Package bencode implements encoding and decoding of bencoded values as defined in BEP 3.,https://godoc.org/github.com/wwalexander/go-bencode,https://github.com/wwalexander/go-bencode,BSD-3-Clause,?,,Met,Given only https: URLs.,?,,?,,Met,"Projects on GitHub by default use issues and pull requests, as encouraged by documentation such as <https://guides.github.com/activities/contributing-to-open-source/>.",?,,Met,Non-trivial license location file in repository: <https://github.com/wwalexander/go-bencode/blob/master/LICENSE>.,Met,The BSD-3-Clause license is approved by the Open Source Initiative (OSI).,Met,The BSD-3-Clause license is approved by the Open Source Initiative (OSI).,Unmet,// No appropriate folder found for documentation basics.,?,,Met,"Repository on GitHub, which provides public git repositories with URLs.",Met,"Repository on GitHub, which uses git. git can track the changes, who made them, and when they were made.",?,,Met,"Repository on GitHub, which uses git. git is distributed.",?,,?,,?,,Unmet,// No release notes file found.,?,,?,,?,,?,,?,,?,,?,,?,,?,,?,,?,,?,,?,,?,,?,,?,,?,,?,,?,,?,,?,,?,,?,,?,,?,,?,,?,,?,,?,,?,,?,,?,,?,,?,,?,,?,,?,,?,,?,,?,,?,,?,,?,,?,,,2021-05-27 04:46:27 UTC,2021-05-27 04:46:27 UTC,?,,?,,,Met,GitHub supports discussions on issues and pull requests.,?,,?,,?,,?,,?,,?,,?,,Unmet,// One or more of the required security hardening headers is missing.,?,,?,,15,,,2022-04-24 23:00:23 UTC,False,Go,4,0,?,,?,,?,,?,,?,,?,,?,,?,,?,,?,,?,,?,,?,,?,,?,,?,,?,,?,,?,,?,,?,,?,,?,,?,,?,,?,,?,,?,,?,,?,,?,,?,,?,,?,,?,,?,,?,,?,,?,,?,,4,?,,?,,?,,?,,?,,?,,?,,?,,?,,?,,?,,?,,Unmet,,Unmet,,15,,,,,,,,,Met,
3,4902,10696,v6d,vineyard (v6d): an in-memory immutable data manager. (Project under CNCF),https://v6d.io,https://github.com/v6d-io/v6d,Apache-2.0,?,,Met,Given only https: URLs.,Met,,Met,,Met,"Projects on GitHub by default use issues and pull requests, as encouraged by documentation such as <https://guides.github.com/activities/contributing-to-open-source/>.",Met,We have guide to contributors about the criteria about acceptable patches: https://github.com/v6d-io/v6d/blob/main/CONTRIBUTING.rst,Met,Non-trivial license location file in repository: <https://github.com/v6d-io/v6d/blob/main/LICENSE>.,Met,The Apache-2.0 license is approved by the Open Source Initiative (OSI).,Met,The Apache-2.0 license is approved by the Open Source Initiative (OSI).,Met,Some documentation basics file contents found.,Met,We have exhausive API documentation: https://v6d.io/notes/cpp_api.html and https://v6d.io/notes/python_api.html.,Met,"Repository on GitHub, which provides public git repositories with URLs.",Met,"Repository on GitHub, which uses git. git can track the changes, who made them, and when they were made.",Met,We follows the semver.,Met,"Repository on GitHub, which uses git. git is distributed.",Met,,Met,,Met,,Met,We include changes about every release in github releases instead: https://github.com/v6d-io/v6d/releases,Met,,?,,Met,Every issue has its own ticket.,Met,We use github issues: https://github.com/v6d-io/v6d/issues,Met,"We response to issue as soon as possible, usually with two days.",Met,,Met,"All issues, pull requests and discussions are public available on Github and searchable: https://github.com/v6d-io/v6d/issues",Met,We have a guide for reporting vulnerabilities: https://github.com/v6d-io/v6d/blob/main/SECURITY.md,Met,We have such a guide: https://github.com/v6d-io/v6d/blob/main/SECURITY.md and reportors should send to security@v6d.io.,Met,,Met,Non-trivial build file in repository: <https://github.com/v6d-io/v6d/blob/main/CMakeLists.txt>.,Met,Non-trivial build file in repository: <https://github.com/v6d-io/v6d/blob/main/CMakeLists.txt>.,Met,All build infra is open-source tools.,Met,We have integratied with Github actions for CI,Met,See https://github.com/v6d-io/v6d/actions,Met,We have integrated with codecov: https://codecov.io/gh/v6d-io/v6d,Met,,Met,,Met,,Met,We have enable `-Wall` for cpp part.,Met,"Yes, we have enabled the `-Werror` compilation option.",Met,,Met,,Met,,Met,Components in this project currently are related to cryptographic.,Met,,Met,,Met,,Met,,Met,The project don't use such protocols or keys.,Met,,Met,,Met,,Met,,Met,,Met,,Met,"Yes, we have `-Wall`, `-Werror`, pylint and go vet as well.",Met,We have static analytics tools integrated in the CI process.,Met,,Met,We run static analysis againist every commit before merging.,Met,,Met,,Met,,Met,,,2021-05-27 06:11:21 UTC,2021-05-27 06:26:36 UTC,Met,,Met,We do have continuous integration on github actions: https://github.com/v6d-io/v6d/actions,,Met,GitHub supports discussions on issues and pull requests.,Met,,Met,,?,,?,,?,,?,,?,,Unmet,"// X-Content-Type-Options was not set to ""nosniff"".",?,,?,,100,2021-05-27 06:26:36 UTC,,,False,"C++, Python, CMake, C, Shell, Go",6,7,?,,?,,?,,?,,?,,?,,?,,?,,?,,?,,?,,?,,?,,?,,?,,?,,?,,?,,?,,?,,?,,?,,?,,?,,?,,?,,?,,?,,?,,?,,?,,?,,?,,?,,?,,?,,?,,?,,?,,?,,13,?,,?,,?,,?,,?,,?,,?,,?,,?,,?,,?,,?,,Met,,Unmet,,107,,,,,,2021-05-27 06:26:36 UTC,,,Met,
4,4903,10890,CAPACITY-mapping,,https://github.com/FAIR-data-for-CAPACITY/CAPACITY-mapping,https://github.com/FAIR-data-for-CAPACITY/CAPACITY-mapping,Apache-2.0,?,,Met,Given only https: URLs.,?,,?,,Met,"Projects on GitHub by default use issues and pull requests, as encouraged by documentation such as <https://guides.github.com/activities/contributing-to-open-source/>.",?,,Met,Non-trivial license location file in repository: <https://github.com/FAIR-data-for-CAPACITY/CAPACITY-mapping/blob/master/LICENSE>.,Met,The Apache-2.0 license is approved by the Open Source Initiative (OSI).,Met,The Apache-2.0 license is approved by the Open Source Initiative (OSI).,Unmet,// No appropriate folder found for documentation basics.,?,,Met,"Repository on GitHub, which provides public git repositories with URLs.",Met,"Repository on GitHub, which uses git. git can track the changes, who made them, and when they were made.",?,,Met,"Repository on GitHub, which uses git. git is distributed.",?,,?,,?,,Unmet,// No release notes file found.,?,,?,,?,,?,,?,,?,,?,,?,,?,,?,,?,,?,,?,,?,,?,,?,,?,,?,,?,,?,,?,,?,,?,,?,,?,,?,,?,,?,,?,,?,,?,,?,,?,,?,,?,,?,,?,,?,,?,,?,,?,,?,,?,,?,,,2021-05-27 12:15:13 UTC,2021-05-27 12:15:13 UTC,?,,?,,,Met,GitHub supports discussions on issues and pull requests.,?,,?,,?,,?,,?,,?,,?,,Met,Found all required security hardening headers.,?,,?,,15,,,2022-04-24 23:00:24 UTC,False,"Jupyter Notebook, Python",4,0,?,,?,,?,,?,,?,,?,,?,,?,,?,,?,,?,,?,,?,,?,,?,,?,,?,,?,,?,,?,,?,,?,,?,,?,,?,,?,,?,,?,,?,,?,,?,,?,,?,,?,,?,,?,,?,,?,,?,,?,,4,?,,?,,?,,?,,?,,?,,?,,?,,?,,?,,?,,?,,Unmet,,Unmet,,15,,,,,,,,,Met,
5,4904,10889,OEEMicroservice,"OEE Microservice provides API to interact with Fiware context broker to store test metrics, station metadata, calculate OEE and build time series data for Grafana plugin.",https://github.com/Exsensio-Ltd/OEEMicroservice,https://github.com/Exsensio-Ltd/OEEMicroservice,Apache-2.0,?,,Met,Given only https: URLs.,Met,https://github.com/Exsensio-Ltd/OEEMicroservice/blob/master/README.md,Unmet,"Currently, it's not open to contribution",Met,"Projects on GitHub by default use issues and pull requests, as encouraged by documentation such as <https://guides.github.com/activities/contributing-to-open-source/>.",Unmet,"Currently, it's not open to contribution",Met,Non-trivial license location file in repository: <https://github.com/Exsensio-Ltd/OEEMicroservice/blob/master/LICENSE>.,Met,The Apache-2.0 license is approved by the Open Source Initiative (OSI).,Met,The Apache-2.0 license is approved by the Open Source Initiative (OSI).,Met,Some documentation basics file contents found.,Met,,Met,"Repository on GitHub, which provides public git repositories with URLs.",Met,"Repository on GitHub, which uses git. git can track the changes, who made them, and when they were made.",?,,Met,"Repository on GitHub, which uses git. git is distributed.",?,,?,,?,,Unmet,// No release notes file found.,Unmet,// No release notes file found.,?,,Met,https://github.com/Exsensio-Ltd/OEEMicroservice/issues,Met,https://github.com/Exsensio-Ltd/OEEMicroservice/issues,Unmet,No major bugs as the project is being setup,Unmet,No major bugs as the project is being setup,Met,https://github.com/Exsensio-Ltd/OEEMicroservice/issues,?,,?,,?,,Met,https://github.com/Exsensio-Ltd/OEEMicroservice/actions,Met,It uses .NET Build to compile the project,Met,It uses .NET Build to compile the project,Met,https://github.com/Exsensio-Ltd/OEEMicroservice#testing,Met,MSTest and xUnit,Met,Line coverage: 32.3% (191 of 591). Branch coverage: 39.3% (37 of 94),?,,?,,?,,,,,,,,?,,?,,,,,,,,,,,,,,,,,,?,,?,,?,,?,,Met,.NET Compiler Platform (Roslyn) Analyzers inspect the project.,Met,.NET Compiler Platform (Roslyn) Analyzers inspect the project.,Met,.NET Compiler Platform (Roslyn) Analyzers inspect the project.,,,Unmet,This is not applicable to C#.,,This is not applicable to C#.,Unmet,This is not applicable to C#.,,,,2021-05-28 08:41:19 UTC,2021-06-29 14:46:03 UTC,,,Unmet,To be done,,Met,GitHub supports discussions on issues and pull requests.,?,,Met,,?,,?,,?,,?,,?,,Met,Found all required security hardening headers.,?,,?,,69,,,2022-03-04 23:00:31 UTC,False,"C#, Dockerfile",14,7,?,,?,,?,,?,,?,,?,,?,,?,,?,,?,,?,,?,,?,,?,,?,,?,,?,,?,,?,,?,,?,,?,,?,,?,,?,,?,,?,,?,,?,,?,,?,,?,,?,,?,,?,,?,,?,,?,,?,,?,,9,?,,?,,?,,?,,?,,?,,?,,?,,?,,?,,?,,?,,Unmet,,Unmet,,69,,,,,,,,,Met,
6,4905,10897,k8devel,A simple to use Kubernetes Framework based on client-go,https://github.com/thekubeworld/k8devel,https://github.com/thekubeworld/k8devel,Apache-2.0,?,,Met,Given only https: URLs.,?,,?,,Met,Non-trivial contribution file in repository: <https://github.com/thekubeworld/k8devel/blob/main/CONTRIBUTE.md>.,?,,Met,Non-trivial license location file in repository: <https://github.com/thekubeworld/k8devel/blob/main/LICENSE>.,Met,The Apache-2.0 license is approved by the Open Source Initiative (OSI).,Met,The Apache-2.0 license is approved by the Open Source Initiative (OSI).,Unmet,// No appropriate folder found for documentation basics.,?,,Met,"Repository on GitHub, which provides public git repositories with URLs.",Met,"Repository on GitHub, which uses git. git can track the changes, who made them, and when they were made.",?,,Met,"Repository on GitHub, which uses git. git is distributed.",?,,?,,?,,Unmet,// No release notes file found.,?,,?,,?,,?,,?,,?,,?,,?,,?,,?,,?,,?,,?,,?,,?,,?,,?,,?,,?,,?,,?,,?,,?,,?,,?,,?,,?,,?,,?,,?,,?,,?,,?,,?,,?,,?,,?,,?,,?,,?,,?,,?,,?,,?,,,2021-05-28 12:59:24 UTC,2021-05-28 12:59:24 UTC,?,,?,,,Met,GitHub supports discussions on issues and pull requests.,?,,?,,?,,?,,?,,?,,?,,Met,Found all required security hardening headers.,?,,?,,15,,,2022-04-25 23:00:40 UTC,False,Go,4,0,?,,?,,?,,?,,?,,?,,?,,?,,?,,?,,?,,?,,?,,?,,?,,?,,?,,?,,?,,?,,?,,?,,?,,?,,?,,?,,?,,?,,?,,?,,?,,?,,?,,?,,?,,?,,?,,?,,?,,?,,4,?,,?,,?,,?,,?,,?,,?,,?,,?,,?,,?,,?,,Unmet,,Unmet,,15,,,,,,,,,Met,
