17,69,34,The Assimilation Project,"The Assimilation Project discovers and keeps updated deep-dive information about your infrastructure then drives various actions directly from discovery. These include evaluation against best practices like security (compliance), monitoring, alerting, network management and CMDB (configuration management database) functions.",http://AssimProj.org,https://github.com/assimilation/assimilation-official,GPL-3.0+,?,,Unmet,,Met,http://linux-ha.org/source-doc/assimilation/html/index.html,Met,http://linux-ha.org/source-doc/assimilation/html/_contributing.html,Met,"Projects on GitHub by default use issues and pull requests, as encouraged by documentation such as <https://guides.github.com/activities/contributing-to-open-source/>.",Met,"http://linux-ha.org/source-doc/assimilation/html/_contributing.html
http://linux-ha.org/source-doc/assimilation/html/_coding_standards.html",Met,https://github.com/assimilation/assimilation-official/blob/master/legal/COPYING,Met,https://github.com/assimilation/assimilation-official/blob/master/legal/COPYING,Met,,Met,http://linux-ha.org/source-doc/assimilation/html/_getting_started.html,Met,http://assimilationsystems.com/2016/03/04/fifteen-minutes-to-better-security/,Met,"Repository on GitHub, which provides public git repositories with URLs.",Met,"Repository on GitHub, which uses git. git can track the changes, who made them, and when they were made.",Met,https://github.com/assimilation/assimilation-official/releases,Met,"Repository on GitHub, which uses git. git is distributed.",Met,,Met,,Met,https://github.com/assimilation/assimilation-official/releases,Met,https://github.com/assimilation/assimilation-official/releases,Met,There are currently none.,?,,Met,"GitHub Issues, or better yet Trello issues board: https://trello.com/b/98QrdEK1/issues-bugs",Met,"GitHub, Trello, mailing list. https://trello.com/b/98QrdEK1/issues-bugs",Met,"https://github.com/assimilation/assimilation-official/issues
https://trello.com/b/98QrdEK1/issues-bugs",Met,Through Trello primarily. https://trello.com/b/98QrdEK1/issues-bugs,Met,"https://trello.com/b/98QrdEK1/issues-bugs http://lists.community.tummy.com/cgi-bin/mailman/listinfo/assimilation
http://lists.community.tummy.com/pipermail/assimilation/
http://dir.gmane.org/gmane.comp.monitoring.assimilation",?,,?,,Met,There haven't been any yet.,Met,"Non-trivial build file in repository: <https://github.com/assimilation/assimilation-official/blob/master/CMakeLists.txt>.

Better yet: cd docker; ./builditall -- will build versions for 12 different versions of Linux.",Met,Non-trivial build file in repository: <https://github.com/assimilation/assimilation-official/blob/master/CMakeLists.txt>.,Met,"It builds and passes tests on 12 different versions of Linux, all using tools available through Docker and",Met,cd cma; testify tests,Met,"cd cma; testify tests

This runs *all* the tests. Some are in C, some are in Python, some are in Python+C, and some are in the shell. This runs them all.",Unmet,It's not OK. It's just unmet.,Met,"It's understood, but not well documented. The most common external code is discovery scripts, and they're documented by this article: http://assimilationsystems.com/2016/02/13/write-an-assimilation-discovery-agent/",Met,Tests were added for the most recent major change - sending events for changes in compliance. Also made up a deficit from early in the project where there were no tests for LLDP or CDP packet processing.,Unmet,It's not OK. Just unmet.,Met,"We use three methods for this: (1) coverity + clang-analysis for C code, pylint for Python programs. Clang and pylint are part of the normal submit routine. Coverity gets run before every major release. We also run all the tests to complain if all objects are not freed, and in addition we run a few of the C-only tests under Valgrind. Tests fail if Valgrind doesn't like it, or if we don't free memory (under the Python tests).",Met,Our build procedure declares ALL warnings as errors.,Met,"We turn on every C warning flag that we can, and test for old releases that don't support some of the new ones, and automatically adjust the buidl accordingly. All those warnings are treated as errors.",Met,"Alan Robertson has been writing software for nearly 40 years, and has a track record for avoiding security problems.",Met,See above. Coverity also helps catch things that I might have missed.,Met,Our crypto is provided by libsodium.,Met,See above.,Met,Libsodium is FLOSS.,Met,This is under the control of crypto expert Dan Bernstein.,Met,We only use libsodium for crypto.,,Our keys are distributed through a different mechanism - the same that installs the software.,,We don't store passwords.,,Libsodium takes care of this for us.,Met,We use https currently. We will switch to signed packages.,Met,We don't retrieve cryptographic hashes.,Met,There aren't any.,Met,There haven't been any yet.,Met,We use coverity and clang-analyzer for C. I don't know of one for Python. Here is our Coverity project URL:  https://scan.coverity.com/projects/assimilation-system-management-suite,Met,Coverity does this.,Met,Check the stats here: https://scan.coverity.com/projects/assimilation-system-management-suite,Met,The C code is pretty stable. It changes only rarely nowadays.,Met,"I use both a home-grown fuzzing tool ""Fuzzy Monkey"" testing... http://assimilationsystems.com/2016/05/24/testing-distributed-systems-with-fuzzy-monkey-testing/",Met,We run the C-level tests under valgrind - as noted before.,Met,,Met,There haven't been any.,"Note that we use both [GitHub](https://github.com/assimilation/assimilation-official) _and_ [Trello](https://trello.com/b/98QrdEK1/issues-bugs) for project bug reports. We also have a [mailing list](http://lists.community.tummy.com/cgi-bin/mailman/listinfo/assimilation) for interactive discussion, and there is also a [blog](http://assimilationsystems.com/category/blog/) for documentation and announcements about the project.",2016-02-24 21:31:43 UTC,2016-08-12 18:42:07 UTC,Met,We only use libsodium for crypto.,Met,Travis-ci builds and runs tests automaticlaly. The builditall script will do the same thing for 12 versions of Linux.,,Met,"GitHub supports discussions on issues and pull requests. In addition, we make extensive use of Trello boards - like this one for issues and/or bugs: https://trello.com/b/98QrdEK1/issues-bugs Issues created in GitHub are automatically replicated to Trello.",Met,,Met,"http://assimilationsystems.com/2016/03/04/fifteen-minutes-to-better-security/
https://github.com/assimilation/assimilation-official/issues
https://trello.com/b/98QrdEK1/issues-bugs",?,,?,,?,,?,,?,,?,,?,,?,,96,,,2022-03-07 23:00:34 UTC,False,"Python, C, Shell (CII estimate)",29,11,?,,?,,?,,?,,?,,?,,?,,?,,?,,?,,?,,?,,?,,?,,?,,?,,?,,?,,?,,?,,?,,?,,?,,?,,?,,?,,?,,?,,?,,?,,?,,?,,?,,?,,?,,?,,?,,?,,?,,?,,9,?,,?,,?,,?,,?,,?,,?,,?,,?,,?,,?,,?,,Unmet,,Unmet,,96,,,,,,,,,Met,
18,73,57,The System Integrity Management Project (SIMP),"SIMP is an Open Source, fully automated, and extensively tested framework that can either enhance your existing infrastructure or allow you to quickly build one from scratch. Built on the mature Puppet product suite, SIMP is designed around scalability, flexibility, and compliance. 

Initially designed as a turn-key solution for isolated environments, SIMP includes everything you need to get started building repeatable infrastructures at any scale.",https://simp-project.com,https://github.com/simp/simp-core,Apache-2.0,?,,Met,,Met,The main software description can be found at https://simp-project.com.,Met,"The 'Help' link on https://simp-project.com provides a direct avenue for obtaining community support and the https://simp-project.com/#download-now section has direct links to the GitHub spaces, as does the FAQ.",Met,Non-trivial contribution file in repository: <https://github.com/simp/simp-core/blob/master/CONTRIBUTING.md>.,Met,Contribution documentation at https://simp.readthedocs.io/en/master/contributors_guide/index.html,Met,Non-trivial license location file in repository: <https://github.com/simp/simp-core/blob/master/LICENSE>.,Met,The Apache-2.0 license is approved by the Open Source Initiative (OSI).,Met,The Apache-2.0 license is approved by the Open Source Initiative (OSI).,Met,The documentation can be found at https://simp.readthedocs.org,Met,The documentation can be found at https://simp.readthedocs.org,Met,"Repository on GitHub, which provides public git repositories with URLs.",Met,"Repository on GitHub, which uses git. git can track the changes, who made them, and when they were made.",Met,,Met,"Repository on GitHub, which uses git. git is distributed.",Met,All sub-components use Semantic Versioning 2.0.0. The overall build uses a modification to Semantic Versioning that is tied directly to the version of the underlying Operating System. This is covered in the documentation for the product.,Met,,Met,Git tags are used for each release,Met,There are changelogs in each package repository for each sub-component as well as a master changelog in the https://github.com/simp/simp-doc project.,Met,Vulnerabilities that are fixed are specifically noted in each master changelog.,?,,Met,All issues are tracked at https://simp-project.atlassian.net.,Met,Bug reports can be submitted at https://simp-project.atlassian.net.,Met,Bugs are triaged as they are submitted into the bug tracking system.,Met,Enhancement requests are triaged every three weeks.,Met,The bug tracking system at https://simp-project.atlassian.net is publicly accessible.,Met,Material on reporting security issues is at https://simp.readthedocs.io/en/master/help/Public_Resources.html and a triage process is in place.,Met,"Per https://github.com/NationalSecurityAgency/SIMP#google-groups, private reports may be sent to the private SIMP security forum at https://groups.google.com/forum/?fromgroups#!forum/simp-security",Met,,Met,All components are built and tested using TravisCI and Jenkins. ConcourseCI is on the way.,Met,All components are built and tested using TravisCI and Jenkins. ConcourseCI is on the way.,Met,Any system with RVM and 'mock' can build any or all components. Many components are usable in their raw form.,Met,All component tests are released as part of the source code.,Met,All tests can be run using 'rake',Met,Most critical paths are tested both with unit tests and acceptance tests.,Met,"If tests are not added, unless the change it trivial, the code review process will flag a need for improvement.",Met,,Unmet,Documentation should be updated.,Met,A linter is run on all code to find issues.,Met,Warnings are not allowed except where explicitly codified.,Met,,Met,,Met,,Met,,Met,,Met,,Met,The system is Linux kernel enforced FIPS conformant by default.,Met,,Met,,Met,"This is met, but OS and application functionality conformance is maintained where required.",,This is up to the final implementing user.,Met,,Met,,Met,,Met,,,Our production code is mostly Puppet code and a static code analysis tool could not be found to work with Puppet at this time.,,,,,,,Unmet,,Unmet,,Unmet,,Met,,,2016-03-03 01:40:08 UTC,2017-07-22 13:40:23 UTC,Met,,Met,All components are built and tested using TravisCI and Jenkins. ConcourseCI is on the way.,,Met,https://github.com/NationalSecurityAgency/SIMP#community details the methods that are available for freely and openly communicating with the SIMP team.,Met,,Met,,Met,,Met,As applicable RFCs allow.,Met,,Met,,Met,,Unmet,"Mostly met, GitHub is compliant, BinTray is not but all packages are GPG signed with a public key available from GitHub. X-Content-Type-Options was not set to ""nosniff"".",Met,All packages are created using RPM and Puppet module files.,Met,See https://github.com/simp/simp-core for details on building the project,100,2017-05-18 16:34:35 UTC,,2017-05-16 23:00:41 UTC,False,"Ruby, Puppet, RestructuredText, Shell",10,29,Unmet,,Unmet,,Unmet,,Unmet,,Met,"The SIMP project is actively maintained by Onyx Point, Inc. (https://onyxpoint.com)",Met,https://github.com/orgs/simp/people,Unmet,,Unmet,,Met,http://simp.readthedocs.io/en/master/security_conop/index.html and http://simp.readthedocs.io/en/master/security_mapping/index.html,Met,http://simp.readthedocs.io/en/master/getting_started_guide/index.html,Met,http://simp.readthedocs.io/en/latest/getting_started_guide/index.html,Met,https://github.com/simp/simp-core,,There are no GUI or web applications involved in SIMP Core,,There is no text generated for end users.,,The project sites do not store user credentials,Unmet,,Met,Vulnerabilities are tracked under the various system sub-component CHANGELOG files https://github.com/simp,Met,http://simp.readthedocs.io/en/latest/help/Public_Resources.html,?,,?,,?,,?,,?,,?,,?,,?,,?,,?,,?,,?,,?,,?,,?,,?,,?,,?,,?,,?,,?,,?,,17,?,,?,,?,,?,,?,,?,,?,,?,,?,,?,,?,,?,,Met,,Unmet,,129,,,,,,2017-05-18 16:34:35 UTC,,,Met,
