18,2050,2710,RDML,RDML data import for R,https://github.com/kablag/RDML,https://github.com/kablag/RDML,MIT,?,,Met,Given only https: URLs.,?,,?,,Met,"Projects on GitHub by default use issues and pull requests, as encouraged by documentation such as <https://guides.github.com/activities/contributing-to-open-source/>.",?,,Met,Non-trivial license location file in repository: <https://github.com/kablag/RDML/blob/master/LICENSE>.,Met,The MIT license is approved by the Open Source Initiative (OSI).,Met,The MIT license is approved by the Open Source Initiative (OSI).,Met,Some documentation basics file contents found.,?,,Met,"Repository on GitHub, which provides public git repositories with URLs.",Met,"Repository on GitHub, which uses git. git can track the changes, who made them, and when they were made.",?,,Met,"Repository on GitHub, which uses git. git is distributed.",?,,?,,?,,Met,Non-trivial release notes file in repository: <https://github.com/kablag/RDML/blob/master/CHANGELOG>.,?,,?,,?,,?,,?,,?,,?,,?,,?,,?,,?,,?,,?,,?,,?,,?,,?,,?,,?,,?,,?,,?,,?,,?,,?,,?,,?,,?,,?,,?,,?,,?,,?,,?,,?,,?,,?,,?,,?,,?,,?,,?,,?,,?,,,2018-07-31 12:36:14 UTC,2018-07-31 12:36:14 UTC,?,,?,,,Met,GitHub supports discussions on issues and pull requests.,?,,?,,?,,?,,?,,?,,?,,Met,Found all required security hardening headers.,?,,?,,18,,,2022-04-18 23:00:12 UTC,False,"R, JavaScript (CII estimate)",19,0,?,,?,,?,,?,,?,,?,,?,,?,,?,,?,,?,,?,,?,,?,,?,,?,,?,,?,,?,,?,,?,,?,,?,,?,,?,,?,,?,,?,,?,,?,,?,,?,,?,,?,,?,,?,,?,,?,,?,,?,,4,?,,?,,?,,?,,?,,?,,?,,?,,?,,?,,?,,?,,Unmet,,Unmet,,18,,,,,,,,,Met,
19,2053,2715,DataExplorer,R package to automate Data Exploration and Treatment,https://boxuancui.github.io/DataExplorer,https://github.com/boxuancui/DataExplorer,MIT,?,,Met,"* https://cran.r-project.org/package=DataExplorer
* https://github.com/boxuancui/DataExplorer",Met,https://​cloud.r-project.org/​package=DataExplorer,Met,https://github.com/boxuancui/DataExplorer/issues,Met,"Projects on GitHub by default use issues and pull requests, as encouraged by documentation such as <https://guides.github.com/activities/contributing-to-open-source/>.",Met,https://github.com/boxuancui/DataExplorer/issues/new,Met,https://cran.r-project.org/package=DataExplorer,Met,https://cran.r-project.org/package=DataExplorer The MIT license is approved by the Open Source Initiative (OSI).,Met,MIT license The MIT license is approved by the Open Source Initiative (OSI).,Met,"* https://cran.r-project.org/package=DataExplorer/vignettes/dataexplorer-intro.html
* https://github.com/boxuancui/DataExplorer/tree/master/man",Met,"* https://cran.r-project.org/package=DataExplorer/vignettes/dataexplorer-intro.html
* https://github.com/boxuancui/DataExplorer/tree/master/man",Met,"Repository on GitHub, which provides public git repositories with URLs.",Met,"Repository on GitHub, which uses git. git can track the changes, who made them, and when they were made.",Met,"There are 3 branchs: CRAN, GitHub master, and GitHub develop",Met,"Repository on GitHub, which uses git. git is distributed.",Met,https://cran.r-project.org/package=DataExplorer/news/news.html,Met,,Met,https://github.com/boxuancui/DataExplorer/releases,Met,Non-trivial release notes file in repository: <https://github.com/boxuancui/DataExplorer/blob/master/NEWS.md>.,,"This is for exploratory data analysis, which is unlikely to have any publicly known vulnerabilities.",?,,Met,https://github.com/boxuancui/DataExplorer/issues,Met,https://github.com/boxuancui/DataExplorer/issues/new,Met,https://github.com/boxuancui/DataExplorer/issues?q=is%3Aissue+is%3Aclosed+label%3Abug,Met,https://github.com/boxuancui/DataExplorer/issues?q=is%3Aissue+is%3Aclosed+label%3Aenhancement,Met,https://github.com/boxuancui/DataExplorer/issues?q=is%3Aissue+is%3Aclosed,Met,https://github.com/boxuancui/DataExplorer/issues,,,,,Met,"* https://travis-ci.org/boxuancui/DataExplorer/
* https://ci.appveyor.com/project/boxuancui/DataExplorer",Met,devtools,Met,,Met,testthat: https://github.com/boxuancui/DataExplorer/tree/master/tests,Met,https://codecov.io/gh/boxuancui/DataExplorer/,Met,https://codecov.io/gh/boxuancui/DataExplorer/,Met,,Met,,Met,,Met,,Met,,Met,,Met,,Met,,,,Met,,,,,,,,,,,,,,Met,,Met,,Met,,Met,,Met,lintr,,,,,Met,https://codecov.io/gh/boxuancui/DataExplorer/,Met,,Met,,Met,,,,,2018-07-31 16:43:00 UTC,2019-03-27 13:24:31 UTC,,,Met,"* https://travis-ci.org/boxuancui/DataExplorer/
* https://ci.appveyor.com/project/boxuancui/DataExplorer",,Met,GitHub supports discussions on issues and pull requests.,Met,,Met,https://github.com/boxuancui/DataExplorer,?,,?,,?,,?,,?,,Unmet,"Found all required security hardening headers. // X-Content-Type-Options was not set to ""nosniff"".",?,,?,,100,2018-10-19 02:48:07 UTC,,2018-09-06 23:00:48 UTC,False,R (CII estimate),9,7,?,,?,,?,,?,,?,,?,,?,,?,,?,,?,,?,,?,,?,,?,,?,,?,,?,,?,,?,,?,,?,,?,,?,,?,,?,,?,,?,,?,,?,,?,,?,,?,,?,,?,,?,,?,,?,,?,,?,,?,,13,?,,?,,?,,?,,?,,?,,?,,?,,?,,?,,?,,?,,Met,,Unmet,,107,,,,,,2018-10-19 02:48:07 UTC,,,Met,
20,2054,2716,PKNCA,An R package is designed to perform all noncompartmental analysis (NCA) calculations for pharmacokinetic (PK) data.,https://github.com/billdenney/pknca,https://github.com/billdenney/pknca,AGPL-3.0-only,?,,Met,Given only https: URLs.,Met,https://github.com/billdenney/pknca/blob/master/README.md,Met,https://github.com/billdenney/pknca/issues,Met,"Projects on GitHub by default use issues and pull requests, as encouraged by documentation such as <https://guides.github.com/activities/contributing-to-open-source/>.",Met,https://github.com/billdenney/pknca/blob/master/.github/CONTRIBUTING.md,Met,https://github.com/billdenney/pknca/blob/master/LICENSE.md,Met,AGPL-3.0 license The AGPL-3.0-only license is approved by the Open Source Initiative (OSI).,Met,The AGPL-3.0-only license is approved by the Open Source Initiative (OSI).,Met,"https://github.com/billdenney/pknca/tree/master/man
https://github.com/billdenney/pknca/tree/master/vignettes",Met,https://github.com/billdenney/pknca/tree/master/man,Met,"Repository on GitHub, which provides public git repositories with URLs.",Met,"Repository on GitHub, which uses git. git can track the changes, who made them, and when they were made.",Met,https://github.com/billdenney/pknca/commits/master,Met,"Repository on GitHub, which uses git. git is distributed.",Met,https://github.com/billdenney/pknca/releases,Met,,Met,https://github.com/billdenney/pknca/releases,Met,Non-trivial release notes file in repository: <https://github.com/billdenney/pknca/blob/master/NEWS.md>.,,No publicly known vulnerabilities,?,,Met,https://github.com/billdenney/pknca/issues,Met,https://github.com/billdenney/pknca/issues,Met,https://github.com/billdenney/pknca/issues,Met,https://github.com/billdenney/pknca/issues,Met,https://github.com/billdenney/pknca/issues,Met,"Via standard issue tracking
https://github.com/billdenney/pknca/issues",,All are public,,No vulnerabilities reported ever,Met,https://travis-ci.org/billdenney/pknca,Met,https://travis-ci.org/billdenney/pknca,Met,"Standard R build system, https://travis-ci.org/billdenney/pknca",Met,https://github.com/billdenney/pknca/tree/master/tests,Met,"devtools::test() will work.
https://github.com/billdenney/pknca/tree/master/tests",Met,Approximately 95% test coverage: https://codecov.io/github/billdenney/pknca?branch=master,Met,https://github.com/billdenney/pknca/blob/master/.github/CONTRIBUTING.md,Met,See history in https://codecov.io/github/billdenney/pknca?branch=master,Met,https://github.com/billdenney/pknca/blob/master/.github/CONTRIBUTING.md,Met,"Not directly applicable.  All R CRAN errors, warnings, and when feasible notes are addressed.
https://travis-ci.org/billdenney/pknca",Met,"Not directly applicable.  All R CRAN errors, warnings, and when feasible notes are addressed.
https://travis-ci.org/billdenney/pknca",Met,"Not directly applicable.  All R CRAN errors, warnings, and when feasible notes are addressed.
https://travis-ci.org/billdenney/pknca",Met,"The primary developer of the project is aware of these.
Generally, this does not apply to the R code being written in this project.",Met,"The primary developer of the project is aware of these.
Generally, this does not apply to the R code being written in this project.",,,,,,,,,,,,,,,,,Met,https://cran.r-project.org/package=PKNCA,Met,"MD5 within https://cran.r-project.org/src/contrib/PKNCA_0.8.5.tar.gz (in file ""PKNCA_0.8.5.tar\PKNCA\MD5"")",Met,"No unpatched, known vulnerabilities: https://github.com/billdenney/pknca/issues",Met,"No unpatched, known vulnerabilities: https://github.com/billdenney/pknca/issues",,No FLOSS tools for static analysis of interpreted R code.,,No FLOSS tools for static analysis of interpreted R code.,,No FLOSS tools for static analysis of interpreted R code.,,No FLOSS tools for static analysis of interpreted R code.,Met,Testing includes many fuzzed inputs.  https://github.com/billdenney/pknca/tree/master/tests,,No FLOSS tools for dynamic analysis of interpreted R code.,Met,Testing includes checking most inputs: https://github.com/billdenney/pknca/tree/master/tests,,No FLOSS tools for dynamic analysis of interpreted R code.,,2018-07-31 17:23:07 UTC,2018-07-31 19:09:39 UTC,,,Met,https://travis-ci.org/billdenney/pknca,,Met,GitHub supports discussions on issues and pull requests.,Met,Does not typically apply.  https://github.com/billdenney/pknca,Met,"https://github.com/billdenney/pknca/tree/master/man
https://github.com/billdenney/pknca/tree/master/vignettes
https://github.com/billdenney/pknca/issues",,Vulnerabilities are unlikely in interpreted R code.,,,,,,,,,Met,Found all required security hardening headers.,Met,Installs via CRAN and has instructions on website: https://github.com/billdenney/pknca#installation,Met,Build to R package via standard R package methods.  Tested with continuous integration: https://travis-ci.org/billdenney/pknca,100,2018-07-31 18:10:58 UTC,,,False,R,16,67,?,,?,,?,,?,,?,,Unmet,,?,,?,,?,,Met,https://cran.r-project.org/web/packages/PKNCA/vignettes/Introduction-and-Usage.html,Met,"New code requires documentation, and continuous integration tests integration of existing code along with rebuilding documentation:
https://github.com/billdenney/pknca/blob/master/.github/CONTRIBUTING.md
https://travis-ci.org/billdenney/pknca",Met,"README is updated when applicable.
https://github.com/billdenney/pknca",?,,Unmet,,,GitHub,Met,"Interface has not changed notably, and https://github.com/billdenney/pknca/blob/master/NEWS.md documents breaking changes with how to work around them.",,No vulnerabilities,?,,?,,?,,Met,"Not exactly binaries, but CRAN requirements are maintained.
https://travis-ci.org/billdenney/pknca",Met,"Not exactly binaries, but CRAN requirements are maintained.
https://travis-ci.org/billdenney/pknca",,Not applicable for R,,Not applicable for R,Met,Installs via CRAN and has instructions on website: https://github.com/billdenney/pknca#installation,Met,Installs via CRAN and has instructions on website: https://github.com/billdenney/pknca#installation,Met,DESCRIPTION file for R: https://github.com/billdenney/pknca/blob/master/DESCRIPTION,,Doesn't typically apply for interpreted R code,Met,Installs via CRAN and has instructions on website: https://github.com/billdenney/pknca#installation,Met,"Installs via CRAN and has instructions on website: https://github.com/billdenney/pknca#installation
Dependencies are minimized and attempted to limit to commonly-used dependencies.",Met,"https://travis-ci.org/billdenney/pknca
https://codecov.io/github/billdenney/pknca?branch=master",Met,https://codecov.io/github/billdenney/pknca?branch=master,Met,https://codecov.io/github/billdenney/pknca?branch=master,Met,https://github.com/billdenney/pknca/blob/master/.github/CONTRIBUTING.md,?,,Met,Test suite checks inputs: https://github.com/billdenney/pknca/tree/master/tests,,,,,?,,?,,48,Unmet,,Unmet,,Unmet,,?,,Unmet,,Unmet,,?,,?,,Met,"https://travis-ci.org/billdenney/pknca
https://codecov.io/github/billdenney/pknca?branch=master",Met,"https://travis-ci.org/billdenney/pknca
https://codecov.io/github/billdenney/pknca?branch=master",?,,?,,Met,,Unmet,,167,,,,,,2018-07-31 18:10:58 UTC,,,Met,
21,2055,2717,BAS,R package BAS: Bayesian Variable Selection and Model Averaging using Bayesian Adaptive Sampling,https://merliseclyde.github.io/BAS,https://github.com/merliseclyde/BAS,GPL-3.0-or-later,?,,Met,Given only https: URLs.,Met,"<https://merliseclyde.github.io/BAS/>
<https://github.com/merliseclyde/BAS/README.md>",Met,"<https://merliseclyde.github.io/BAS/>
<https://github.com/merliseclyde/BAS/README.md>",Met,"Projects on GitHub by default use issues and pull requests, as encouraged by documentation such as <https://guides.github.com/activities/contributing-to-open-source/>.",Met,https://github.com/merliseclyde/BAS/blob/master/CONTRIBUTING.md,Met,Non-trivial license location file in repository: <https://github.com/merliseclyde/BAS/blob/master/LICENSE>.,Met,The GPL-3.0 license is approved by the Open Source Initiative (OSI). The GPL-3.0-or-later license is approved by the Open Source Initiative (OSI).,Met,The GPL-3.0 license is approved by the Open Source Initiative (OSI). The GPL-3.0-or-later license is approved by the Open Source Initiative (OSI).,Met,<https://merliseclyde.github.io/BAS/reference/index.html>,Met,<https://merliseclyde.github.io/BAS/articles/BAS-vignette.html>,Met,"Repository on GitHub, which provides public git repositories with URLs.",Met,"Repository on GitHub, which uses git. git can track the changes, who made them, and when they were made.",Met,Interim versions are available on GitHub <https://github.com/merliseclyde/BAS> in the master and dev branches.  Released versions are tagged.,Met,"Repository on GitHub, which uses git. git is distributed.",Met,Version numbers are of the form major.minor.patch,Met,,Met,Using git releases <https://github.com/merliseclyde/BAS/releases>,Met,Non-trivial release notes file in repository: <https://github.com/merliseclyde/BAS/blob/master/NEWS.md><https://github.com/merliseclyde/BAS/blob/master/CHANGELOG>.,,No known public vulnerabilities,?,,Met,Issues may be reported at <https://​github.com/​merliseclyde/​BAS/​issues>,Met,Bug reports may be reported on GitHub <https://​github.com/​merliseclyde/​BAS/​issues>,Met,"Issues are labeled as enhancement, bug, etc and comments are at <https://​github.com/​merliseclyde/​BAS/​issues>.  ",Met,<https://​github.com/​merliseclyde/​BAS/​issues>  ,Met,<https://​github.com/​merliseclyde/​BAS/​issues>,Met,Vulnerabilities may be reported at <https://​github.com/​merliseclyde/​BAS/​issues>. Maintainer's email is provided on site.,,,,No vulnerability reports in the last 6 months+,Met,,Met,,Met,,Met,,Met,R CMD check runs tests in <https://github.com/merliseclyde/BAS/tree/master/tests>  or use devtools::test() ,Met,,Met,,Met,<https://github.com/merliseclyde/BAS/tree/master/tests>,Met,<https://github.com/merliseclyde/BAS/blob/master/.github/CONTRIBUTING.md>,Met,,Met,,Met,"Not directly applicable. All R CRAN errors, warnings, and when feasible notes are addressed. <https://travis-ci.org/merliseclyde/BAS>",Met,,Met,,,,,,,,,,,,,,,,,,Met,,Met,,Met,,Met,,Met,R CMD check is the language equivalent,Met,R CMD check  with valgrind is used to check for memory/buffer vulnerabilities as well as using  R with other address sanitizers see <http://dirk.eddelbuettel.com/code/sanitizers.html>,Met,,Met,,Met,Testing includes many fuzzed inputs <https://github.com/merliseclyde/BAS/tree/master/tests> checked with Travis CI,Met,valgrind is used in CI with each commit,Met,<https://github.com/merliseclyde/BAS/tree/master/tests>,Met,,,2018-07-31 18:36:41 UTC,2018-10-23 02:40:14 UTC,,,Met,Travis CI <https://travis-ci.org/merliseclyde/BAS> used for continuous integration on all branches,,Met,GitHub supports discussions on issues and pull requests.,Met,,Met,"Documentation <https://merliseclyde.github.io/BAS/reference/index.html>  
Bug reports and comments accepted at <https://​github.com/​merliseclyde/​BAS/​issues>",,Vulnerabilities are not likely in interpreted R code;  C source code uses checks and address sanitizers to identify security vulnerabilities.,,,,,,,,,Unmet,"Found all required security hardening headers. // X-Content-Type-Options was not set to ""nosniff"".  <https://github.com/merliseclyde/BAS> 
<https://merliseclyde.github.io/BAS> is a static site // X-Content-Type-Options was not set to ""nosniff"".",Met,Installs from CRAN  or uses `install.packages` or  package manager within R.  Instructions for installing from GitHub are on the package website:   <https://merliseclyde.github.io/BAS>,Met,Build to R package via standard R package methods. Tested with Travis continuous integration: <https://travis-ci.org/merliseclyde/BAS> for each commit and on multiple platforms prior to release on CRAN.,100,2018-07-31 21:42:45 UTC,,,False,"R, C, Fortran",34,85,Met,<https://github.com/merliseclyde/BAS/blob/master/CONTRIBUTING.md>,Met,<https://github.com/merliseclyde/BAS/blob/master/CONTRIBUTING.md> describes how to make contributions;  developers with significant contributions are listed in <https://github.com/merliseclyde/BAS/blob/master/DESCRIPTION.md> ,Met,<https://github.com/merliseclyde/BAS/blob/master/CODE_OF_CONDUCT.md>,Met,<https://github.com/merliseclyde/BAS/blob/master/DESCRIPTION.md> provides roles of contirubuters,Unmet, This is an open source package; package development could continue by others by cloning the project.,Unmet, This is an open source package; package development could continue by others by cloning the project.,Unmet,,?,,?,,Met,<https://merliseclyde.github.io/BAS/articles/index.html>,Met,Documentation at <https://merliseclyde.github.io/BAS/> is produced using continuous integration via Travis CI with each commit if build is successful in terms of passing R CMD check on the master branch,Met,<https://github.com/merliseclyde/BAS/blob/master/README.md> and <https://merliseclyde.github.io/BAS/>,?,,Met,"This is provided by R  for R and C messages as documented at 
<https://cran.r-project.org/doc/manuals/r-release/R-exts.html#Internationalization>",,No passwords are used,Met, All previous CRAN releases <https://cran.r-project.org/src/contrib/Archive/BAS/> ,,Vulnerabilities should be reported at <https://github.com/merliseclyde/BAS/issues>,Met,Report at <https://github.com/merliseclyde/BAS/issues> ,?,,,No FLOSS tool to enforce coding style automatically;  must be run manually at this time.,Met,R CMD check --as-cran is language standard,Met,Standards for CRAN apply for building with debugging.,,Not applicable for R,,Not applicable for the package source files; no random seeds are set by the code but are obtained from the scripting language within R,,Installs from CRAN  or uses `install.packages` or  package manager within R which supports default/custom installation directories.  Instructions for installing from GitHub are on the package website:   <https://merliseclyde.github.io/BAS>,Met,Installs from CRAN or uses `install.packages` or  package manager within R.  Instructions for installing from GitHub are on the package website:   <https://github.com/merliseclyde/BAS>. ,Met,DESCRIPTION file for R: <https://github.com/merliseclyde/BAS/blob/master/DESCRIPTION>  lists all package dependencies ,Met,External dependencies checked on CRAN; <https://cran.r-project.org/web/checks/check_results_BAS.html>,Met,Uses standard components provided by R and contributed packages available through R,Met,"Uses APIs through R for math libraries, etc",Met,Uses Travis CI for all branches on every commit <https://travis-ci.org/merliseclyde/BAS>   Passing Badge for master branch is shown on < https://github.com/merliseclyde/BAS/blob/master/README.md>,Met,"Test suite in <https://github.com/merliseclyde/BAS/tree/master/tests>
",Met,<https://codecov.io/github/merliseclyde/BAS?branch=master>,Met,<https://github.com/merliseclyde/BAS/blob/master/.github/CONTRIBUTING.md>,Met,Installation is secure;  other aspects NA for R packages.,Met,Test suite checks inputs: https://github.com/merliseclyde/BAS/tree/master/tests; in general no restrictions on data,,,,,Met,Releases on CRAN include the file MD5 which is checked when packages are installed,?,,52,?,,?,,?,,?,,?,,?,,?,,?,,Met,codecov is automatically run via Travis CI after each successful build.  Coverage  for R and C code reported at https://codecov.io/github/merliseclyde/BAS?branch=master,Met,Test suites implemented using testthat; automatically run via R CMD check with Travis CI and codecov,Met,<https://securityheaders.com/?q=https%3A%2F%2Fgithub.com%2Fmerliseclyde%2FBAS&followRedirects=on>,?,,Met,,Unmet,,185,,,,,,2018-07-31 21:42:45 UTC,,,Met,
22,2056,2718,earthEngineGrabR,,https://github.com/JesJehle/earthEngineGrabR,https://github.com/JesJehle/earthEngineGrabR,,?,,Met,Given only https: URLs.,?,,?,,Met,"Projects on GitHub by default use issues and pull requests, as encouraged by documentation such as <https://guides.github.com/activities/contributing-to-open-source/>.",?,,Unmet,// No license location file found.,?,,?,,Unmet,// No appropriate folder found for documentation basics.,?,,Met,"Repository on GitHub, which provides public git repositories with URLs.",Met,"Repository on GitHub, which uses git. git can track the changes, who made them, and when they were made.",?,,Met,"Repository on GitHub, which uses git. git is distributed.",?,,?,,?,,Unmet,// No release notes file found.,?,,?,,?,,?,,?,,?,,?,,?,,?,,?,,?,,?,,?,,?,,?,,?,,?,,?,,?,,?,,?,,?,,?,,?,,?,,?,,?,,?,,?,,?,,?,,?,,?,,?,,?,,?,,?,,?,,?,,?,,?,,?,,?,,?,,,2018-07-31 20:10:47 UTC,2018-07-31 20:10:47 UTC,?,,?,,,Met,GitHub supports discussions on issues and pull requests.,?,,?,,?,,?,,?,,?,,?,,Met,Found all required security hardening headers.,?,,?,,10,,,2022-04-27 23:00:30 UTC,False,"R, Python (CII estimate)",19,0,?,,?,,?,,?,,?,,?,,?,,?,,?,,?,,?,,?,,?,,?,,?,,?,,?,,?,,?,,?,,?,,?,,?,,?,,?,,?,,?,,?,,?,,?,,?,,?,,?,,?,,?,,?,,?,,?,,?,,?,,4,?,,?,,?,,?,,?,,?,,?,,?,,?,,?,,?,,?,,Unmet,,Unmet,,10,,,,,,,,,Met,
23,2057,2719,DALEX,Descriptive mAchine Learning EXplanations,https://pbiecek.github.io/DALEX,https://github.com/pbiecek/DALEX,,?,,Met,Given only https: URLs.,?,,?,,Met,"Projects on GitHub by default use issues and pull requests, as encouraged by documentation such as <https://guides.github.com/activities/contributing-to-open-source/>.",?,,Unmet,// No license location file found.,?,,?,,Met,Some documentation basics file contents found.,?,,Met,"Repository on GitHub, which provides public git repositories with URLs.",Met,"Repository on GitHub, which uses git. git can track the changes, who made them, and when they were made.",?,,Met,"Repository on GitHub, which uses git. git is distributed.",?,,?,,?,,Met,Non-trivial release notes file in repository: <https://github.com/pbiecek/DALEX/blob/master/NEWS.md>.,?,,?,,?,,?,,?,,?,,?,,?,,?,,?,,?,,?,,?,,?,,?,,?,,?,,?,,?,,?,,?,,?,,?,,?,,?,,?,,?,,?,,?,,?,,?,,?,,?,,?,,?,,?,,?,,?,,?,,?,,?,,?,,?,,?,,,2018-07-31 21:09:01 UTC,2018-07-31 21:09:01 UTC,?,,?,,,Met,GitHub supports discussions on issues and pull requests.,?,,?,,?,,?,,?,,?,,?,,Unmet,"// X-Content-Type-Options was not set to ""nosniff"".",?,,?,,13,,,2022-05-01 23:00:37 UTC,False,R (CII estimate),19,0,?,,?,,?,,?,,?,,?,,?,,?,,?,,?,,?,,?,,?,,?,,?,,?,,?,,?,,?,,?,,?,,?,,?,,?,,?,,?,,?,,?,,?,,?,,?,,?,,?,,?,,?,,?,,?,,?,,?,,?,,4,?,,?,,?,,?,,?,,?,,?,,?,,?,,?,,?,,?,,Unmet,,Unmet,,13,,,,,,,,,Met,
24,2058,2720,adapr,next gen ADAP,https://github.com/gelfondjal/adapr,https://github.com/gelfondjal/adapr,,?,,Met,Given only https: URLs.,?,,?,,Met,"Projects on GitHub by default use issues and pull requests, as encouraged by documentation such as <https://guides.github.com/activities/contributing-to-open-source/>.",?,,Unmet,// No license location file found.,?,,?,,Unmet,// No appropriate folder found for documentation basics.,?,,Met,"Repository on GitHub, which provides public git repositories with URLs.",Met,"Repository on GitHub, which uses git. git can track the changes, who made them, and when they were made.",?,,Met,"Repository on GitHub, which uses git. git is distributed.",?,,?,,?,,Unmet,// No release notes file found.,?,,?,,?,,?,,?,,?,,?,,?,,?,,?,,?,,?,,?,,?,,?,,?,,?,,?,,?,,?,,?,,?,,?,,?,,?,,?,,?,,?,,?,,?,,?,,?,,?,,?,,?,,?,,?,,?,,?,,?,,?,,?,,?,,?,,,2018-07-31 21:36:21 UTC,2018-07-31 21:36:21 UTC,?,,?,,,Met,GitHub supports discussions on issues and pull requests.,?,,?,,?,,?,,?,,?,,?,,Met,Found all required security hardening headers.,?,,?,,10,,,2022-05-01 23:00:37 UTC,False,R (CII estimate),19,0,?,,?,,?,,?,,?,,?,,?,,?,,?,,?,,?,,?,,?,,?,,?,,?,,?,,?,,?,,?,,?,,?,,?,,?,,?,,?,,?,,?,,?,,?,,?,,?,,?,,?,,?,,?,,?,,?,,?,,?,,4,?,,?,,?,,?,,?,,?,,?,,?,,?,,?,,?,,?,,Unmet,,Unmet,,10,,,,,,,,,Met,
