5,33,23,Ruby on Rails,Ruby on Rails is an open-source web framework that’s optimized for programmer happiness and sustainable productivity. It favors convention over configuration.,http://rubyonrails.org,https://github.com/rails/rails,MIT,?,,Unmet,// Given an http: URL.,Met,http://rubyonrails.org/,Met,http://edgeguides.rubyonrails.org/contributing_to_ruby_on_rails.html,Met,http://edgeguides.rubyonrails.org/contributing_to_ruby_on_rails.html,Met,http://edgeguides.rubyonrails.org/contributing_to_ruby_on_rails.html#write-your-code,Met,https://github.com/rails/rails/blob/master/activerecord/MIT-LICENSE and the same in other sub-projects.,Met,https://github.com/rails/rails#license The MIT license is approved by the Open Source Initiative (OSI).,Met,The MIT license is approved by the Open Source Initiative (OSI).,Met,http://guides.rubyonrails.org/,Met,http://api.rubyonrails.org/,Met,https://github.com/rails/rails,Met,"Repository on GitHub, which uses git. git can track the changes, who made them, and when they were made.",Met,,Met,"Repository on GitHub, which uses git. git is distributed.",Met,,Met,,Met,https://github.com/rails/rails/releases,Met,http://weblog.rubyonrails.org/releases/,Met,,?,,Met,,Met,https://github.com/rails/rails/issues,Met,,Met,,Met,https://github.com/rails/rails/issues,Met,http://rubyonrails.org/security/,Met,http://rubyonrails.org/security/,Met,,Met,https://github.com/rails/rails/blob/master/RELEASING_RAILS.md,Met,,Met,,Met,http://guides.rubyonrails.org/contributing_to_ruby_on_rails.html#running-tests,Met,http://guides.rubyonrails.org/contributing_to_ruby_on_rails.html#running-tests,Met,,Met,http://guides.rubyonrails.org/contributing_to_ruby_on_rails.html#write-your-code,Met,,Met,http://guides.rubyonrails.org/contributing_to_ruby_on_rails.html#write-your-code,Met,"As explained in the [Contributing to Ruby on Rails (warning section)](http://edgeguides.rubyonrails.org/contributing_to_ruby_on_rails.html#warnings): ""The test suite runs with warnings enabled. Ideally, Ruby on Rails should issue no warnings, but there may be a few, as well as some from third-party libraries. Please ignore (or fix!) them, if any, and submit patches that do not issue new warnings. If you are sure about what you are doing and would like to have a more clear output, there's a way to override the flag:
$ RUBYOPT=-W0 bundle exec rake test"".  In short, Rails *does* run with Ruby compiler warnings, and patches are to be submitted in a way that ""do not issue new warnings"".",Met,See [Contributing to Ruby on Rails (warning section)](http://edgeguides.rubyonrails.org/contributing_to_ruby_on_rails.html#warnings).,Unmet,,Met,,Met,,Met,,Met,,Met,,,,Met,http://api.rubyonrails.org/classes/ActiveSupport/MessageEncryptor.html,,,,,Met,,Met,https://rubygems.org/gems/rails/,Met,,Met,,Met,,?,,Unmet,,?,,Unmet,,Unmet,,,,Unmet,,Unmet,,,2015-11-05 21:12:14 UTC,2020-10-15 21:53:50 UTC,Met,,Met,https://travis-ci.org/rails/rails,cpe:/a:rubyonrails,Met,GitHub issue tracker and pull requests support discussion,Met,,Met,,?,,?,,?,,?,,?,,Unmet,"// X-Content-Type-Options was not set to ""nosniff"".",?,,?,,94,,,2022-04-29 23:00:22 UTC,False,"Ruby, JavaScript, CoffeeScript (CII estimate)",29,4,?,,?,,?,,?,,?,,?,,?,,?,,?,,?,,?,,?,,?,,?,,?,,?,,?,,?,,?,,?,,?,,?,,?,,?,,?,,?,,?,,?,,?,,?,,?,,?,,?,,?,,?,,?,,?,,?,,?,,?,,13,?,,?,,?,,?,,?,,?,,?,,?,,?,,?,,?,,?,,Unmet,,Unmet,,94,,,,,,,,,Met,
6,34,30,Linux Kernel,The Linux kernel.,https://www.kernel.org,https://git.kernel.org,GPL-2.0,?,,Met,,Met,https://www.kernel.org/linux.html,Met,https://bugzilla.kernel.org/,Met,https://git.kernel.org/cgit/linux/kernel/git/torvalds/linux.git/tree/Documentation/HOWTO,Met,https://git.kernel.org/cgit/linux/kernel/git/torvalds/linux.git/tree/Documentation/SubmittingPatches,Met,"The license (GPL-2.0) is in the file COPYING, see <https://git.kernel.org/cgit/linux/kernel/git/torvalds/linux.git/tree/COPYING>.",Met,https://git.kernel.org/cgit/linux/kernel/git/torvalds/linux.git/tree/COPYING The GPL-2.0 license is approved by the Open Source Initiative (OSI).,Met,The GPL-2.0 license is approved by the Open Source Initiative (OSI).,Met,https://git.kernel.org/cgit/linux/kernel/git/torvalds/linux.git/tree/Documentation/,Met,https://git.kernel.org/cgit/linux/kernel/git/torvalds/linux.git/tree/Documentation/ABI/,Met,https://git.kernel.org/cgit/linux/kernel/git/torvalds/linux.git,Met,https://git.kernel.org/cgit/linux/kernel/git/torvalds/linux.git,Met,https://git.kernel.org/cgit/linux/kernel/git/torvalds/linux.git,Met,https://git.kernel.org/cgit/linux/kernel/git/torvalds/linux.git,Met,,Unmet,"The Linux kernel does not make API changes that affect userspace, so there is no need to have denote api compatibility, it is always stable.",Met,,Met,http://kernelnewbies.org/LinuxChanges,Met,,?,,Met,https://bugzilla.kernel.org,Met,See https://git.kernel.org/cgit/linux/kernel/git/torvalds/linux.git/tree/REPORTING-BUGS,Met,,Unmet,"It is up to contributors to submit enhancement requests, the Linux kernel developers almost never accept ""enhancement requests"" on their own.",Met,"Reports and responses are handled as described in <https://git.kernel.org/cgit/linux/kernel/git/torvalds/linux.git/tree/REPORTING-BUGS>.  Many reports on subsystems are handled via subsystem mailing lists, see <http://vger.kernel.org/vger-lists.html>.  Archives of the overall linux-kernel mailing list are available via <http://vger.kernel.org/vger-lists.html#linux-kernel>. The kernel bug tracker is also used (and is searchable); it is accessible at <https://bugzilla.kernel.org/>.",Met,The vulnerability reporting process is described in https://git.kernel.org/cgit/linux/kernel/git/torvalds/linux.git/tree/REPORTING-BUGS and https://git.kernel.org/cgit/linux/kernel/git/torvalds/linux.git/tree/Documentation/SecurityBugs,Met,See https://git.kernel.org/cgit/linux/kernel/git/torvalds/linux.git/tree/Documentation/SecurityBugs,Met,,Met,,Met,,Met,,Met,An example is the Linux Test Project http://linux-test-project.github.io/,Met,https://www.kernel.org/doc/html/latest/process/development-process.html describes how 'make tests' works.,Unmet,"Kernel tests test individual feature functionality, not code branches, and is generally for only ""new"" features, not older POSIX-like functionality.",Met,,Met,,Met,"Not all new features are able to have automated tests added for them.  But, for new syscalls, we do strongly recommend that new tests be added to the automated test suite to show that testing has happened, and to allow for regressions to be found over time.",Met,"The kernel build process enables a lot of warning flags, and it also provides the tool 'sparse' to check for many other coding problems.  And a full test suite of coccineele scripts is integrated into the kernel source tree itself.",Met,,Met,"Where ever practical, all warnings are fixed.",Met,,Met,,Met,,,,Met,,Met,,Met,,,,,,Met,,Met,,Met,,Met,,Met,,Met,Coverity and sparse and smatch and many other static code analysis tools are run on the kernel all the time.,Met,We use coverity and sparse and smatch and others for this.,Met,,Met,,Met,https://01.org/lkp/documentation/0-day-test-service runs lots of these tools on all trees before release.,Met,We use coverity and sparse and smatch and others for this,Met,"Look at all of the wonderful BUG_ON() calls in the kernel (hint, you really don't want those to ever trigger, but they are there...)",Met,,,2015-11-10 02:54:22 UTC,2020-06-10 07:14:42 UTC,Met,https://www.kernel.org/doc/html/latest/crypto/architecture.html,Met,"https://01.org/lkp/documentation/0-day-test-service
The 0-day bot does testing of every commit before it is merged into the main repository.",cpe:/o:linux:linux_kernel,Met,,Met,,Met,,Met,"The Linux kernel self protection project develops hardening improvements for the Linux kernel; many of them have already been accepted into the Linux kernel mainline: http://kernsec.org/wiki/index.php/Kernel_Self_Protection_Project
There are a number of hardening mechanisms in the Linux kernel, such as Linux kernel stack protection.
",,"The kernel implements network packets in general; applications running on top request or perform network communication.  The kernel does implement IPSEC, which is used if requested.  Otherwise, the user specifically requests or configures whatever network protocol is used.",Met,The kernel properly implements TLS if you are so crazy as to wish to use it from within kernelspace.,Met,The kernel properly implements TLS if you are so crazy as to wish to use it from within kernelspace.,Met,The kernel properly implements TLS if you are so crazy as to wish to use it from within kernelspace.,Met,https://kernel.org // One or more of the required security hardening headers is missing.,Met,"Many third parties provide packages (e.g., .deb for apt-get, .rpm).  It's also provided as an xz-compressed tarball.  Since this is a kernel, installation is in general different than application software.",Met,https://www.kernel.org/doc/html/latest/,100,2018-06-14 16:10:57 UTC,2018-06-14 15:39:52 UTC,,False,,31,100,Met,"https://www.kernel.org/doc/html/latest/process/submitting-patches.html#sign-your-work-the-developer-s-certificate-of-origin
We created the DCO for the kernel project :)",Met,"https://www.kernel.org/doc/html/latest/process/development-process.html
",Met,https://www.kernel.org/doc/html/latest/process/code-of-conflict.html,Met,"https://www.kernel.org/doc/html/latest/process/development-process.html
",Met,"https://www.kernel.org/doc/html/latest/process/development-process.html
",Met,"https://www.kernel.org/doc/html/latest/process/development-process.html
",Met,"There is never a roadmap for the kernel, this type of thing is crazy for a project to try to determine.
If you want to see what is coming, look at https://git.kernel.org/
",Met,"https://www.kernel.org/doc/html/latest/process/development-process.html
",Met,https://www.kernel.org/doc/html/latest/admin-guide/security-bugs.html,,"A kernel is not a ""quick start"" type of thing.  That being said, https://kernelnewbies.org does provide a lot of documentation for people getting involved in development.",Met,https://www.kernel.org/doc/html/latest/,Met,https://www.kernel.org,Met,https://www.kernel.org/,,A kernel does not need to have any locale at all.,,No passwords are stored.,Met,https://www.kernel.org/,Met,"https://www.kernel.org/ has full changelog history of all commits, see the ""Reported-by:"" tags for full attributions.",Met,https://www.kernel.org/doc/html/latest/admin-guide/security-bugs.html,Met,https://www.kernel.org/doc/html/latest/process/coding-style.html,Met,scripts/checkpatch.pl checks and enforces coding style rules.,Met,All build environment variables are properly handled.,Met,Configuration options allow for all debugging symbols to be retained in the built objects.,Met,No recursion in the build system when there are cross-dependencies in the subdirectories.,Met,The kernel meets the reproducible build requirements.,Met,The kernel install process is standard on all distros as there is a distro-specific include script which always will work properly.,Met,All distros usually have a 'kernel-developer' meta-package option to automatically install needed dependancies to build the project.,,The kernel has no external dependencies.,,The kernel has no external dependencies.,,The kernel has no external dependencies.,,The kernel has no external dependencies.,Met,The 0-day bot runs on each commit in almost all maintainers trees before they are merged into Linus's tree.,,"It is impossible to create automated regression tests for even a small percentage of the bugs found in the kernel.  But, people are actively working on this, and we do have a very large test suite that includes checks for almost all major CVEs that can be tested for.",,Code coverage is a horrible metric.  See above for the discussion about our automated regression tests.,Met,"Not all kernel functionality can be tested with an automated test suite.  That being said, we do have a huge test suite for almost all major functionality that is run all the time on all maintainer's branches to ensure no regressions happen.",Met,"The kernel implements ""known secure design"" principles.",Met,"""All input is evil"" is the mantra the kernel attempts to follow.  We have automated testing for following userspace data into the kernel and when it is validated properly.",Met,https://www.kernel.org/doc/html/latest/crypto/architecture.html,Met,https://www.kernel.org/doc/html/latest/crypto/architecture.html,Met,https://www.kernel.org/category/signatures.html,Met,All tags for kernel releases are properly signed.,100,Met,https://www.kernel.org/,Met,https://www.kernel.org/doc/html/latest/process/license-rules.html,Met,https://www.kernel.org/doc/html/latest/process/license-rules.html,Met,http://kernelnewbies.org/,Met,https://www.kernel.org/category/signatures.html,Met,https://www.kernel.org/category/signatures.html,Met,https://www.kernel.org/doc/html/latest/process/development-process.html,Met,https://www.kernel.org/doc/html/latest/process/development-process.html,,"There is no such tool that can provide this.

And code coverage is not an indication of code quality :)",,No such tool can provide this.,Met,Lots of people audit the kernel all the time for these types of issues.,Met,"The kernel's security requirements are constantly tested and probed by everyone in the world.  When problems are found, they are resolved as quickly as possible as described in our security bugs reporting documentation: https://www.kernel.org/doc/html/latest/admin-guide/security-bugs.html",Met,,Met,,300,,,,2020-06-10 07:14:42 UTC,,2018-06-14 16:10:57 UTC,,2020-06-10 07:14:42 UTC,Met,
7,35,23,schema_to_scaffold,"Enables ""rails generate scaffold"" to create Rails code that matches an existing database.",https://github.com/frenesim/schema_to_scaffold,https://github.com/frenesim/schema_to_scaffold,MIT,?,,Met,,?,,?,,Met,"Projects on GitHub by default use issues and pull requests, as encouraged by documentation such as <https://guides.github.com/activities/contributing-to-open-source/>.",?,,Met,Non-trivial license location file in repository: <https://github.com/frenesim/schema_to_scaffold/blob/master/LICENSE.txt>.,Met,The MIT license is approved by the Open Source Initiative (OSI).,Met,The MIT license is approved by the Open Source Initiative (OSI).,Unmet,No appropriate folder found for documentation basics.,?,,Met,"Repository on GitHub, which provides public git repositories with URLs.",Met,"Repository on GitHub, which uses git. git can track the changes, who made them, and when they were made.",?,,Met,"Repository on GitHub, which uses git. git is distributed.",?,,?,,?,,Met,Non-trivial release notes file in repository: <https://github.com/frenesim/schema_to_scaffold/blob/master/CHANGELOG.md>.,?,,?,,?,,?,,?,,?,,?,,?,,?,,?,,Met,Non-trivial build file in repository: <https://github.com/frenesim/schema_to_scaffold/blob/master/Rakefile>.,Met,Non-trivial build file in repository: <https://github.com/frenesim/schema_to_scaffold/blob/master/Rakefile>.,?,,?,,?,,?,,?,,?,,?,,?,,?,,?,,?,,?,,?,,?,,?,,?,,?,,?,,?,,?,,?,,?,,?,,?,,?,,?,,?,,?,,?,,?,,?,,?,,,2015-11-12 21:57:27 UTC,2017-08-23 19:18:34 UTC,?,,?,,,Met,GitHub issue tracker and pull requests support discussion,?,,Met,,?,,?,,?,,?,,?,,Met,Found all required security hardening headers.,?,,?,,21,,,2022-05-18 23:00:24 UTC,False,Ruby (CII estimate),28,0,?,,?,,?,,?,,?,,?,,?,,?,,?,,?,,?,,?,,?,,?,,?,,?,,?,,?,,?,,?,,?,,?,,?,,?,,?,,?,,?,,?,,?,,?,,?,,?,,?,,?,,?,,?,,?,,?,,?,,?,,4,?,,?,,?,,?,,?,,?,,?,,?,,?,,?,,?,,?,,Unmet,,Unmet,,21,,,,,,,,,Met,
8,40,31,API Client for Lightspeed Restaurant,"Lightspeed Restaurant API Client is a gem for interacting with Lightspeed Restaurant API. Lightspeed Restaurant is point of sale that helps bars, restaurants, and cafés deliver a better customer experience and run a more profitable business.",https://github.com/chronogolf/lightspeed_restaurant,https://github.com/chronogolf/lightspeed_restaurant,MIT,?,,Met,,?,,?,,Unmet,No contribution file found.,?,,Met,Non-trivial license location file in repository: <https://github.com/chronogolf/lightspeed_restaurant/blob/master/LICENSE.txt>.,Met,The MIT license is approved by the Open Source Initiative (OSI).,Met,The MIT license is approved by the Open Source Initiative (OSI).,?,,?,,?,,Met,"Repository on GitHub, which uses git. git can track the changes, who made them, and when they were made.",?,,Met,"Repository on GitHub, which uses git. git is distributed.",?,,?,,?,,Unmet,No changelog file found.,?,,?,,?,,?,,?,,?,,?,,?,,?,,?,,Met,Non-trivial build file in repository: <https://github.com/chronogolf/lightspeed_restaurant/blob/master/Rakefile>.,Met,Non-trivial build file in repository: <https://github.com/chronogolf/lightspeed_restaurant/blob/master/Rakefile>.,?,,?,,?,,?,,?,,?,,?,,?,,?,,?,,?,,?,,?,,?,,?,,?,,?,,?,,?,,?,,?,,?,,?,,?,,?,,?,,?,,?,,?,,?,,?,,?,,,2015-12-08 15:04:16 UTC,2015-12-08 15:04:16 UTC,?,,?,,,Met,GitHub issue tracker and pull requests support discussion,?,,Met,,?,,?,,?,,?,,?,,?,,?,,?,,16,,,2022-04-08 23:00:19 UTC,False,"Ruby, Shell (CII estimate)",29,0,?,,?,,?,,?,,?,,?,,?,,?,,?,,?,,?,,?,,?,,?,,?,,?,,?,,?,,?,,?,,?,,?,,?,,?,,?,,?,,?,,?,,?,,?,,?,,?,,?,,?,,?,,?,,?,,?,,?,,?,,4,?,,?,,?,,?,,?,,?,,?,,?,,?,,?,,?,,?,,Unmet,,Unmet,,16,,,,,,,,,Met,
9,41,64,byobu,"Byobu is a GPLv3 open source text-based window manager and terminal multiplexer. It was originally designed to provide elegant enhancements to the otherwise functional, plain, practical GNU Screen, for the Ubuntu server distribution. Byobu now includes an enhanced profiles, convenient keybindings, configuration utilities, and toggle-able system status notifications for both the GNU Screen window manager and the more modern Tmux terminal multiplexer, and works on most Linux, BSD, and Mac distributions.",https://byobu.org,https://launchpad.net/byobu,GPL-3.0,?,,Met,,Met,,Met,"Website contains information on how to obtain the software. Project is hosted on Launchpad, so bug reports and enhancements are per default.",Met,http://byobu.org/source.html,Met,http://byobu.org/source.html,Met,Non-trivial license location file in repository: <https://github.com/dustinkirkland/byobu/blob/master/COPYING>.,Met,The GPL-3.0 license is approved by the Open Source Initiative (OSI).,Met,The GPL-3.0 license is approved by the Open Source Initiative (OSI).,Met,Man page: http://bazaar.launchpad.net/~kirkland/byobu/trunk/download/head:/byobu.1-20090505232055-xg34yvd44d9ips2p-1/byobu.1,Met,Keybindings described in /usr/share/doc/byobu page: http://bazaar.launchpad.net/~kirkland/byobu/trunk/download/head:/help.tmux.txt-20111109180841-6hbcf922823ajk8l-1/help.tmux.txt,Met,,Met,"Repository on GitHub, which uses git. git can track the changes, who made them, and when they were made.",Met,,Met,"Repository on GitHub, which uses git. git is distributed.",Met,,Unmet,major.minor has been sufficient for this project so far.,Met,,Met,http://bazaar.launchpad.net/~kirkland/byobu/trunk/view/head:/debian/changelog,Met,,?,,Met,Launchpad bugs,Met,Bug reporting via Launchpad documented on http://byobu.org/support.html,Met,,Met,,Met,https://bugs.launchpad.net/byobu,Met,http://byobu.org/support.html,Met,Private Launchpad bugs. http://byobu.org/support.html,Met,,Met,http://bazaar.launchpad.net/~kirkland/byobu/trunk/view/head:/Makefile.am,Met,autoconf/automake/configure/make driven,Met,,Met,http://bazaar.launchpad.net/~kirkland/byobu/trunk/view/head:/debian/rules,Met,,Unmet,,Met,,Met,http://bazaar.launchpad.net/~kirkland/byobu/trunk/annotate/head:/debian/rules,Unmet,,Met,,Met,,Unmet,,Met,,Met,,,,,,,,,,,,,,,,,,Met,,Met,,Met,,Met,,Met,"pep8 syntax checking, shell syntax checking, bashisms checking",Unmet,,Met,,Unmet,,Unmet,,,,Unmet,,Met,,,2015-12-08 15:40:45 UTC,2018-04-09 01:53:28 UTC,,,Unmet,,,Met,GitHub issue tracker and pull requests support discussion,Met,,Met,,?,,,,,,,,,,Unmet,"// X-Content-Type-Options was not set to ""nosniff"".",?,,Unmet,,100,2018-04-09 01:53:28 UTC,,2018-03-14 23:00:54 UTC,False,"Bash, Python",10,15,?,,?,,?,,?,,?,,?,,?,,?,,?,,?,,?,,?,,?,,?,,?,,?,,?,,?,,?,,?,,?,,?,,?,,?,,?,,?,,?,,?,,?,,?,,?,,?,,?,,?,,?,,?,,?,,?,,?,,?,,13,?,,?,,?,,?,,?,,?,,?,,?,,?,,?,,?,,?,,Met,,Unmet,,115,,,,,,2018-04-09 01:53:28 UTC,,,Met,
10,42,33,GitLab,"GitLab is version control for your server. It also includes an issue tracker, CI/CD and a wiki.",https://about.gitlab.com,https://gitlab.com/gitlab-org/gitlab-ce,MIT,?,,Met,,Met,,Met,,Met,Non-trivial contribution file in repository: <https://github.com/gitlabhq/gitlabhq/blob/master/CONTRIBUTING.md>.,Met,https://gitlab.com/gitlab-org/gitlab-ce/blob/master/CONTRIBUTING.md,Met,Non-trivial license location file in repository: <https://github.com/gitlabhq/gitlabhq/blob/master/LICENSE>.,Met,The MIT license is approved by the Open Source Initiative (OSI).,Met,The MIT license is approved by the Open Source Initiative (OSI).,Met,,Met,,Met,,Met,"Repository on GitHub, which uses git. git can track the changes, who made them, and when they were made.",Met,,Met,"Repository on GitHub, which uses git. git is distributed.",Met,,Met,,Met,,Met,Non-trivial changelog file in repository: <https://github.com/gitlabhq/gitlabhq/blob/master/CHANGELOG>.,Met,,?,,Met,,Met,https://gitlab.com/gitlab-org/gitlab-ce/issues,Met,,Met,,Met,https://gitlab.com/gitlab-org/gitlab-ce/issues,Met,https://about.gitlab.com/disclosure/,Met,https://about.gitlab.com/disclosure/,Met,https://about.gitlab.com/disclosure/,Met,Non-trivial build file in repository: <https://github.com/gitlabhq/gitlabhq/blob/master/Rakefile>.,Met,Non-trivial build file in repository: <https://github.com/gitlabhq/gitlabhq/blob/master/Rakefile>.,Met,,Met,,Met,,Met,,Met,,Met,,Met,,,,,,, ,Met,,Met,,Met,,Met,,Met,,Met,,Met,,Met,,Met,,Met,,Met,,Met,,Met,,Met,,Met,,Met,,Met,,Met,,Met,,Met,,Met,,Met,,See the [GitLab handbook](https://about.gitlab.com/handbook/); [here's a discussion on why the handbook is open source](https://about.gitlab.com/2016/07/12/our-handbook-is-open-source-heres-why/).,2015-12-08 22:53:25 UTC,2016-07-17 03:32:22 UTC,Met,,Met,,,Met,,Met,,Met,,?,,?,,?,,?,,?,,?,,?,,?,,99,2016-01-30 22:49:00 UTC,2021-04-11 18:16:17 UTC,2022-04-06 23:00:40 UTC,False,,9,2,?,,?,,?,,?,,?,,?,,?,,?,,?,,?,,?,,?,,?,,?,,?,,?,,?,,?,,?,,?,,?,,?,,?,,?,,?,,?,,?,,?,,?,,?,,?,,?,,?,,?,,?,,?,,?,,?,,?,,?,,4,?,,?,,?,,?,,?,,?,,?,,?,,?,,?,,?,,?,,Unmet,,Unmet,,99,,,,,,2016-01-30 22:49:00 UTC,,,Met,
11,54,75,OpenSSL,"OpenSSL is an open source project that provides a robust, commercial-grade, and full-featured toolkit for the Transport Layer Security (TLS) and Secure Sockets Layer (SSL) protocols. It is also a general-purpose cryptography library.",https://www.openssl.org,https://git.openssl.org/,OpenSSL,?,,Met,,Met,,Met,https://www.openssl.org/community/,Met,https://www.openssl.org/community/,Met,https://www.openssl.org/policies/codingstyle.html,Met,https://github.com/openssl/openssl/blob/master/LICENSE,Met,"OpenSSL uses an unusual license that is known to be FLOSS.  [GNU's ""Various Licenses and Comments about Them""](https://www.gnu.org/licenses/license-list.html) lists this as a ""GPL-Incompatible Free Software License"".  It is listed by [Debian](https://www.debian.org/legal/licenses/) as a ""license found in main"", and [Fedora](https://fedoraproject.org/wiki/Licensing:Main?rd=Licensing) lists it as a ""good"" license.",Unmet,,Met,,Met,,Met,,Met,,Met,,Met,,Met,,Met,,Met,,Met,https://www.openssl.org/news/changelog.html,Met,,?,,Met,https://rt.openssl.org/,Met,https://www.openssl.org/community/#bugs,Met,,Met,,Met,https://rt.openssl.org/,Met,https://www.openssl.org/news/vulnerabilities.html,Met,https://www.openssl.org/news/vulnerabilities.html,Met,,Met,,Met,,Met,,Met,https://github.com/openssl/openssl/tree/master/test,Met,,Met,,Met,https://wiki.openssl.org/index.php/Unit_Testing,Met,Example commit of tests being added: https://git.openssl.org/?p=openssl.git;a=commitdiff;h=5dc312215fa54b70cc8b4baec933bcc19525bc03,Unmet,,Met,,Met,,Unmet,,Met,,Met,,Met,,Met,,Met,,Met,,Met,,Met,,Met,,Met,,Met,,Met,,Met,,Met,,Met,https://scan.coverity.com/projects/294,Met,,Met,,Met,,Met,https://wiki.openssl.org/index.php/Static_and_Dynamic_Analysis,Met,,Unmet,,Met,,"Note that this badge entry is for the current OpenSSL project.  There is a separate *different* entry for the historical information on [OpenSSL before Heartbleed](https://bestpractices.coreinfrastructure.org/projects/87).
",2016-01-25 20:18:15 UTC,2016-05-19 15:28:54 UTC,Met,,Met,TravisCI: https://mta.openssl.org/pipermail/openssl-dev/2015-October/003251.html,cpe:2.3:a:openssl:openssl:1.0.1:*:*:*:*:*:*:*,Met,OpenSSL uses rt and provides a guest login.,Met,,Met,,?,,?,,?,,?,,?,,?,,?,,?,,100,2016-02-12 22:09:00 UTC,,,False,,2,5,?,,?,,?,,?,,?,,?,,?,,?,,?,,?,,?,,?,,?,,?,,?,,?,,?,,?,,?,,?,,?,,?,,?,,?,,?,,?,,?,,?,,?,,?,,?,,?,,?,,?,,?,,?,,?,,?,,?,,?,,9,?,,?,,?,,?,,?,,?,,?,,?,,?,,?,,?,,?,,Met,,Unmet,,105,,,,,,2016-02-12 22:09:00 UTC,,,Met,
