7,3987,5421,jottings,A collection of jottings in Hindi & English languages.,https://mm1705.github.io/jottings,https://github.com/mm1705/jottings,,?,,Met,Given only https: URLs.,?,,?,,Met,"Projects on GitHub by default use issues and pull requests, as encouraged by documentation such as <https://guides.github.com/activities/contributing-to-open-source/>.",?,,Unmet,// No license location file found.,?,,?,,Unmet,// No appropriate folder found for documentation basics.,?,,Met,"Repository on GitHub, which provides public git repositories with URLs.",Met,"Repository on GitHub, which uses git. git can track the changes, who made them, and when they were made.",?,,Met,"Repository on GitHub, which uses git. git is distributed.",?,,?,,?,,Unmet,// No release notes file found.,?,,?,,?,,?,,?,,?,,?,,?,,?,,?,,?,,?,,?,,?,,?,,?,,?,,?,,?,,?,,?,,?,,?,,?,,?,,?,,?,,?,,?,,?,,?,,?,,?,,?,,?,,?,,?,,?,,?,,?,,?,,?,,?,,?,,,2020-05-30 13:18:24 UTC,2020-05-30 13:18:24 UTC,?,,?,,,Met,GitHub supports discussions on issues and pull requests.,?,,?,,?,,?,,?,,?,,?,,Unmet,"// X-Content-Type-Options was not set to ""nosniff"".",?,,?,,10,,,2022-05-12 23:00:42 UTC,False,Ruby,9,0,?,,?,,?,,?,,?,,?,,?,,?,,?,,?,,?,,?,,?,,?,,?,,?,,?,,?,,?,,?,,?,,?,,?,,?,,?,,?,,?,,?,,?,,?,,?,,?,,?,,?,,?,,?,,?,,?,,?,,?,,4,?,,?,,?,,?,,?,,?,,?,,?,,?,,?,,?,,?,,Unmet,,Unmet,,10,,,,,,,,,Met,
8,3988,5422,CProgramming,,https://github.com/HellAmbro/CProgramming,,,?,,Met,Given only https: URLs.,?,,?,,?,,?,,?,,?,,?,,?,,?,,?,,?,,?,,?,,?,,?,,?,,?,,?,,?,,?,,?,,?,,?,,?,,?,,?,,?,,?,,?,,?,,?,,?,,?,,?,,?,,?,,?,,?,,?,,?,,?,,?,,?,,?,,?,,?,,?,,?,,?,,?,,?,,?,,?,,?,,?,,?,,?,,?,,?,,?,,?,,,2020-05-30 19:42:05 UTC,2020-05-30 19:42:05 UTC,?,,?,,,?,,?,,?,,?,,?,,?,,?,,?,,?,,?,,?,,3,,,2022-05-12 23:00:43 UTC,False,,9,0,?,,?,,?,,?,,?,,?,,?,,?,,?,,?,,?,,?,,?,,?,,?,,?,,?,,?,,?,,?,,?,,?,,?,,?,,?,,?,,?,,?,,?,,?,,?,,?,,?,,?,,?,,?,,?,,?,,?,,?,,0,?,,?,,?,,?,,?,,?,,?,,?,,?,,?,,?,,?,,Unmet,,Unmet,,3,,,,,,,,,Met,
9,3989,4025,CCTag,Detection of CCTag markers made up of concentric circles.,https://alicevision.org,https://github.com/alicevision/CCTag,MPL-2.0,?,,Met,// Given an http: URL.,Met,https://alicevision.github.io,Met,https://github.com/alicevision/popsift/blob/develop/README.md,Met,Non-trivial contribution file in repository: <https://github.com/alicevision/CCTag/blob/develop/CONTRIBUTING.md>.,Met,https://github.com/alicevision/popsift/blob/develop/CONTRIBUTING.md,Met,Non-trivial license location file in repository: <https://github.com/alicevision/CCTag/blob/develop/COPYING.md>.,Met,The MPL-2.0 license is approved by the Open Source Initiative (OSI).,Met,The MPL-2.0 license is approved by the Open Source Initiative (OSI).,Met,Some documentation basics file contents found.,Met,https://cctag.readthedocs.io/en/develop/,Met,"Repository on GitHub, which provides public git repositories with URLs.",Met,"Repository on GitHub, which uses git. git can track the changes, who made them, and when they were made.",Met,"Master contains the releases, develop ongoing works. We follow the GitFlow paradigm as described in https://github.com/alicevision/CCTag/blob/develop/CONTRIBUTING.md",Met,"Repository on GitHub, which uses git. git is distributed.",Met,,Met,,Met,https://github.com/alicevision/popsift/releases,Met,https://github.com/alicevision/CCTag/releases,Met,there have been no publicly known vulnerabilities,?,,Met,https://github.com/alicevision/CCTag/issues,Met,https://github.com/alicevision/CCTag/issues or the mailing list alicevision@googlegroups.com http://groups.google.com/group/alicevision,Met,,Met,All major enhancements requests are merged using priorities labels on github,Met,https://github.com/alicevision/CCTag/issues or the mailing list alicevision@googlegroups.com http://groups.google.com/group/alicevision,Met,Vulnerabilities can be reported in the GitHub issues or via email the mailing list alicevision@googlegroups.com or privately to the dev team to alicevision-team@googlegroups.com as described in https://github.com/alicevision/popsift/blob/CCTag/README.md,Met,alicevision-team@googlegroups.com https://github.com/alicevision/CCTag/blob/develop/README.md,,,Met,Non-trivial build file in repository: <https://github.com/alicevision/CCTag/blob/develop/CMakeLists.txt>.,Met,Non-trivial build file in repository: <https://github.com/alicevision/CCTag/blob/develop/CMakeLists.txt>.,Met,,Met,,Met,,Met,,Met,defined in https://github.com/alicevision/CCTag/blob/develop/CONTRIBUTING.md,Met,Some tests cover the code and others will be added with new features,Met,defined in https://github.com/alicevision/CCTag/blob/develop/CONTRIBUTING.md,,,,,,,Met,The developers have experienced C/C++ and programmers.,Met,no cryptography is used,,,,,,,,,,,,,,,,,Met,,Met,,Met,,Met,,Met,cppcheck is used during the development (IDE plugins) codacy is also used https://app.codacy.com/manual/alicevision/CCTag/dashboard,Met,cppcheck,Met,cppcheck is used during the development (IDE plugins),Met,codacy is used to check the code at each push and pull request,Met,We use codacy and CodeFactor.,Met,,Met,,Met,All known vulnerabilities have been addressed,,2020-05-30 20:33:25 UTC,2020-10-02 13:09:49 UTC,,,Met,https://travis-ci.org/alicevision/CCTag,,Met,GitHub supports discussions on issues and pull requests.,Met,,Met,,?,,?,,?,,?,,?,,Unmet,"// X-Content-Type-Options was not set to ""nosniff"".",?,,?,,100,2020-10-02 13:09:49 UTC,,2020-08-25 23:01:32 UTC,False,"C++, Cuda, CMake, C, Shell, Perl, Dockerfile",9,11,?,,?,,?,,?,,?,,?,,?,,?,,?,,?,,?,,?,,?,,?,,?,,?,,?,,?,,?,,?,,?,,?,,?,,?,,?,,?,,?,,?,,?,,?,,?,,?,,?,,?,,?,,?,,?,,?,,?,,?,,13,?,,?,,?,,?,,?,,?,,?,,?,,?,,?,,?,,?,,Met,,Unmet,,111,,,,,,2020-10-02 13:09:49 UTC,,,Met,
10,3990,4583,PowerShellForGitHub,Microsoft PowerShell wrapper for GitHub API,https://github.com/microsoft/PowerShellForGitHub,https://github.com/microsoft/PowerShellForGitHub,OTHER,?,,Met,Given only https: URLs.,Met,,Met,,Met,https://github.com/microsoft/PowerShellForGitHub/blob/master/CONTRIBUTING.md,Met,https://github.com/microsoft/PowerShellForGitHub/blob/master/CONTRIBUTING.md,Met,https://github.com/microsoft/PowerShellForGitHub/blob/master/LICENSE,Met,https://github.com/microsoft/PowerShellForGitHub/blob/master/LICENSE,Met,"MIT license
https://github.com/microsoft/PowerShellForGitHub/blob/master/LICENSE",Met,https://github.com/microsoft/PowerShellForGitHub/blob/master/USAGE.md,Met,https://github.com/microsoft/PowerShellForGitHub/blob/master/USAGE.md,Met,"Repository on GitHub, which provides public git repositories with URLs.",Met,"Repository on GitHub, which uses git. git can track the changes, who made them, and when they were made.",Met,Not every commit results in a new release. A new release ultimately happens by compiling one or more recent commits since the previous release.,Met,"Repository on GitHub, which uses git. git is distributed.",Met,"We use SemVer

'https://github.com/microsoft/PowerShellForGitHub/blob/master/CONTRIBUTING.md#updating-the-version-number",Met,,Met,"Every release has a corresponding tag, as denoted in the CHANGELOG: https://github.com/microsoft/PowerShellForGitHub/blob/master/CHANGELOG.md",Met,Non-trivial release notes file in repository: <https://github.com/microsoft/PowerShellForGitHub/blob/master/CHANGELOG.md>.,Met,"There have been no vulnerabilities, but if there were, they'd be called out in https://github.com/microsoft/PowerShellForGitHub/blob/master/CHANGELOG.md",?,,Met,https://github.com/microsoft/PowerShellForGitHub/issues,Met,https://github.com/microsoft/PowerShellForGitHub/issues,Met,https://github.com/microsoft/PowerShellForGitHub/issues,Met,https://github.com/microsoft/PowerShellForGitHub/issues,Met,https://github.com/microsoft/PowerShellForGitHub/issues,Met,https://github.com/microsoft/PowerShellForGitHub#reporting-security-issues,Met,https://github.com/microsoft/PowerShellForGitHub/blob/master/SECURITY.md,Met,There have been no reported vulnerabilities.,,The entire project is PowerShell -- a runtime scripting language.  No compilation is needed.,,This is built on top of PowerShell is public OSS.,,This is built on top of PowerShell is public OSS.,Met,"The UT's are built on top of Pester (https://github.com/pester/pester).
Tests can be seen here: https://github.com/microsoft/PowerShellForGitHub/tree/master/Tests",Met,"The UT's are built on top of Pester (https://github.com/pester/pester).
Invoke-Pester",Met,"The UT's are built on top of Pester (https://github.com/pester/pester).
Invoke-Pester",Met,https://github.com/microsoft/PowerShellForGitHub/blob/master/CONTRIBUTING.md#testing,Met,"You can see more tests are added and updated all the time:
https://github.com/microsoft/PowerShellForGitHub/tree/master/Tests",Met,Covered in https://github.com/microsoft/PowerShellForGitHub/blob/master/CONTRIBUTING.md#overview,Met,This uses PSScriptAnalyzer (https://github.com/PowerShell/PSScriptAnalyzer),Met,We are PSScriptAnalyzer clean.  We recently got re-clean via this PR: https://github.com/microsoft/PowerShellForGitHub/pull/180 and the CI build is not verifying this doesn't regress.,Met,"All PSScriptAnalyzer issues must be addressed (either fixed, or added an exception with an explanation).",Met,"The primary developer, https://github.com/HowardWolosky, has been a Microsoft developer for 19 years, and has undergone a number of security trainings during those years of employment.",Met,"The primary developer, https://github.com/HowardWolosky, has been a Microsoft developer for 19 years, and has undergone a number of security trainings during those years of employment.",Met,"The only cryptography used is .NET's System.Security.Cryptography.SHA512CryptoServiceProvider for creating SHA's (used to remove PII in telemetry), and System.Security.SecureString for storing the user's access token value.",Met,"The only cryptography used is .NET's System.Security.Cryptography.SHA512CryptoServiceProvider for creating SHA's (used to remove PII in telemetry), and System.Security.SecureString for storing the user's access token value.",Met,"The only cryptography used is .NET's System.Security.Cryptography.SHA512CryptoServiceProvider for creating SHA's (used to remove PII in telemetry), and System.Security.SecureString for storing the user's access token value.",Met,"The only cryptography used is .NET's System.Security.Cryptography.SHA512CryptoServiceProvider for creating SHA's (used to remove PII in telemetry), and System.Security.SecureString for storing the user's access token value.",Met,"The only cryptography used is .NET's System.Security.Cryptography.SHA512CryptoServiceProvider for creating SHA's (used to remove PII in telemetry), and System.Security.SecureString for storing the user's access token value.",Met,"The only cryptography used is .NET's System.Security.Cryptography.SHA512CryptoServiceProvider for creating SHA's (used to remove PII in telemetry), and System.Security.SecureString for storing the user's access token value.",Met,",NET's System.Security.SecureString is used for storing the user's access token value.",Met,"The only cryptography used is .NET's System.Security.Cryptography.SHA512CryptoServiceProvider for creating SHA's (used to remove PII in telemetry), and System.Security.SecureString for storing the user's access token value.",Met,https is used for all GitHub and PowerShellGallery API access requests,Met,https is used for all GitHub and PowerShellGallery API access requests,Met,,Met,"There haven't been any, but they would be addressed rapidly if any were reported.",Met,PSScriptAnalyzer (https://github.com/PowerShell/PSScriptAnalyzer),Met,PSScriptAnalyzer (https://github.com/PowerShell/PSScriptAnalyzer),Met,We are 100% clean from PSScriptAnalyzer,Met,The CI build does this.,Unmet,There hasn't been a major release yet.,,PowerShell is memory-safe (built on top of .NET),Unmet,,Met,There haven't been any.,,2020-05-30 22:22:46 UTC,2020-05-30 22:55:40 UTC,Met,"The only cryptography used is .NET's System.Security.Cryptography.SHA512CryptoServiceProvider for creating SHA's (used to remove PII in telemetry), and System.Security.SecureString for storing the user's access token value.",Met,https://dev.azure.com/ms/PowerShellForGitHub/_build?definitionId=109&_a=summary,,Met,GitHub supports discussions on issues and pull requests.,Met,,Met,"https://github.com/microsoft/PowerShellForGitHub/blob/master/USAGE.md
https://github.com/microsoft/PowerShellForGitHub/issues",?,,?,,?,,?,,?,,Met,Found all required security hardening headers.,?,,?,,100,2020-05-30 22:55:40 UTC,,,False,PowerShell,6,15,?,,?,,?,,?,,?,,?,,?,,?,,?,,?,,?,,?,,?,,?,,?,,?,,?,,?,,?,,?,,?,,?,,?,,?,,?,,?,,?,,?,,?,,?,,?,,?,,?,,?,,?,,?,,?,,?,,?,,?,,13,?,,?,,?,,?,,?,,?,,?,,?,,?,,?,,?,,?,,Met,,Unmet,,115,,,,,,2020-05-30 22:55:40 UTC,,,Met,
11,3992,5428,pyclean,Pure Python cross-platform pyclean. Clean up your Python bytecode.,https://speakerdeck.com/bittner/pyclean,https://github.com/bittner/pyclean,GPL-3.0,?,,Met,Given only https: URLs.,?,,?,,Met,"Projects on GitHub by default use issues and pull requests, as encouraged by documentation such as <https://guides.github.com/activities/contributing-to-open-source/>.",?,,Met,Non-trivial license location file in repository: <https://github.com/bittner/pyclean/blob/master/LICENSE>.,Met,The GPL-3.0 license is approved by the Open Source Initiative (OSI).,Met,The GPL-3.0 license is approved by the Open Source Initiative (OSI).,Unmet,// No appropriate folder found for documentation basics.,?,,Met,"Repository on GitHub, which provides public git repositories with URLs.",Met,"Repository on GitHub, which uses git. git can track the changes, who made them, and when they were made.",?,,Met,"Repository on GitHub, which uses git. git is distributed.",?,,?,,?,,Unmet,// No release notes file found.,?,,?,,Met,https://github.com/bittner/pyclean/issues,Met,https://github.com/bittner/pyclean/issues,Met,I respond to created issues or comments in a timely manner in all my Open Source projects.,Met,I respond to created issues or comments in a timely manner in all my Open Source projects.,Met,https://github.com/bittner/pyclean/issues,?,,?,,?,,Met,"Building is not strictly necessary, but releases can be packaged and uploaded to PyPI, which happens automatically through a pipeline.",Met,Tox is suggested for easily _using_ the software.,Met,"Yes, Python stack.",Met,"GitHub Actions is configured, which runs the test suite via Tox.",Met,"Yes, Tox is a standard tool. Alternatively, tests can be run with pytest individually.",Met,"There is only the main branch (master), which is covered, and feature branches to be  merged into the main branch, which are also covered. This can easily be seen from the pull requests, e,g, https://github.com/bittner/pyclean/pulls?q=is%3Apr+is%3Aclosed
The test suite is comprehensive. https://github.com/bittner/pyclean/tree/master/tests",Met,"Yes, this is explained in https://github.com/bittner/pyclean/blob/master/CONTRIBUTING.md",Met,"All PRs and direct commits have the test suite linked to it, and a history of test suite execution is visible on GitHub in the project > ""Actions"" tab.",Met,Documented https://github.com/bittner/pyclean/blob/master/CONTRIBUTING.md,Met,"flake8 (code quality) and pylint (dynamic linter) run in the pipeline each time, in an automated fashion.",Met,Pipeline will fail on errors.,Met,Pipeline fails when one of the linters complain about anything.,?,,?,,,,,,,,,,,,,,,,,,?,,?,,?,,?,,Met,Both flake8 and pylint are integrated in the pipeline.,Met,"With tox we also run Bandit, the Python security scanner.",Met,Any issue is attempted to be fixed in a timely manner in this project.,Met,"Yes, the pipeline run automatically.",Met,Pylint is integrated in the pipeline.,,,?,,Met,Any issue is attempted to be fixed in a timely manner in this project.,,2020-06-03 12:19:31 UTC,2020-08-30 12:27:03 UTC,,,Met,"CI/CD, Continuous Delivery all the way through. This is my daily business.",,Met,GitHub supports discussions on issues and pull requests.,?,,?,,?,,?,,?,,?,,?,,Unmet,// One or more of the required security hardening headers is missing.,?,,?,,66,,,2022-05-16 23:00:24 UTC,False,Python,13,9,?,,?,,?,,?,,?,,?,,?,,?,,?,,?,,?,,?,,?,,?,,?,,?,,?,,?,,?,,?,,?,,?,,?,,?,,?,,?,,?,,?,,?,,?,,?,,?,,?,,?,,?,,?,,?,,?,,?,,?,,9,?,,?,,?,,?,,?,,?,,?,,?,,?,,?,,?,,?,,Unmet,,Unmet,,66,,,,,,,,,Met,
12,3994,4758,okta-developer-docs,okta-developer-docs,https://github.com/okta/okta-developer-docs,https://github.com/Qdigital/okta-developer-docs,,?,,Met,Given only https: URLs.,?,,?,,Met,"Projects on GitHub by default use issues and pull requests, as encouraged by documentation such as <https://guides.github.com/activities/contributing-to-open-source/>.",?,,Unmet,// No license location file found.,?,,?,,Unmet,// No appropriate folder found for documentation basics.,?,,Met,"Repository on GitHub, which provides public git repositories with URLs.",Met,"Repository on GitHub, which uses git. git can track the changes, who made them, and when they were made.",?,,Met,"Repository on GitHub, which uses git. git is distributed.",?,,?,,?,,Unmet,// No release notes file found.,?,,?,,?,,?,,?,,?,,?,,?,,?,,?,,?,,?,,?,,?,,?,,?,,?,,?,,?,,?,,?,,?,,?,,?,,?,,?,,?,,?,,?,,?,,?,,?,,?,,?,,?,,?,,?,,?,,?,,?,,?,,?,,?,,?,,,2020-06-04 10:54:59 UTC,2020-06-04 10:56:06 UTC,?,,?,,,Met,GitHub supports discussions on issues and pull requests.,?,,?,,?,,?,,?,,?,,?,,Met,Found all required security hardening headers.,?,,?,,10,,,2022-05-17 23:00:13 UTC,False,"JavaScript, Vue, Shell",10,0,?,,?,,?,,?,,?,,?,,?,,?,,?,,?,,?,,?,,?,,?,,?,,?,,?,,?,,?,,?,,?,,?,,?,,?,,?,,?,,?,,?,,?,,?,,?,,?,,?,,?,,?,,?,,?,,?,,?,,?,,4,?,,?,,?,,?,,?,,?,,?,,?,,?,,?,,?,,?,,Unmet,,Unmet,,10,,,,,,,,,Met,
13,3995,5551,libstring,Adds support for modern strings to ANSI C.,https://github.com/carmesim/libstring,https://github.com/carmesim/libstring,MIT,?,,Met,Given only https: URLs.,?,,?,,Met,"Projects on GitHub by default use issues and pull requests, as encouraged by documentation such as <https://guides.github.com/activities/contributing-to-open-source/>.",?,,Met,Non-trivial license location file in repository: <https://github.com/carmesim/libstring/blob/master/LICENSE>.,Met,The MIT license is approved by the Open Source Initiative (OSI).,Met,The MIT license is approved by the Open Source Initiative (OSI).,Unmet,// No appropriate folder found for documentation basics.,?,,Met,"Repository on GitHub, which provides public git repositories with URLs.",Met,"Repository on GitHub, which uses git. git can track the changes, who made them, and when they were made.",?,,Met,"Repository on GitHub, which uses git. git is distributed.",?,,?,,?,,Unmet,// No release notes file found.,?,,?,,?,,?,,?,,?,,?,,?,,?,,?,,?,,?,,?,,?,,?,,?,,?,,?,,?,,?,,?,,?,,?,,?,,?,,?,,?,,?,,?,,?,,?,,?,,?,,?,,?,,?,,?,,?,,?,,?,,?,,?,,?,,?,,,2020-06-05 18:43:00 UTC,2020-06-05 18:43:00 UTC,?,,?,,,Met,GitHub supports discussions on issues and pull requests.,?,,?,,?,,?,,?,,?,,?,,Met,Found all required security hardening headers.,?,,?,,15,,,2022-05-18 23:00:24 UTC,False,"C, QMake",9,0,?,,?,,?,,?,,?,,?,,?,,?,,?,,?,,?,,?,,?,,?,,?,,?,,?,,?,,?,,?,,?,,?,,?,,?,,?,,?,,?,,?,,?,,?,,?,,?,,?,,?,,?,,?,,?,,?,,?,,?,,4,?,,?,,?,,?,,?,,?,,?,,?,,?,,?,,?,,?,,Unmet,,Unmet,,15,,,,,,,,,Met,
14,3996,5555,amazon-ec2-instance-selector,A CLI tool and go library which recommends instance types based on resource criteria like vcpus and memory,https://github.com/aws/amazon-ec2-instance-selector,https://github.com/aws/amazon-ec2-instance-selector,OTHER,?,,Met,Given only https: URLs.,?,,?,,Met,Non-trivial contribution file in repository: <https://github.com/aws/amazon-ec2-instance-selector/blob/master/CONTRIBUTING.md>.,?,,Met,Non-trivial license location file in repository: <https://github.com/aws/amazon-ec2-instance-selector/blob/master/LICENSE>.,?,,Unmet,// Did not find license in the OSI list.,Unmet,// No appropriate folder found for documentation basics.,?,,Met,"Repository on GitHub, which provides public git repositories with URLs.",Met,"Repository on GitHub, which uses git. git can track the changes, who made them, and when they were made.",?,,Met,"Repository on GitHub, which uses git. git is distributed.",?,,?,,?,,Unmet,// No release notes file found.,?,,?,,?,,?,,?,,?,,?,,?,,?,,?,,Met,Non-trivial build file in repository: <https://github.com/aws/amazon-ec2-instance-selector/blob/master/Makefile>.,Met,Non-trivial build file in repository: <https://github.com/aws/amazon-ec2-instance-selector/blob/master/Makefile>.,?,,?,,?,,?,,?,,?,,?,,?,,?,,?,,?,,?,,?,,?,,?,,?,,?,,?,,?,,?,,?,,?,,?,,?,,?,,?,,?,,?,,?,,?,,?,,?,,,2020-06-07 18:37:21 UTC,2020-06-07 18:37:21 UTC,?,,?,,,Met,GitHub supports discussions on issues and pull requests.,?,,?,,?,,?,,?,,?,,?,,Met,Found all required security hardening headers.,?,,?,,16,,,2022-05-20 23:00:24 UTC,False,"Go, Shell, Makefile, Dockerfile, HCL",9,0,?,,?,,?,,?,,?,,?,,?,,?,,?,,?,,?,,?,,?,,?,,?,,?,,?,,?,,?,,?,,?,,?,,?,,?,,?,,?,,?,,?,,?,,?,,?,,?,,?,,?,,?,,?,,?,,?,,?,,?,,4,?,,?,,?,,?,,?,,?,,?,,?,,?,,?,,?,,?,,Unmet,,Unmet,,16,,,,,,,,,Met,
15,3997,5556,OOPS-Java,an object oriented project developed in java language.,https://github.com/tharun143/OOPS-Java,https://github.com/tharun143/OOPS-Java,EPL-2.0,?,,Met,Given only https: URLs.,?,,?,,Met,Non-trivial contribution file in repository: <https://github.com/tharun143/OOPS-Java/blob/master/CONTRIBUTING.md>.,?,,Met,Non-trivial license location file in repository: <https://github.com/tharun143/OOPS-Java/blob/master/LICENSE>.,?,,Unmet,// Did not find license in the OSI list.,Unmet,// No appropriate folder found for documentation basics.,?,,Met,"Repository on GitHub, which provides public git repositories with URLs.",Met,"Repository on GitHub, which uses git. git can track the changes, who made them, and when they were made.",?,,Met,"Repository on GitHub, which uses git. git is distributed.",?,,?,,?,,Unmet,// No release notes file found.,?,,?,,?,,?,,?,,?,,?,,?,,?,,?,,?,,?,,?,,?,,?,,?,,?,,?,,?,,?,,?,,?,,?,,?,,?,,?,,?,,?,,?,,?,,?,,?,,?,,?,,?,,?,,?,,?,,?,,?,,?,,?,,?,,?,,,2020-06-07 23:28:48 UTC,2020-06-07 23:28:48 UTC,?,,?,,,Met,GitHub supports discussions on issues and pull requests.,?,,?,,?,,?,,?,,?,,?,,Met,Found all required security hardening headers.,?,,?,,13,,,2022-05-21 23:00:14 UTC,False,Java,9,0,?,,?,,?,,?,,?,,?,,?,,?,,?,,?,,?,,?,,?,,?,,?,,?,,?,,?,,?,,?,,?,,?,,?,,?,,?,,?,,?,,?,,?,,?,,?,,?,,?,,?,,?,,?,,?,,?,,?,,?,,4,?,,?,,?,,?,,?,,?,,?,,?,,?,,?,,?,,?,,Unmet,,Unmet,,13,,,,,,,,,Met,
16,3998,5559,skyOS,"Web presence for Lonestar, a virtual airline that simulates operations for flight simulation enthusiasts.",https://github.com/lonestarvirtual/skyOS,https://github.com/lonestarvirtual/skyOS,MIT,?,,Met,Given only https: URLs.,?,,?,,Met,"Projects on GitHub by default use issues and pull requests, as encouraged by documentation such as <https://guides.github.com/activities/contributing-to-open-source/>.",?,,Met,Non-trivial license location file in repository: <https://github.com/lonestarvirtual/skyOS/blob/master/LICENSE>.,Met,The MIT license is approved by the Open Source Initiative (OSI).,Met,The MIT license is approved by the Open Source Initiative (OSI).,Unmet,// No appropriate folder found for documentation basics.,?,,Met,"Repository on GitHub, which provides public git repositories with URLs.",Met,"Repository on GitHub, which uses git. git can track the changes, who made them, and when they were made.",Met,"Pull Requests MUST go through a review by a project maintainer. In addition, master serves as staging, continuously deploying to https://skyos-staging.herokuapp.com. A release must be tagged from master to be considered a formal release. ",Met,"Repository on GitHub, which uses git. git is distributed.",?,,?,,?,,Unmet,// No release notes file found.,?,,?,,Met,https://github.com/lonestarvirtual/skyOS/issues,Met,https://github.com/lonestarvirtual/skyOS/issues,?,,?,,?,,?,,?,,?,,Met,Non-trivial build file in repository: <https://github.com/lonestarvirtual/skyOS/blob/master/Rakefile>.,Met,Non-trivial build file in repository: <https://github.com/lonestarvirtual/skyOS/blob/master/Rakefile>.,Met,The build system uses Rake + docker compose.,?,,?,,?,,?,,?,,?,,?,,?,,?,,?,,?,,?,,?,,?,,?,,?,,?,,?,,?,,?,,?,,?,,?,,Met,Brakeman,?,,?,,Met,"Brakeman is run on every PR + master branch commit with Github Actions.
https://github.com/lonestarvirtual/skyOS/blob/master/.github/workflows/verify.yml",?,,,This project is written in Ruby.,?,,?,,,2020-06-08 19:13:51 UTC,2020-06-08 19:24:06 UTC,?,,?,,,Met,GitHub supports discussions on issues and pull requests.,?,,?,,?,,?,,?,,?,,?,,Met,Found all required security hardening headers.,?,,?,,28,,,2022-05-21 23:00:15 UTC,False,"Ruby, JavaScript, Dockerfile, Shell",12,4,?,,?,,?,,?,,?,,?,,?,,?,,?,,?,,?,,?,,?,,?,,?,,?,,?,,?,,?,,?,,?,,?,,?,,?,,?,,?,,?,,?,,?,,?,,?,,?,,?,,?,,?,,?,,?,,?,,?,,?,,4,?,,?,,?,,?,,?,,?,,?,,?,,?,,?,,?,,?,,Unmet,,Unmet,,28,,,,,,,,,Met,
