10,3239,4364,aiocometd,CometD client for asyncio,https://github.com/robertmrk/aiocometd,https://github.com/robertmrk/aiocometd,MIT,?,,Met,Given only https: URLs.,?,,?,,Met,"Projects on GitHub by default use issues and pull requests, as encouraged by documentation such as <https://guides.github.com/activities/contributing-to-open-source/>.",?,,Met,Non-trivial license location file in repository: <https://github.com/robertmrk/aiocometd/blob/develop/LICENSE.txt>.,Met,The MIT license is approved by the Open Source Initiative (OSI).,Met,The MIT license is approved by the Open Source Initiative (OSI).,Met,Some documentation basics file contents found.,?,,Met,"Repository on GitHub, which provides public git repositories with URLs.",Met,"Repository on GitHub, which uses git. git can track the changes, who made them, and when they were made.",?,,Met,"Repository on GitHub, which uses git. git is distributed.",?,,?,,?,,Unmet,// No release notes file found.,?,,?,,?,,?,,?,,?,,?,,?,,?,,?,,?,,?,,?,,?,,?,,?,,?,,?,,?,,?,,?,,?,,?,,?,,?,,?,,?,,?,,?,,?,,?,,?,,?,,?,,?,,?,,?,,?,,?,,?,,?,,?,,?,,?,,,2019-10-02 12:39:55 UTC,2019-10-02 12:39:55 UTC,?,,?,,,Met,GitHub supports discussions on issues and pull requests.,?,,?,,?,,?,,?,,?,,?,,Met,Found all required security hardening headers.,?,,?,,16,,,2022-05-09 23:00:36 UTC,False,Python,12,0,?,,?,,?,,?,,?,,?,,?,,?,,?,,?,,?,,?,,?,,?,,?,,?,,?,,?,,?,,?,,?,,?,,?,,?,,?,,?,,?,,?,,?,,?,,?,,?,,?,,?,,?,,?,,?,,?,,?,,?,,4,?,,?,,?,,?,,?,,?,,?,,?,,?,,?,,?,,?,,Unmet,,Unmet,,16,,,,,,,,,Met,
11,3240,4366,udho,Tiny C++ HTTP library based on boost beast,https://gitlab.com/neel.basu/udho,https://github.com/neel/udho,BSD-2-Clause,?,,Met,Given only https: URLs.,?,,?,,Met,"Projects on GitHub by default use issues and pull requests, as encouraged by documentation such as <https://guides.github.com/activities/contributing-to-open-source/>.",?,,Met,Non-trivial license location file in repository: <https://github.com/neel/udho/blob/master/LICENSE>.,Met,The BSD-2-Clause license is approved by the Open Source Initiative (OSI).,Met,The BSD-2-Clause license is approved by the Open Source Initiative (OSI).,Unmet,// No appropriate folder found for documentation basics.,?,,Met,"Repository on GitHub, which provides public git repositories with URLs.",Met,"Repository on GitHub, which uses git. git can track the changes, who made them, and when they were made.",?,,Met,"Repository on GitHub, which uses git. git is distributed.",?,,?,,?,,Unmet,// No release notes file found.,?,,?,,?,,?,,?,,?,,?,,?,,?,,?,,Met,Non-trivial build file in repository: <https://github.com/neel/udho/blob/master/CMakeLists.txt>.,Met,Non-trivial build file in repository: <https://github.com/neel/udho/blob/master/CMakeLists.txt>.,?,,?,,?,,?,,?,,?,,?,,?,,?,,?,,?,,?,,?,,?,,?,,?,,?,,?,,?,,?,,?,,?,,?,,?,,?,,?,,?,,?,,?,,?,,?,,?,,,2019-10-02 16:37:17 UTC,2019-10-02 16:37:17 UTC,?,,?,,,Met,GitHub supports discussions on issues and pull requests.,?,,?,,?,,?,,?,,?,,?,,Met,Found all required security hardening headers.,?,,?,,18,,,2022-05-09 23:00:37 UTC,False,"C++, CMake",12,0,?,,?,,?,,?,,?,,?,,?,,?,,?,,?,,?,,?,,?,,?,,?,,?,,?,,?,,?,,?,,?,,?,,?,,?,,?,,?,,?,,?,,?,,?,,?,,?,,?,,?,,?,,?,,?,,?,,?,,?,,4,?,,?,,?,,?,,?,,?,,?,,?,,?,,?,,?,,?,,Unmet,,Unmet,,18,,,,,,,,,Met,
12,3241,4367,arlo-techsolution,,https://www.arlo-techsolution.com,https://www.arlo-techsolution.com,,?,,Met,Given only https: URLs.,?,,?,,?,,?,,?,,?,,?,,?,,?,,?,,?,,?,,?,,?,,?,,?,,?,,?,,?,,?,,?,,?,,?,,?,,?,,?,,?,,?,,?,,?,,?,,?,,?,,?,,?,,?,,?,,?,,?,,?,,?,,?,,?,,?,,?,,?,,?,,?,,?,,?,,?,,?,,?,,?,,?,,?,,?,,?,,?,,?,,?,,,2019-10-03 04:01:15 UTC,2019-10-03 05:03:17 UTC,?,,?,,,?,,?,,?,,?,,?,,?,,?,,?,,Unmet,"// X-Content-Type-Options was not set to ""nosniff"".",?,,?,,3,,,2022-05-10 23:00:47 UTC,False,,13,0,?,,?,,?,,?,,?,,?,,?,,?,,?,,?,,?,,?,,?,,?,,?,,?,,?,,?,,?,,?,,?,,?,,?,,?,,?,,?,,?,,?,,?,,?,,?,,?,,?,,?,,?,,?,,?,,?,,?,,?,,0,?,,?,,?,,?,,?,,?,,?,,?,,?,,?,,?,,?,,Unmet,,Unmet,,3,,,,,,,,,Met,
13,3242,4373,kratos,Kratos is a debuggable hardware generator framework.,https://github.com/Kuree/kratos,https://github.com/Kuree/kratos,BSD-2-Clause,?,,Met,Given only https: URLs.,Met,https://github.com/Kuree/kratos/blob/master/README.rst,Met,,Met,"Projects on GitHub by default use issues and pull requests, as encouraged by documentation such as <https://guides.github.com/activities/contributing-to-open-source/>.",?,,Met,https://github.com/Kuree/kratos/blob/master/LICENSE,Met,The code is hosted at https://github.com/Kuree/kratos The BSD-2-Clause license is approved by the Open Source Initiative (OSI).,Met,The BSD-2-Clause license is approved by the Open Source Initiative (OSI).,Met,Some documentation basics file contents found.,Met,https://kratos-doc.readthedocs.io/,Met,"Repository on GitHub, which provides public git repositories with URLs.",Met,"Repository on GitHub, which uses git. git can track the changes, who made them, and when they were made.",?,,Met,"Repository on GitHub, which uses git. git is distributed.",Met,,Met,,Met,https://github.com/Kuree/kratos/releases,Met,Non-trivial release notes file in repository: <https://github.com/Kuree/kratos/blob/master/CHANGELOG.md>.,,No publicly known vulnerabilities.,?,,Met,,Met,https://github.com/Kuree/kratos/issues,Met,,Met,,Met,https://github.com/Kuree/kratos/issues,?,,,,,,Met,Non-trivial build file in repository: <https://github.com/Kuree/kratos/blob/master/CMakeLists.txt>.,Met,Non-trivial build file in repository: <https://github.com/Kuree/kratos/blob/master/CMakeLists.txt>.,Met,,Met,,Met,,Met,,?,,Met,,?,,Met,,Met,,Met,,Met,,Met,,,,Met,,,,,,,,,,,,,,Met,,Met,,Met,,Met,,Met,clang-tidy,,,,,Met,,?,,Met,,?,,Met,,,2019-10-04 07:10:49 UTC,2020-11-26 23:03:07 UTC,,,Met,,,Met,GitHub supports discussions on issues and pull requests.,Met,,Met,,?,,?,,?,,?,,?,,Met,Found all required security hardening headers.,?,,?,,90,,,2022-05-12 23:00:39 UTC,False,"C++, Python, SystemVerilog, CMake, Shell",24,2,?,,?,,?,,?,,?,,?,,?,,?,,?,,?,,?,,?,,?,,?,,?,,?,,?,,?,,?,,?,,?,,?,,?,,?,,?,,?,,?,,?,,?,,?,,?,,?,,?,,?,,?,,?,,?,,?,,?,,?,,4,?,,?,,?,,?,,?,,?,,?,,?,,?,,?,,?,,?,,Unmet,,Unmet,,90,,,,,,,,,Met,
14,3243,4375,soDLA,"Chisel implementation of the NVIDIA Deep Learning Accelerator (NVDLA), with self-driving accelerated",http://nvdla.org,https://github.com/redpanda3/soDLA,OTHER,?,,Unmet,// Given an http: URL.,?,,?,,Met,"Projects on GitHub by default use issues and pull requests, as encouraged by documentation such as <https://guides.github.com/activities/contributing-to-open-source/>.",?,,Unmet,// No license location file found.,?,,Unmet,// Did not find license in the OSI list.,Unmet,// No appropriate folder found for documentation basics.,?,,Met,"Repository on GitHub, which provides public git repositories with URLs.",Met,"Repository on GitHub, which uses git. git can track the changes, who made them, and when they were made.",?,,Met,"Repository on GitHub, which uses git. git is distributed.",?,,?,,?,,Unmet,// No release notes file found.,?,,?,,?,,?,,?,,?,,?,,?,,?,,?,,Met,Non-trivial build file in repository: <https://github.com/redpanda3/soDLA/blob/master/build.sbt>.,Met,Non-trivial build file in repository: <https://github.com/redpanda3/soDLA/blob/master/build.sbt>.,?,,?,,?,,?,,?,,?,,?,,?,,?,,?,,?,,?,,?,,?,,?,,?,,?,,?,,?,,?,,?,,?,,?,,?,,?,,?,,?,,?,,?,,?,,?,,?,,,2019-10-04 15:00:10 UTC,2019-10-04 15:02:57 UTC,?,,?,,,Met,GitHub supports discussions on issues and pull requests.,?,,?,,?,,?,,?,,?,,?,,Unmet,"// X-Content-Type-Options was not set to ""nosniff"".",?,,?,,13,,,2022-05-12 23:00:40 UTC,False,"Scala, Makefile, Verilog, Jupyter Notebook, XSLT, Shell",13,0,?,,?,,?,,?,,?,,?,,?,,?,,?,,?,,?,,?,,?,,?,,?,,?,,?,,?,,?,,?,,?,,?,,?,,?,,?,,?,,?,,?,,?,,?,,?,,?,,?,,?,,?,,?,,?,,?,,?,,?,,4,?,,?,,?,,?,,?,,?,,?,,?,,?,,?,,?,,?,,Unmet,,Unmet,,13,,,,,,,,,Met,
15,3244,4379,measurement-kit,Network measurement engine,https://measurement-kit.github.io,https://github.com/measurement-kit/measurement-kit,BSD-2-Clause,?,,Met,Given only https: URLs.,Met,https://measurement-kit.github.io/,Met,https://measurement-kit.github.io/,Met,Non-trivial contribution file in repository: <https://github.com/measurement-kit/measurement-kit/blob/master/CONTRIBUTING.md>.,Met,There is a section in CONTRIBUTING.md where we explain coding standards: https://github.com/measurement-kit/measurement-kit/blob/master/CONTRIBUTING.md#3-coding-style,Met,Non-trivial license location file in repository: <https://github.com/measurement-kit/measurement-kit/blob/master/LICENSE>.,Met,https://github.com/measurement-kit/measurement-kit/blob/master/LICENSE The BSD-2-Clause license is approved by the Open Source Initiative (OSI).,Met,BSD 2 clause is OSI approved The BSD-2-Clause license is approved by the Open Source Initiative (OSI).,Met,Some documentation basics file contents found.,Met,https://github.com/measurement-kit/measurement-kit#api-and-examples,Met,"Repository on GitHub, which provides public git repositories with URLs.",Met,"Repository on GitHub, which uses git. git can track the changes, who made them, and when they were made.",Met,,Met,"Repository on GitHub, which uses git. git is distributed.",Met,,Met,,Met,,Met,Non-trivial release notes file in repository: <https://github.com/measurement-kit/measurement-kit/blob/master/ChangeLog.md>.,,No publicly known vulnerabilities so far :crossed_fingers:,?,,Met,https://github.com/measurement-kit/measurement-kit/issues,Met,https://github.com/measurement-kit/measurement-kit/issues,Met,,Met,,Met,https://github.com/measurement-kit/measurement-kit/issues,Met,There is a paragraph explaining what to do at https://measurement-kit.github.io/,Met,There is a paragraph explaining how to reach out to use using PGP: https://measurement-kit.github.io/,,,?,,?,,?,,?,,?,,?,,?,,?,,?,,?,,?,,?,,?,,?,,?,,?,,?,,?,,?,,?,,?,,?,,?,,?,,?,,?,,?,,?,,?,,?,,?,,?,,?,,?,,,2019-10-06 06:36:12 UTC,2019-10-06 07:01:32 UTC,?,,?,,,Met,GitHub supports discussions on issues and pull requests.,?,,Met,,?,,?,,?,,?,,?,,Unmet,"// X-Content-Type-Options was not set to ""nosniff"".",?,,?,,45,,,2022-05-14 23:00:18 UTC,False,C++,15,4,?,,?,,?,,?,,?,,?,,?,,?,,?,,?,,?,,?,,?,,?,,?,,?,,?,,?,,?,,?,,?,,?,,?,,?,,?,,?,,?,,?,,?,,?,,?,,?,,?,,?,,?,,?,,?,,?,,?,,?,,4,?,,?,,?,,?,,?,,?,,?,,?,,?,,?,,?,,?,,Unmet,,Unmet,,45,,,,,,,,,Met,
16,3245,4380,server,Server for SYN system,https://github.com/syn-inc/server,https://github.com/syn-inc/server,MIT,?,,Met,Given only https: URLs.,?,,?,,Met,"Projects on GitHub by default use issues and pull requests, as encouraged by documentation such as <https://guides.github.com/activities/contributing-to-open-source/>.",?,,Met,Non-trivial license location file in repository: <https://github.com/syn-inc/server/blob/master/LICENSE>.,Met,The MIT license is approved by the Open Source Initiative (OSI).,Met,The MIT license is approved by the Open Source Initiative (OSI).,Unmet,// No appropriate folder found for documentation basics.,?,,Met,"Repository on GitHub, which provides public git repositories with URLs.",Met,"Repository on GitHub, which uses git. git can track the changes, who made them, and when they were made.",?,,Met,"Repository on GitHub, which uses git. git is distributed.",?,,?,,?,,Unmet,// No release notes file found.,?,,?,,?,,?,,?,,?,,?,,?,,?,,?,,?,,?,,?,,?,,?,,?,,?,,?,,?,,?,,?,,?,,?,,?,,?,,?,,?,,?,,?,,?,,?,,?,,?,,?,,?,,?,,?,,?,,?,,?,,?,,?,,?,,?,,,2019-10-06 08:00:41 UTC,2019-10-06 08:01:36 UTC,?,,?,,,Met,GitHub supports discussions on issues and pull requests.,?,,?,,?,,?,,?,,?,,?,,Met,Found all required security hardening headers.,?,,?,,15,,,2022-05-14 23:00:18 UTC,False,"Go, Dockerfile",13,0,?,,?,,?,,?,,?,,?,,?,,?,,?,,?,,?,,?,,?,,?,,?,,?,,?,,?,,?,,?,,?,,?,,?,,?,,?,,?,,?,,?,,?,,?,,?,,?,,?,,?,,?,,?,,?,,?,,?,,?,,4,?,,?,,?,,?,,?,,?,,?,,?,,?,,?,,?,,?,,Unmet,,Unmet,,15,,,,,,,,,Met,
17,3246,4381,lightning-monkey,Lightning monkey is the key solution for automatic deploying & managing Kubernetes clusters.,https://github.com/g0194776/lightning-monkey,https://github.com/g0194776/lightning-monkey,MIT,?,,Met,Given only https: URLs.,?,,?,,Met,"Projects on GitHub by default use issues and pull requests, as encouraged by documentation such as <https://guides.github.com/activities/contributing-to-open-source/>.",?,,Met,Non-trivial license location file in repository: <https://github.com/g0194776/lightning-monkey/blob/master/LICENSE>.,Met,The MIT license is approved by the Open Source Initiative (OSI).,Met,The MIT license is approved by the Open Source Initiative (OSI).,Unmet,// No appropriate folder found for documentation basics.,?,,Met,"Repository on GitHub, which provides public git repositories with URLs.",Met,"Repository on GitHub, which uses git. git can track the changes, who made them, and when they were made.",?,,Met,"Repository on GitHub, which uses git. git is distributed.",?,,?,,?,,Unmet,// No release notes file found.,?,,?,,?,,?,,?,,?,,?,,?,,?,,?,,Met,Non-trivial build file in repository: <https://github.com/g0194776/lightning-monkey/blob/master/makefile>.,Met,Non-trivial build file in repository: <https://github.com/g0194776/lightning-monkey/blob/master/makefile>.,?,,?,,?,,?,,?,,?,,?,,?,,?,,?,,?,,?,,?,,?,,?,,?,,?,,?,,?,,?,,?,,?,,?,,?,,?,,?,,?,,?,,?,,?,,?,,?,,,2019-10-06 15:55:49 UTC,2019-10-06 15:55:49 UTC,?,,?,,,Met,GitHub supports discussions on issues and pull requests.,?,,?,,?,,?,,?,,?,,?,,Met,Found all required security hardening headers.,?,,?,,18,,,2022-05-14 23:00:19 UTC,False,"Go, Shell, Makefile",12,0,?,,?,,?,,?,,?,,?,,?,,?,,?,,?,,?,,?,,?,,?,,?,,?,,?,,?,,?,,?,,?,,?,,?,,?,,?,,?,,?,,?,,?,,?,,?,,?,,?,,?,,?,,?,,?,,?,,?,,?,,4,?,,?,,?,,?,,?,,?,,?,,?,,?,,?,,?,,?,,Unmet,,Unmet,,18,,,,,,,,,Met,
18,3248,4383,Group-Office,Group Office groupware and CRM,https://www.group-office.com,https://github.com/Intermesh/groupoffice,AGPL-3.0-or-later,?,,Met,Given only https: URLs.,Met,,Met,,Met,"Projects on GitHub by default use issues and pull requests, as encouraged by documentation such as <https://guides.github.com/activities/contributing-to-open-source/>.",Met,https://groupoffice.readthedocs.io/en/latest/developer/building-a-server-module.html#code-standards,Met,Non-trivial license location file in repository: <https://github.com/Intermesh/groupoffice/blob/master/LICENSE>.,Met,The AGPL-3.0-or-later license is approved by the Open Source Initiative (OSI).,Met,// Did not find license in the OSI list. The AGPL-3.0-or-later license is approved by the Open Source Initiative (OSI).,Met,https://groupoffice.readthedocs.io,Met,https://groupoffice.readthedocs.io,Met,"Repository on GitHub, which provides public git repositories with URLs.",Met,"Repository on GitHub, which uses git. git can track the changes, who made them, and when they were made.",Met,,Met,"Repository on GitHub, which uses git. git is distributed.",Met,https://sourceforge.net/projects/group-office/files/,Met,,Met,https://github.com/Intermesh/groupoffice/releases,Met,Non-trivial release notes file in repository: <https://github.com/Intermesh/groupoffice/blob/master/CHANGELOG.md>.,Met,,?,,Met,https://github.com/Intermesh/groupoffice/issues,Met,https://github.com/Intermesh/groupoffice/issues,Met,https://github.com/Intermesh/groupoffice/issues,Met,,Met,"https://github.com/Intermesh/groupoffice/issues
https://www.group-office.com/forum",Met,https://www.cvedetails.com/product/11202/Group-office-Group-office-Groupware.html?vendor_id=6647,,,Met,,Met,,Met,,Met,,Met,PHP Unit: https://github.com/Intermesh/groupoffice/tree/master/tests,Met,PHPunit,Met,,Met,,Met,,Met,,Met,php -l,Met,,Met,,Met,,Met,,Met,,Met,,Met,,Met,,Met,,Met,,Met,,Met,,Met,https is used,Met,,Met,https://www.cvedetails.com/product/11202/Group-office-Group-office-Groupware.html?vendor_id=6647,Met,https://www.cvedetails.com/product/11202/Group-office-Group-office-Groupware.html?vendor_id=6647,Met,"php lint, php unit",Met,,Met,,Met,,Met,php lint,Met,,Met,,Met,,,2019-10-07 11:33:35 UTC,2019-10-07 12:16:28 UTC,Met,,Met,,,Met,GitHub supports discussions on issues and pull requests.,Met,,Met,https://groupoffice.readthedocs.io,?,,?,,?,,?,,?,,Unmet,"// X-Content-Type-Options was not set to ""nosniff"".",?,,?,,100,2019-10-07 11:54:32 UTC,,,False,"PHP, JavaScript",12,5,?,,?,,?,,?,,?,,?,,?,,?,,?,,?,,?,,?,,?,,?,,?,,?,,?,,?,,?,,?,,?,,?,,?,,?,,?,,?,,?,,?,,?,,?,,?,,?,,?,,?,,?,,?,,?,,?,,?,,?,,9,?,,?,,?,,?,,?,,?,,?,,?,,?,,?,,?,,?,,Met,,Unmet,,105,,,,,,2019-10-07 11:54:32 UTC,,,Met,
19,3249,4384,dbc-scripts,DeepBrain Chain Community Scripts,https://github.com/dbc-community/dbc-scripts,https://github.com/dbc-community/dbc-scripts,MIT,?,,Met,Given only https: URLs.,?,,?,,Met,Non-trivial contribution file in repository: <https://github.com/dbc-community/dbc-scripts/blob/master/CONTRIBUTING.md>.,?,,Met,Non-trivial license location file in repository: <https://github.com/dbc-community/dbc-scripts/blob/master/LICENSE>.,Met,The MIT license is approved by the Open Source Initiative (OSI).,Met,The MIT license is approved by the Open Source Initiative (OSI).,Unmet,// No appropriate folder found for documentation basics.,?,,Met,"Repository on GitHub, which provides public git repositories with URLs.",Met,"Repository on GitHub, which uses git. git can track the changes, who made them, and when they were made.",?,,Met,"Repository on GitHub, which uses git. git is distributed.",?,,?,,?,,Unmet,// No release notes file found.,?,,?,,?,,?,,?,,?,,?,,?,,?,,?,,?,,?,,?,,?,,?,,?,,?,,?,,?,,?,,?,,?,,?,,?,,?,,?,,?,,?,,?,,?,,?,,?,,?,,?,,?,,?,,?,,?,,?,,?,,?,,?,,?,,?,,,2019-10-08 05:39:41 UTC,2019-10-08 05:41:28 UTC,?,,?,,,Met,GitHub supports discussions on issues and pull requests.,?,,?,,?,,?,,?,,?,,?,,Met,Found all required security hardening headers.,?,,?,,15,,,2022-05-16 23:00:28 UTC,False,"Shell, Dockerfile",13,0,?,,?,,?,,?,,?,,?,,?,,?,,?,,?,,?,,?,,?,,?,,?,,?,,?,,?,,?,,?,,?,,?,,?,,?,,?,,?,,?,,?,,?,,?,,?,,?,,?,,?,,?,,?,,?,,?,,?,,?,,4,?,,?,,?,,?,,?,,?,,?,,?,,?,,?,,?,,?,,Unmet,,Unmet,,15,,,,,,,,,Met,
20,3250,4385,essaycorp,,https://essaycorp.com,https://essaycorp.com,,?,,Met,Given only https: URLs.,?,,?,,?,,?,,?,,?,,?,,?,,?,,?,,?,,?,,?,,?,,?,,?,,?,,?,,?,,?,,?,,?,,?,,?,,?,,?,,?,,?,,?,,?,,?,,?,,?,,?,,?,,?,,?,,?,,?,,?,,?,,?,,?,,?,,?,,?,,?,,?,,?,,?,,?,,?,,?,,?,,?,,?,,?,,?,,?,,?,,?,,,2019-10-08 09:02:22 UTC,2019-10-08 09:02:22 UTC,?,,?,,,?,,?,,?,,?,,?,,?,,?,,?,,Unmet,"// X-Content-Type-Options was not set to ""nosniff"".",?,,?,,3,,,2022-05-16 23:00:28 UTC,False,,12,0,?,,?,,?,,?,,?,,?,,?,,?,,?,,?,,?,,?,,?,,?,,?,,?,,?,,?,,?,,?,,?,,?,,?,,?,,?,,?,,?,,?,,?,,?,,?,,?,,?,,?,,?,,?,,?,,?,,?,,?,,0,?,,?,,?,,?,,?,,?,,?,,?,,?,,?,,?,,?,,Unmet,,Unmet,,3,,,,,,,,,Met,
21,3251,2734,Transform-Digital.git,"Transform digital bot device that was created to aim at integrating a completely storing and secure system to other systems, both systems in the internal environment, cloud, data centers or on external systems on third parties or other open sources.",https://github.com/transdigiware/Transform-Digital.git,https://transform.cloudns.cx,GPL-3.0-or-later,?,,Met,https://transform.cloudns.cx/,Met,https://transform.cloudns.cx,Met,https://transform.cloudns.cx,Met,https://transform.cloudns.cx,Met,https://transform.cloudns.cx/,Met,https://github.com/transdigiware/Transform-Digital/blob/master/LICENSE,Met,The GPL-3.0-or-later license is approved by the Open Source Initiative (OSI).,Met,The GPL-3.0-or-later license is approved by the Open Source Initiative (OSI).,Met,https://transform.cloudns.cx/,Met,https://transform.cloudns.cx/,Met,https://github.com/apps/transdigiware,Met,https://github.com/apps/transdigiware,Met,https://github.com/apps/transdigiware,Met,https://github.com/apps/transdigiware,Met,https://github.com/apps/transdigiware,Met,,Met,https://github.com/apps/transdigiware,Met,https://transform.cloudns.cx,Met,https://transform.cloudns.cx,?,,Met,https://transform.cloudns.cx,Met,"Dengan mengirimkan data ini tentang proyek, Anda setuju untuk merilisnya di bawah setidaknya lisensi Creative Commons Attribution versi 3.0 atau yang lebih baru (CC-BY-3.0 +) . Ini berarti bahwa semua bebas untuk berbagi dan mengadaptasi data, tetapi mereka harus memberikan kredit yang sesuai. Anda memegang hak cipta (jika ada), dan lisensi proyek tidak terpengaruh.",Met,transform.cloudns.cx,Met,,Met,https://transform.cloudns.cx/,Met,https://transform.cloudns.cx/,Met,https://transform.cloudns.cx/,Met,https://transform.cloudns.cx/,Met,https://transform.cloudns.cx/,Met,https://transform.cloudns.cx/,Met,https://transform.cloudns.cx/,Met,https://transform.cloudns.cx/,Met,https://transform.cloudns.cx/,Met,https://transform.cloudns.cx/,Met,https://transform.cloudns.cx/,Met,https://transform.cloudns.cx/,Met,https://transform.cloudns.cx/,Met,https://transform.cloudns.cx/,Met,https://transform.cloudns.cx/,Met,https://transform.cloudns.cx/,Met,https://github.com/apps/transdigiware,Met,https://github.com/apps/transdigiware,Met,https://github.com/apps/transdigiware,Met,https://github.com/apps/transdigiware,Met,https://github.com/apps/transdigiware,Met,https://github.com/apps/transdigiware,Met,https://github.com/apps/transdigiware,Met,https://github.com/apps/transdigiware,Met,https://github.com/apps/transdigiware,Met,https://github.com/apps/transdigiware,Met,https://github.com/apps/transdigiware,Met,https://github.com/apps/transdigiware,Met,https://github.com/apps/transdigiware,Met,https://github.com/apps/transdigiware,Met,https://transform.cloudns.cx/,Met,https://transform.cloudns.cx/,Met,https://transform.cloudns.cx/,Met,https://transform.cloudns.cx/,Met,https://transform.cloudns.cx/,Met,https://transform.cloudns.cx/,Met,https://transform.cloudns.cx/,Met,https://transform.cloudns.cx/,"Dengan mengirimkan data ini tentang proyek, Anda setuju untuk merilisnya di bawah setidaknya lisensi Creative Commons Attribution versi 3.0 atau yang lebih baru (CC-BY-3.0 +) . Ini berarti bahwa semua bebas untuk berbagi dan mengadaptasi data, tetapi mereka harus memberikan kredit yang sesuai. Anda memegang hak cipta (jika ada), dan lisensi proyek tidak terpengaruh.",2019-10-08 11:35:27 UTC,2019-10-08 13:07:27 UTC,Met,https://github.com/apps/transdigiware,Met,https://transform.cloudns.cx/,,Met,https://transform.cloudns.cx/,Met,https://github.com/apps/transdigiware,Met,https://transform.cloudns.cx/,?,,?,,?,,?,,?,,Unmet,"// X-Content-Type-Options was not set to ""nosniff"".",?,,?,,99,2019-10-08 12:51:04 UTC,2019-10-08 12:56:02 UTC,,True,PowerShell,16,13,?,,?,,?,,?,,?,,?,,?,,?,,?,,?,,?,,?,,?,,?,,?,,?,,?,,?,,?,,?,,?,,?,,?,,?,,?,,?,,?,,?,,?,,?,,?,,?,,?,,?,,?,,?,,?,,?,,?,,?,,22,?,,?,,?,,?,,?,,?,,?,,?,,?,,?,,?,,?,,Unmet,,Unmet,,99,,,,,,2019-10-08 12:51:04 UTC,,,Met,
22,3252,4387,Grafana,"The tool for beautiful monitoring and metric analytics & dashboards for Graphite, InfluxDB & Prometheus & More",https://grafana.com,https://github.com/grafana/grafana,Apache-2.0,?,,Met,Given only https: URLs.,Met,https://grafana.com/grafana/,Met,https://github.com/grafana/grafana/blob/master/CONTRIBUTING.md,Met,Non-trivial contribution file in repository: <https://github.com/grafana/grafana/blob/master/CONTRIBUTING.md>.,Met,https://github.com/grafana/grafana/tree/master/contribute/style-guides,Met,Non-trivial license location file in repository: <https://github.com/grafana/grafana/blob/master/LICENSE>.,Met,The Apache-2.0 license is approved by the Open Source Initiative (OSI).,Met,The Apache-2.0 license is approved by the Open Source Initiative (OSI).,Met,Some documentation basics file contents found.,Met,https://grafana.com/docs/,Met,"Repository on GitHub, which provides public git repositories with URLs.",Met,"Repository on GitHub, which uses git. git can track the changes, who made them, and when they were made.",Met,Nightly builds available at: https://grafana.com/grafana/download,Met,"Repository on GitHub, which uses git. git is distributed.",Met,https://grafana.com/grafana/download,Met,,Met,https://github.com/grafana/grafana/releases,Met,Non-trivial release notes file in repository: <https://github.com/grafana/grafana/blob/master/CHANGELOG.md>.,?,,?,,Met,https://github.com/grafana/grafana/issues,Met,https://github.com/grafana/grafana/issues/new?labels=type%3A+bug&template=1-bug_report.md,?,,?,,?,,Met,"Security policy: https://github.com/grafana/grafana/blob/master/SECURITY.md
Mailing address: security@grafana.com",Met,Encrypt message using PGP: https://github.com/grafana/grafana/blob/master/SECURITY.md,?,,Met,Non-trivial build file in repository: <https://github.com/grafana/grafana/blob/master/Makefile>.,Met,Non-trivial build file in repository: <https://github.com/grafana/grafana/blob/master/Makefile>.,Met,"Tools used to build: Go, yarn, Makefile",?,,?,,?,,?,,?,,?,,?,,?,,?,,?,,?,,?,,?,,?,,?,,?,,?,,?,,?,,?,,?,,?,,?,,?,,?,,?,,?,,?,,?,,?,,?,,,2019-10-08 13:30:04 UTC,2019-10-08 13:42:34 UTC,?,,?,,,Met,GitHub supports discussions on issues and pull requests.,?,,Met,https://github.com/grafana/grafana/blob/master/contribute/pull-request.md,?,,?,,?,,?,,?,,Unmet,"// X-Content-Type-Options was not set to ""nosniff"".",?,,?,,42,,,2022-05-16 23:00:28 UTC,False,"TypeScript, Go, Shell, JavaScript, Python, Jsonnet, Dockerfile, Makefile, Smarty, PHP",16,4,?,,?,,?,,?,,?,,?,,?,,?,,?,,?,,?,,?,,?,,?,,?,,?,,?,,?,,?,,?,,?,,?,,?,,?,,?,,?,,?,,?,,?,,?,,?,,?,,?,,?,,?,,?,,?,,?,,?,,?,,4,?,,?,,?,,?,,?,,?,,?,,?,,?,,?,,?,,?,,Unmet,,Unmet,,42,,,,,,,,,Met,
